category,datetime,headline,id,image,related,source,summary,url
company,1768262043,"Dow Jones Futures: Nvidia, Tesla, Walmart Are Key Movers; CPI Inflation Report Next",138082634,https://s.yimg.com/rz/stage/p/yahoo_finance_en-US_h_p_finance_2.png,AVGO,Yahoo,"Dow Jones Futures: Broadcom, Nvidia, Palantir, Tesla and Walmart were key movers Monday. The CPI inflation report is due Tuesday.",https://finnhub.io/api/news?id=59c0a95e435fbc4c4d7739d8937d18000cc0f3d7952b491d5d47118613e48b55
company,1768257905,Broadcom Inc. (AVGO) Rises Higher Than Market: Key Facts,138083074,https://s.yimg.com/rz/stage/p/yahoo_finance_en-US_h_p_finance_2.png,AVGO,Yahoo,"Broadcom Inc. (AVGO) closed the most recent trading day at $352.23, moving +2.1% from the previous trading session.",https://finnhub.io/api/news?id=550d2ae705dd2a6638b8dc349e7b83892154621231352d0c79c8c17f9bba5a1a
company,1768257180,Broadcom: A high-conviction dividend stock I'd own in 2026,138083075,https://s.yimg.com/rz/stage/p/yahoo_finance_en-US_h_p_finance_2.png,AVGO,Yahoo,"Valued at a market cap of $1.6 trillion, Broadcom (AVGO) is among the largest companies in the world. In the last decade, AVGO stock has returned 2,600% to shareholders. If we adjust for dividend reinvestments, cumulative returns are closer to 3,400%, according to data from Ycharts. The ...",https://finnhub.io/api/news?id=dfe309faa4a3e478150d4b65376f290225f2a8777cb201e916ae2955b6701381
company,1768255200,ValuEngine Weekly Market Summary And Commentary,138079902,https://static.seekingalpha.com/cdn/s3/uploads/getty_images/1427537698/image_1427537698.jpg?io=getty-c-w1536,AVGO,SeekingAlpha,"U.S. equity markets continued their constructive start to 2026, with broad participation across styles, sectors, and market capitalizations.",https://finnhub.io/api/news?id=49e4c383168005d7c27238758a9aa71f4d27ddf171f03f81acf1a346971dba33
company,1768243200,Traders Are Moving Past Powell's Investigation: U.S. Stock Index Outlook And Pre-CPI Trading Levels,138079125,https://static.seekingalpha.com/cdn/s3/uploads/getty_images/2214651343/image_2214651343.jpg?io=getty-c-w1536,AVGO,SeekingAlpha,"Stocks caught a bid immediately after the open as participants shrugged off the headlines, using the early drop as yet another buying opportunity.",https://finnhub.io/api/news?id=5ad658b45921686f6dfbf79f7abb28c54a99fb07c656cf4dc1b6ae8ee1c0509c
company,1768240035,Broadcom Inc. (AVGO) Launches new Wi-Fi Products at CES 2026,138076376,https://s.yimg.com/rz/stage/p/yahoo_finance_en-US_h_p_finance_2.png,AVGO,Yahoo,"Broadcom Inc. (NASDAQ:AVGO) is one of the Best Stocks to Buy for High Returns in 2026. On January 6, Broadcom Inc. (NASDAQ:AVGO) launched new Wi-Fi products at CES 2026 in Las Vegas. The products include the BCM4918 accelerated processing unit and two Wi-Fi 8 chipsets, including BCM6714 and BCM6719. ​Management noted that these new product […]",https://finnhub.io/api/news?id=0f824cff21c428c3bf3ccd6e0255391aa5586d28dbd11f8358c9277d75d3c0fc
company,1768232082,5 U.S. chip stocks to buy in 2026: Bernstein,138075080,https://s.yimg.com/rz/stage/p/yahoo_finance_en-US_h_p_finance_2.png,AVGO,Yahoo,"Investing.com -- Bernstein has reiterated its bullish stance on several major U.S. semiconductor names in 2026, arguing that the sector remains supported by strong AI spending trends and rising prospects for wafer-fab equipment demand.",https://finnhub.io/api/news?id=4d9aba25a144f5c40698f556c0ef9306a7a6e153eb5a6bb0c24e1ed4105e33c3
company,1768224600,MACOM Appoints Bryan Ingram to its Board of Directors,138071812,https://s.yimg.com/rz/stage/p/yahoo_finance_en-US_h_p_finance_2.png,AVGO,Yahoo,"LOWELL, Mass., Jan. 12, 2026 (GLOBE NEWSWIRE) -- MACOM Technology Solutions Holdings, Inc. (“MACOM”) (NASDAQ: MTSI), a leading supplier of semiconductor products, today announced the appointment of Bryan Ingram as an independent director to MACOM’s Board to Directors (the “Board”), effective January 12, 2026. Mr. Ingram has had a distinguished career, spanning engineering, operations, technical management and executive roles and has successfully managed complex semiconductor businesses in excess",https://finnhub.io/api/news?id=882996ed3d6b80989ade5f047f26abea94a8feca698c289a870b0917fd252284
company,1768208520,"Co-Packaged Optics Market Report 2026-2036: NVIDIA vs. Broadcom Ecosystem Strategies, CPO Platforms, and Foundry Roadmaps",138071257,https://s.yimg.com/rz/stage/p/yahoo_finance_en-US_h_p_finance_2.png,AVGO,Yahoo,"The global Co-Packaged Optics (CPO) market is set for transformative growth, driven by the burgeoning demands of AI, large language models, and generative AI. CPO technology addresses key issues such as bandwidth, power consumption, and latency inefficiencies existing in traditional pluggable modules. By integrating optical transceivers with switch ASICs, CPO significantly reduces power consumption from 15 to 5 picojoules per bit, with ambitions to go below 1. Market segmentation into scale-out",https://finnhub.io/api/news?id=ca238132cae0f7881762b13bbe4aa2f134a6421d3309167ebc97bc0cfe3c7ba6
