category,datetime,headline,id,image,related,source,summary,url
company,1768253520,CHIPOTLE ANNOUNCES LEADERSHIP TRANSITIONS,138083627,https://s.yimg.com/rz/stage/p/yahoo_finance_en-US_h_p_finance_2.png,CMG,Yahoo,"Chipotle Mexican Grill (NYSE: CMG) today announced that Ilene Eskenazi, Chief Human Resources Officer (CHRO), has been appointed Chief Legal and Human Resources Officer. Ms. Eskenazi succeeds Roger Theodoredis who has transitioned out of his role of Chief Legal Officer and General Counsel. In addition, Stephanie Perdue, Vice President of Brand Marketing, will serve as Interim Chief Marketing Officer, succeeding Chris Brandt who has transitioned out of his role of President, Chief Brand Officer.",https://finnhub.io/api/news?id=a0cbb16368d8f1e2371afe251668f81fb4adf3e01308068ed7066b49377c2ed8
company,1768237440,Chipotle Names Perdue Interim CMO,138131859,,CMG,MarketWatch,Chipotle Names Perdue Interim CMO,https://finnhub.io/api/news?id=cfa6f42a9edc6ad21f7167e8fc02fcc6eae277c6d4c8f9d19b864e2d107e798d
company,1768235400,MCD's International Markets Stay Resilient: What's Supporting Comps?,138076528,https://s.yimg.com/rz/stage/p/yahoo_finance_en-US_h_p_finance_2.png,CMG,Yahoo,"McDonald's leans on resilient international markets as disciplined value, local marketing and scale efficiencies help support comps amid global QSR pressure.",https://finnhub.io/api/news?id=3018dde316c54d6776664d357a972d4442a912651e8181c4337988f729926cca
company,1768228800,"Is Dutch Bros Winning the Coffee Wars With Traffic, Not Pricing?",138076701,https://s.yimg.com/rz/stage/p/yahoo_finance_en-US_h_p_finance_2.png,CMG,Yahoo,"BROS is standing out by driving same-shop sales with traffic gains, not price hikes, as transactions and digital tools fuel growth.",https://finnhub.io/api/news?id=794d55261d5a049799aba5fddce4590ee3a2b27525034a308311f6f8d967099e
company,1768222380,"CHIPOTLE ANNOUNCES FREE DOUBLE PROTEIN OFFER ON TUESDAY, JANUARY 13 TO POWER PROTEIN GOALS",138071558,https://s.yimg.com/rz/stage/p/yahoo_finance_en-US_h_p_finance_2.png,CMG,Yahoo,"Chipotle Mexican Grill (NYSE: CMG) today announced a free double protein offer on bowls, burritos and salads1 on Tuesday, January 13, one of the most popular days to work out.2 With consumers prioritizing active lifestyles in January, Chipotle is curating its menu and offerings to help guests hit their fitness and dietary goals.",https://finnhub.io/api/news?id=ee9be09d2ec90740562304ee27c15cc25441f2691997696c4cdbd7e0a8dd7c02
company,1768216120,Chipotle Mexican Grill Earnings Preview: What to Expect,138072489,https://s.yimg.com/rz/stage/p/yahoo_finance_en-US_h_p_finance_2.png,CMG,Yahoo,Analysts expect Chipotle to face near-term pressure but remain optimistic about the company’s long-term growth prospects.,https://finnhub.io/api/news?id=c3522f33fa9e06c733f697e987362f3453d5c910f9bc7b456b0c69d09a4ae845
