category,datetime,headline,id,image,related,source,summary,url
company,1768239519,3 Stocks Estimated To Be Trading At A Discount In January 2026,138076724,https://s.yimg.com/rz/stage/p/yahoo_finance_en-US_h_p_finance_2.png,DDOG,Yahoo,"As the U.S. stock market navigates a mixed landscape with major indices showing varied performances and precious metals reaching record highs, investors are closely watching economic indicators and political developments that could influence market dynamics. In this environment, identifying undervalued stocks can be particularly appealing, as these opportunities may offer potential value when broader market conditions create uncertainty.",https://finnhub.io/api/news?id=920bd0ee3cc436c2ac52bd8f2753b174bebb7b1d489f7af2bef5d61dd2f0cf24
company,1768236348,"3 U.S. software stocks to buy, 2 to avoid: Goldman Sachs",138076353,https://s.yimg.com/rz/stage/p/yahoo_finance_en-US_h_p_finance_2.png,DDOG,Yahoo,"Investing.com -- Goldman Sachs has assumed coverage of the U.S. software sector, naming three stocks it is bullish on while cautioning against two names amid what it calls the “decade of agentic workflow.”",https://finnhub.io/api/news?id=c538aa771ac20d01d553e1cae2f1acb77307c54ef73689ade5771c6b7c2947cc
company,1768236178,"Datadog's Core Growth Backed by Digital Transformation, Cloud Migration Projects, Morgan Stanley Says",138076726,https://s.yimg.com/rz/stage/p/yahoo_finance_en-US_h_p_finance_2.png,DDOG,Yahoo,Datadog's (DDOG) accelerating core growth is being supported by the main pillars of observability ad,https://finnhub.io/api/news?id=7f8c8357fc1035df8bfeb034ffefb3a0a3fe330c237c9f8fd79902a6c610dfa4
company,1768229349,"Netflix initiated, Palantir upgraded: Wall Street's top analyst calls",138072329,https://s.yimg.com/rz/stage/p/yahoo_finance_en-US_h_p_finance_2.png,DDOG,Yahoo,"Netflix initiated, Palantir upgraded: Wall Street's top analyst calls",https://finnhub.io/api/news?id=04295d72aa2324c5bd39190f2de3dffa04f287bd4410bdbb17cef2cc3ceabbd1
company,1768223241,"Here Are Monday’s Top Wall Street Analyst Research Calls: Airbnb, Akamai, Applied Materials, CoreWeave, CrowdStrike, Datadog, NetFlix, Snowflake, and More",138072316,https://s.yimg.com/rz/stage/p/yahoo_finance_en-US_h_p_finance_2.png,DDOG,Yahoo,"Pre-Market Stock Futures: The futures are trading lower on Monday morning after a strong finish to the week on Friday, completing a winning week for investors as all three of the major indices closed at all-time highs. The news that Jay Powell, the Chairman of the Federal Reserve, is under criminal investigation by the Department ... Here Are Monday’s Top Wall Street Analyst Research Calls: Airbnb, Akamai, Applied Materials, CoreWeave, CrowdStrike, Datadog, NetFlix, Snowflake, and More",https://finnhub.io/api/news?id=73ad8fd72b9d17c3e0ef1c05a88403b9b314443ae7cbfb13e8887886239d73f4
company,1768217882,3 Stocks Estimated To Be Undervalued By Up To 36.9%,138071582,https://s.yimg.com/rz/stage/p/yahoo_finance_en-US_h_p_finance_2.png,DDOG,Yahoo,"As the Dow and S&P 500 close at record highs, reflecting a strong start to 2026, investors are keenly observing the broader market dynamics shaped by recent economic indicators and policy developments. In this environment of heightened market performance, identifying undervalued stocks becomes crucial for those looking to capitalize on potential growth opportunities amidst these record-setting indices.",https://finnhub.io/api/news?id=2cb76940143eb05a5f43d4aca960aa53be0770aca5eb3a9641a6eb5df48adca1
company,1768192377,2 Growth Stocks with All-Star Potential and 1 We Question,138072503,https://s.yimg.com/rz/stage/p/yahoo_finance_en-US_h_p_finance_2.png,DDOG,Yahoo,"Growth is a hallmark of all great companies, but the laws of gravity eventually take hold. Those who rode the COVID boom and ensuing tech selloff in 2022 will surely remember that the market’s punishment can be swift and severe when trajectories fall.",https://finnhub.io/api/news?id=2747372d71f00ba0f1ea9cf499de6f115ce4d2f2a56484abe70c9578dfb5d06a
