category,datetime,headline,id,image,related,source,summary,url
company,1768252094,What Recent Developments Mean For The Fidelity National Information Services FIS Investment Story,138083713,https://s.yimg.com/rz/stage/p/yahoo_finance_en-US_h_p_finance_2.png,FIS,Yahoo,"Fidelity National Information Services just saw its fair value estimate trimmed slightly to US$80.45 from US$81.05, even as the model now incorporates higher projected revenue growth of 7.18% and a modestly adjusted discount rate of 8.11%. This updated narrative reflects research that is becoming more confident about the top line over time while staying careful about how much valuation headroom to assume. Read on to see how you can keep on top of these shifting assumptions and what they might...",https://finnhub.io/api/news?id=51f4e65a594326518c13f528d205d2eda88fa9d01c4c0ea0491411890f41f74f
company,1768248514,New Agentic Commerce Platform With Visa and Mastercard Could Be A Game Changer For Fidelity National Information Services (FIS),138083168,https://s.yimg.com/rz/stage/p/yahoo_finance_en-US_h_p_finance_2.png,FIS,Yahoo,"Fidelity National Information Services recently launched its first agentic commerce offering, following the completion of its acquisition of the FIS Total Issuing Solutions portfolio, to let banks safely support AI-initiated transactions with card networks like Visa and Mastercard. This move positions FIS at the center of the emerging agentic commerce infrastructure, aiming to help banks manage authorization, fraud protection and compliance as AI assistants conduct purchases on behalf of...",https://finnhub.io/api/news?id=2b4c6ca25901e0a9f442ccfaa3ae9af74a286c612fcdca484d2db90a15a075ce
company,1768225166,Why analysts think Trump’s 10% credit card fee cap is a low-probability risk,138072313,https://s.yimg.com/rz/stage/p/yahoo_finance_en-US_h_p_finance_2.png,FIS,Yahoo,"Investing.com -- President Trump’s proposal to cap credit card interest rates at 10% has drawn attention, but analysts say the risk of meaningful disruption to financial stocks is low.",https://finnhub.io/api/news?id=07a793d3ebd07fd77037056d1c3864a9e62fc53626b505773d3df0970e4cf815
company,1768219320,FIS Launches Industry-First Offering Enabling Banks to Lead and Scale in Agentic Commerce,138071348,https://s.yimg.com/rz/stage/p/yahoo_finance_en-US_h_p_finance_2.png,FIS,Yahoo,"JACKSONVILLE, Fla., January 12, 2026--FIS® (NYSE: FIS), a global leader in financial technology, today announced the launch of its first offering to enable agentic commerce on the heels of announcing the close of the acquisition of its FIS Total Issuing™ Solutions portfolio. FIS’ new agentic commerce offering is the first to enable banks to safely and securely conduct commerce with AI agents and card networks.",https://finnhub.io/api/news?id=a96f73e317961b213a9ca0f890d2b14b55ff554dc426401b7df31bf50de9de10
company,1768219200,GTCR Completes Sale of Worldpay to Global Payments,138071599,https://s.yimg.com/rz/stage/p/yahoo_finance_en-US_h_p_finance_2.png,FIS,Yahoo,"GTCR, a leading private equity firm, announced today that it has closed the previously announced sale of Worldpay (the ""Company""), a global leader in merchant acquiring and payments processing, to Global Payments (NYSE: GPN) as part of a transformative three-way transaction. The sale of Worldpay represents one of the largest strategic sales in the history of the private equity industry.",https://finnhub.io/api/news?id=700d8058a6e305c42471ce5301b89b99839f3be00dd2122221c5607bdda65fb4
company,1768219200,FIS Completes Strategic Acquisition of Global Payments’ Issuer Solutions Business and Sale of Worldpay Stake,138071598,https://s.yimg.com/rz/stage/p/yahoo_finance_en-US_h_p_finance_2.png,FIS,Yahoo,"JACKSONVILLE, Fla., January 12, 2026--FIS® (NYSE: FIS), a global leader in financial technology, today announced the completion of its acquisition of Global Payments' Issuer Solutions business, formerly known as TSYS, for an enterprise value of $13.5 billion, or a net purchase price of $12 billion including $1.5 billion of net present value of tax assets. Offerings from this asset, the world’s largest issuing business, will now go to market under the FIS® Total Issuing™ Solutions portfolio brand",https://finnhub.io/api/news?id=6a339fa6b50c8efd06df5319bc69e94f01a1a6a96bb02fe44c2164524667c3f2
