category,datetime,headline,id,image,related,source,summary,url
company,1768257720,Secretary of War Visits Lockheed Martin F-35 Production Facility,138083484,https://s.yimg.com/rz/stage/p/yahoo_finance_en-US_h_p_finance_2.png,LMT,Yahoo,"Lockheed Martin (NYSE: LMT) welcomed Secretary of War Pete Hegseth to the Fort Worth, Texas, F-35 Lightning II production facility today. The visit was part of the secretary's Arsenal of Freedom industry tour and underscored Lockheed Martin's role in accelerating acquisition transformation and delivering critical capabilities to the warfighter.",https://finnhub.io/api/news?id=9e302c8b3c83c9fca8f1e8cac67ad8e92efdaa8aea542b97c66e94e40645983d
company,1768250962,British jobs at risk as Army ‘prepares to buy Black Hawk helicopters’,138083485,https://s.yimg.com/rz/stage/p/yahoo_finance_en-US_h_p_finance_2.png,LMT,Yahoo,"The Army is preparing to buy US Black Hawk helicopters in a move putting thousands of British defence jobs at risk, Reform UK has suggested.",https://finnhub.io/api/news?id=5c9eb4e6d514110bab8c94ee2956928102febbea063fe8dfc9cd795d04830203
company,1768235760,How Defense Stocks Could Find New Buyers if Dividends Go Away,138127844,,LMT,MarketWatch,How Defense Stocks Could Find New Buyers if Dividends Go Away,https://finnhub.io/api/news?id=519d366bb16c654c78eda702df38418fd3212fe6c7be5feb2a8b07e7d9ae3136
company,1768232700,Why 2026 Will See Unprecedented U.S. GDP Growth,138076614,https://s.yimg.com/rz/stage/p/yahoo_finance_en-US_h_p_finance_2.png,LMT,Yahoo,"While a 5-6% GDP growth rate for an economy as massive as the United States was once considered unthinkable, the alignment of historical stimulus and a shift in monetar",https://finnhub.io/api/news?id=f0b869e9ca5187852f4721cdd7fe5dc5b2c87dd6783638395ec139f02d227dd3
company,1768215600,"NioCorp Provides Preliminary Unaudited Financial Results for the Three- and Six-Month Periods Ended December 31, 2025",138071517,https://s.yimg.com/rz/stage/p/yahoo_finance_en-US_h_p_finance_2.png,LMT,Yahoo,"CENTENNIAL, CO / ACCESS Newswire / January 12, 2026 / NioCorp Developments Ltd. (""NioCorp,"" ""our,"" or the ""Company"") (NASDAQ:NB) today provided its preliminary unaudited financial results for the three- and six-month periods ended December 31, 2025. ...",https://finnhub.io/api/news?id=de0ebc4ae2734285f2f644ab6bff18e69bd4af28fe1c36070a95c82aebda2fab
company,1768208400,Bear of the Day: TAT Technologies (TATT),138071518,https://s.yimg.com/rz/stage/p/yahoo_finance_en-US_h_p_finance_2.png,LMT,Yahoo,"TAT Technologies' stock price is starting to reflect speculation, not improving business fundamentals.",https://finnhub.io/api/news?id=c565f00131aaaf1f42d37362590553f24a348ec91cf5ab313276b5f6d938fa0f
