category,datetime,headline,id,image,related,source,summary,url
company,1768235820,Newmont Corp. stock outperforms competitors on strong trading day,138127239,,NEM,MarketWatch,Newmont Corp. stock outperforms competitors on strong trading day,https://finnhub.io/api/news?id=4406327197cb9214b52d2c288f360106a22ba359d016c87301756f342e295448
company,1768235160,ARMN's Margins Expand Despite Rising Costs: Will the Momentum Sustain?,138076599,https://s.yimg.com/rz/stage/p/yahoo_finance_en-US_h_p_finance_2.png,NEM,Yahoo,"Aris Mining's AISC climbs 6.6% in Q3 2025, but higher gold prices and volumes lift margins 42% year over year, keeping profitability resilient.",https://finnhub.io/api/news?id=b8291027861c0c162952ca3843dc710ff90e9cf200644ff959682d531e2a8a85
company,1768229280,Gold and Silver Prices Hit Record Highs,138075301,https://s.yimg.com/rz/stage/p/yahoo_finance_en-US_h_p_finance_2.png,NEM,Yahoo,"Precious metals prices scaled new peaks after U.S prosecutors launched a probe into Federal Reserve Chair Jerome Powell, adding to concerns about the independence of the central bank.",https://finnhub.io/api/news?id=c6cf77c90ee5af8e3b8a3071a7910a68bd1c1d76e5815d196b205a492d17366a
company,1768227420,Silver and Gold Hit New Highs on Fed Probe and Heightened Geopolitical Tensions,138075302,https://s.yimg.com/rz/stage/p/yahoo_finance_en-US_h_p_finance_2.png,NEM,Yahoo,Gold and silver prices climb to record highs amid concerns over Fed independence and geopolitical tensions.,https://finnhub.io/api/news?id=98b30b0efd62401b2c6e66e881250db632f916b88dc1bd333034d55d492561ae
company,1768224060,Is AEM Stock a Screaming Buy After the 132% Price Surge in a Year?,138072412,https://s.yimg.com/rz/stage/p/yahoo_finance_en-US_h_p_finance_2.png,NEM,Yahoo,"AEM's 132% rally in a year, strong cash flows and project progress suggest more upside, backed by surging gold prices.",https://finnhub.io/api/news?id=4f69b7131170130004f471f4931c8e32fc12cfa73e8db4890925655f4b4f68ba
