category,datetime,headline,id,image,related,source,summary,url
company,1768244248,"Paramount fires back at Warner Bros. bid, launching proxy fight for board seats at annual meeting",138083230,https://s.yimg.com/rz/stage/p/yahoo_finance_en-US_h_p_finance_2.png,PSKY,Yahoo,Paramount has also filed a lawsuit asking Warner Bros. Discovery to give more information about its merger agreement with Netflix.,https://finnhub.io/api/news?id=fcef826538cd8d686e46fdadf81486cedb8806d74762b968e2fceb8d642dec39
company,1768242960,Show us the math: Paramount sues Warner Bros. over how it determined Netflix’s bid is better,138141408,,PSKY,MarketWatch,Show us the math: Paramount sues Warner Bros. over how it determined Netflix’s bid is better,https://finnhub.io/api/news?id=4834907fbc24fefb5a3c3645628598e3f4bc88a7e0cf9a8bf11444c6a36f828a
company,1768241880,"Paramount Sues Warner Bros., Plans Proxy Fight. The Ellisons Aren’t Giving Up.",138124497,,PSKY,MarketWatch,"Paramount Sues Warner Bros., Plans Proxy Fight. The Ellisons Aren’t Giving Up.",https://finnhub.io/api/news?id=58bbb0831b41d4e77d8772b459027201c816051352075a8b3f91398988441e66
company,1768240800,"""IN SNOOKI WE TRUST"" - NICOLE 'SNOOKI' POLIZZI HEADS NORTH IN NEW SERIES, CANADA SHORE",138078329,https://s.yimg.com/rz/stage/p/yahoo_finance_en-US_h_p_finance_2.png,PSKY,Yahoo,"Paramount+ announced today that the legendary JERSEY SHORE original cast member Nicole 'Snooki' Polizzi will bring her small stature and big personality to the Shore house, making several powerhouse guest appearances during the first season of CANADA SHORE, premiering January 22 on Paramount+ in all markets globally. Bringing her signature sparkle to the CANADA SHORE crib, she parties, hands out job duties and shares her 'Shore' expertise with the new cast across several episodes.",https://finnhub.io/api/news?id=1b5c9845db2af0a4cebe17c349f049530bf11033d61d47d0133027e6ae02c9b1
company,1768239247,"Paramount Launches Warner Bros. Proxy Fight, Files Suit",138076457,https://s.yimg.com/rz/stage/p/yahoo_finance_en-US_h_p_finance_2.png,PSKY,Yahoo,"The company, run by David Ellison, also said it filed a lawsuit against Warner Bros. in an attempt to force out into the open more details about Netflix’s $82.7 billion takeover agreement, escalating an acrimonious bidding war between the media company and the streaming giant that has captivated Hollywood and Wall Street.  Paramount has been pursuing Warner Bros. for four months and has submitted multiple offers for the iconic Hollywood studio, all of which have been rebuffed by Warner Bros.’s board.",https://finnhub.io/api/news?id=716112eee192e0746d2d095faf905f08f17c1497440f0eb8b685dd390e998c40
company,1768239240,Communications Services Down on Deal Views -- Communications Services Roundup,138141410,,PSKY,MarketWatch,Communications Services Down on Deal Views -- Communications Services Roundup,https://finnhub.io/api/news?id=49ec0809c7ca4b3c8f1342c27e3e942134fac69be45840c0af9bc06bd2a76d8d
company,1768237987,Paramount sues Warner Bros in attempt to revive hostile takeover,138078074,https://s.yimg.com/rz/stage/p/yahoo_finance_en-US_h_p_finance_2.png,PSKY,Yahoo,Paramount is suing Warner Bros in an effort to revive its $108bn (£80bn) hostile takeover bid for the Hollywood studio giant.,https://finnhub.io/api/news?id=f6bb6780005916860e056adbe1f25b76a610eb24936d0ddfd052edb6b4aea3ba
company,1768237572,Paramount files lawsuit against Warner Bros. amidst controversial Netflix merger,138076458,https://s.yimg.com/rz/stage/p/yahoo_finance_en-US_h_p_finance_2.png,PSKY,Yahoo,"Paramount has filed a lawsuit against Warner Bros. Discovery, demanding greater financial disclosure regarding Netflix's $82.7 billion acquisition.",https://finnhub.io/api/news?id=358e886ecc3d371255e9a8631c14dac31dcfe962fb4c76631d583bf013a4c254
company,1768236990,"Top Midday Stories: DOJ Opens Criminal Probe Into Fed Chair Powell; Trump Calls for 10% Credit-Card Rate Cap, Bank Shares Tumble",138076341,https://s.yimg.com/rz/stage/p/yahoo_finance_en-US_h_p_finance_2.png,PSKY,Yahoo,"US stocks were mixed in midday trading Monday, after Federal Reserve Chair Jerome Powell said Sunday",https://finnhub.io/api/news?id=06925d19394a332fd956fd4992b82aa117f78577d0e74c703331568e6d62c0a9
company,1768234121,"Paramount sues Warner Bros, launches proxy war to scupper Netflix deal",138075202,https://s.yimg.com/rz/stage/p/yahoo_finance_en-US_h_p_finance_2.png,PSKY,Yahoo,"Paramount Skydance claims WBD’s Netflix transaction undervalues the company and says shareholders should decide, as it prepares a proxy contest and court action in Delaware.View on euronews",https://finnhub.io/api/news?id=0ee72ec114ee197bb0c4593161abd1aa2f64bb191ec05b41c0283b79cc74f3eb
company,1768233573,Paramount files lawsuit in pursuit of Warner Bros. Discovery and threatens proxy fight,138075433,https://s.yimg.com/rz/stage/p/yahoo_finance_en-US_h_p_finance_2.png,PSKY,Yahoo,Paramount is taking its pursuit of CNN’s parent company Warner Bros. Discovery to court.,https://finnhub.io/api/news?id=227ce9078e0e36cec3cbf320bada8e68837e76927063edeeb12f0982aeea220d
company,1768233066,"Paramount launches WBD proxy battle, Meta appoints new president",138075141,https://s.yimg.com/rz/stage/p/yahoo_finance_en-US_h_p_finance_2.png,PSKY,Yahoo,"Morning Brief host Julie Hyman and Yahoo Finance Markets and Data Editor Jared Blikre track several of Monday's top trending stock tickers, including Paramount Skydance (PSKY) launching a proxy battle against Warner Bros. Discovery (WBD), Meta Platforms (META) hiring former Trump security advisor Dina Powell McCormick as its new president and vice chair, and Abercrombie & Fitch (ANF) plummeting on its fourth quarter guidance. To watch more expert insights and analysis on the latest market action, check out more Morning Brief.",https://finnhub.io/api/news?id=5842833d74804ba9601b99a6bc98124d7e9d98d5f7b75cad01204fcfe59ce177
company,1768230008,Paramount's next target in hostile takeover bid of Warner Bros. is a board of its own making,138075204,https://s.yimg.com/rz/stage/p/yahoo_finance_en-US_h_p_finance_2.png,PSKY,Yahoo,"Paramount Skydance is taking another step in its hostile takeover bid of Warner Bros. Discovery, saying Monday that it will name its own slate of directors before the next shareholder meeting of the Hollywood studio.  Paramount also filed a suit in Delaware Chancery Court seeking to compel Warner Bros. to disclose to shareholders how it values its bid and the competing offer from Netflix.",https://finnhub.io/api/news?id=e96b8da808a676de435f9c51e6788943d0288426bdb06e5e1554e46902557a48
company,1768229880,Paramount Plans Proxy Fight to Push Hostile Warner Bid,138075205,https://s.yimg.com/rz/stage/p/yahoo_finance_en-US_h_p_finance_2.png,PSKY,Yahoo,The company also said Monday it filed a lawsuit seeking more information on Warner’s deal with Netflix,https://finnhub.io/api/news?id=6177f0bd9ff089ff96306ca2531badec2b156f072abe03ac3b6f44ce380bd931
company,1768228604,Paramount Files Suit for Info Related to Warner Bros. Acquisition Bid,138072334,https://s.yimg.com/rz/stage/p/yahoo_finance_en-US_h_p_finance_2.png,PSKY,Yahoo,Paramount Skydance (PSKY) said Monday that it has filed a lawsuit to obtain information from Warner,https://finnhub.io/api/news?id=66136e19ee11786702793afd33b45e132fef02c0a5634965f8f8ce8421a915d4
company,1768228260,Paramount Skydance steps up hostile bid for Warner Bros Discovery with law suit,138083232,https://s.yimg.com/rz/stage/p/yahoo_finance_en-US_h_p_finance_2.png,PSKY,Yahoo,"A hostile takeover bid for media giant Warner Bros Discovery (WBD) has ratcheted up with entertainment conglomerate Paramount taking legal action to force the release of financial data.  Paramount Skydance, which owns film production company Paramount Pictures and TV network CBS, has filed a law suit seeking to compel WBD to disclose to shareholders how it values the bid and a competing offer from Netflix.  The board had already agreed a $82.7bn (£61.4bn) deal with Netflix in early December to sell its TV studios and rights to top franchises, including Harry Potter and Game of Thrones.",https://finnhub.io/api/news?id=dad23b810a9d7babe64613e24ea7d8fdaff2b11f756411f4de74fb58b97b59dd
company,1768226820,PARAMOUNT PROVIDES UPDATE TO WARNER BROS. DISCOVERY SHAREHOLDERS ON ACTIONS IT IS TAKING TO ADVANCE  ITS SUPERIOR $30 PER SHARE ALL-CASH OFFER,138072460,https://s.yimg.com/rz/stage/p/yahoo_finance_en-US_h_p_finance_2.png,PSKY,Yahoo,"Paramount Skydance Corporation (NASDAQ: PSKY) (""Paramount"") today sent a letter to shareholders of Warner Bros. Discovery, Inc. (NASDAQ: WBD) (""WBD"") outlining Paramount's next steps for delivering its superior, fully financed, all-cash offer of $30 per share to WBD shareholders.",https://finnhub.io/api/news?id=e320436c9df4fbdb658f57f3b5a665099fdf8ee9a609d9bd6f3d2a81f8efc83a
company,1768225440,"Buy Struggling Netflix Stock, Says Analyst. Why Warner Takeover Fears Are Overblown.",138075125,https://s.yimg.com/rz/stage/p/yahoo_finance_en-US_h_p_finance_2.png,PSKY,Yahoo,"Savvy investors should see a recent selloff as a buying opportunity, HSBC analyst Mohammed Khallouf said.",https://finnhub.io/api/news?id=3257431c3edf63b651fa506a96de307fc50be5a8258b5728744b890638edbc0d
company,1768225029,Wall Street Lunch: Paramount Skydance Takes Fight To Warner's Board To Block Netflix Deal,138076923,https://static.seekingalpha.com/cdn/s3/uploads/getty_images/2254004225/image_2254004225.jpg?io=getty-c-w1536,PSKY,SeekingAlpha,Paramount Skydance (PSKY) says it plans to nominate directors to Warner Bros. Discovery (WBD) and has filed suit in Delaware seeking basic information.,https://finnhub.io/api/news?id=97d3718eb8e5e8ca40d8eb640faaadc4e45ac2c057db8fc9a32114dc0dc6ffb9
company,1768224600,A cautionary Hollywood tale: the Ellisons’ lose-lose Paramount positioning,138075346,https://s.yimg.com/rz/stage/p/yahoo_finance_en-US_h_p_finance_2.png,PSKY,Yahoo,"Hollywood history is a trail littered with cautionary tales, and Netflix's Greg Peters and Ted Sarandos have framed a lose-lose coin toss for the Ellisons.",https://finnhub.io/api/news?id=eb0181d2b61053387435fec80863911a8ef2cd1ede80cfdea2b5438894303cfd
company,1768212742,Faber Report: Paramount files lawsuit against Warner Bros. Discovery,138076109,https://image.cnbcfm.com/api/v1/image/108251159-17682300151768230012-43459514470-1080pnbcnews.jpg?v=1768230014&w=1920&h=1080,PSKY,CNBC,CNBC's David Faber reports on the latest news from Warner Bros. Discovery.,https://finnhub.io/api/news?id=df077188bc3e87c636700215fe837694fd645854b9b7f1b273bacea36a2efc65
company,1768209348,Paramount Skydance sues Warner Bros. Discovery in hostile takeover attempt,138075903,https://image.cnbcfm.com/api/v1/image/108238518-1765220921385-108238518-17652208212025-12-08t155407z_15273980_rc2dcia5ox8f_rtrmadp_0_warner-bros-dis-m-a-paramount-skydan.jpg?v=1766425555&w=1920&h=1080,PSKY,CNBC,The lawsuit comes shortly after the WBD board once again told shareholders to reject Paramount's offer. ,https://finnhub.io/api/news?id=0b984a2500aa5b200e1e49340d73180f04a2abdcf8cbb3cc8521b3f5b2a139ec
