category,datetime,headline,id,image,related,source,summary,url
company,1769198400,MSTR Drops 50%+: Buy the Dip or Walk Away?,138229255,https://s.yimg.com/rz/stage/p/yahoo_finance_en-US_h_p_finance_2.png,CRM,Yahoo,"MSTR shares are down over 50% as Bitcoin slides, but strong fundamentals and its BTC-heavy strategy could set Strategy up for a rebound.",https://finnhub.io/api/news?id=d0386c15c70072cbbaec8e449199301f056fd0ebf13ec70450c894ade43956e7
company,1769198400,How did Davos turn into a tech conference?,138229273,https://s.yimg.com/rz/stage/p/yahoo_finance_en-US_h_p_finance_2.png,CRM,Yahoo,"The World Economic Forum’s annual meeting in Davos felt different this year, and not just because Meta and Salesforce took over storefronts on the main promenade. AI dominated the conversation in a way that overshadowed traditional topics like climate change and global poverty, and the CEOs weren’t holding back. There was public criticism of trade policy, warnings about AI […]",https://finnhub.io/api/news?id=024a240f5f2035fd25fc2549d85cc764b1180d13b7f6c99fbb72405d034df8ff
company,1769197560,Salesforce CEO Marc Benioff on the Rise of the “Agentic Enterprise”,138229367,https://s.yimg.com/rz/stage/p/yahoo_finance_en-US_h_p_finance_2.png,CRM,Yahoo,"Marc Benioff, Salesforce co-founder and CEO, speaks with WSJ Leadership Institute President Alan Murray in Davos as AI agents begin to change the way companies operate. He says businesses may soon be “kind of running themselves.” Benioff also reflects on why this year’s Davos marks a turning point for business, technology, and geopolitics.",https://finnhub.io/api/news?id=5f05282f3ac66b528e30febe5c387d4ffc2f575421afd5a8ba9bed35aa8c706a
company,1769194471,"After a 32% Reckoning In Shares, Investors Are Calling The Salesforce Bottom. It’s Time To Rally | CRM",138228514,https://s.yimg.com/rz/stage/p/yahoo_finance_en-US_h_p_finance_2.png,CRM,Yahoo,"Shares of Salesforce (NYSE:CRM) are trading at $229.86, down 31% over the past year, yet retail investor sentiment has surged to a bullish 72 out of 100 on social platforms like Reddit and X. The disconnect between price action and online sentiment reflects a growing conviction that the cloud software giant’s decline has created a ... After a 32% Reckoning In Shares, Investors Are Calling The Salesforce Bottom. It’s Time To Rally | CRM",https://finnhub.io/api/news?id=795cdb45b001731b129d6ba8dc6091a281e2d488a3d4559fc89c74d2b9b5ff92
company,1769183220,Software Stocks Have Plunged: Steals or Traps?,138226989,https://s.yimg.com/rz/stage/p/yahoo_finance_en-US_h_p_finance_2.png,CRM,Yahoo,"Due to AI worries, some software stocks are trading near 5-years lows. Are they oversold?",https://finnhub.io/api/news?id=955e5acfb37d2411181963fd11b872380b91e446a138550dcd2ea6801232333b
company,1769178426,Andrew Ng Thinks AI Apps are “Underinvested”—Here are the Stocks I’d Buy in Response,138225564,https://s.yimg.com/rz/stage/p/yahoo_finance_en-US_h_p_finance_2.png,CRM,Yahoo,"While others see an inflating AI bubble that could burst and lose investors a boatload of money, others see underinvestment in some specific parts of the theme. Undoubtedly, it’s hard to know with any degree of certainty where the AI trade goes next, especially as other volatility drivers (think Trump tariffs) are thrown into the ... Andrew Ng Thinks AI Apps are “Underinvested”—Here are the Stocks I’d Buy in Response",https://finnhub.io/api/news?id=61970723260501caf9618a7a620d188bc24c07e034a25e1db58f9762b4f92f3a
company,1769177282,2 Bruised Tech Stocks on the Fast Track to AGI,138225579,https://s.yimg.com/rz/stage/p/yahoo_finance_en-US_h_p_finance_2.png,CRM,Yahoo,"The race to achieve artificial general intelligence (AGI) is on, and the race might be closer than investors realize. Of course, it’s up for debate as to how long it’ll take for true AGI to be achieved. Some of the bigger bulls think it could happen in as little as a few years, while others ... 2 Bruised Tech Stocks on the Fast Track to AGI",https://finnhub.io/api/news?id=772f9dcba254f3d941131c237d7b834c2b96c22511dfd1cfeb6587eebcf3cf5f
company,1769171888,This Week In Cloud AI - Unlocking Unstructured Data with Rocket ContentEdge Innovation,138224716,https://s.yimg.com/rz/stage/p/yahoo_finance_en-US_h_p_finance_2.png,CRM,Yahoo,"Rocket Software has unveiled Rocket® ContentEdge™, a new solution designed to unlock the value of unstructured data while ensuring safety and compliance in data modernization efforts. With features such as safety-first generative AI, automation, and seamless integration capabilities, ContentEdge enables organizations to access critical unstructured information securely across diverse environments without disrupting existing operations. This launch addresses the challenge many organizations...",https://finnhub.io/api/news?id=6155b39d3d49098e91acb7bf446d51c223ea5f3a3771b42220a33e8830932205
