category,datetime,headline,id,image,related,source,summary,url
company,1769207120,Mark Cuban urges Congress to make healthcare companies divest,138229919,https://s.yimg.com/rz/stage/p/yahoo_finance_en-US_h_p_finance_2.png,CVS,Yahoo,"Healthcare affordability is in focus as lawmakers meet with health insurance executives on Capitol Hill. Additionally, Mark Cuban called on Congress to make health insurance companies divest from all non-insurance assets. Capital Alpha Partners founding partner Kim Monk sits down with Market Domination host Josh Lipton to explain why this is unlikely to happen. To watch more expert insights and analysis on the latest market action, check out more Market Domination.",https://finnhub.io/api/news?id=8953504eb9932813cf1d8088add061e74af88dfbec1c37c4b66ff479cbed4c0f
company,1769204521,Democrats & Republicans find some common ground on health insurers,138229315,https://s.yimg.com/rz/stage/p/yahoo_finance_en-US_h_p_finance_2.png,CVS,Yahoo,"Health insurance companies are in focus after executives met with US lawmakers on Capitol Hill to address affordability concerns and rising healthcare costs. Capital Alpha Partners founding partner Kim Monk joins Market Domination with Josh Lipton to discuss takeaways from the hearing. To watch more expert insights and analysis on the latest market action, check out more Market Domination.",https://finnhub.io/api/news?id=4b5e5abfc69f0d320c1cb06ab25650008ec8b48ce0fd21c82798b0db0f6dc668
company,1769204280,"Top Stock Reports for Microsoft, Anheuser-Busch & CVS Health",138229900,https://s.yimg.com/rz/stage/p/yahoo_finance_en-US_h_p_finance_2.png,CVS,Yahoo,"Microsoft's strong cash flows, Azure's 25% cloud share and AI integration drive performance, even as rising debt, capex needs and competition pose risks.",https://finnhub.io/api/news?id=2e6802ff5f9b3e527c9df1917b07e56e34fb8a83006b6f8bd71ed20dc899741e
company,1769173864,CVS Health (CVS) Valuation Check As Regulatory Scrutiny And Legal Outcomes Draw Investor Focus,138224862,https://s.yimg.com/rz/stage/p/yahoo_finance_en-US_h_p_finance_2.png,CVS,Yahoo,"Regulatory and legal scrutiny is back in focus for CVS Health (CVS), as a U.S. House Judiciary Committee probe into its pharmacy benefit manager practices unfolds, while a separate class action over prescription drug pricing has been dismissed. See our latest analysis for CVS Health. For context, CVS Health shares now trade at US$82.68, with a 30 day share price return of 5.95% and a year to date share price return of 3.18%, while the 1 year total shareholder return of 59.48% reflects how...",https://finnhub.io/api/news?id=255dd684500868287fd2a0bf222396128eb47001cfa7185bd74e1d97b3640860
company,1769173200,CVS Health supports communities as major winter storm approaches,138224863,https://s.yimg.com/rz/stage/p/yahoo_finance_en-US_h_p_finance_2.png,CVS,Yahoo,"CVS Health® (NYSE: CVS) is actively preparing for the major winter storm expected to impact much of the country over the next few days. The company's priority is the health and safety of its customers, members and colleagues, and is committed to providing communities with access to the products and services they need to plan for snow, ice, and potential power outages.",https://finnhub.io/api/news?id=0185bfb9d052580e37ded08564d24e840a3cc5f380d960ef574cd7ba9b3f670b
company,1769157370,Express Scripts considering settlement in FTC insulin price lawsuit,138226954,https://s.yimg.com/rz/stage/p/yahoo_finance_en-US_h_p_finance_2.png,CVS,Yahoo,The antitrust agency paused its lawsuit against the pharmacy benefit manager while the two discuss a proposed consent agreement.,https://finnhub.io/api/news?id=67b4edb07698e3b8bd3c423b1cf241e6ea1796a7557751974908968c5b4717ec
