category,datetime,headline,id,image,related,source,summary,url
company,1769191913,"Dividend Champion, Contender, And Challenger Highlights: Week Of Jan 25",138229764,https://static.seekingalpha.com/cdn/s3/uploads/getty_images/1072593728/image_1072593728.jpg?io=getty-c-w1536,FAST,SeekingAlpha,"A weekly summary of dividend activity for Dividend Champions, Contenders, and Challengers. Read the full list here.",https://finnhub.io/api/news?id=51cad26e98a55cff634e728377ee94ee04cf1e5384eb442f6922079bdc07e397
company,1769186820,Fastenal Co. stock underperforms Friday when compared to competitors,138240643,,FAST,MarketWatch,Fastenal Co. stock underperforms Friday when compared to competitors,https://finnhub.io/api/news?id=448a599f4efafcf8bba8adca5e89451e2559d1ce7defef075a436486ac56b62c
company,1769183117,W.W. Grainger's Biggest Threat Is High Expectations,138229025,https://static.seekingalpha.com/cdn/s3/uploads/getty_images/1291268967/image_1291268967.jpg?io=getty-c-w1536,FAST,SeekingAlpha,"W.W. Grainger continues to gain U.S. MRO market share and deliver strong operating performance. Learn more about GWW valuation, outlook, and stock prospects.",https://finnhub.io/api/news?id=ca33cf517b4e35e11db5977883be287567d22ae55556c825cecfe70c96ac7d9f
company,1769169600,CEOs Wary of a Jittery US Consumer as Global Tensions Intensify,138224778,https://s.yimg.com/rz/stage/p/yahoo_finance_en-US_h_p_finance_2.png,FAST,Yahoo,"Delta Air Lines Inc. struck a cautious tone on profits amid geopolitical uncertainty, while United Airlines Holdings Inc. warned that global tensions could weigh on travel demand.  Meanwhile, executives at consumer staples giants Procter & Gamble Co. and McCormick & Co. said shoppers remain cautious.  Signs of strain are lingering in industrial sectors as reports from distributor Fastenal Co. and logistics company JB Hunt Transport Services Inc. disappointed investors.",https://finnhub.io/api/news?id=93aaa09c9243cab12d450dc5f2044f26ce8829a08d6205f4ce64309df0012bd5
company,1769143110,1 Safe-and-Steady Stock to Research Further and 2 We Turn Down,138223679,https://s.yimg.com/rz/stage/p/yahoo_finance_en-US_h_p_finance_2.png,FAST,Yahoo,"A stock with low volatility can be reassuring, but it doesn’t always mean strong long-term performance. Investors who prioritize stability may miss out on higher-reward opportunities elsewhere.",https://finnhub.io/api/news?id=b7b0ac64b5be6df3c5dd793314ca753381a63b111605f18f87e171ef30ca707c
