category,datetime,headline,id,image,related,source,summary,url
company,1769204831,"Dow Jones Futures: Tesla, Microsoft, Meta, Apple Lead Earnings Wave After Whipsaw Trump Week",138229244,https://s.yimg.com/rz/stage/p/yahoo_finance_en-US_h_p_finance_2.png,STX,Yahoo,"Tesla, Microsoft, Meta and Apple lead an earnings wave after the stock market weathered whipsaw action from President Trump's moves",https://finnhub.io/api/news?id=6061a24acb0046941b9177cdd5b8017e4d81013b88c153a864a750fb3315df3a
company,1769191856,Reassessing Seagate Technology Holdings (STX) After Its 226% One Year Share Price Surge,138228582,https://s.yimg.com/rz/stage/p/yahoo_finance_en-US_h_p_finance_2.png,STX,Yahoo,"If you are asking yourself whether Seagate Technology Holdings at US$346.53 still makes sense on a value basis after such a strong run, you are not alone. The stock has delivered returns of 8.2% over the last 7 days, 22.5% over the past month, 20.5% year to date and 225.8% over the last year, with very large gains over 3 and 5 years as well. Recent attention on Seagate has focused on its position within the broader tech hardware space and how investors are treating storage related names in...",https://finnhub.io/api/news?id=e5c72a543835fe7d8f6eac53e07c9d7a6b9453350c07bf18d64ba609273df80e
company,1769181836,Boeing Stock Rips Higher Ahead Of Q4 Results; 3 Data Storage Stocks In Earnings Spotlight,138225562,https://s.yimg.com/rz/stage/p/yahoo_finance_en-US_h_p_finance_2.png,STX,Yahoo,Boeing stock has been on a tear ahead of its Q4 report as Wall Street bets on clearer skies ahead for the aerospace giant.,https://finnhub.io/api/news?id=b9b692b319fac61438ee509892aa6a6ec946ac1ebc47b4911f9ceaa6846b8c72
company,1769176140,"Seagate Stock Ahead of Q2 Earnings Release: Buy, Sell or Stay Put?",138225789,https://s.yimg.com/rz/stage/p/yahoo_finance_en-US_h_p_finance_2.png,STX,Yahoo,"STX heads into Jan. 27 earnings with revenue expected to rise 16% YoY, strong AI-driven data center demand and solid margins.",https://finnhub.io/api/news?id=d48708b88d3f3feeb7a9477cdfb5a97a36529503a065eae80e9bf06e310f03c8
company,1769172660,Intel Faces Memory-Price Crunch. Why Apple Will Be the Next Victim.,138225568,https://s.yimg.com/rz/stage/p/yahoo_finance_en-US_h_p_finance_2.png,STX,Yahoo,"Intel stock was falling as it faces headwinds from soaring memory-chip prices, which could hit other companies such as Apple.",https://finnhub.io/api/news?id=d89e79a4b072a0fbe116ab9c744f7b145aff183e20078413f6b78c78ced874d9
company,1769153400,Seagate: Outlandish Valuation With Little Upside,138223844,https://static.seekingalpha.com/cdn/s3/uploads/getty_images/2183694406/image_2183694406.jpg?io=getty-c-w1536,STX,SeekingAlpha,"Seagate Technology Holdings plc sees 16% growth, 30% margins, and 2026 production caps at an overvalued 29x forward P/E. Read why STX stock is a sell.",https://finnhub.io/api/news?id=900f16e9fe25a0e408dc8886a936e9b91c314d24aa5d75087aab75ba18614423
