category,datetime,headline,id,image,related,source,summary,url
company,1769204136,"Earnings live: Intel stock plunges, with more Big Tech earnings from Apple, Microsoft, and Tesla ahead",138229245,https://s.yimg.com/rz/stage/p/yahoo_finance_en-US_h_p_finance_2.png,T,Yahoo,"The fourth quarter earnings season kicks into high gear in the week ahead, with Big Tech results from Microsoft, Meta, Tesla, and Apple headlining the earnings calendar.",https://finnhub.io/api/news?id=1bb4634df98fad0a4b4c757c616ce6f3410f389b642f3d496be049c7978eb4f3
company,1769184707,AT&T Q4 Earnings Preview: Absurd Combination Of 4.7% Yield And 4.4x P/Cash Ratio,138229116,https://static.seekingalpha.com/cdn/s3/uploads/getty_images/1162604361/image_1162604361.jpg?io=getty-c-w1536,T,SeekingAlpha,AT&T stock looks overly bearish: 4.4x forward P/CF and 4.7% yield. Read the latest analysis on the stock here.,https://finnhub.io/api/news?id=21cc5344adc7bbfb498264bc26bce3e7fd937f21edcfa60b8f80ec81d952a286
company,1769177708,Countdown to AT&T (T) Q4 Earnings: A Look at Estimates Beyond Revenue and EPS,138225728,https://s.yimg.com/rz/stage/p/yahoo_finance_en-US_h_p_finance_2.png,T,Yahoo,"Evaluate the expected performance of AT&T (T) for the quarter ended December 2025, looking beyond the conventional Wall Street top-and-bottom-line estimates and examining some of its key metrics for better insight.",https://finnhub.io/api/news?id=64c230518ec1a51a2bb0bb05addaf47bda2dd2459f2500a949e4b5e35b3f7a70
company,1769174580,"Fiber to the Premises Market Analysis Report 2026 - Global Industry Size, Share, Trends, Opportunity, and Forecast, 2021-2031",138224838,https://s.yimg.com/rz/stage/p/yahoo_finance_en-US_h_p_finance_2.png,T,Yahoo,"The market for Fiber to the Premises is poised for significant growth due to increasing demand for high-speed internet to support digital services and remote work, bolstered by government funding to replace old infrastructures. Key challenges include high capital expenses for installation. Key players include AT&T and Huawei. Fiber to the Premises Market Fiber to the Premises Market Dublin, Jan. 23, 2026 (GLOBE NEWSWIRE) -- The ""Fiber to the Premises Market - Global Industry Size, Share, Trends,",https://finnhub.io/api/news?id=70ab9d0281904f29693162a3cb1ef46c70ea52863169785f39be50978bc864df
company,1769168622,AT&T: 3 Alternatives To The 6% Yielding Preferreds Before They Move To Junk,138226244,https://static.seekingalpha.com/cdn/s3/uploads/getty_images/1388405669/image_1388405669.jpg?io=getty-c-w1536,T,SeekingAlpha,"Preferred shares T.PR.A and T.PR.C yield just over 6%, but are at risk of downgrades and offer poor value versus higher-yielding, better-rated alternatives. Read the full analysis here.",https://finnhub.io/api/news?id=863841044950133874879300aec06161c0194db6e36c2f6ea3f0266ac89ee428
company,1769162061,December Readers ID'd 9 Ideal 'Safer' Dividends In 40 Dogs,138225275,,T,SeekingAlpha,,https://finnhub.io/api/news?id=902e79f8c9e0fe52d1a3693e35ba8b469f2b4bc48e5d46b6cedcb2bb2602762c
company,1769159040,"Zacks Industry Outlook Highlights MasTec, Dycom Industries, Tutor Perini and Orion Group",138223477,https://s.yimg.com/rz/stage/p/yahoo_finance_en-US_h_p_finance_2.png,T,Yahoo,"MasTec, Dycom, Tutor Perini, and Orion are positioned to benefit from multi-year U.S. infrastructure projects despite near-term cost and labor challenges.",https://finnhub.io/api/news?id=ce5305b362d2fdc9c1c85437959bb3c8342b01d5101aa443c039dfba99c4a9cc
company,1769145330,Warner Bros. Discovery: Time To Consider An Exit Strategy (Rating Downgrade),138223028,https://static.seekingalpha.com/cdn/s3/uploads/getty_images/2153902733/image_2153902733.jpg?io=getty-c-w1536,T,SeekingAlpha,Warner Bros. Discovery faces a capped upside from the Netflix cash offer with high valuations and monetization potential. Read why WBD stock is downgraded to hold.,https://finnhub.io/api/news?id=19e8b74674ecdeaf55f5c4d7842bf4a45058a72744681bbee9291bc46f7ca112
