category,datetime,headline,id,image,related,source,summary,url
company,1769195246,How New Price Targets Are Reframing The Story For Tyson Foods (TSN),138228676,https://s.yimg.com/rz/stage/p/yahoo_finance_en-US_h_p_finance_2.png,TSN,Yahoo,"The recent change in Tyson Foods’ price target has put fresh attention on how investors are thinking about the company and its prospects. With this new target now setting the tone for expectations around the stock, it reflects a reassessment of the risks and opportunities that analysts see ahead. Stay tuned to see how you can keep on top of these shifting targets and the story they tell about Tyson Foods in the months to come. Analyst Price Targets don't always capture the full story. Head...",https://finnhub.io/api/news?id=4411e7fc8fb48ad05f62c0fba5eea602b874f09cb7dcb34d204b0c6aff53331b
company,1769176803,Want Better Returns? Don't Ignore These 2 Consumer Staples Stocks Set to Beat Earnings,138225873,https://s.yimg.com/rz/stage/p/yahoo_finance_en-US_h_p_finance_2.png,TSN,Yahoo,Investors looking for ways to find stocks that are set to beat quarterly earnings estimates should check out the Zacks Earnings ESP.,https://finnhub.io/api/news?id=c7aa25528560e63797da16c49f5628aafbe45a218d3ad196299ec14182ade34b
company,1769170080,Sysco Set to Report Q2 Earnings: Here's What to Expect From SYY,138224910,https://s.yimg.com/rz/stage/p/yahoo_finance_en-US_h_p_finance_2.png,TSN,Yahoo,"SYY is set for Q2 earnings growth as U.S. Foodservice volumes improve, margins expand and productivity gains support higher profits.",https://finnhub.io/api/news?id=821ba1a090aea50283f8a67bba2c5e544319937a18b5b529feb314ef5dd3192f
company,1769169540,Kimberly-Clark's Q4 Earnings Coming Up: What Investors Need to Know,138224917,https://s.yimg.com/rz/stage/p/yahoo_finance_en-US_h_p_finance_2.png,TSN,Yahoo,"KMB heads into Q4 earnings with expected revenue and EPS declines, pressured by promotions, tariffs and FX, even as core demand and productivity hold up.",https://finnhub.io/api/news?id=2ac455ce82d193d89d2f72aa270d04421e93a1a4d9eae81fa2287ba0e0858d1f
company,1769142869,3 Unpopular Stocks We Keep Off Our Radar,138229364,https://s.yimg.com/rz/stage/p/yahoo_finance_en-US_h_p_finance_2.png,TSN,Yahoo,Wall Street’s bearish price targets for the stocks in this article signal serious concerns. Such forecasts are uncommon in an industry where maintaining cordial corporate relationships often trumps delivering the hard truth.,https://finnhub.io/api/news?id=65c689c39a55b935d0e4cb6fab3dd470c15635d6d01bb22efd3492821feb63f2
