category,datetime,headline,id,image,related,source,summary,url
company,1769198412,"Fed Meeting, Apple, Microsoft Earnings: What to Watch Next Week",138229248,https://s.yimg.com/rz/stage/p/yahoo_finance_en-US_h_p_finance_2.png,TXN,Yahoo,"It's shaping up to be a busy week ahead. Earnings season is in full throttle, with results expected from the likes of UnitedHealth, Chevron and Boeing. A trio of tech giants—Apple, Meta Platforms and Microsoft—will also report earnings.",https://finnhub.io/api/news?id=d411c54bb136955e3b0912346ce4a60800259e0b4c19b559cd44fd45a3e278c8
company,1769195436,Weebit Nano (ASX:WBT) Is Up 22.2% After Tier‑1 Licensing And Foundry Qualification Milestones – What's Changed,138228531,https://s.yimg.com/rz/stage/p/yahoo_finance_en-US_h_p_finance_2.png,TXN,Yahoo,"Weebit Nano recently advanced its commercial rollout by signing licensing agreements for its ReRAM technology with Tier‑1 chipmakers onsemi and Texas Instruments, while also achieving technology qualification at South Korean foundry DB HiTek to support scalable manufacturing and potential volume production. What makes these developments especially important is that Weebit Nano has now paired validation from leading industry customers with a qualified foundry partner, tightening the link...",https://finnhub.io/api/news?id=7e7b267b11a561ed2ff3faee7e9f7c7b9c69b4379682859bca5ea626299ef6c5
company,1769191913,"Dividend Champion, Contender, And Challenger Highlights: Week Of Jan 25",138229764,https://static.seekingalpha.com/cdn/s3/uploads/getty_images/1072593728/image_1072593728.jpg?io=getty-c-w1536,TXN,SeekingAlpha,"A weekly summary of dividend activity for Dividend Champions, Contenders, and Challengers. Read the full list here.",https://finnhub.io/api/news?id=51cad26e98a55cff634e728377ee94ee04cf1e5384eb442f6922079bdc07e397
company,1769179306,"Alphabet upgraded, Micron initiated: Wall Street’s top analyst calls",138225592,https://s.yimg.com/rz/stage/p/yahoo_finance_en-US_h_p_finance_2.png,TXN,Yahoo,"The most talked about and market moving research calls around Wall Street are now in one place. Here are today’s research calls that investors need to know, as compiled by The Fly.Top 5 Upgrades: Claim 50% Off TipRanks PremiumUnlock hedge fund-level data and powerful investing tools for smarter, sharper decisions Stay ahead of the market with the latest news and analysis and maximize your portfolio's potential Raymond James upgraded Alphabet (GOOGL) to Strong Buy from Outperform with a price tar",https://finnhub.io/api/news?id=cd81e55f9a1c0d5cc79bdfebc67dd236fad7fb25cfab5e0e5aad53f62167a513
company,1769178420,TXN Likely to Beat Q4 Earnings Estimates: How to Play the Stock,138225719,https://s.yimg.com/rz/stage/p/yahoo_finance_en-US_h_p_finance_2.png,TXN,Yahoo,"Texas Instruments is likely to report better-than-expected Q4 results as recovering industrial, auto and data center demand support revenue growth despite cost pressures.",https://finnhub.io/api/news?id=50ad8f04c942138664d1462c037d14a409ba57dc5f68ac3ad82beb55e9a71a0d
company,1769149237,A Look At Texas Instruments (TXN) Valuation As Analyst Upgrades Highlight Industrial Restocking Cycle,138222087,https://s.yimg.com/rz/stage/p/yahoo_finance_en-US_h_p_finance_2.png,TXN,Yahoo,"Analyst upgrades and industrial restocking set the stage Texas Instruments (TXN) is back in focus after multiple analyst upgrades tied to a broad industrial restocking cycle and growing attention on its upcoming Q4 and full year 2025 earnings call. With industrial customers accounting for a meaningful share of revenue, investors are watching how restocking trends intersect with Texas Instruments' existing margin pressures and its recent share price gains over the past month and the past three...",https://finnhub.io/api/news?id=2c8dfcf2d530fd12cc7f810a511a66962b6d7b761e4abeb1a4e2dd85c05aad18
