category,datetime,headline,id,image,related,source,summary,url
company,1768603107,Heard on the Street: Risks Rise as Tech Giants Dive Into Energy,138157435,https://s.yimg.com/rz/stage/p/yahoo_finance_en-US_h_p_finance_2.png,AMZN,Yahoo,"In a landmark deal, Google-parent Alphabet last month agreed to buy renewable energy developer Intersect Power for $4.75 billion, plus the assumption of debt. It was the first time a tech company brought an energy developer in-house.",https://finnhub.io/api/news?id=e4b437c6ebcff3e82e8f50e2537346b30141ddda994a7f35457bbf0a2b86a9c2
company,1768599240,Liberty All-Star® Equity Fund December 2025 Monthly Update,138156171,https://s.yimg.com/rz/stage/p/yahoo_finance_en-US_h_p_finance_2.png,AMZN,Yahoo,"BOSTON, January 16, 2026--Liberty All-Star® Equity Fund December 2025 Monthly Update",https://finnhub.io/api/news?id=390665fd0ccf20a6209fcb5a38a6a9470adcd9efefd8af19e395b0c877de8548
company,1768599180,"Liberty All-Star® Growth Fund, Inc. December 2025 Monthly Update",138156172,https://s.yimg.com/rz/stage/p/yahoo_finance_en-US_h_p_finance_2.png,AMZN,Yahoo,"BOSTON, January 16, 2026--Liberty All-Star® Growth Fund, Inc. December 2025 Monthly Update",https://finnhub.io/api/news?id=1b652944d2450a27f3e669784bc2df6b7ab5db43954042ad994ad68799f73b12
company,1768599070,Trump Says It's 'A Good Thing' Ford Has 5K Open Mechanic Jobs. 'You're Going To Have A Thing Called Robots',138156194,https://s.yimg.com/rz/stage/p/yahoo_finance_en-US_h_p_finance_2.png,AMZN,Yahoo,"President Donald Trump shrugged off concerns about worker shortages during a visit to a Ford (NYSE:F) assembly plant on Tuesday, instead framing the 5,000 unfilled mechanic jobs as a sign of economic strength. “That's a good thing, Tony,” Trump told CBS News in an interview at the Dearborn, Michigan factory. “That means it's vibrant.” Trump Defends Tariffs, Touts Robots And AI Trump toured Ford’s facility, where gas and hybrid F-150s are assembled. He praised U.S. automakers and used the visit t",https://finnhub.io/api/news?id=bc16f456a7c3a9c5bb0daf8ba3e51f04ee15ef6423d5e8997355fea642326087
company,1768593600,1 Fintech Disruptor + 2 Mag 7 Stocks to Buy as Momentum Surges,138156189,https://s.yimg.com/rz/stage/p/yahoo_finance_en-US_h_p_finance_2.png,AMZN,Yahoo,Nu Holdings stands out as a momentum leader as Driehaus' buy-high strategy highlights strong trends and earnings surprises driving further upside.,https://finnhub.io/api/news?id=e34b69d824964a3e0d6f0f228bca1c3ea89a5b48c04ff857d32f5f974555eed0
company,1768592400,After Saks’s Collapse—a Bitter Rift With Amazon,138156196,https://s.yimg.com/rz/stage/p/yahoo_finance_en-US_h_p_finance_2.png,AMZN,Yahoo,The department-store chain’s bankruptcy throws one of Amazon’s biggest bets on luxury retail into doubt,https://finnhub.io/api/news?id=247ad6f1bc1d913725d671402b8ea951952974b3b892d2b9fc16ad1f986a7023
company,1768591800,"How Amazon, Microsoft's growth went from 'stupendous' to 'nice'",138155238,https://s.yimg.com/rz/stage/p/yahoo_finance_en-US_h_p_finance_2.png,AMZN,Yahoo,"Research Affiliates Founder and chairman of the board Rob Arnott sits down with Market Catalysts Anchor Julie Hyman to have a conversation dissecting Wall Street's perceptions of growth and value stocks (^DJI, ^IXIC, ^GSPC), going on to make such cases for Magnificent Seven tech companies Nvidia (NVDA), Amazon (AMZN), and Microsoft (MSFT). Also watch Rob Arnott share his perspective on how fiscal stimulus mainly works to bolster wealth and asset bubbles, not the economy. To watch more expert insights and analysis on the latest market action, check out more Market Catalysts.",https://finnhub.io/api/news?id=c85ca1f9289f6960f4f654037201d68b3a5c26a449cf7dae3223cf272b588e05
company,1768590079,Cathie Wood's ARK Invest Says Apple's Reliance On Google For AI Signals Deeper Trouble,138155290,https://s.yimg.com/rz/stage/p/yahoo_finance_en-US_h_p_finance_2.png,AMZN,Yahoo,"Apple Inc.'s (NASDAQ:AAPL) decision to outsource its artificial intelligence (AI) foundation to Alphabet Inc.‘s (NASDAQ:GOOG) (NASDAQ:GOOGL) Google is not a strategic masterstroke but a sign of a company in “huge, hairy trouble,” according to the research team at Cathie Wood's ARK Invest. ‘Strategic Disaster’ During the latest episode of ARK’s “The Brainstorm,” Chief Futurist Brett Winton offered a scathing critique of the newly announced partnership that will see Google's Gemini models power Si",https://finnhub.io/api/news?id=da71d66525fdd0e4a22f9895e8be7572865946a5ae7393bc2acf3ac668f943d3
company,1768589679,ICE raids spur investor questions on Home Depot surveillance data,138155307,https://s.yimg.com/rz/stage/p/yahoo_finance_en-US_h_p_finance_2.png,AMZN,Yahoo,"STORY: A group of Home Depot investors is asking the company to review its partnership with a surveillance firm following media reports saying the firm's data has been used in Immigration and Customs Enforcement investigations.Digital publication 404 Media said ICE agents have used data from the company Flock Safety which was sent to them by local law enforcement.Home Depot locations have become hotbeds for ICE arrests, after U.S. Homeland Security Adviser Stephen Miller said the agency should target the home improvement chain, where migrant day laborers are known to gather.Zevin Asset Management, a sustainability-minded investor is leading a Home Depot shareholder proposal with 17 co-filers asking the retailer to evaluate and report the risks associated with sharing the surveillance data.Zevin’s proposal comes after a Walmart and Amazon shareholder asked the retailers for details on how the immigration crackdown is affecting their finances and supply chains…and as protests erupt after the fatal shooting of a 37-year-old woman by an ICE agent in Minneapolis.According to the proposal which was seen by Reuters, the investor group says it is concerned about financial and legal risks to Home Depot from misuse of customer data.Home Depot has faced criticism for ICE raids in its store parking lots.[quote box]A Home Depot spokesperson said: ""We cannot legally interfere with federal enforcement agencies, including preventing them from coming into our stores and parking lots.""Like other retailers, Home Depot collects demographic information including age, race, ethnicity and gender from companies that provide services on its behalf for fraud prevention and other reasons.The company said it discloses the information to ""law enforcement, public and government authorities"" that it considers ""reasonably necessary.”Home Depot plans to hold its annual shareholder meeting in May.",https://finnhub.io/api/news?id=c90dba9282efa5d59affe0b5017b4b11a2941e3f223e9ef5ac76ca599667b833
company,1768589591,This Under-the-Radar Pet Stock Could Be the Biggest Meme Buy in January 2026,138156197,https://s.yimg.com/rz/stage/p/yahoo_finance_en-US_h_p_finance_2.png,AMZN,Yahoo,"This pet stock is down more than 93% in five years, but recent takeover rumors have BARK spiking again.",https://finnhub.io/api/news?id=fd1d9aff9709b436f9c52940160a074db81c679cd8f0f15546a14ffb7f6d9110
company,1768589451,Why Is Meta Platforms Priced 36% Cheaper Than Its Hyperscaler Peers?,138155291,https://s.yimg.com/rz/stage/p/yahoo_finance_en-US_h_p_finance_2.png,AMZN,Yahoo,"Meta Platforms (NASDAQ:META) has delivered outstanding performance compared its hyperscaler peers such as Apple (NASDAQ:AAPL), Amazon (NASDAQ:AMZN), Alphabet (NASDAQ:GOOG)(NASDAQ:GOOGL), and Microsoft (NASDAQ:MSFT). Over the last 12 months, revenue growth hit 21.3%, far exceeding the low- to mid-teens rates for the others, such as with Alphabet at 13.4% and Amazon below that. And in the past ... Why Is Meta Platforms Priced 36% Cheaper Than Its Hyperscaler Peers?",https://finnhub.io/api/news?id=7934bae56640bfea1aa9828a6706037acd2fcb60b49de1a65ab550e21ffa6f94
company,1768585938,AutoZone: Recent Pullback Creates An Opportunity In A Durable Auto Parts Leader,138156622,https://static.seekingalpha.com/cdn/s3/uploads/getty_images/458652445/image_458652445.jpg?io=getty-c-w1536,AMZN,SeekingAlpha,"AutoZone, Inc. is rated a Buy due to solid business, strong expansion potential and good financials. Learn more about AZO stock here.",https://finnhub.io/api/news?id=42ae794ef04a68f778c95673b35f9ca7a6bc0c5c0f0512e00b900732828b774e
company,1768585483,"Walmart (WMT)’s Giving Great Competition to Amazon, Says Jim Cramer",138153941,https://s.yimg.com/rz/stage/p/yahoo_finance_en-US_h_p_finance_2.png,AMZN,Yahoo,"We recently published 10 Stocks Jim Cramer Talked About. Walmart Inc. (NASDAQ:WMT) is one of the stocks on Jim Cramer talked about. Supermarket giant Walmart Inc. (NASDAQ:WMT) is one of Jim Cramer’s favorite stocks. Throughout 2025, the CNBC TV host reiterated his opinion that, along with Costco, it had played an important role in keeping […]",https://finnhub.io/api/news?id=8079aa5f868418c93e7c14d7ba1381fa29ad620d4cd774647dc4684d8f0e7553
company,1768585455,"Focus On Amazon (AMZN)’s Retail Business As Well, Says Jim Cramer",138153942,https://s.yimg.com/rz/stage/p/yahoo_finance_en-US_h_p_finance_2.png,AMZN,Yahoo,"We recently published 10 Stocks Jim Cramer Talked About. Amazon.com, Inc. (NASDAQ:AMZN) is one of the stocks on Jim Cramer talked about. Amazon.com, Inc. (NASDAQ:AMZN)’s shares have gained a modest 5% over the past year. Cantor Fitzgerald started the year by slashing the share price target to $260 from $315 and keeping an Overweight rating […]",https://finnhub.io/api/news?id=1e9ebace7a6eb153287940f6b5ac37e50bd773bf1093568f4f39168b86dcc548
company,1768584660,"30 Stocks to Buy in 2026, According to Our Roundtable Pros",138155309,https://s.yimg.com/rz/stage/p/yahoo_finance_en-US_h_p_finance_2.png,AMZN,Yahoo,"DoorDash, LVMH, and Home Depot are just some of the stocks our panelists favor this year. How AI is changing the game for companies and investors.",https://finnhub.io/api/news?id=2ec147a0614e53884db61c50c86fd35467174dfff6b5f09e3c1a28c76e232598
company,1768584300,These Stocks Trade Near All-Time Highs but Remain Solid Long-Term Buys,138153943,https://s.yimg.com/rz/stage/p/yahoo_finance_en-US_h_p_finance_2.png,AMZN,Yahoo,These tech giants are strengthening their competitive position with artificial intelligence (AI).,https://finnhub.io/api/news?id=098d9e3656733afa402338905cbb7218b6d8584e33fe7c538ccdabb1bc851be6
company,1768582556,"Copper, AI & America's Supply Risk",138153944,https://s.yimg.com/rz/stage/p/yahoo_finance_en-US_h_p_finance_2.png,AMZN,Yahoo,"Copper prices are near record highs as demand surges from AI, data centers, EVs and grid expansion. This week, Amazon struck a deal with Rio Tinto to buy copper produced using new technology. Vicky Peacey, president of Resolution Copper, is an operator of one of the largest undeveloped copper projects in the US. She joined ""Bloomberg Open Interest"" to talk about America's big bet on the future of the metal.",https://finnhub.io/api/news?id=2b502be8b342f4c5de5a7e6ae7a209e2d803c51401ffef6ca4271181aa680a8f
company,1768581335,"Walmart overhauls executive ranks, John Furner set to take CEO role at month's end",138153945,https://s.yimg.com/rz/stage/p/yahoo_finance_en-US_h_p_finance_2.png,AMZN,Yahoo,Walmart is set to see a rash of changes at the top of its organization alongside its CEO transition at the end of January.,https://finnhub.io/api/news?id=d1b381836b82a2ee8a9f06edd0103c7a012e402b98293c352f930a19efd33022
company,1768580864,Tech Earnings Seen as AI Reality Check,138153936,https://s.yimg.com/rz/stage/p/yahoo_finance_en-US_h_p_finance_2.png,AMZN,Yahoo,Wedbush expects Big Tech to validate AI spend,https://finnhub.io/api/news?id=3edb7e4808f63956a2b07667e49017be25613249f7d63760149b470b95ac22a9
company,1768580460,Amazon vs. Oracle: Which Cloud Computing Stock is the Better Buy Now?,138153920,https://s.yimg.com/rz/stage/p/yahoo_finance_en-US_h_p_finance_2.png,AMZN,Yahoo,"AMZN's AWS is reaccelerating with 20% growth, a $200 billion backlog, and massive AI investments as it pulls ahead of ORCL in cloud scale.",https://finnhub.io/api/news?id=f4b1b99ef75445ec6b459aa28f5e49ba024ac304ba1345571b6264687faccace
company,1768578540,Is Carter's Wholesale Segment Weakness Dragging Overall Growth?,138153948,https://s.yimg.com/rz/stage/p/yahoo_finance_en-US_h_p_finance_2.png,AMZN,Yahoo,"CRI's growth is held back by U.S. Wholesale declines tied to Simple Joys, offsetting gains in Retail and International.",https://finnhub.io/api/news?id=7092bfc6c725899131d6c2ab208101ca64caf2378e5009302b0a46d323372146
company,1768577950,"Nigeria Approves Satellite Licenses for Amazon Kuiper, BeetleSat, Satelio",138153949,https://s.yimg.com/rz/stage/p/yahoo_finance_en-US_h_p_finance_2.png,AMZN,Yahoo,Move expands competition in Africa's growing space-based broadband market.,https://finnhub.io/api/news?id=8f5c81713120a5493e3d5dd2a960f1ee53337e7bdd4d6866270a827bfb7dacd3
company,1768577209,"AI-Shopping Assistant Rufus to Drive Amazon.com, Inc. (AMZN) e-Commerce Growth: Evercore ISI",138152472,https://s.yimg.com/rz/stage/p/yahoo_finance_en-US_h_p_finance_2.png,AMZN,Yahoo,"Amazon.com Inc (NASDAQ:AMZN) is one of the best blue-chip stocks to buy for 2026. On January 5, analysts at Evercore ISI reiterated an outperform rating on Amazon.com Inc (NASDAQ:AMZN) and set a $335 price target. According to the research firm, the e-commerce giant is well-positioned for growth driven by its AI-powered shopping assistant, Rufus. Evercore […]",https://finnhub.io/api/news?id=38b6a23caaa79fc02b69a62a15ae127532533b21c2f799c947dba598fcacaccc
company,1768576800,"Prediction: This Will Be the First Dividend Champion from the ""Magnificent Seven""",138152443,https://s.yimg.com/rz/stage/p/yahoo_finance_en-US_h_p_finance_2.png,AMZN,Yahoo,"One ""Magnificent Seven"" company has raised payouts by 600% since 2010.",https://finnhub.io/api/news?id=de9d61788c2b755594b69975abae74483a866811792028cac2460c58aab7fbf6
company,1768575601,OpenAI has committed billions to recent chip deals. Some big names have been left out,138162679,https://image.cnbcfm.com/api/v1/image/108236135-1764788503612-gettyimages-2197366908-dsc00472_mof5bjgn.jpeg?v=1768592223&w=1920&h=1080,AMZN,CNBC,"OpenAI has inked multibillion-dollar deals with AI chipmakers including Nvidia, AMD, Broadcom and Cerebras. ",https://finnhub.io/api/news?id=f792ff64fb4eb1062c3e9855be4e1825eb69734e51236daae0f4bfdfefcb3928
company,1768573560,It's More Complicated Than Mag Seven,138155075,https://static.seekingalpha.com/cdn/s3/uploads/getty_images/2221411629/image_2221411629.jpg?io=getty-c-w1536,AMZN,SeekingAlpha,"We see outsized gains for the year so far by Micron and TSMC, up 18 percent and 12 percent, respectively.",https://finnhub.io/api/news?id=5906d31ad2f589cadf0d02149eb29ca2df9e3bc200a47480501bc734bb1432b0
company,1768573070,Spotify will net an eye-popping amount of money by raising prices again,138152461,https://s.yimg.com/rz/stage/p/yahoo_finance_en-US_h_p_finance_2.png,AMZN,Yahoo,The streaming platform is raising prices across its plans.,https://finnhub.io/api/news?id=055993744518a389edbe7e1e22a7376075854ec6b064af068ab3c9a5abdf2527
company,1768572948,Amazon Will Be America’s First $1T Revenue Company,138152452,https://s.yimg.com/rz/stage/p/yahoo_finance_en-US_h_p_finance_2.png,AMZN,Yahoo,"At is current pace of growth, Amazon will have over $1 trillion in revenue by 2028. Its growth is likely to be supercharged by artificial intelligence.",https://finnhub.io/api/news?id=42680c049aa5fc8bca6fc877249f2034d976d79a95c30c0f89f40560184db153
company,1768572003,Cathie Wood Is Selling Meta Platforms Stock. Should You?,138153930,https://s.yimg.com/rz/stage/p/yahoo_finance_en-US_h_p_finance_2.png,AMZN,Yahoo,"Even as Wood trims her position, Meta’s accelerating AI infrastructure buildout, strong cash generation, and consensus analyst rating make META stock appear solid.",https://finnhub.io/api/news?id=17ee0be627e86eae33872be3f468f4b2a3b396318b8ae10f00cb000ab190b3b3
company,1768571400,5 Bargain Stocks That Could Deliver Jaw-Dropping Returns in 2026,138151639,https://s.yimg.com/rz/stage/p/yahoo_finance_en-US_h_p_finance_2.png,AMZN,Yahoo,"Despite the market being near all-time highs, there are several great bargains available.",https://finnhub.io/api/news?id=0b405f0ba96f31d055033509db4ee65be6d891e60945550a111f3ef980484c6d
company,1768570301,Stock Market Today: Dow Wavers Near Record Highs; Nvidia Regains Key Level (Live Coverage),138151611,https://s.yimg.com/rz/stage/p/yahoo_finance_en-US_h_p_finance_2.png,AMZN,Yahoo,"Futures for the Dow Jones Industrial Average and other major stock indexes were mostly higher Friday, as Wall Street looked to finish out the week on a high note. An early winner was Nvidia, which rose on the stock market today after making a bullish move above a key level Thursday.",https://finnhub.io/api/news?id=fe0dbe413d81adb944c727cd1cda04344594a47a02d5f96646ffeab245c73030
company,1768570053,Rigetti Stock: Hype or Hidden Opportunity in Quantum Tech?,138151612,https://s.yimg.com/rz/stage/p/yahoo_finance_en-US_h_p_finance_2.png,AMZN,Yahoo,"Wall Street Flags Rigetti Risks as Revenue Remains Near Zero, Cash Burn Persists",https://finnhub.io/api/news?id=e4d1cbacbb7a4c6c685a43c51630dcc45472862fde4ed4aa098d8eae049a9f6c
company,1768568700,"The Best Warren Buffett Stocks to Buy With $1,000 Right Now",138151642,https://s.yimg.com/rz/stage/p/yahoo_finance_en-US_h_p_finance_2.png,AMZN,Yahoo,These two companies can be great buy-and-hold options for long-term investors.,https://finnhub.io/api/news?id=641103b2cac3e87b25cec6b2b0c832fd46961c57fd1bce97843b3cb47ae67d33
company,1768568470,"Multimillionaires Were Asked If 'The Harder You Work, The Luckier You Get' Is True. 'You Can't Sink A Long Putt If You Aren't On The Green'",138151643,https://s.yimg.com/rz/stage/p/yahoo_finance_en-US_h_p_finance_2.png,AMZN,Yahoo,"Someone recently posed a question to multimillionaires: Is the phrase “the harder you work, the luckier you get” actually true, or is building wealth mostly a matter of gambling and being in the right place at the right time? In Reddit’s r/RichPeoplePF thread, responses from multimillionaires pointed to an obvious takeaway: Luck matters, but those who work hard and position themselves strategically tend to have far more chances to benefit from it. Don't Miss: The AI Marketing Platform Backed by",https://finnhub.io/api/news?id=78161f04d15caa2968d31033ae3689664c965ad06bb574c11f899c6d0c3982e3
company,1768568468,"Taiwan Semiconductor's Stock Surge Minted $6 Billion For Ken Fisher, Laffont And Sanders",138151644,https://s.yimg.com/rz/stage/p/yahoo_finance_en-US_h_p_finance_2.png,AMZN,Yahoo,"Taiwan Semiconductor Manufacturing Co Ltd (NYSE:TSM) didn't just beat earnings — it forced a rethink on investor positioning. The stock surged to fresh all-time highs after a blowout quarter, but the more interesting story sits beneath the headline numbers: how much wealth this AI rally just locked in for the market's biggest long-term holders. Chart created using Benzinga Pro Don't Miss: The AI Marketing Platform Backed by Insiders from Google, Meta, and Amazon — Invest at $0.85/Share Missed th",https://finnhub.io/api/news?id=c21e19d041bdb53582941a5ad5dc1a7fc015729226f1facb541f06cb94345e7d
company,1768567980,OpenAI Is Going on a Massive Spending Spree. These Stocks Stand to Benefit.,138151633,https://s.yimg.com/rz/stage/p/yahoo_finance_en-US_h_p_finance_2.png,AMZN,Yahoo,"OpenAI is expected to spend nearly half a trillion dollars by 2030, according to analysts at New Street Research, as it looks to extend the lead of its ChatGPT chatbot in an increasingly competitive market for consumer artificial intelligence.  Spending could rise to an annual rate of $100 billion by 2028, New Street’s Dan Salmon and Max Spaeth said in a note published late Thursday, and sustain that pace into the end of the decade.",https://finnhub.io/api/news?id=d26a32af919b4edb37d647e620fe1433475207d8298ea177deebae8ac3519595
company,1768566682,Oracle Doubles Down On Nashville World Headquarters As Cloud Hiring Hits Record High,138151646,https://s.yimg.com/rz/stage/p/yahoo_finance_en-US_h_p_finance_2.png,AMZN,Yahoo,"Oracle Corp (NYSE:ORCL) is trying to balance an ambitious expansion plan with investor skepticism as it builds out its AI future and reshapes its physical footprint. Oracle Pushes Nashville As A Future Growth Hub It is pushing to build Nashville into a major hub for its future, even as it faces challenges attracting enough workers. The company is advertising more open roles in Nashville than in any other U.S. city, with a heavy focus on cloud infrastructure jobs that sit at the center of its gro",https://finnhub.io/api/news?id=b90b16ccc572baf6f84267239866aa73c5c5607a7e74c9b2de796b7ba0f33d4f
company,1768566335,Watch February Earnings From NVIDIA and Microsoft to Predict Where This Mag7 ETF Goes Next,138151615,https://s.yimg.com/rz/stage/p/yahoo_finance_en-US_h_p_finance_2.png,AMZN,Yahoo,"The Roundhill Magnificent Seven ETF (NYSEARCA:MAGS) provides equal-weight exposure to the seven largest tech companies for investors seeking diversified exposure to this basket without selecting individual stocks. The fund holds NVIDIA Corporation (NASDAQ:NVDA), Alphabet Inc (NASDAQ:GOOGL), Microsoft Corporation (NASDAQ:MSFT), and Meta Platforms Inc (NASDAQ:META) in equal portions alongside Apple Inc (NASDAQ:AAPL), Amazon.com Inc (NASDAQ:AMZN), and ... Watch February Earnings From NVIDIA and Mic",https://finnhub.io/api/news?id=d1a1a942b11954a5eb2c07b5f8d3047ba9934dcaffbf479d5abb0c0ae9a4f02c
company,1768566240,Amazon & 3 More Stocks With Strong Interest Coverage Worth Buying,138152476,https://s.yimg.com/rz/stage/p/yahoo_finance_en-US_h_p_finance_2.png,AMZN,Yahoo,"AMZN, LRN, EAT and CAH boast strong interest coverage ratios, signaling solid financial footing and growth potential.",https://finnhub.io/api/news?id=c3e7d2a580d383da2738220c8e4f188c24656c989a578ece9facafefe8fe52a9
company,1768565700,"Have $1,000? 3 Consumer Stocks to Buy and Hold for the Next 10 Years: Costco, Coca-Cola, and Amazon​.",138151648,https://s.yimg.com/rz/stage/p/yahoo_finance_en-US_h_p_finance_2.png,AMZN,Yahoo,These three companies are stalwarts and industry leaders with proven track records.,https://finnhub.io/api/news?id=26d6b58daff5785a0809140a7a3fa54fe594e756689770604914f0bd2e58ea78
company,1768565100,AST SpaceMobile Stock Jumps Again. Why the SpaceX Rival’s Shares Are Going Stellar.,138151630,https://s.yimg.com/rz/stage/p/yahoo_finance_en-US_h_p_finance_2.png,AMZN,Yahoo,AST SpaceMobile stock was rising as investors got excited about the potential for the satellite-communications company to expand in the defense sector.,https://finnhub.io/api/news?id=3a43761b7c35711e4a37b836d6509ab1b0bec5846e11091c9fd9e32e98b6984c
company,1768564846,"Gold, silver record climb has hint of 'Sell America' trade in it",138151650,https://s.yimg.com/rz/stage/p/yahoo_finance_en-US_h_p_finance_2.png,AMZN,Yahoo,"Gold (GC=F) and silver prices (SI=F) climb to yet another set of record highs on Wednesday. Wilmington Trust chief economist Luke Tilley comments on the safe haven nature of commodities, while Argent Capital Management portfolio manager Jed Ellerbroek explains how Amazon (AMZN) is his firm's best idea for 2026. Tilley previously served as an economic advisor for the Federal Reserve Bank of Philadelphia. Also catch Luke Tilley discuss the avenues the Federal Reserve could go to maintain independence from the Trump administration. To watch more expert insights and analysis on the latest market action, check out more Market Domination.",https://finnhub.io/api/news?id=a4e135051cf04e4d3cd40ab399120d4d985ada1414fd2ae6b04fc0bdbaea990b
company,1768563005,Nvidia stock is 'on track' but lacks 'meaningful new catalysts',138150961,https://s.yimg.com/rz/stage/p/yahoo_finance_en-US_h_p_finance_2.png,AMZN,Yahoo,"Nvidia (NVDA) stock has fallen from its record high in October. Intelligent Alpha founder and CEO Doug Clinton joins Market Domination host Josh Lipton to take a closer look at Nvidia's stock price action. Watch the video above for more, and to hear another ""Magnificent Seven"" name the analyst is bullish on this year. To watch more expert insights and analysis on the latest market action, check out more Market Domination.",https://finnhub.io/api/news?id=55490732a22ffd4739e57467cb1e076b83d4877d24f1849dcd20c4f348a1ed16
company,1768561892,Amazon Locks In Copper Supply as AI Power Demand Grows,138150967,https://s.yimg.com/rz/stage/p/yahoo_finance_en-US_h_p_finance_2.png,AMZN,Yahoo,AWS becomes the first buyer of copper produced using Rio Tinto's Nuton technology in Arizona.,https://finnhub.io/api/news?id=e90d53c8f800fe82781f928d84148ef1e6c502f02207fa0f9367d4fa14d11032
company,1768561284,Strategy Director Buys MSTR For First Time In 3.5 Years—Here's Why That Matters,138150968,https://s.yimg.com/rz/stage/p/yahoo_finance_en-US_h_p_finance_2.png,AMZN,Yahoo,"Strategy Inc. (NASDAQ:MSTR) director Carl Rickertsen recently broke a 3.5-year pattern of only selling stock, buying 5,000 shares for $779,395 on Monday after the stock crashed 68% from its $543 November peak. Director Flips From Seller To Buyer After 68%...",https://finnhub.io/api/news?id=97da6233ceee62d233678916d69fd3377d47fbabbaa9d92d1be4b30dde248211
