category,datetime,headline,id,image,related,source,summary,url
company,1768559400,"As Tech Giants Get More Hands-On With Energy, Their Risks Rise",138150969,https://s.yimg.com/rz/stage/p/yahoo_finance_en-US_h_p_finance_2.png,AMZN,Yahoo,"The race to build up more AI data centers has created a strain on the existing power grid while also bottlenecking the ambitious plans of the world’s largest tech companies.  AI systems consume far more energy than more typical servers and other computing gear, but new energy generation facilities don’t exactly go up overnight.  In a landmark deal, Google-parent  Alphabet  last month agreed to buy renewable energy developer Intersect Power for $4.75 billion, plus the assumption of debt.",https://finnhub.io/api/news?id=ddd92d036345470f7c2cb00fe00b669d791b50eb4fbe91dea4aeb27af755e4e1
company,1768556032,Why I'm Finally Bullish On Equities Again,138152114,https://static.seekingalpha.com/cdn/s3/uploads/getty_images/2245411719/image_2245411719.jpg?io=getty-c-w1536,AMZN,SeekingAlpha,"TSMC's earnings highlight AI demand and boosted 2026 CapEx, making tech stocks look undervalued after a valuation reset. Click for my updated market outlook.",https://finnhub.io/api/news?id=5f47d0a5782115a893be7e3566fcfb075bb3305ce4e8c4f07b767dca33f67884
company,1768552200,AI + America + SCHG = Long-Term Growth,138151546,https://static.seekingalpha.com/cdn/s3/uploads/getty_images/2149027472/image_2149027472.jpg?io=getty-c-w1536,AMZN,SeekingAlpha,"SCHG ETF remains a long-term buy for AI-driven growth: low 0.04% fee, tech-heavy exposure (NVIDIA top holding), strong performance. Click here to read the analysis.",https://finnhub.io/api/news?id=170f1c7e529d5743fe64f8792511846b9e2eddc3f50b2b5f415ba6e3fc2d8b15
company,1768550591,"AI chip trade, Saks' bankruptcy woes, Trump's health-care plan and more in Morning Squawk",138153271,https://image.cnbcfm.com/api/v1/image/108253260-17685125162026-01-15t212728z_2088796254_rc2x1ja1uy7l_rtrmadp_0_usa-trump.jpeg?v=1768512551&w=1920&h=1080,AMZN,CNBC,Here are five key things investors need to know to start the trading day.,https://finnhub.io/api/news?id=b6d78e13f81d654da3be528933554f25edca5aa1dbebdf2bfabb00f1c247130e
company,1768539660,AI Market Looks More Like Boom than Bubble After TSMC Earnings,138151631,https://s.yimg.com/rz/stage/p/yahoo_finance_en-US_h_p_finance_2.png,AMZN,Yahoo,The foundry behind Nvidia’s and Apple’s chips predicted Thursday its capital spending would swell at least 27% this year.,https://finnhub.io/api/news?id=1a4748f7b24358abd653d44d47df78287f40ba339a913183321972bb8a586b01
company,1768534290,Exclusive: Is Apple Late To Foldable iPhones? Ming-Chi Kuo Says Cupertino Isn't At 'Disadvantage' As Samsung Sees Foldables Go Mainstream,138147442,https://s.yimg.com/rz/stage/p/yahoo_finance_en-US_h_p_finance_2.png,AMZN,Yahoo,"Apple Inc.'s (NASDAQ:AAPL) long-anticipated entry into the foldable iPhone market may not be as delayed — or as risky — as it appears, according to analyst Ming-Chi Kuo, even as Samsung Electronics Co. (OTC:SSNLF) says the category is nearing mainstream adoption. Apple's Timing May Not Be A Problem After All Apple has yet to launch a foldable iPhone, but Kuo, a TF International Securities analyst known for tracking Apple's supply chain, told Benzinga that timing alone does not put Cupertino at a",https://finnhub.io/api/news?id=2f11d15ed05328ed172f6ac673b033873b3571214f74e017f1224befd22c016f
company,1768530821,Trump Moves to Make Tech Giants Pay for Surging Power Costs,138151638,https://s.yimg.com/rz/stage/p/yahoo_finance_en-US_h_p_finance_2.png,AMZN,Yahoo,"The unprecedented plan, set to be announced Friday morning, seeks to address growing tensions over how the nation can supply electricity to power-hungry data centers — seen as necessary to help win the global AI race — without simultaneously hiking utility bills for homes and businesses.  The Trump administration and some US governors plan to direct grid operator PJM Interconnection LLC to hold an auction for tech companies to bid on 15-year contracts for new electricity generation capacity.",https://finnhub.io/api/news?id=69b4c0036c8fa879cf1139d9d9fcb84d2589c922d455a0f81b01ad292f570a82
company,1768530666,Netflix Reportedly Prepares All-Cash Bid For Warner Bros. As Paramount Turns Up Heat On Takeover Battle,138147445,https://s.yimg.com/rz/stage/p/yahoo_finance_en-US_h_p_finance_2.png,AMZN,Yahoo,"Netflix Inc. (NASDAQ:NFLX) is reportedly preparing to revise the terms of its $82.7 billion deal to buy Warner Bros. Discovery (NASDAQ:WBD) to make it an all-cash offer, as it seeks to fend off Paramount Skydance’s (NASDAQ:PSKY) hostile bid. The revised deal, aimed at offering WBD shareholders a quicker and simpler transaction, is still under negotiation and may change, the Financial Times reported on Tuesday, citing people familiar with the matter. Netflix and WBD did not immediately respond to",https://finnhub.io/api/news?id=d80f1a48a9366dafe5036c54949f6aec8b7e76fd57ba2456c904c527f2dae815
