category,datetime,headline,id,image,related,source,summary,url
company,1768599180,"Top Analyst Reports for Visa, AMD & Thermo Fisher",138156823,https://s.yimg.com/rz/stage/p/yahoo_finance_en-US_h_p_finance_2.png,CAH,Yahoo,"Visa's volume-driven growth, cross-border expansion and AI investments support long-term prospects, but rising costs and regulatory risks keep the outlook cautious.",https://finnhub.io/api/news?id=b0dbb69a5c18c8548d8bf9bdfa5d50ef8f90071e0a710ff2d991f2a38ccd8aa4
company,1768585560,Intuitive Surgical Stock Dips on Q4 Preliminary Revenue Results,138155412,https://s.yimg.com/rz/stage/p/yahoo_finance_en-US_h_p_finance_2.png,CAH,Yahoo,"ISRG posts strong preliminary Q4 and full-year 2025 revenue growth, but shares dip as investors weigh procedure trends, margins and outlook.",https://finnhub.io/api/news?id=df8455018ab6b57a318ed582a92a6254e239e3521cd39badd50633628505a584
company,1768585320,DexCom Stock Declines Following Strong Preliminary Q4 Results,138155443,https://s.yimg.com/rz/stage/p/yahoo_finance_en-US_h_p_finance_2.png,CAH,Yahoo,"DXCM posts strong preliminary Q4 and full-year 2025 revenue growth, beating estimates, though shares slip after the announcement.",https://finnhub.io/api/news?id=e4dff2a4e85e869943dbd884e690f8072fae0a8a9033d0b41eed3458dda67ef8
company,1768572902,"Cardinal Health, Inc. (CAH) Hit a 52 Week High, Can the Run Continue?",138152647,https://s.yimg.com/rz/stage/p/yahoo_finance_en-US_h_p_finance_2.png,CAH,Yahoo,"Cardinal (CAH) is at a 52-week high, but can investors hope for more gains in the future? We take a look at the company's fundamentals for clues.",https://finnhub.io/api/news?id=de75578d9e7a8c899918a2b51dff65312ba325d9ecf44aa231fdc0ae7ce7e1d1
company,1768572007,Why Investors Need to Take Advantage of These 2 Medical Stocks Now,138152719,https://s.yimg.com/rz/stage/p/yahoo_finance_en-US_h_p_finance_2.png,CAH,Yahoo,The Zacks Earnings ESP is a great way to find potential earnings surprises. Why investors should take advantage now.,https://finnhub.io/api/news?id=4720d056dbef1d5218595d9ae88ba76f3f24ea673c502b32a25bcb0c2af43693
company,1768566240,Amazon & 3 More Stocks With Strong Interest Coverage Worth Buying,138152476,https://s.yimg.com/rz/stage/p/yahoo_finance_en-US_h_p_finance_2.png,CAH,Yahoo,"AMZN, LRN, EAT and CAH boast strong interest coverage ratios, signaling solid financial footing and growth potential.",https://finnhub.io/api/news?id=c3e7d2a580d383da2738220c8e4f188c24656c989a578ece9facafefe8fe52a9
company,1768564814,Cardinal Health (NYSE:CAH) Shareholders Will Want The ROCE Trajectory To Continue,138151837,https://s.yimg.com/rz/stage/p/yahoo_finance_en-US_h_p_finance_2.png,CAH,Yahoo,What trends should we look for it we want to identify stocks that can multiply in value over the long term? One common...,https://finnhub.io/api/news?id=53e8ce82fd2fdceea8b5af6c16be4eb604878193b7a6da0191e7650b1cb420e7
