category,datetime,headline,id,image,related,source,summary,url
company,1768602904,"Stock Market Today, Jan. 16: Super Micro Computer Jumps on AI Server Demand After Taiwan Semiconductor Results",138156929,https://s.yimg.com/rz/stage/p/yahoo_finance_en-US_h_p_finance_2.png,DELL,Yahoo,"AI-fueled server demand, surging trading volume, and sector momentum put this hardware maker in sharp focus, today, Jan. 16, 2026.",https://finnhub.io/api/news?id=58f649e7e479a2922dd2df4f098edd0de891472c06c22bb69eea8fc8593d97a0
company,1768586777,Micron: Here's What I Underestimated About The AI Memory Upside,138156683,https://static.seekingalpha.com/cdn/s3/uploads/getty_images/1689227296/image_1689227296.jpg?io=getty-c-w1536,DELL,SeekingAlpha,Micron stock up 50% as AI boosts DRAM/NAND pricing and SSD demand beyond HBM.,https://finnhub.io/api/news?id=5373c075b12b1cc71205d059ca35d85f6ca5f802bc49d10e47402021652dbf1f
company,1768584998,Barclays Calls This 1 AI Server Stock ‘Best in Class’ Amid Upgrade to ‘Overweight’ Rating,138156397,https://s.yimg.com/rz/stage/p/yahoo_finance_en-US_h_p_finance_2.png,DELL,Yahoo,"Dell Technologies' stock offers significant upside potential in 2026, given its widening AI moat, according to Barclays.",https://finnhub.io/api/news?id=607e6d6c679ac62ba84c86637ba1f8193f7f1b3a064061b8ef42671bdbe26dcd
company,1768578900,DELL vs. CSCO: Which AI Infrastructure Stock Is the Better Buy Now?,138154031,https://s.yimg.com/rz/stage/p/yahoo_finance_en-US_h_p_finance_2.png,DELL,Yahoo,"Dell Technologies leads in AI server demand, but Cisco Systems' networking strength and earnings momentum position it as the stronger AI infrastructure stock.",https://finnhub.io/api/news?id=46102f6471fdf3e8df68d755adff15fac5f29ea33195118aa5d55a235bd6f065
company,1768578420,Machine Investment Group Acquires Newly Built Multifamily Asset in Fast-Growing Submarket of Austin MSA,138152457,https://s.yimg.com/rz/stage/p/yahoo_finance_en-US_h_p_finance_2.png,DELL,Yahoo,"Machine Investment Group (MIG), a real estate investment platform focused on opportunistic, distressed, and special situations across the United States, announced the off-market acquisition of Rise 120, a newly built property consisting of 227 multifamily units and 15,000 square feet of retail located in Georgetown, TX, a highly desirable and fast growing submarket of the Austin MSA.",https://finnhub.io/api/news?id=94df62d8b99135e0adde70c360d42be23eafc1e074f5eae2a37404b7c28721a6
company,1768577520,Why Options Traders Are Loading Up on Pure Storage,138162278,https://s.yimg.com/rz/stage/p/yahoo_finance_en-US_h_p_finance_2.png,DELL,Yahoo,Institutional investors are aggressively buying Pure Storage call options as the company secures hyperscaler deals for its energy-efficient AI technology.,https://finnhub.io/api/news?id=d6c09b5199cdfa576aea7cd25d62170d97dac343dd1f5603fa122b9ad5261bf3
company,1768568400,BDT & MSD Hires Centerview Banker Adam Beshara as a Top Executive,138151683,https://s.yimg.com/rz/stage/p/yahoo_finance_en-US_h_p_finance_2.png,DELL,Yahoo,"BDT & MSD Partners is bringing on a Centerview veteran as one of its top executives, as the merchant bank grows its business advising and investing in founder- and family-owned companies.  Adam Beshara,  who has been a partner at Centerview Partners since 2012, will be one of five presidents at the firm when he starts the job in May, BDT & MSD executives said.  Run by  Byron Trott  and  Gregg Lemkau,  both former star bankers at  Goldman Sachs  BDT & MSD provides families and founders with advice and capital.",https://finnhub.io/api/news?id=381a19da310ed6409b9473be26905a7aa7004ef0cdd8c1ce3904061afc720280
