category,datetime,headline,id,image,related,source,summary,url
company,1768603502,Freeport-McMoRan (FCX) Falls More Steeply Than Broader Market: What Investors Need to Know,138156889,https://s.yimg.com/rz/stage/p/yahoo_finance_en-US_h_p_finance_2.png,FCX,Yahoo,"In the latest trading session, Freeport-McMoRan (FCX) closed at $58.71, marking a -2.08% move from the previous day.",https://finnhub.io/api/news?id=81df7033e3d02269ef07162572b9161e105ce46b3a34dea1232fcaf793c9b31a
company,1768594843,Abundant Nat-Gas Supplies Pressure Prices,138156890,https://s.yimg.com/rz/stage/p/yahoo_finance_en-US_h_p_finance_2.png,FCX,Yahoo,"February Nymex natural gas (NGG26 ) on Friday closed down by -0.025 (-0.80%), Feb nat-gas prices settled lower on Friday but remained above Thursday's 3-month nearest-futures low. Abundant US supplies are weighing on nat-gas prices after Thursday's weekly EIA report showed nat-gas storage levels +3.4% above their 5-year seasonal average....",https://finnhub.io/api/news?id=ca117c3e538047cc6a0cf9e3e9f5d22400a1275c587366cffbbf0f939a54a44a
company,1768587154,"Cramer's week ahead: Earnings from Netflix, Intel, Capital One, McCormick",138162728,https://image.cnbcfm.com/api/v1/image/104741387-IMG_8445-jim-cramer.jpg?v=1696458439&w=1920&h=1080,FCX,CNBC,CNBC's Jim Cramer walked investors through next week on Wall Street.,https://finnhub.io/api/news?id=66badca546c5001ec802e6b5244989fb723e949eeed74ef82d69ec35b7c35b3d
company,1768581120,3 Metals Stocks Bank of America Is Bullish on for 2026,138163051,https://s.yimg.com/rz/stage/p/yahoo_finance_en-US_h_p_finance_2.png,FCX,Yahoo,"Bank of America highlights Agnico Eagle, Freeport-McMoRan, and Cameco as mining stocks positioned to benefit from strength in gold, copper, and uranium",https://finnhub.io/api/news?id=1026ebeb78391eb689089ce55b98950c5a18f0cd4afa533adc6651a7efc46c49
company,1768548600,Materials Stocks Are a ‘Go.’ It’s a Positive Signal for a New Era.,138149621,https://s.yimg.com/rz/stage/p/yahoo_finance_en-US_h_p_finance_2.png,FCX,Yahoo,"The fundamentals are changing for the better, positioning the stocks as potentially viable long-term investments.",https://finnhub.io/api/news?id=1fb52cf6043b4a93a5d5d7e042f0823f4d0dc1d6c2a56fae0ca4bb1026636217
