category,datetime,headline,id,image,related,source,summary,url
company,1768596950,"Ahead of the Quantinuum IPO, Should You Buy Honeywell Stock?",138156846,https://s.yimg.com/rz/stage/p/yahoo_finance_en-US_h_p_finance_2.png,HON,Yahoo,"Honeywell is considering a debut for its quantum computing division, Quantinuum.",https://finnhub.io/api/news?id=8df0190c5f3fb7eb9eec47b5bbde5db2261f067eaaa49e0fcaca9c84015ea3e9
company,1768596884,"Honeywell upgraded by JPMorgan, OpenAI to begin testing ads",138156337,https://s.yimg.com/rz/stage/p/yahoo_finance_en-US_h_p_finance_2.png,HON,Yahoo,"Market Domination Host Josh Lipton tracks several of the day's top trending stock tickers, including Honeywell shares (HON) receiving an upgrade to Overweight from JPMorgan analysts, OpenAI (OPAI.PVT) set to begin testing ads on ChatGPT, and Morgan Stanley issuing downgrades on Kraft Heinz (KHC) and J.M. Smucker (SJM). To watch more expert insights and analysis on the latest market action, check out more Market Domination.",https://finnhub.io/api/news?id=713a05db780c0757899aeed8d71f9e2f3737304db31b4ba4d1862ab8225711eb
company,1768574475,Honeywell upgraded at JPM as breakup nears and aerospace momentum builds,138152509,https://s.yimg.com/rz/stage/p/yahoo_finance_en-US_h_p_finance_2.png,HON,Yahoo,"Investing.com -- JPMorgan upgraded Honeywell to Overweight, saying the stock’s discount to its sum-of-the-parts valuation and improving underlying momentum create an opportunity ahead of the planned breakup.",https://finnhub.io/api/news?id=9e27a227c1270a0fd0e7b71d3e03e562bd0a6b91225cf7e7fd82026b42ba8ade
company,1768568569,"Here Are Friday’s Top Wall Street Analyst Research Calls: ConocoPhillips, Devon Energy, Garmin, Honeywell, HP, PepsiCo, Rocket Labs, Seagate, and More",138151875,https://s.yimg.com/rz/stage/p/yahoo_finance_en-US_h_p_finance_2.png,HON,Yahoo,"Pre-Market Stock Futures: The futures are trading higher as we get set to close out the week on a possible winning note, after a massive bounce-back rally on Thursday that saw all the major indices surge higher. The combination of a stiff 2-day sell-off, positive economic data showing inflation steady and trending lower this week, ... Here Are Friday’s Top Wall Street Analyst Research Calls: ConocoPhillips, Devon Energy, Garmin, Honeywell, HP, PepsiCo, Rocket Labs, Seagate, and More",https://finnhub.io/api/news?id=86f959a039692c056b94f1c3aecab2f49b170a158d7c07df4e4aca873d548502
company,1768564163,"Stocks making the biggest moves midday: Novo Nordisk, Vistra, GE Vernova, Regions Financial and more",138153488,https://image.cnbcfm.com/api/v1/image/108231180-17640121262025-11-24t185244z_352081195_rc263iank3kr_rtrmadp_0_novo-nordisk.jpeg?v=1765918401&w=1920&h=1080,HON,CNBC,These are some of the stocks posting the largest moves in midday trading. ,https://finnhub.io/api/news?id=863ad9e11ad54b9eef52139b11550e210c56bcd7f51d1d9edd9dd1fa682f16ea
company,1768549650,"Stocks making the biggest moves premarket: PNC, ImmunityBio, Coupang & more",138153747,https://image.cnbcfm.com/api/v1/image/107120267-1663370501107-gettyimages-1222123413-AFP_1TY3N1.jpeg?v=1768566950&w=1920&h=1080,HON,CNBC,These are the stocks posting the largest moves in premarket trading. ,https://finnhub.io/api/news?id=4653f6ac24b15377dd69454068a460c5d88ea33f70976d8b75c8af8279968db6
