category,datetime,headline,id,image,related,source,summary,url
company,1768587154,"Cramer's week ahead: Earnings from Netflix, Intel, Capital One, McCormick",138162728,https://image.cnbcfm.com/api/v1/image/104741387-IMG_8445-jim-cramer.jpg?v=1696458439&w=1920&h=1080,ISRG,CNBC,CNBC's Jim Cramer walked investors through next week on Wall Street.,https://finnhub.io/api/news?id=66badca546c5001ec802e6b5244989fb723e949eeed74ef82d69ec35b7c35b3d
company,1768585560,Intuitive Surgical Stock Dips on Q4 Preliminary Revenue Results,138155412,https://s.yimg.com/rz/stage/p/yahoo_finance_en-US_h_p_finance_2.png,ISRG,Yahoo,"ISRG posts strong preliminary Q4 and full-year 2025 revenue growth, but shares dip as investors weigh procedure trends, margins and outlook.",https://finnhub.io/api/news?id=df8455018ab6b57a318ed582a92a6254e239e3521cd39badd50633628505a584
company,1768581240,Intuitive Surgical Inc. stock outperforms competitors despite losses on the day,138208786,,ISRG,MarketWatch,Intuitive Surgical Inc. stock outperforms competitors despite losses on the day,https://finnhub.io/api/news?id=ac8457eba1411a5edeafe6ccb6ef0466c4e54525583b329580cf8f0e0c1f4778
company,1768573834,"Surging Intel Stock, 2 Other Nasdaq 100 Giants Headline Earnings Calendar",138152451,https://s.yimg.com/rz/stage/p/yahoo_finance_en-US_h_p_finance_2.png,ISRG,Yahoo,"Intel stock is holding near highs ahead of its Q4 earnings report, along with Leaderboard stock GE Aerospace.",https://finnhub.io/api/news?id=8fce287aecebaccab25f2fe88e18378e4d3f2bfa3b0c4c15e2206a8b964e5862
company,1768573803,Brokers Suggest Investing in Intuitive Surgical (ISRG): Read This Before Placing a Bet,138152583,https://s.yimg.com/rz/stage/p/yahoo_finance_en-US_h_p_finance_2.png,ISRG,Yahoo,"The average brokerage recommendation (ABR) for Intuitive Surgical (ISRG) is equivalent to a Buy. The overly optimistic recommendations of Wall Street analysts make the effectiveness of this highly sought-after metric questionable. So, is it worth buying the stock?",https://finnhub.io/api/news?id=e12a66aa368755a6e70fa70459cc867e038a67adad7bf2053513d1d27c0671a1
company,1768572908,Intuitive Surgical (ISRG) Q4 Earnings on the Horizon: Analysts' Insights on Key Performance Measures,138152584,https://s.yimg.com/rz/stage/p/yahoo_finance_en-US_h_p_finance_2.png,ISRG,Yahoo,Get a deeper insight into the potential performance of Intuitive Surgical (ISRG) for the quarter ended December 2025 by going beyond Wall Street's top-and-bottom-line estimates and examining the estimates for some of its key metrics.,https://finnhub.io/api/news?id=ce8f43ff5cbb55e66783c780c777d1d0329726cdb8c9c5d11754e974af7fd5fd
company,1768566540,Intuitive Surgical: Buying The Dip On This Wide-Moat Compounder,138153625,https://static.seekingalpha.com/cdn/s3/uploads/getty_images/2222831149/image_2222831149.jpg?io=getty-c-w1536,ISRG,SeekingAlpha,"Intuitive Surgical Q4 2025 revenue rose 19% y/y; 2026 procedure guidance disappointed, but da Vinci 5 strength supports Buy—read now.",https://finnhub.io/api/news?id=7d706b7435ee1f9be411e69d487184122651b91ced08dbf463bc186678fa77fd
company,1768566240,"The Zacks Analyst Blog Highlights American Express, Intuitive Surgical, Booking Holdings, Daily Journal and Star Group",138152585,https://s.yimg.com/rz/stage/p/yahoo_finance_en-US_h_p_finance_2.png,ISRG,Yahoo,"American Express shows steady growth from travel spending and new products, even as rising costs and credit risks temper upside.",https://finnhub.io/api/news?id=31c62ad4f6d2c8a44f9dba40807bae4146cd374124ef4781a3592f220479ab32
company,1768557967,"Intuitive says general surgery, acute care fuel US robot momentum",138154075,https://s.yimg.com/rz/stage/p/yahoo_finance_en-US_h_p_finance_2.png,ISRG,Yahoo,"CEO Dave Rosa said a strong rollout for the da Vinci 5 surgical robot in 2025 exceeded expectations, with the system driving greater utilization than the earlier Xi model.",https://finnhub.io/api/news?id=4fa442ba4149f096c58a0434e8b8a58b153afafa5a95dbdd85c58f30d6c50508
