category,datetime,headline,id,image,related,source,summary,url
company,1768598700,The $56 Billion Draft: Follow TSMC’s CapEx Stream,138164744,https://s.yimg.com/rz/stage/p/yahoo_finance_en-US_h_p_finance_2.png,KLAC,Yahoo,A capital injection into the semiconductor supply chain creates guaranteed revenue for the companies building the infrastructure of the digital economy.,https://finnhub.io/api/news?id=f490bf2f73bb6962f792bb9aa34f29d04c3055393987362d02aa8e2ec582a0a1
company,1768596800,Wells Fargo Can’t Get Enough of These 2 Semiconductor Stocks,138156839,https://s.yimg.com/rz/stage/p/yahoo_finance_en-US_h_p_finance_2.png,KLAC,Yahoo,Wells Fargo is kicking off 2026 with two massive price target increases that are ahead of the consensus and point to further growth in the semiconductor industry.,https://finnhub.io/api/news?id=30fd2f1b66437982cf1f481c5e7d59d0c3c9abaf905d39ed4b1361df16586a4e
company,1768587535,"KLA (KLAC) is “Terrific,” Says Jim Cramer",138155419,https://s.yimg.com/rz/stage/p/yahoo_finance_en-US_h_p_finance_2.png,KLAC,Yahoo,We recently published 9 Stocks Jim Cramer Talked About. KLA Corporation (NASDAQ:KLAC) is one of the stocks on Jim Cramer talked about. KLA Corporation (NASDAQ:KLAC) is a semiconductor manufacturing equipment and services provider. Its shares are up by 117% over the past year and by 22% year-to-date. Investment bank Morgan Stanley has started the year […],https://finnhub.io/api/news?id=934aa05157ed69353d280b94dd8a26fe531f7ce23a9b973e04170529e42aa390
company,1768582805,Are You Looking for a Top Momentum Pick? Why KLA (KLAC) is a Great Choice,138155420,https://s.yimg.com/rz/stage/p/yahoo_finance_en-US_h_p_finance_2.png,KLAC,Yahoo,Does KLA (KLAC) have what it takes to be a top stock pick for momentum investors? Let's find out.,https://finnhub.io/api/news?id=ceefbb8b6c7ba3bc771faa0f89fba5fd4e82bdf1af0a0fb50c6070444954fa52
company,1768581240,KLA Corp. stock underperforms Friday when compared to competitors despite daily gains,138208707,,KLAC,MarketWatch,KLA Corp. stock underperforms Friday when compared to competitors despite daily gains,https://finnhub.io/api/news?id=32f3da6cd25e5f1752f55059507079654c5444e2601252481cec75cc88baeaff
company,1768558164,US Stock Market Today: S&P 500 Futures Edge Higher On Strong Jobs Data And Tariff Jitters,138151011,https://s.yimg.com/rz/stage/p/yahoo_finance_en-US_h_p_finance_2.png,KLAC,Yahoo,"The Morning Bull - US Market Morning Update Friday, Jan, 16 2026 US stock futures are pointing higher this morning, with E-mini S&P 500 contracts up about 0.3%, as investors weigh strong economic data against fresh trade tensions. Weekly initial jobless claims have dropped to 198,000, and continuing claims are at 1.884 million, numbers that signal a resilient job market and, for many households, better job security. At the same time, the White House is flagging 25% tariffs on some...",https://finnhub.io/api/news?id=64aa9f2ceec6e3155d8814274e55572cc68617d64af0f93b0609acd43c1550f1
company,1768538540,3 Market-Beating Stocks to Target This Week,138149613,https://s.yimg.com/rz/stage/p/yahoo_finance_en-US_h_p_finance_2.png,KLAC,Yahoo,"Companies that consistently increase their sales, margins, or returns on capital are usually rewarded with the best returns, and those that can do all three for years on end are almost always the legendary stocks that return 100 times your money.",https://finnhub.io/api/news?id=95f0e62649b0154ef2c256a224bda9f51de4f137db313777432ec83c1ffa14bb
