category,datetime,headline,id,image,related,source,summary,url
company,1768561211,"Should You Be Impressed By ONEOK, Inc.'s (NYSE:OKE) ROE?",138151072,https://s.yimg.com/rz/stage/p/yahoo_finance_en-US_h_p_finance_2.png,OKE,Yahoo,"While some investors are already well versed in financial metrics (hat tip), this article is for those who would like...",https://finnhub.io/api/news?id=42f240f3a23f5495298ab5589665ef13368d82e7ec0c6bca01934b77be2986a0
company,1768558500,ONEOK: Buy This Income Machine On Sale Now,138152274,https://static.seekingalpha.com/cdn/s3/uploads/getty_images/1404942636/image_1404942636.jpg?io=getty-c-w1536,OKE,SeekingAlpha,"ONEOK offers safe yield, value, and growth with organic projects and a BBB credit rating; discounted shares could return 34% in 2026. Read why OKE stock is a buy.",https://finnhub.io/api/news?id=69978a6cb3ab478d53e4d28e602f4af1f6d8281e597c77950b122741817b999e
company,1768555986,"ONEOK: A Mispriced Growth, Value And Dividend Stock All At Once",138152125,https://static.seekingalpha.com/cdn/s3/uploads/getty_images/1275086161/image_1275086161.jpg?io=getty-c-w1536,OKE,SeekingAlpha,"ONEOK offers value, growth, and income with a 5.4% dividend, 60,000-mile pipeline, resilient cash flows, and discounted valuation. Read why OKE stock is a strong buy.",https://finnhub.io/api/news?id=a0da33cc8b8b70021971fc3136ab0d1f076ada50602619b8bdf5f79de52f496d
company,1768553100,"Dividend Harvesting Portfolio Week 254: $25,400 Allocated, $2,720.76 In Projected Dividends",138151581,https://static.seekingalpha.com/cdn/s3/uploads/getty_images/1445810162/image_1445810162.jpg?io=getty-c-w1536,OKE,SeekingAlpha,"The Dividend Harvesting Portfolio, built with $100/week, now yields 8.04% and has returned 33.22% on invested capital. Click here to know more.",https://finnhub.io/api/news?id=b0b329efaa6b558609252f04271aa8711e0de4f44f6e38b381d200c1de2039dd
company,1768544808,ONEOK: Why Its Aggressive Growth And Yield Outshine Kinder Morgan's Stability,138150896,https://static.seekingalpha.com/cdn/s3/uploads/getty_images/2226433087/image_2226433087.jpg?io=getty-c-w1536,OKE,SeekingAlpha,"Compare ONEOK (OKE) vs. Kinder Morgan (KMI): why both are Buy-rated midstream stocks, with OKE’s M&A upside and KMI’s stable gas growth—read now.",https://finnhub.io/api/news?id=c95137244d97ee3a077c190a6dc8cdd2de59971019def73e3542cf4e04c1bec4
