category,datetime,headline,id,image,related,source,summary,url
company,1768593876,JPMorgan Reduces the Firm’s PT on Crown Castle Inc. (NYSE:CCI) Stock,138156324,https://s.yimg.com/rz/stage/p/yahoo_finance_en-US_h_p_finance_2.png,T,Yahoo,"Crown Castle Inc. (NYSE:CCI) is one of the Best Depressed Stocks to Buy Right Now. On January 12, JPMorgan reduced the firm’s price objective on the company’s stock to $110 from $115, while keeping a “Neutral” rating, as reported by The Fly. Notably, the firm reduced new leasing estimates for the tower companies ahead of earnings. This […]",https://finnhub.io/api/news?id=852301b69886059551670c325a4b9ea510636d73cc97da9f4363ea63bbfe45eb
company,1768589640,Pentagon Deal Sends AST SpaceMobile Soaring—Is This the Next Leg Up?,138164107,https://s.yimg.com/rz/stage/p/yahoo_finance_en-US_h_p_finance_2.png,T,Yahoo,Shares of AST SpaceMobile surged on Friday after the company announced it was rewarded a government contract as part of the Golden Dome project.,https://finnhub.io/api/news?id=be78f405a1fb604fbda2920f2bade9b0b630ce55697d30aa11f47809bc831151
company,1768573805,Brokers Suggest Investing in Tutor Perini (TPC): Read This Before Placing a Bet,138152603,https://s.yimg.com/rz/stage/p/yahoo_finance_en-US_h_p_finance_2.png,T,Yahoo,"The average brokerage recommendation (ABR) for Tutor Perini (TPC) is equivalent to a Buy. The overly optimistic recommendations of Wall Street analysts make the effectiveness of this highly sought-after metric questionable. So, is it worth buying the stock?",https://finnhub.io/api/news?id=8fce093e38f72cc83dc3b8e918ffc8db4f1a2e1ff50951194017a59367ca7b4c
company,1768572005,AT&T Inc. (T) is Attracting Investor Attention: Here is What You Should Know,138152604,https://s.yimg.com/rz/stage/p/yahoo_finance_en-US_h_p_finance_2.png,T,Yahoo,"AT&T (T) has been one of the stocks most watched by Zacks.com users lately. So, it is worth exploring what lies ahead for the stock.",https://finnhub.io/api/news?id=0ef7360ed2512aa000a5c61aebe7e14ff1bea295636c15fc48a6665090fbf54d
company,1768571940,VZ Wins Regulatory Nod for Frontier Buyout: Will it Boost Prospects?,138152602,https://s.yimg.com/rz/stage/p/yahoo_finance_en-US_h_p_finance_2.png,T,Yahoo,"VZ wins approval for $20B Frontier deal, expanding fiber reach to 30M+ passings and opening cross-selling that could reshape growth prospects.",https://finnhub.io/api/news?id=fb9d0f244f7d49aeeb1a6cf181ae2df54b829e7495143c4f7177a3627e64bfde
company,1768554300,"2 Dirt Cheap Stocks to Buy With $1,000 Right Now",138149615,https://s.yimg.com/rz/stage/p/yahoo_finance_en-US_h_p_finance_2.png,T,Yahoo,"Despite the increasingly expensive market, many stocks are on sale.",https://finnhub.io/api/news?id=736067e2b21ba40b95d4098090fe7819786162ad6e646ad00d708eff4d0b5572
