category,datetime,headline,id,image,related,source,summary,url
company,1769461322,"Leidos Holdings, Inc. (LDOS) ENTRUST Solutions Group, LLC - M&A Call - Slideshow",138266100,,LDOS,SeekingAlpha,,https://finnhub.io/api/news?id=8d774c464056b165afaaed148d7e016ac63d8dd308fcff900424a15655767e12
company,1769436900,Market Minute 1-26-26- Gold Tops $5K as US Dollar Slides,138266587,https://s.yimg.com/rz/stage/p/yahoo_finance_en-US_h_p_finance_2.png,LDOS,Yahoo,"After a mixed day on Friday, stocks are flattish in early trading today. Precious metals are rocketing higher again, while the US dollar is sliding. Treasuries are up a bit, while energy markets are mixed.",https://finnhub.io/api/news?id=c22726fd4b1da5409cfc38a3e56b81e6e9b37f6c9ac36e90b03993647c36b433
company,1769428500,Leidos to Buy Kohlberg’s Entrust for $2.4 Billion,138261373,https://s.yimg.com/rz/stage/p/yahoo_finance_en-US_h_p_finance_2.png,LDOS,Yahoo,Leidos Holdings has struck a deal to buy utility consulting and engineering services platform Entrust Solutions Group from private-equity firm Kohlberg & Co. for about $2.4 billion in cash.,https://finnhub.io/api/news?id=4610406098e2777a2b1821d99c341bbf6354f9b6d7d9ce5b440bf1a7ad0fa5d5
company,1769426665,Leidos to buy power design firm ENTRUST for about $2.4 billion,138260513,https://s.yimg.com/rz/stage/p/yahoo_finance_en-US_h_p_finance_2.png,LDOS,Yahoo,Jan 26 () - Defense contractor Leidos Holdings said ​on Monday it would ‌buy power design firm ENTRUST ‌Solutions Group from private equity firm Kohlberg for about $2.4 billion to bolster ⁠its engineering ‌offerings for utilities.,https://finnhub.io/api/news?id=d71640fe39e3c0c2b466e5400fefa67f2078bd9ea30dabc40396cef48a7b303a
company,1769426100,Kohlberg Announces Sale of ENTRUST Solutions Group to Leidos for $2.4 Billion,138260514,https://s.yimg.com/rz/stage/p/yahoo_finance_en-US_h_p_finance_2.png,LDOS,Yahoo,"MOUNT KISCO, N.Y., January 26, 2026--Kohlberg, a leading U.S. middle-market private equity firm, today announced that it has entered into a definitive agreement to sell ENTRUST Solutions Group (""ENTRUST"" or the ""Company"") to Leidos (NYSE: LDOS) for approximately $2.4 billion. The transaction represents a successful exit for Kohlberg, following its initial acquisition of the Company in 2019 and a minority recapitalization in 2023.",https://finnhub.io/api/news?id=052883fef3264214c9cb6207983d1dcf21dd15961235629d7280a13fe94d0284
company,1769425941,"Leidos Holdings, Inc. (LDOS) M&A Call Transcript",138262426,https://static.seekingalpha.com/assets/og_image_1200-29b2bfe1a595477db6826bd2126c63ac2091efb7ec76347a8e7f81ba17e3de6c.png,LDOS,SeekingAlpha,"Leidos Holdings, Inc. (LDOS) M&A Call January 26, 2026 8:00 AM ESTCompany ParticipantsStuart Davis - Senior Vice President of Investor RelationsThomas...",https://finnhub.io/api/news?id=12d13f1dda5d0d0c19e0b937bca37dd50ff9a0a532a156bcf3f5d2340dc7cdc1
company,1769425260,"Leidos to acquire power design firm ENTRUST, bolstering its energy infrastructure portfolio",138260515,https://s.yimg.com/rz/stage/p/yahoo_finance_en-US_h_p_finance_2.png,LDOS,Yahoo,"Leidos (NYSE: LDOS) has signed a definitive agreement to acquire ENTRUST Solutions Group from Kohlberg for approximately $2.4 billion, accelerating Leidos' position as a leading engineering solutions provider for utilities nationwide.",https://finnhub.io/api/news?id=367570cd15e7a83faf3f759a89ecc5720af7f2713ff432973ce0a64b9c34365e
