category,datetime,headline,id,image,related,source,summary,url
company,1769465443,Assessing Realty Income (NYSE:O) Valuation After Recent Share Price Consolidation,138265506,https://s.yimg.com/rz/stage/p/yahoo_finance_en-US_h_p_finance_2.png,O,Yahoo,"Understanding Realty Income after recent performance Realty Income (O) has seen mixed share performance recently, with a 0.2% decline over the past day and a 1.1% decline over the past week, while returns over the past month and past 3 months are positive. See our latest analysis for Realty Income. While the share price has eased back over the past week, the 30 day share price return of 7.1% and year to date gain of 6.0% sit alongside a 1 year total shareholder return of 14.7%, suggesting...",https://finnhub.io/api/news?id=8a30f823d69527d78aca8589f8327445f3ce3372fadda343fabfa158447b7786
company,1769454621,The 3 Dividend Stocks I Think Every Investor Should Own Right Now,138264892,https://s.yimg.com/rz/stage/p/yahoo_finance_en-US_h_p_finance_2.png,O,Yahoo,"The current macro investing climate is one in which investors have plenty to consider. On the one hand, growth stocks continue to outperform as investors look for ways to capitalize on a surprisingly robust bull market. Yes, we’ve already seen plenty of history made in early 2026, with geopolitical issues and newfound ramped up tariff ... The 3 Dividend Stocks I Think Every Investor Should Own Right Now",https://finnhub.io/api/news?id=365d79dbb25864369cba25f8fa2b04df1ab4f50549c090b9d9a72300eaeb5199
company,1769436006,Realty Income Corporation (O) Is a Trending Stock: Facts to Know Before Betting on It,138262221,https://s.yimg.com/rz/stage/p/yahoo_finance_en-US_h_p_finance_2.png,O,Yahoo,"Recently, Zacks.com users have been paying close attention to Realty Income Corp. (O). This makes it worthwhile to examine what the stock has in store.",https://finnhub.io/api/news?id=ab53e2caab7a94b81b5990f5edcc0caf8bb5b3ee58071d1235df5735cd530a1c
company,1769418300,The Best Dividend Stocks to Buy and Hold Forever,138259695,https://s.yimg.com/rz/stage/p/yahoo_finance_en-US_h_p_finance_2.png,O,Yahoo,These stocks offer highly attractive dividends and staying power.,https://finnhub.io/api/news?id=9492d55d4b7b82ca404193c6339d6771d74d18af5daa4064b1ab0c482466e56c
company,1769417400,Sell Alert: 2 REITs Getting Too Risky,138261315,https://static.seekingalpha.com/cdn/s3/uploads/getty_images/2207876898/image_2207876898.jpg?io=getty-c-w1536,O,SeekingAlpha,"Not all REITs are well-positioned going into 2026. On the contrary, some have become very risky. I present two good examples of that.",https://finnhub.io/api/news?id=8c6b423bafa5433c2f223f45d556703318dcafbf457db295e774fc8065e86005
