category,datetime,headline,id,image,related,source,summary,url
company,1769447360,RTX (RTX) Q3 2024 Earnings Call Transcript,138263489,https://s.yimg.com/rz/stage/p/yahoo_finance_en-US_h_p_finance_2.png,RTX,Yahoo,"Christopher Calio: Thank you, and good morning, everyone.  As you saw from our press release this morning, RTX delivered another strong quarter of performance, building on our momentum from the first half of the year.",https://finnhub.io/api/news?id=daa08b3b694e3f9b58aab03624f5a4d13179b2cc71814b8e9ee454269fdfb85c
company,1769445214,RTX (RTX) Q1 2025 Earnings Call Transcript,138263490,https://s.yimg.com/rz/stage/p/yahoo_finance_en-US_h_p_finance_2.png,RTX,Yahoo,"Chris Calio: Thank you, and good morning, everyone.  Generally speaking, the aerospace and defense sector has operated in a duty-free environment and that has been instrumental to the industry maintaining one of the largest trade surpluses across American manufacturing industries for decades.",https://finnhub.io/api/news?id=579c1ffdc939edd8ee9c8a2a1ae61adba956c802da3c9700340549ae2d44f08d
company,1769436900,BAE Systems Wins $473M Deal to Produce 40 M109A7 Paladin Howitzer,138263491,https://s.yimg.com/rz/stage/p/yahoo_finance_en-US_h_p_finance_2.png,RTX,Yahoo,"BAESY secures a $473M contract to build 40 M109A7 Paladin howitzer sets, strengthening the U.S. Army's firepower and its armored vehicle footprint.",https://finnhub.io/api/news?id=8433b023cf7dac6c51baa0a2123d9af134e8332fa495df5b0438f4632bbf19b1
company,1769429451,Why Lockheed Martin's Stock Run-Up Doesn't Scare Me Going Into Earnings,138262772,https://static.seekingalpha.com/cdn/s3/uploads/getty_images/1423754757/image_1423754757.jpg?io=getty-c-w1536,RTX,SeekingAlpha,"Preview Lockheed Martin Corporation's Q4 earnings, F-35 outlook, and defense budget tailwinds under Trumpâs $1.5T planâknow risks & upside. Click for this LMT update.",https://finnhub.io/api/news?id=968bcaa3e99c11bbd71611114afcb17815b82dd90526b9bfe6716e9619d4c8f8
company,1769426729,"Fed, Geopolitics, Earnings, Gold Spike Cap Wall Street Pre-Bell; Asia, Europe Off",138260341,https://s.yimg.com/rz/stage/p/yahoo_finance_en-US_h_p_finance_2.png,RTX,Yahoo,Wall Street futures pointed modestly lower pre-bell Monday as traders weighed record precious metal,https://finnhub.io/api/news?id=062456d8c2b30814159f3f325c880ef87cad7277d48593e4e8969d47cd1bec7a
company,1769426530,"Stocks Set for Muted Open After Trump’s Tariff Threats, Big Tech Earnings and Fed Meeting in Focus",138261994,https://s.yimg.com/rz/stage/p/yahoo_finance_en-US_h_p_finance_2.png,RTX,Yahoo,"March S&P 500 E-Mini futures (ESH26) are down -0.05%, and March Nasdaq 100 E-Mini futures (NQH26) are down -0.14% this morning, pointing to a muted open on Wall Street as President Trump’s tariff threats against Canada and the looming risk of a partial U.S. government shutdown curbed risk appetite at the start of a busy week.",https://finnhub.io/api/news?id=87f9b482850a40a722fdd1e331914009a4e148f056cc8e045beab4fcf070b500
company,1769423400,Furious Rally in US Defense Stocks Faces Earnings Reality Check,138261267,https://s.yimg.com/rz/stage/p/yahoo_finance_en-US_h_p_finance_2.png,RTX,Yahoo,"Now, with some of the biggest names in the industry set to report earnings this week, investors are eager for evidence that the rally is rooted in reality.  An index of aerospace and defense shares notched a 42% gain last year, more than double the returns of the technology-heavy Nasdaq 100 Index, amid expectations for heavier government spending on fighter jets and missiles, as well as newer military technology like drones and sophisticated software.  The sudden US ouster this month of Venezuelan President Nicolas Maduro and President Donald Trump’s threats about taking over Greenland have further intensified the rush to own defense stocks, propelling valuations to levels typically reserved for high-flying tech names.",https://finnhub.io/api/news?id=788cc873c237c24f823ae1aa21441de1569bc4c2157038cb530908fd9c1e9380
company,1769415600,"Meta Earnings, Fed Decision, Venezuela Testimony: What to Watch This Week",138259762,https://s.yimg.com/rz/stage/p/yahoo_finance_en-US_h_p_finance_2.png,RTX,Yahoo,"Earnings season is in full throttle, with results expected from big-name companies including UnitedHealth, Chevron and Boeing. A quartet of tech giants—Apple, Meta Platforms, Microsoft and Tesla—will also report results.",https://finnhub.io/api/news?id=cd181e2d80d97dc11a001a99a6ba0c0d22ef8a82c0dda867a52e635d4d621ee5
company,1769396627,RTX (RTX) To Report Earnings Tomorrow: Here Is What To Expect,138257952,https://s.yimg.com/rz/stage/p/yahoo_finance_en-US_h_p_finance_2.png,RTX,Yahoo,Aerospace and defense company Raytheon (NYSE:RTX) will be reporting earnings this Tuesday before market hours. Here’s what you need to know.,https://finnhub.io/api/news?id=bf52dc37b0a1db74b6b9729d6471127d068fb5d9a774e50ebc374ab520ff55e9
