category,datetime,headline,id,image,related,source,summary,url
company,1769418000,Bull of the Day: Nvidia (NVDA),138260339,https://s.yimg.com/rz/stage/p/yahoo_finance_en-US_h_p_finance_2.png,TSLA,Yahoo,Nvidia's transformation from a gaming pioneer to the bedrock of the global AI revolution has solidified its future growth.,https://finnhub.io/api/news?id=11e9933a8503a13d6cb51467fb5a6bc5ac643cf3a2027551465ef123d0316a15
company,1769417121,A Make-or-Break Week for the AI Trade?,138261195,https://s.yimg.com/rz/stage/p/yahoo_finance_en-US_h_p_finance_2.png,TSLA,Yahoo,"As AI investments reach unprecedented levels, investors are demanding proof of profitability.",https://finnhub.io/api/news?id=e26563aa1a64c0300e4e15f503c1e114ed738442a43455f1ccebc73a620d73ff
company,1769417100,"The Stock Market This Week: President Trump's Tariffs, the Fed's Interest Rate Decision, and Big Tech Earnings",138259672,https://s.yimg.com/rz/stage/p/yahoo_finance_en-US_h_p_finance_2.png,TSLA,Yahoo,"The stock market could be volatile as investors process Trump's latest tariff threat, the Federal Reserve's interest rate decision, and earnings results from four big tech companies.",https://finnhub.io/api/news?id=9ac3bf086c05fe18ba93f6031898b6d66ad42cbe53a5f559382125d2b6f49b5f
company,1769415600,"Meta Earnings, Fed Decision, Venezuela Testimony: What to Watch This Week",138259762,https://s.yimg.com/rz/stage/p/yahoo_finance_en-US_h_p_finance_2.png,TSLA,Yahoo,"Earnings season is in full throttle, with results expected from big-name companies including UnitedHealth, Chevron and Boeing. A quartet of tech giants—Apple, Meta Platforms, Microsoft and Tesla—will also report results.",https://finnhub.io/api/news?id=cd181e2d80d97dc11a001a99a6ba0c0d22ef8a82c0dda867a52e635d4d621ee5
company,1769415299,"Minnesota shooting, Big Tech earnings, the winter storm and more in Morning Squawk",138262798,https://image.cnbcfm.com/api/v1/image/108256658-1769211521580-gettyimages-2257859436-08-04-deport012326march.jpeg?v=1769211574&w=1920&h=1080,TSLA,CNBC,Here are five key things investors need to know to start the trading day.,https://finnhub.io/api/news?id=5c054d1b67b02e8859a550ac2819e90f1caf3f937c3f7124f6996109065368ce
company,1769414753,Microsoft Q2 Preview: The Greatest Pressure Test Since 2021,138260961,https://static.seekingalpha.com/cdn/s3/uploads/getty_images/1410473753/image_1410473753.jpg?io=getty-c-w1536,TSLA,SeekingAlpha,"Microsoft faces Azure slowdown risks, AI competition, and Musk lawsuitâbut RPO and capex signal strong demand.",https://finnhub.io/api/news?id=38f460708f4dbb1df6fc35b4689bce4760468aff01afd275c001d215f0c25904
company,1769412960,Is Tesla Stock a Buy Now?,138259147,https://s.yimg.com/rz/stage/p/yahoo_finance_en-US_h_p_finance_2.png,TSLA,Yahoo,Shareholders hope the momentum can continue for this long-term market outperformer.,https://finnhub.io/api/news?id=e98a436b3df269ebc2e7ae453dd76f8f630773f7e22ee440577f59feaebc087a
company,1769412420,"Microsoft, Meta, Tesla and Apple are part of Zacks Earnings Preview",138259673,https://s.yimg.com/rz/stage/p/yahoo_finance_en-US_h_p_finance_2.png,TSLA,Yahoo,"Microsoft, Meta, Tesla and Apple have been highlighted in this Earnings Preview article.",https://finnhub.io/api/news?id=b911b3d4cc7ea7aafa3c78292ff0e001d56f2da00e1900fad396d2fdeb7521ac
company,1769409300,"The Zacks Analyst Blog Tesla, Cummins, BorgWarner and Rivian",138259148,https://s.yimg.com/rz/stage/p/yahoo_finance_en-US_h_p_finance_2.png,TSLA,Yahoo,"Tesla heads into Q4 earnings with record energy storage deployments and rising Energy Generation revenues, even as vehicle deliveries remain under pressure.",https://finnhub.io/api/news?id=446779b4e25c41380289acfa9fa184f4a32272df510389d9d828df57ed618081
company,1769403660,Anthropic’s Claude Code Platform Looks Like a Software Killer,138260377,https://s.yimg.com/rz/stage/p/yahoo_finance_en-US_h_p_finance_2.png,TSLA,Yahoo,Claude Code promises to create any type of software — from analyzing specific data sets to building websites and editing photos.,https://finnhub.io/api/news?id=80d4f967a1a7756dbbd9b01500aa73d59dce8645feda32a217641e4ba441a11e
company,1769403660,Tesla Revs Up Earnings as Investors Focus on the Future over the Now,138260376,https://s.yimg.com/rz/stage/p/yahoo_finance_en-US_h_p_finance_2.png,TSLA,Yahoo,"Earlier this month, Tesla shared that it delivered about 1.6 million vehicles last year, a 9% drop from 2024.",https://finnhub.io/api/news?id=8ba86956647fa9f0a49ab4b607fdeade666fcdc48a2676588f06b81d0a195050
