category,datetime,headline,id,image,related,source,summary,url
company,1769469462,Is Union Pacific (UNP) Offering A Rare Opening After Rail Infrastructure Focus?,138265478,https://s.yimg.com/rz/stage/p/yahoo_finance_en-US_h_p_finance_2.png,UNP,Yahoo,Wondering if Union Pacific is reasonably priced or if the market is offering a rare opening on this US$230.89 stock? This article walks through what the current share price might be implying about its value. Over the past week the share price is up 0.6%. The 30 day return is a 1.1% decline and the year to date return is a 0.4% decline. The 1 year return is a 7.1% decline and the longer term 3 and 5 year returns are 23.7% and 30.0% respectively. Recent price moves have come alongside ongoing...,https://finnhub.io/api/news?id=4ae0db9e04bc1b7b5a83aeed4d7cedb52ebd9603321b89c39a5147277f5903ed
company,1769463003,"Union Pacific (UNP) Faces Near-Term Pressure After Merger Setback, Susquehanna Says",138264935,https://s.yimg.com/rz/stage/p/yahoo_finance_en-US_h_p_finance_2.png,UNP,Yahoo,"Union Pacific Corporation (NYSE:UNP) is included among the 12 Most Profitable Dividend Stocks to Buy in 2026. On January 19, Susquehanna said it expects Union Pacific Corporation (NYSE:UNP) shares to trade modestly lower on Tuesday after the US Surface Transportation Board rejected the company’s proposed merger with Norfolk Southern. The decision was issued “without prejudice,” […]",https://finnhub.io/api/news?id=901a212401b27d702db45e0ef70ec71cac626befc0bc8c52382ff8eb9c211891
company,1769457600,Union Pacific’s Big Boy to Celebrate America’s 250th Birthday with Historic Coast-to-Coast Tour,138264936,https://s.yimg.com/rz/stage/p/yahoo_finance_en-US_h_p_finance_2.png,UNP,Yahoo,"OMAHA, Neb., January 26, 2026--Union Pacific Railroad will join the nation in celebrating 250 years of American independence and innovation this year with its first-ever coast-to-coast steam tour led by the legendary Big Boy No. 4014. The world’s largest operating steam locomotive will be joined by two commemorative locomotives, including the railroad’s newest locomotive: No. 1776 – America250.",https://finnhub.io/api/news?id=262c36b6b3df7849e9b72803e90eeea4a60d3d8568e9b1beb0552430ff507b5f
company,1769437020,Watch These 4 Transportation Stocks for Q4 Earnings: Beat or Miss?,138263535,https://s.yimg.com/rz/stage/p/yahoo_finance_en-US_h_p_finance_2.png,UNP,Yahoo,"Investors interested in the Transportation sector can watch out for fourth-quarter 2025 earnings reports of UNP, UPS, AAL and NSC.",https://finnhub.io/api/news?id=c3beedc82bcb203c0ae9ac3aa37becd9cf98ef307f8d0b4374c058c2b0eb87da
company,1769424000,"Tech Rebound Soothes Greenland-Induced Shivers, Just As Earnings Season Hits Its Stride",138261917,https://static.seekingalpha.com/cdn/s3/uploads/getty_images/1293253135/image_1293253135.jpg?io=getty-c-w1536,UNP,SeekingAlpha,"With only 13% of companies reporting thus far, S&P 500 EPS growth for Q4 currently stands at 8.2%. Headline whiplash impacted US markets last week. The tech sector continues to dominate.",https://finnhub.io/api/news?id=3ca7eb144a4146935221c1e17b357a04a77f34682c6590f5b53b5f31c9d56096
company,1769415600,"Meta Earnings, Fed Decision, Venezuela Testimony: What to Watch This Week",138259762,https://s.yimg.com/rz/stage/p/yahoo_finance_en-US_h_p_finance_2.png,UNP,Yahoo,"Earnings season is in full throttle, with results expected from big-name companies including UnitedHealth, Chevron and Boeing. A quartet of tech giants—Apple, Meta Platforms, Microsoft and Tesla—will also report results.",https://finnhub.io/api/news?id=cd181e2d80d97dc11a001a99a6ba0c0d22ef8a82c0dda867a52e635d4d621ee5
company,1769396981,Union Pacific (UNP) To Report Earnings Tomorrow: Here Is What To Expect,138257962,https://s.yimg.com/rz/stage/p/yahoo_finance_en-US_h_p_finance_2.png,UNP,Yahoo,Freight transportation company Union Pacific (NYSE:UNP) will be reporting results this Tuesday before the bell. Here’s what you need to know.,https://finnhub.io/api/news?id=7fa3da9ebb06df28b4c1a4a104c22dcb7d18730df2eab2a57d2b300aa7ce8195
