category,datetime,headline,id,image,related,source,summary,url
company,1768044600,AI Reset Is Complete; Tech's Next Leg Starts Here,138056783,https://static.seekingalpha.com/cdn/s3/uploads/getty_images/2216425295/image_2216425295.jpg?io=getty-c-w1536,GOOG,SeekingAlpha,Tech (XLK) shows resilient momentum as AI buildout accelerates. Insider buying and attractive valuations (incl.,https://finnhub.io/api/news?id=69dbf643c5d285bee62ee97e260eb40c9ca1270d97a88cda3351ce94c9c5e9b8
company,1768032050,Alphabet's 'Ironwood' Singularity And The Inevitability Of The Zero-Marginal-Cost Compute Flywheel,138055417,https://static.seekingalpha.com/cdn/s3/uploads/getty_images/2246161011/image_2246161011.jpg?io=getty-c-w1536,GOOG,SeekingAlpha,"Alphabet delivers an integrated AI stack with TPUs, data scale, and near-zero inference costs, plus targets and key risks. Read why GOOG stock is a strong buy.",https://finnhub.io/api/news?id=bba357a339175c8e9de7bbc4c40c3db5c605e606ca3574b45eea511f8b23502e
company,1768032001,Behind Anthropic's stunning growth is a sibling team that may hold the key to generative AI,138057101,https://image.cnbcfm.com/api/v1/image/108204189-1758834976885-gettyimages-2233950387-boivin-notitle250909_npSDA.jpeg?v=1768057917&w=1920&h=1080,GOOG,CNBC,Daniela Amodei has helped build Anthropic into a serious AI player by betting on safety and enterprise adoption.,https://finnhub.io/api/news?id=917ffb164ddc38a0ccc5e6a8ed7c4264d2dceaa28bb2e77d3282037ba9115eb6
company,1768032001,"Are we in an AI bubble? What 40 tech leaders and analysts are saying, in one chart",138057099,https://image.cnbcfm.com/api/v1/image/108214997-1761078222031-gettyimages-1412458280-business444.jpeg?v=1763748235&w=1920&h=1080,GOOG,CNBC,OpenAI and Nvidia have gone on a blitz of AI infrastructure deals while hyperscalers continue to spend billions in capex.,https://finnhub.io/api/news?id=94c46a6fe1c6482888e571ad70dcf8438a8f9851fdaee59d299ffa1ad352e8f7
company,1768028401,"AI memory is sold out, causing an unprecedented surge in prices",138057102,https://image.cnbcfm.com/api/v1/image/108183409-1754634274002-gettyimages-885294104-spk_00007_01015.jpeg?v=1762812885&w=1920&h=1080,GOOG,CNBC,"Three primary memory vendors — Micron, SK Hynix and Samsung Electronics — make up nearly the entire RAM market, and they're benefitting from this shortage. ",https://finnhub.io/api/news?id=0ad4487dd3b3dc8e81aaff0a9d191c29581f19f72f369a45e38098d0d33aa43a
company,1768012265,"Mark Zuckerberg's Mom Predicted It, His Sister Bet On It: The Story Behind Meta CEO's Harvard Dropout",138052079,https://s.yimg.com/rz/stage/p/yahoo_finance_en-US_h_p_finance_2.png,GOOG,Yahoo,"Mark Zuckerberg's exit from Harvard University in 2004 has become one of the most famous college dropouts in tech history, but according to the Meta Platforms, Inc. (NASDAQ:META) CEO, it was hardly a surprise at home. Friends And Family Expected Him To Leave Harvard During a 2013 appearance at Y Combinator's Startup School, Zuckerberg reflected on his early college days and the fallout from Facemash, a website he built that allowed students to rate classmates' photos. The project briefly overwhe",https://finnhub.io/api/news?id=a9d965ab74451201e7de514423032cb09f88a05b13a8e9735ff2c1c868d2a93a
company,1768008695,Netflix Stock Has A January Superpower — And The Numbers Prove It,138052080,https://s.yimg.com/rz/stage/p/yahoo_finance_en-US_h_p_finance_2.png,GOOG,Yahoo,"Netflix Inc. (NASDAQ:NFLX) has developed a striking seasonal pattern that traders have come to recognize: January has historically been its strongest month of the year, and by a wide margin. Over the past two decades, Netflix shares have posted an average January gain of 14.7%, finishing the month higher in 71% of years. That performance meaningfully outpaces both the broader S&P 500 and most large-cap technology peers over the same period, cementing January as a recurring sweet spot for the str",https://finnhub.io/api/news?id=6d96dfdb25e658c7b2d04895eb7ebd98f028653fbc44838593dd5a544c570039
company,1768005479,Google moonshot spinout SandboxAQ claims an ex-exec is attempting ‘extortion’,138052103,https://s.yimg.com/rz/stage/p/yahoo_finance_en-US_h_p_finance_2.png,GOOG,Yahoo,"A former SandboxAQ executive filed a wrongful termination lawsuit filled with shocking allegations. The company is fighting back, hard.",https://finnhub.io/api/news?id=81f4e8d00dec4f70804a545e66e85f784becea36191e2559e48b67f2cb3c3c52
company,1768005230,Investor Michael Burry Reveals Options Bet Against Oracle,138052038,https://s.yimg.com/rz/stage/p/yahoo_finance_en-US_h_p_finance_2.png,GOOG,Yahoo,"Burry owns put options on Oracle shares, he said in a Substack post after markets closed on Friday.  Burry, who revealed bearish bets against AI chipmaker Nvidia Corp. and Palantir Technologies Inc. in November, also directly shorted Oracle during the last six months, he said.",https://finnhub.io/api/news?id=0c1c3b2b2ed75f46981e7612e355dd63f82651ecdad6496b892677d1b003f947
