category,datetime,headline,id,image,related,source,summary,url
company,1768739446,"Trump in Davos, Netflix and Intel results on deck as earnings season ramps up: What to watch this week",138177439,https://s.yimg.com/rz/stage/p/yahoo_finance_en-US_h_p_finance_2.png,LRCX,Yahoo,A holiday-shortened trading week will bring investors the start of tech earnings and a key speech from President Trump in Davos.,https://finnhub.io/api/news?id=ed434edb1c8f11ebd2d4295d87fd8322cc63d6788c3b4d11d34cc7e40e74fd9c
company,1768739446,"Trump in Davos, Netflix and Intel results on deck as earnings season ramps: What to watch this week",138169748,https://s.yimg.com/rz/stage/p/yahoo_finance_en-US_h_p_finance_2.png,LRCX,Yahoo,A holiday-shortened trading week will bring investors the start of tech earnings and a key speech from President Trump in Davos.,https://finnhub.io/api/news?id=4b5b09cc133a454c7059657148c077d6c88c36424a8cd2d5935f85da2b7d7e53
company,1768739446,"Trump in Davos, Netflix and Intel results on deck earnings season ramps: What to watch this week",138169072,https://s.yimg.com/rz/stage/p/yahoo_finance_en-US_h_p_finance_2.png,LRCX,Yahoo,A holiday-shortened trading week will bring investors the start of tech earnings and a key speech from President Trump in Davos.,https://finnhub.io/api/news?id=deccd2a4105a105758e4afb2cbb5e479bcea679b4e22a5952a14998dade833b9
company,1768737600,Big Tech stocks are quickly falling out of favor. Here’s the market’s new momentum trade.,138208078,,LRCX,MarketWatch,Big Tech stocks are quickly falling out of favor. Here’s the market’s new momentum trade.,https://finnhub.io/api/news?id=2301339095a907139a1ff6615a16f336f2867a95feff911825799dcf6a7fd8a5
company,1768723200,"KLA Corporation: Off To A Strong Start In 2026, Waiting For Better Entry",138168847,https://static.seekingalpha.com/cdn/s3/uploads/getty_images/2178547375/image_2178547375.jpg?io=getty-c-w1536,LRCX,SeekingAlpha,"KLA Corporation benefits from hyperscaler and TSMC capex cycles, but its stock sits at the top of its historical trading range. Read why KLAC stock is a Hold.",https://finnhub.io/api/news?id=e6c6eb5c60f22b99e781577852e4381c77818966a75db60635ba7676f749bbc9
company,1768716408,SMH: Semiconductors Got A Taiwan-Sized Demand Boost,138168194,https://static.seekingalpha.com/cdn/s3/uploads/getty_images/1421858666/image_1421858666.jpg?io=getty-c-w1536,LRCX,SeekingAlpha,"VanEck Semiconductor ETF targets AI growth with 70% exposure to equipment, memory, and chipmakers, supported by TSMCâs $54B 2026 capex. See why SMH ETF is a buy.",https://finnhub.io/api/news?id=a56634ee5abe4427e2e0be9a2e01bbcb6f024646484c3a632c0401227188051c
company,1768715706,Analysts Bullish on Lam Research Corporation (LRCX) as Semiconductor Capex and Memory Investments Rise,138166691,https://s.yimg.com/rz/stage/p/yahoo_finance_en-US_h_p_finance_2.png,LRCX,Yahoo,"We recently compiled a list of the 10 Best Investments During A Recession. The fourth stock on our list of best investments is Lam Research Corporation. TheFly reported on January 9 that Goldman Sachs analyst James Schneider raised the LRCX price target to $180 from $160 while maintaining a Buy rating. Improved semiconductor industry circumstances, […]",https://finnhub.io/api/news?id=ec324774d1a49e8cf7b03ba6ecba0f30c69b03cec47ceb07e2042901f9c39776
