category,datetime,headline,id,image,related,source,summary,url
company,1768779379,Dow Jones Futures Fall Over Trump Greenland Tariffs On NATO Nations,138172859,https://s.yimg.com/rz/stage/p/yahoo_finance_en-US_h_p_finance_2.png,SCHW,Yahoo,President Donald Trump will impose escalating tariffs on eight NATO members unless a deal is struck for the U.S. buying Greenland. How will markets react?,https://finnhub.io/api/news?id=e499392b9aa391c3e838125afc8282f91c1120276a6ac632962ee10c53b70769
company,1768750800,Dow Jones Futures To React To Trump Greenland Tariffs On NATO Nations,138169798,https://s.yimg.com/rz/stage/p/yahoo_finance_en-US_h_p_finance_2.png,SCHW,Yahoo,President Donald Trump will impose escalating tariffs on eight NATO members unless a deal is struck for the U.S. buying Greenland. How will markets react?,https://finnhub.io/api/news?id=9c44d41b802a8164a09a6c1cc3c6e3f2bfc0d8cd031492e38ae50a1d9d7337f9
company,1768744567,Dow Jones Futures Due After Trump Greenland Tariffs On NATO Nations,138169053,https://s.yimg.com/rz/stage/p/yahoo_finance_en-US_h_p_finance_2.png,SCHW,Yahoo,President Donald Trump will impose escalating tariffs on eight NATO members unless a deal is struck for the U.S. buying Greenland. How will markets react?,https://finnhub.io/api/news?id=04d98ee7d7e60818945b84065083be22c624c657a48d613d596def8421a1f721
company,1768741245,"Gen Z traders have been trading more cautiously, new report reveals",138191004,https://s.yimg.com/rz/stage/p/yahoo_finance_en-US_h_p_finance_2.png,SCHW,Yahoo,"Charles Schwab's Schwab Trading Activity Index gives investors insight into retail trading activity. Charles Schwab head trading & derivatives strategist Joe Mazzola shares what the report on December trading activity reveals about the divide between Gen Z and Gen X. To watch more expert insights and analysis on the latest market action, check out more Market Domination Overtime.",https://finnhub.io/api/news?id=cdbaa1d303e93f1d64d80b3a4cde92a7a8e1f83ba841fe759ae9e4c199cf43a8
company,1768739446,"Trump in Davos, Netflix and Intel results on deck as earnings season ramps up: What to watch this week",138177439,https://s.yimg.com/rz/stage/p/yahoo_finance_en-US_h_p_finance_2.png,SCHW,Yahoo,A holiday-shortened trading week will bring investors the start of tech earnings and a key speech from President Trump in Davos.,https://finnhub.io/api/news?id=ed434edb1c8f11ebd2d4295d87fd8322cc63d6788c3b4d11d34cc7e40e74fd9c
company,1768739446,"Trump in Davos, Netflix and Intel results on deck as earnings season ramps: What to watch this week",138169748,https://s.yimg.com/rz/stage/p/yahoo_finance_en-US_h_p_finance_2.png,SCHW,Yahoo,A holiday-shortened trading week will bring investors the start of tech earnings and a key speech from President Trump in Davos.,https://finnhub.io/api/news?id=4b5b09cc133a454c7059657148c077d6c88c36424a8cd2d5935f85da2b7d7e53
company,1768739446,"Trump in Davos, Netflix and Intel results on deck earnings season ramps: What to watch this week",138169072,https://s.yimg.com/rz/stage/p/yahoo_finance_en-US_h_p_finance_2.png,SCHW,Yahoo,A holiday-shortened trading week will bring investors the start of tech earnings and a key speech from President Trump in Davos.,https://finnhub.io/api/news?id=deccd2a4105a105758e4afb2cbb5e479bcea679b4e22a5952a14998dade833b9
company,1768720500,International Stocks Are Waking Up - Here's Why SCHY Is My Pick,138168636,https://static.seekingalpha.com/cdn/s3/uploads/getty_images/1351962935/image_1351962935.jpg?io=getty-c-w1536,SCHW,SeekingAlpha,SCHY focuses on non-US dividend payers with strong financials. Read why SCHY ETF should be considered for diversification and income.,https://finnhub.io/api/news?id=9cb6a1371cf75dbbaed5e46151c539852e4f845eb19d3d901a35f2471dcca59a
