category,datetime,headline,id,image,related,source,summary,url
company,1769556322,"UPS cutting 30,000 jobs, closing 24 facilities in 2026",138276351,https://s.yimg.com/rz/stage/p/yahoo_finance_en-US_h_p_finance_2.png,AMZN,Yahoo,The large workforce reduction marks the third year in a row UPS has significantly cut jobs.,https://finnhub.io/api/news?id=396fd53ed7e271652a65f7c896ad67eb813b7a021dadb271ea1f35fa81fb5356
company,1769554225,"Stock Market Today, Jan. 27: Dow Sinks As UnitedHealth Plummets, Tech Stocks Boost S&P 500 and Nasdaq",138276352,https://s.yimg.com/rz/stage/p/yahoo_finance_en-US_h_p_finance_2.png,AMZN,Yahoo,"UnitedHealth’s earnings stumble sent healthcare reeling and left the Dow out of step with tech-fueled records, today, Jan. 27, 2026.",https://finnhub.io/api/news?id=c309e949bd7b1bfdb381e148fcc6204cb91722ee5bf497ddd2771c594870c326
company,1769553903,Amazon (AMZN) Exceeds Market Returns: Some Facts to Consider,138277093,https://s.yimg.com/rz/stage/p/yahoo_finance_en-US_h_p_finance_2.png,AMZN,Yahoo,"Amazon (AMZN) reached $244.68 at the closing of the latest trading day, reflecting a +2.63% change compared to its last close.",https://finnhub.io/api/news?id=7886942333b3a8644a79ea7b2b22e3db1457114081c8436c797b214f5ab7705b
company,1769553720,Berkshire Hathaway Will Lose Its Biggest Mutual-Fund Fan With Danoff’s Retirement,138277094,https://s.yimg.com/rz/stage/p/yahoo_finance_en-US_h_p_finance_2.png,AMZN,Yahoo,"The mutual-fund industry will lose its biggest fan of  Berkshire Hathaway  with the retirement of Fidelity Contrafund manager Will Danoff at the end of 2026 after 35 years at its helm.  Danoff’s $176 billion fund probably was the single largest holder of Berkshire among actively managed mutual funds.  Contrafund’s stake in Berkshire is now worth about $10 billion, Barron’s calculates.",https://finnhub.io/api/news?id=288a1281e3a91acdef8aeacb09732f488c99a78d33c547b411abfa8c5dac0ddd
company,1769550180,Some Savvy Wall Streeters Just Named This the Top AI Pick for 2026,138275263,https://s.yimg.com/rz/stage/p/yahoo_finance_en-US_h_p_finance_2.png,AMZN,Yahoo,Analysts see more upside in artificial intelligence (AI) semiconductor stocks this year.,https://finnhub.io/api/news?id=017b434062ee32f26b8b7789c2b36d5695b859b59e95165bb479bcec30b6d365
company,1769549468,Are You Richer Than You Feel? Nearly 70% Of Millionaires Don't Consider Themselves Wealthy,138275274,https://s.yimg.com/rz/stage/p/yahoo_finance_en-US_h_p_finance_2.png,AMZN,Yahoo,"If being a millionaire used to mean yacht parties and champagne toasts, someone forgot to tell today's millionaires. Turns out, having seven figures in the bank doesn't always come with a sense of financial comfort—or even confidence. According to the 2025 Planning & Progress Study by Northwestern Mutual, only 36% of U.S. adults with at least $1 million in investable assets actually consider themselves ""wealthy."" That means 64%—despite their millionaire status—feel like they're still chasing fin",https://finnhub.io/api/news?id=b6cec1d88b77866b62ef3cbd3bf98371f5ea159aead41075756079ff71f37acd
company,1769549220,"UPS Stock Rises After Earnings, Layoffs. The Dividend Is Safe for Now.",138276353,https://s.yimg.com/rz/stage/p/yahoo_finance_en-US_h_p_finance_2.png,AMZN,Yahoo,UPS reported fourth-quarter earnings per share of $2.38 from sales of $24.5 billion. Wall Street was looking for EPS of $2.20 from sales of $24 billion.,https://finnhub.io/api/news?id=6b6fb2952b0694f259260cb82b0d95f52be16551d26460c73199d46660e5e36e
company,1769549084,"Tech stocks strong but earnings may add volatility, says market expert",138275275,https://s.yimg.com/rz/stage/p/yahoo_finance_en-US_h_p_finance_2.png,AMZN,Yahoo,"STORY: Rathbun said the S&P 500 reaching a record high could be ""nerve-wracking"" to some, but added that she remains ""positive"" on the index.""A lot of people are ready for a correction and we may get that, but a lot of the companies underneath, the fundamentals are pretty strong, especially when it comes to the tech side,"" she said. ""So I wouldn't be too worried about the S&P 500 going up."" She adds that Amazon is one company that will be closely watched this earnings season.""If we don't hear of something, good news with regards to AI, especially in their cloud infrastructure, I think there may be some disappointment,"" she said.",https://finnhub.io/api/news?id=1c93cddb2533fc990ed4be142e1af3a3de961fb01fc8e97bd1d8279f5c4224db
company,1769547638,Amazon Fresh and Go stores may soon turn into Whole Foods in Illinois,138275276,https://s.yimg.com/rz/stage/p/yahoo_finance_en-US_h_p_finance_2.png,AMZN,Yahoo,More than a dozen Amazon Go and Fresh stores will be closing or transitioning to Whole Foods in Illinois. Here's where.,https://finnhub.io/api/news?id=d428ed6d3bd51b6c0fcb11fa542a8ed68544af33c2e48747d9ef5a62ff0c0928
company,1769547300,Amazon Turns Over a New Leaf In Physical Stores. It’s About Grocery Delivery.,138275277,https://s.yimg.com/rz/stage/p/yahoo_finance_en-US_h_p_finance_2.png,AMZN,Yahoo,Amazon.com is closing dozens of Amazon Go and Amazon Fresh physical stores to focus on expanding same-day delivery of groceries and adding to its Whole Foods operations.,https://finnhub.io/api/news?id=56dcfb6a496efd0e0d08e70de2ef06b9148cd6230cd017c5f9fe0b5bda1048c7
company,1769546557,United Parcel Service Q4 Earnings Call Highlights,138275278,https://s.yimg.com/rz/stage/p/yahoo_finance_en-US_h_p_finance_2.png,AMZN,Yahoo,"United Parcel Service (NYSE:UPS) reported fourth-quarter 2025 results that management said exceeded internal expectations, citing “strong revenue quality, solid cost management, and overall great execution,” including an eighth consecutive year as the industry leader in on-time service during peak s",https://finnhub.io/api/news?id=a291d9ffc9289873f667e6fd59ac4a95263564eb6deda1e2e2af80b244328602
company,1769546283,Amazon agrees to pay consumers $309M in returns policy settlement,138275279,https://s.yimg.com/rz/stage/p/yahoo_finance_en-US_h_p_finance_2.png,AMZN,Yahoo,"The lawsuit, filed in 2023, alleged that Amazon caused ""substantial unjustified monetary losses” for consumers who returned an item but were still charged for it.",https://finnhub.io/api/news?id=9a807c19b0af5601e0831a322997e235bb9f5c3ca213971e87a1de42ce48527e
company,1769546000,Amazon inadvertently announces cloud unit layoffs in email to employees,138282543,https://image.cnbcfm.com/api/v1/image/108217403-1769610896097-108217403-1761591014974-gettyimages-2233522650-298621final.jpg?v=1769610914&w=1920&h=1080,AMZN,CNBC,"Amazon sent a notice out to staffers in an apparent error acknowledging ""organizational changes"" at the company.",https://finnhub.io/api/news?id=ecd2a0093701ce3f86964dd508582458395b30b71eb6ab4fe3f1d0ddac3a5089
company,1769544701,Amazon closing Fresh and Go stores in Whole Foods push,138275280,https://s.yimg.com/rz/stage/p/yahoo_finance_en-US_h_p_finance_2.png,AMZN,Yahoo,"Amazon on Tuesday said it is closing its Go and Fresh real-world stores to focus on its Whole Foods markets and online grocery delivery.""The bet is that mass-market groceries sell more efficiently through same-day delivery, with Whole Foods as its primary physical retail brand.",https://finnhub.io/api/news?id=001d90fbd6e0068b3000544ea9a08c1336d9cae3b7cc140737947cfd36243aa7
company,1769542634,Amazon to close Fresh and Go stores. Which ones in New Jersey?,138275281,https://s.yimg.com/rz/stage/p/yahoo_finance_en-US_h_p_finance_2.png,AMZN,Yahoo,"Amazon said it will continue with its brick-and-mortar concept, like with Whole Foods, as it closes Fresh and Go stores. Here are the NJ locations.",https://finnhub.io/api/news?id=0928555f48fcd1810dc0017ba61ffe904f29f1eef27c92f989dd94fd7d5535b8
company,1769542380,BGL Real Estate Advisors Completes Financing for The Orchards Apartment Complex in North Carolina,138273895,https://s.yimg.com/rz/stage/p/yahoo_finance_en-US_h_p_finance_2.png,AMZN,Yahoo,"Brown Gibbons Lang & Company (BGL), a leading independent investment bank and financial advisory firm, is pleased to announce the financial closing of the new 166-unit apartment community development in Hendersonville, North Carolina. Peachtree Group provided development financing. BGL's Real Estate Advisors team served as the exclusive financial advisor to Orchards Properties LLC in this transaction.",https://finnhub.io/api/news?id=5caab8a98e60da62d3eaecac68778ec9c72f4d12a1c9100e66229f484da4b0c9
company,1769541240,"Plug Power Calls on Stockholders to Act Now and Vote in Favor of Proposals at January 29, 2026 Special Meeting",138273896,https://s.yimg.com/rz/stage/p/yahoo_finance_en-US_h_p_finance_2.png,AMZN,Yahoo,"SLINGERLANDS, N.Y., Jan. 27, 2026 (GLOBE NEWSWIRE) -- Plug Power Inc. (NASDAQ: PLUG), a global leader in comprehensive hydrogen solutions for the hydrogen economy, encourages stockholders to vote their shares ahead of the Company’s Special Meeting of Stockholders (the “Special Meeting”) scheduled for January 29, 2026. The Special Meeting includes proposals that are critical to supporting the Company’s ongoing operations, financial flexibility and long-term growth strategy. The Board of Directors",https://finnhub.io/api/news?id=3a82d7ebaf0dd7878e3aa91c324ca9bdc1e0229230a4b30dd2e527c196ee68c8
company,1769541138,"UnitedHealth sinks on Q4 results, Amazon aims to open 100+ Whole Foods",138273897,https://s.yimg.com/rz/stage/p/yahoo_finance_en-US_h_p_finance_2.png,AMZN,Yahoo,"Yahoo Finance Host Josh Lipton tracks today's top moving stocks and biggest market stories in this Market Minute, including UnitedHealth Group (UNH) shares sinking on its fourth quarter earnings results and Amazon (AMZN) looking to open over 100 new Whole Foods Market stores over the next several years.Stay up to date on the latest market action, minute-by-minute, with Yahoo Finance's Market Minute.",https://finnhub.io/api/news?id=9de636c2fc359357d4e73aebdf0b55cbd668f3587e00d2c62c34ef29e5d61081
company,1769540591,"UPS to Cut 30,000 More Jobs as Amazon Pullback Further Reshapes Network",138273898,https://s.yimg.com/rz/stage/p/yahoo_finance_en-US_h_p_finance_2.png,AMZN,Yahoo,"The courier is targeting $3 billion in total savings from the Amazon ""glide down,"" and also retired its MD-11 air cargo fleet.",https://finnhub.io/api/news?id=b68b2ccfda2cce56840cab907b76319270340c21f93f9a8808370292fc3a6706
company,1769540572,Is AI In A Bubble? What Wall Street Thinks Now,138273878,https://s.yimg.com/rz/stage/p/yahoo_finance_en-US_h_p_finance_2.png,AMZN,Yahoo,Market headlines keep circling the same question: Are we in an AI bubble or boom?  Investors are pouring unprecedented capital into a technology that remains early in its profit cycle.  The stakes are already visible in the AI infrastructure trade.,https://finnhub.io/api/news?id=216d930549843a266b7082d9c29c1ba8f9a1d7e7d7df741c13793675cf65a8bc
company,1769540269,"Amazon closing all Go and Fresh stores, eyes 'supercenter' concept",138275282,https://s.yimg.com/rz/stage/p/yahoo_finance_en-US_h_p_finance_2.png,AMZN,Yahoo,"Amazon announced it's closing all Amazon Go and Amazon Fresh stores to focus on Whole Foods expansion, citing a lack of ""distinctive customer experience.""",https://finnhub.io/api/news?id=c6f7a24c0932067979b7f5baaf43f3af2d9a41b6d9cc2f5eefc1d2ca0f4cb339
company,1769539980,U.S. Warns Korea Against Targeting American Tech Firms Amid Trade Escalation,138273900,https://s.yimg.com/rz/stage/p/yahoo_finance_en-US_h_p_finance_2.png,AMZN,Yahoo,JD Vance warned Prime Minister Kim Min-seok against pursuing penalties and regulations on U.S.-based firms like Coupang,https://finnhub.io/api/news?id=53b31867ea14f4e98c33716f473279f25d5ea66dab7da76c7171636e7d74e1d4
company,1769538655,"Amazon to close Fresh and Go stores to focus on delivery, Whole Foods",138273901,https://s.yimg.com/rz/stage/p/yahoo_finance_en-US_h_p_finance_2.png,AMZN,Yahoo,Amazon is converting Go and Fresh stores into Whole Foods locations.,https://finnhub.io/api/news?id=12582bdf51ada951bb958d289eb57b24e0bcaf7906161f2f58be1e0a2cebb86e
company,1769537012,"S&P 500 touches 7,000 for first time then retreats as traders await Fed decision: Live updates",138282427,https://image.cnbcfm.com/api/v1/image/108257698-1769534842387-Traders-Photo-20260127-KK-PRESS-014.jpg?v=1769535031&w=1920&h=1080,AMZN,CNBC,The S&P 500 rose to a milestone level ahead of the Federal Reserve's interest rate decision and earnings reports from major tech companies.,https://finnhub.io/api/news?id=45308eb86f00b0ebf962d353c054bf7b786018c30d16a252ea5f007b227c0595
company,1769536420,"American Eagle, Office Depot pull plug on third-party logistics services",138272669,https://s.yimg.com/rz/stage/p/yahoo_finance_en-US_h_p_finance_2.png,AMZN,Yahoo,"American Eagle Outfitters is closing down Quiet Logistics and Office Depot is cutting its logistics service subsidiary Veyer, demonstrating that sidelight businesses can be distractions from core retail execution. The post American Eagle, Office Depot pull plug on third-party logistics services appeared first on FreightWaves.",https://finnhub.io/api/news?id=544d0e4e7e95d8a96e585c1f71d882768c839593bb8d5d9140d4c90f17229f2d
company,1769536020,Will Higher Ad Revenues Aid Meta Platforms Stock in Q4 Earnings?,138273903,https://s.yimg.com/rz/stage/p/yahoo_finance_en-US_h_p_finance_2.png,AMZN,Yahoo,META's Q4 ad revenues are set to surge on AI-driven tools and rising global engagement across its platforms.,https://finnhub.io/api/news?id=bb977e57e912d6bec7f80edf65489306b5a124c3ab6c2e92c8ce8a588db118ed
company,1769535780,The 1 thing You Need to Watch in Amazon's Earnings,138272386,https://s.yimg.com/rz/stage/p/yahoo_finance_en-US_h_p_finance_2.png,AMZN,Yahoo,This is a bellwether for the AI business.,https://finnhub.io/api/news?id=785fc1beb5e906ae16b818a61f4ba44df0386e575ec560e924170b9e2bb95490
company,1769535660,All Amazon Go and Amazon Fresh stores to close,138272391,https://s.yimg.com/rz/stage/p/yahoo_finance_en-US_h_p_finance_2.png,AMZN,Yahoo,"Amazon is closing all its physical Amazon Fresh and Amazon Go stores, the company announced Tuesday. The Amazon Fresh online delivery service will continue operating, and Amazon plans to expand its Whole Foods operation in the next year, according to a press release. “While we’ve seen encouraging signals in our Amazon-branded physical grocery stores, we haven’t yet created a truly distinctive ...",https://finnhub.io/api/news?id=d543eb636261b916b371d1746a67db511e6798a96c78f0f27f620d40950e7734
company,1769535543,"UPS looks to cut up to 30,000 jobs this year",138272392,https://s.yimg.com/rz/stage/p/yahoo_finance_en-US_h_p_finance_2.png,AMZN,Yahoo,"UPS is planning to cut up to 30,000 operational jobs this year as the package delivery company continues with its turnaround efforts and reducing the number of Amazon shipments that it handles.  Chief Financial Officer Brian Dykes said during the company's conference call on Tuesday that the job cuts will be made through a voluntary buyout offer for full-time drivers and through attrition.  UPS said in a regulatory filing in October that it had cut about 34,000 operational positions and closed daily operations at 93 leased and owned buildings during the first nine months of last year.",https://finnhub.io/api/news?id=33d6ff46e65fe6d543ffbac2310bf534e65a1abade95e050773a3291467ac555
company,1769534455,"Amazon Is Closing Its Fresh Grocery, Go Convenience Stores",138272393,https://s.yimg.com/rz/stage/p/yahoo_finance_en-US_h_p_finance_2.png,AMZN,Yahoo,"Amazon Fresh and Amazon Go stores will close, the company said in a blog post on Tuesday, with some locations converted into Whole Foods Market stores.  “While we’ve seen encouraging signals in our Amazon-branded physical grocery stores, we haven’t yet created a truly distinctive customer experience with the right economic model needed for large-scale expansion,” Amazon said.  Since the surprise opening of a physical bookstore in 2015, Amazon has tried and failed to establish a foothold under its own brand in categories from groceries to fashion, often with technological flourishes such as digital price tags or novel checkout methods.",https://finnhub.io/api/news?id=fe55780c39a488b5d091ffcb68e594c88fc75a5a83827fb1ab2711e97acd04da
company,1769534400,3 Reasons to Buy Amazon Stock Right Now,138272394,https://s.yimg.com/rz/stage/p/yahoo_finance_en-US_h_p_finance_2.png,AMZN,Yahoo,"When the market is pessimistic, that could spell opportunity.",https://finnhub.io/api/news?id=dec808f5508d1d130818d925529c56418f18771b6baf7048e61fdaecf8c9a8fc
company,1769533881,Pinterest will lay off 15% of its workforce as the platform pivots resources to AI,138272395,https://s.yimg.com/rz/stage/p/yahoo_finance_en-US_h_p_finance_2.png,AMZN,Yahoo,"Pinterest plans to lay off under 15% of its workforce, as part of broader restructuring that arrives as the image-sharing platform pivots more of its money to artificial intelligence.  In a Tuesday securities filing, San Francisco-based Pinterest said it was making these cuts to support “transformation initiatives” — which include reallocating the company's resources to AI-focused roles and prioritizing AI-powered products.  Beyond the coming layoffs, Pinterest said it will reduce office space.",https://finnhub.io/api/news?id=0a65576612e6b1da59feee72923dbb5f99bcb0ea531e151de5dfb33efd0c61ff
company,1769533137,"UPS to slash workforce by up to 30,000 jobs this year",138272396,https://s.yimg.com/rz/stage/p/yahoo_finance_en-US_h_p_finance_2.png,AMZN,Yahoo,UPS executive said the delivery company is moving to cut costs and plans to offer a voluntary separation program for full-time drivers.,https://finnhub.io/api/news?id=2a3bc19b3f349ec714da3fe960dce7770f9fbba9b6f1d280f5c9004670173c57
company,1769532271,Amazon to close Amazon Go and Amazon Fresh to concentrate on Whole Foods and grocery delivery,138272397,https://s.yimg.com/rz/stage/p/yahoo_finance_en-US_h_p_finance_2.png,AMZN,Yahoo,"Amazon said it's closing all of its Amazon Go and Amazon Fresh locations, as the online behemoth focuses on its grocery delivery, Whole Foods Market and a new “supersized” store concept.  The Seattle-based online retailer said Tuesday in a blog post that it plans to convert some of those soon-to-be shuttered locations into Whole Foods Market stores.  The company operates 57 Amazon Fresh stores and 15 Amazon Go stores.",https://finnhub.io/api/news?id=735b67e45cd0f79d51663e7cdb5de9b62b2289b32a37904d4c2bd7d8500960c0
company,1769531929,Amazon To Close Fresh And Go Stores While Expanding Whole Foods In Latest Grocery Revamp,138272398,https://s.yimg.com/rz/stage/p/yahoo_finance_en-US_h_p_finance_2.png,AMZN,Yahoo,Amazon stock was higher as the company announced a larger focus on its Whole Foods brand while shutting down Fresh.,https://finnhub.io/api/news?id=2b3b9f9db9e3c4769d3a5f42a7f8cc0a42fbf5a822585a80acd3b8e646eca2e5
company,1769531494,"All Amazon Fresh and Go stores to close, including 3 in Bucks County",138272399,https://s.yimg.com/rz/stage/p/yahoo_finance_en-US_h_p_finance_2.png,AMZN,Yahoo,"All physical Amazon Fresh and Amazon Go stores are set to close, the company announced Tuesday.",https://finnhub.io/api/news?id=c367cf0a371bf8d42004c430d59d56c8f37c41123b8ecfc3575a371c390b58f2
company,1769531448,"Microsoft Boosts Data Centers, Debuts Maia 200 AI Chip Before Earnings",138272388,https://s.yimg.com/rz/stage/p/yahoo_finance_en-US_h_p_finance_2.png,AMZN,Yahoo,Major expansion positions Microsoft to meet AI demand as Q2 results approach.,https://finnhub.io/api/news?id=a6fd65b4eee9a33c71526fe5c9679d010bc249a28f35e698e5a801d88f1810f2
company,1769531030,Amazon is closing its Fresh and Go locations,138272401,https://s.yimg.com/rz/stage/p/yahoo_finance_en-US_h_p_finance_2.png,AMZN,Yahoo,"Amazon is closing its branded brick-and-mortar grocery stores, with the company consolidating its strategy under the Whole Foods name.",https://finnhub.io/api/news?id=d7559dac9285019eba13eb9219bbc3878e6633dc3cb1f12c6e46dba963eb46c3
company,1769530892,Amazon is closing its physical Amazon Go and Amazon Fresh stores,138272402,https://s.yimg.com/rz/stage/p/yahoo_finance_en-US_h_p_finance_2.png,AMZN,Yahoo,These retail closures will not impact customers who use Amazon for grocery delivery.,https://finnhub.io/api/news?id=f2006b4d470b83d1730e85c6a3a21cbfc6fd9fcb3f5dfab374b2302a378ad2a7
company,1769516498,"Stocks to Watch Tuesday: GM, Micron, Salesforce",138270050,https://s.yimg.com/rz/stage/p/yahoo_finance_en-US_h_p_finance_2.png,AMZN,Yahoo,"↗️ General Motors (GM): The U.S.'s largest automaker reported a $3.3 billion quarterly loss, but still beat expectations. Shares jumped 4% in premarket trading. ↗️ RTX (RTX): The defense contractor's quarterly results topped forecasts, boosted by demand for munitions and missiles, and the company gave an upbeat outlook.",https://finnhub.io/api/news?id=6f14f26e6f469a0dc1da3caac442acd2797c6a08a8ac57e484c9e88eabbf220b
company,1769529705,Amazon is closing its Amazon Fresh grocery and Go convenience stores,138272404,https://s.yimg.com/rz/stage/p/yahoo_finance_en-US_h_p_finance_2.png,AMZN,Yahoo,"Amazon acknowledged it hasn't yet ""created a truly distinctive customer experience"" in announcing move to scale back its brick-and-mortar grocery business.",https://finnhub.io/api/news?id=c3b3ff3e881c5ba70b939cecf5abf86a6dab616a6ef9ff3ba7b755c759be7fd9
company,1769529542,Apollo Took Loss on Asset-Backed Loan Deemed Safe,138272405,https://s.yimg.com/rz/stage/p/yahoo_finance_en-US_h_p_finance_2.png,AMZN,Yahoo,"Apollo Global Management took a loss on a portion of a $170 million asset-backed financing for Amazon brand aggregator Perch that was written off to zero. Silas Brown has more on ""Bloomberg Open Interest.""",https://finnhub.io/api/news?id=d20da76244061463310db645b236436073a82044d5d240a588aa479ae8f7537e
company,1769528820,Amazon to Shut Down All Amazon Go and Amazon Fresh Stores,138270852,https://s.yimg.com/rz/stage/p/yahoo_finance_en-US_h_p_finance_2.png,AMZN,Yahoo,BUSINESS   Amazon is closing all of its Amazon Go and Amazon Fresh physical stores in a shift to focus on its online same-day delivery service and new big-box retail stores.  The e-commerce giant said Tuesday that some of its shuttered Amazon-branded brick-and-mortar stores would be converted into Whole Foods Market locations.,https://finnhub.io/api/news?id=99931a83ac4af28534fff871fd71bedd26c171105699bf7765a84f8bd273556e
company,1769528778,Microsoft to report Q2 earnings with investors eyeing AI growth and spending,138270838,https://s.yimg.com/rz/stage/p/yahoo_finance_en-US_h_p_finance_2.png,AMZN,Yahoo,Microsoft will report its second quarter earnings on Wednesday.,https://finnhub.io/api/news?id=70ce1f99990e1a312194e9cbcb52afb738168edd15bfff04bd0f37d5f2c30272
company,1769528769,Amazon Closing All Go and Fresh Stores,138272406,https://s.yimg.com/rz/stage/p/yahoo_finance_en-US_h_p_finance_2.png,AMZN,Yahoo,Amazon will close all of its Amazon Fresh and Amazon Go stores. Bloomberg's Ed Ludlow reports.,https://finnhub.io/api/news?id=9e695f85490f537b2c0e44c465a660598bf7be5a2fb102804218ba52b355f101
company,1769528696,Meta to report Q4 earnings amid AI spending concerns,138270839,https://s.yimg.com/rz/stage/p/yahoo_finance_en-US_h_p_finance_2.png,AMZN,Yahoo,Meta will report its fourth quarter earnings after the bell on Wednesday.,https://finnhub.io/api/news?id=983cae15708e248c1cdba05b72ec88b7b60763b8c8c40d9c17207b5073406aa4
company,1769528249,"Amazon grocery push sinks Kroger, Instacart, delivery stocks",138270855,https://s.yimg.com/rz/stage/p/yahoo_finance_en-US_h_p_finance_2.png,AMZN,Yahoo,"Investing.com -- Kroger (NYSE:KR) stock fell 1.6% Tuesday, while Instacart (NASDAQ:CART) tumbled 5% after Amazon (NASDAQ:AMZN) announced plans to double down on its online grocery delivery services and expand Whole Foods Market locations.",https://finnhub.io/api/news?id=2a7ddd510d08b3f368be6d92a90643aac42d8de800acbc3725aab997c564bf7d
company,1769527620,"UPS to Cut 30,000 Jobs This Year",138270856,https://s.yimg.com/rz/stage/p/yahoo_finance_en-US_h_p_finance_2.png,AMZN,Yahoo,"The latest round of cuts comes as the company reported higher quarterly profit, guided for slightly higher revenue in the coming year. The shipper eliminated 48,000 positions in 2025.",https://finnhub.io/api/news?id=144b99e5702491139c070eeee1aae47a7cb850786262eea416fcc7d5c7afe1c2
company,1769526720,Microsoft’s New AI Chip Can’t Keep Nvidia Stock Down,138270824,https://s.yimg.com/rz/stage/p/yahoo_finance_en-US_h_p_finance_2.png,AMZN,Yahoo,"Nvidia  stock was rising early Tuesday even as  Microsoft  revealed the use of its own artificial-intelligence chip.  The focus for the week is on earnings from Microsoft and  Meta Platforms  both big customers of Nvidia.  “Maia 200 is…the most efficient inference system Microsoft has ever deployed, with 30% better performance per dollar than the latest generation hardware in our fleet today,” said Scott Guthrie, executive vice president of the Microsoft Cloud and AI Group, in a statement.",https://finnhub.io/api/news?id=ed9db35f6a451b68ab5dd13c603637cbb2b67546f2731b3fe936e633b29e7ab6
company,1769526300,Here's Why Feb. 5 Could Be a Big Day for Amazon Investors,138270858,https://s.yimg.com/rz/stage/p/yahoo_finance_en-US_h_p_finance_2.png,AMZN,Yahoo,Amazon's growing portfolio of artificial intelligence initiatives will be in the spotlight in early February.,https://finnhub.io/api/news?id=b4558ede6cef7da10b55c056e516ca37244c85d1147b48a076517b60f3922887
company,1769526120,UPS Stock Jumps After Earnings. The Dividend Is Safe for Now.,138270859,https://s.yimg.com/rz/stage/p/yahoo_finance_en-US_h_p_finance_2.png,AMZN,Yahoo,UPS reported fourth-quarter earnings per share of $2.38 from sales of $24.5 billion. Wall Street was looking for EPS of $2.20 from sales of $24 billion.,https://finnhub.io/api/news?id=6299fd90610eede7b9b2c4b975ea9e2acf94d32a78f41a7d09c91723863681e0
