category,datetime,headline,id,image,related,source,summary,url
company,1769549880,New Jersey American Water Plans for Temporary Treatment Change in Water Treatment Plants Serving Central and Northern Parts of the State,138275520,https://s.yimg.com/rz/stage/p/yahoo_finance_en-US_h_p_finance_2.png,AWK,Yahoo,"As part of an annual, routine maintenance program, New Jersey American Water will temporarily change the water treatment process from using chloramine to free chlorine at its Raritan-Millstone Water Treatment Plant in Bridgewater and its Canal Road Water Treatment Plant in Somerset. These surface water treatment plants serve New Jersey American Water customers in the following counties: Essex, Hunterdon, Mercer, Middlesex, Morris, Somerset, and Union.",https://finnhub.io/api/news?id=ec4f2ca5f600f458ef4e02f7daa07a07856bcbf020aaccf2cbf6dae03482c480
company,1769547900,"Illinois American Water Files Rate Request Driven by Approximately $577 Million in Investments to Provide Safe, Clean, Reliable and Affordable Service",138275521,https://s.yimg.com/rz/stage/p/yahoo_finance_en-US_h_p_finance_2.png,AWK,Yahoo,Illinois American Water today filed a request with the Illinois Commerce Commission (ICC) for new rates to support approximately $577 million in water and wastewater system investments from January 2026 through December 2027. The request reinforces the company's commitment to implementing critical system upgrades and continuing to improve water quality and reliability for its more than 1.3 million people served statewide.,https://finnhub.io/api/news?id=3575ce97aaae018fa712d3f55089747187793a0b6a7ac7751776c78eb20ecce4
company,1769534340,American Water Charitable Foundation Donated $5.7 Million in 2025 to Support and Strengthen Communities,138272724,https://s.yimg.com/rz/stage/p/yahoo_finance_en-US_h_p_finance_2.png,AWK,Yahoo,"The American Water Charitable Foundation, a philanthropic non-profit organization established by American Water (NYSE: AWK), the largest regulated water and wastewater utility company in the U.S., today announced that it awarded a combined total of $5.7 million to organizations across the U.S., supporting communities served by American Water in the 2025 Community Impact Report.",https://finnhub.io/api/news?id=7f3f203d327c83ea6cfff6b914a9e5bb43b029beac2321d1dc9408342f3b6eb2
company,1769526000,California American Water Invests Nearly $5 Million in Sacramento Community Water Supply with New Contempo Well Installation,138271250,https://s.yimg.com/rz/stage/p/yahoo_finance_en-US_h_p_finance_2.png,AWK,Yahoo,"California American Water is investing $4.7 million in a new groundwater well to help enhance water resiliency and reliability for Suburban-Rosemont customers. This project reflects California American Water's ongoing commitment to infrastructure improvements that support long-term system demand and help provide safe, clean, and reliable water service.",https://finnhub.io/api/news?id=22fae6381569405de5921c7bea3c4c33bc0021c47346f4e4e7fbdfeab5343885
company,1769517917,Essential Utilities: A Quality Dividend Grower To Buy Now,138272277,,AWK,SeekingAlpha,,https://finnhub.io/api/news?id=33b9b1e9719b5eaec975403259b9b31ef6b44cfed3d6207d51a889340ced836c
