category,datetime,headline,id,image,related,source,summary,url
company,1769501702,"Meta Earnings, Fed Decision, Venezuela Testimony: What to Watch This Week",138268618,https://s.yimg.com/rz/stage/p/yahoo_finance_en-US_h_p_finance_2.png,BA,Yahoo,"Earnings season is in full throttle, with results expected from big-name companies including UnitedHealth, Chevron and Boeing. A quartet of tech giants—Apple, Meta Platforms, Microsoft and Tesla—will also report results.",https://finnhub.io/api/news?id=be072e490655b9f2576b5e65f6388db36f9640479de4f33dc798cd414e2cc1c5
company,1769499205,"Stocks making the biggest moves premarket: Humana, Corning, General Motors, Boeing & more",138271964,https://image.cnbcfm.com/api/v1/image/107280605-1690984357528-gettyimages-1569285206-HUMANA_EARNS.jpeg?v=1769515885&w=1920&h=1080,BA,CNBC,These are the stocks posting the largest moves in early trading. ,https://finnhub.io/api/news?id=7bc120331d30bfad3fd45aa69e1f02c7d6ee3464fa0561b5a5b0dba9ac03ba5f
company,1769497201,Boeing's quarterly sales jump 57% as CEO says there's 'a lot to be optimistic about',138272029,https://image.cnbcfm.com/api/v1/image/108250212-1767906027935-gettyimages-2249102881-BOEING_737_MAX.jpeg?v=1769521867&w=1920&h=1080,BA,CNBC,Boeing's aircraft deliveries have surged over the past year as the manufacturer expects to continue to increase production.,https://finnhub.io/api/news?id=849edf6d602f5c14b6789dd3bfa5e193a71a3f59e6c95bf3049e00c3521d3aaf
company,1769481178,Jim Cramer Says “This Is the Year One of a Multi-Year Turn in the Stock of Boeing”,138266499,https://s.yimg.com/rz/stage/p/yahoo_finance_en-US_h_p_finance_2.png,BA,Yahoo,"The Boeing Company (NYSE:BA) is one of the stocks in focus as Jim Cramer shared his weekly game plan. Cramer highlighted why he would not sell the stock, as he remarked: Tuesday starts with Boeing. Now, this stock’s had a monster move since the last quarter. I don’t think it can report a number that […]",https://finnhub.io/api/news?id=85165a68c0d136ec3d034177d0f4e6452f808d11a06a768cf9b0bb47b51f30c6
company,1769472000,"GM earnings, Fed meeting, consumer confidence: What to Watch",138266046,https://s.yimg.com/rz/stage/p/yahoo_finance_en-US_h_p_finance_2.png,BA,Yahoo,"Market Domination Overtime Host Jared Blikre previews several of the biggest stories to come tomorrow, Tuesday, January 27, including earnings results from companies like General Motors (GM), Boeing (BA), United Parcel Service (UPS), and more; the start of the Federal Reserve's January FOMC meeting; and the latest consumer confidence data print.To watch more expert insights and analysis on the latest market action, check out more Market Domination Overtime.",https://finnhub.io/api/news?id=5ccac4323a11adc6b742a4346b089939eeab465606654260d5629f8c9302861f
