category,datetime,headline,id,image,related,source,summary,url
company,1769539970,Former Citi exec alleges sexual harassment by wealth chief,138274029,https://s.yimg.com/rz/stage/p/yahoo_finance_en-US_h_p_finance_2.png,C,Yahoo,"Julia Carreon is suing the bank, alleging she suffered race and sex discrimination, including sexual harassment by Andy Sieg, the bank's head of wealth management.",https://finnhub.io/api/news?id=238ede5b0542e4bf587b43bb77115edd44b0b8fc5eb95a9376f2c69eb8e7a10e
company,1769536446,"HSBC to Shut Raffles Place Retail Branch, Pivoting to Wealth Center",138274030,https://s.yimg.com/rz/stage/p/yahoo_finance_en-US_h_p_finance_2.png,C,Yahoo,The bank will close one of six Singapore branches on Feb. 28 and open a new wealth center in the same building.,https://finnhub.io/api/news?id=fbd912884a0361b990aa80c3930914c24d5c85976487aa32ce46bef584906756
company,1769530613,Citi initiates coverage of European pharma stocks; AstraZeneca ‘best in class’,138272520,https://s.yimg.com/rz/stage/p/yahoo_finance_en-US_h_p_finance_2.png,C,Yahoo,"Investing.com -- Citi launched broad coverage of major European pharmaceutical companies with a mixed outlook, issuing Buy ratings on AstraZeneca and Novartis while taking a more cautious stance on GSK, Novo Nordisk and Sanofi.",https://finnhub.io/api/news?id=340ea3f76472e2ac00e69bc5b4a85b385d90552b3498b50385864256a9c493b2
company,1769529435,"As AI wipes out desk jobs, Citigroup CEO Jane Fraser says the company is training 175,000 employees to ‘reinvent themselves’ before their roles change forever",138274031,https://s.yimg.com/rz/stage/p/yahoo_finance_en-US_h_p_finance_2.png,C,Yahoo,"Instead of letting Citigroup’s employees fend for themselves, the $205 billion bank has provided workers with an AI training mandate.",https://finnhub.io/api/news?id=20bd9d03584f239e424bb0fe4cd1792e2c7b6ad7578db061316a77a0d93adeb8
company,1769529120,"Citi’s HR department ‘spearheaded’ a harassment campaign, former managing director alleges",138275378,https://s.yimg.com/rz/stage/p/yahoo_finance_en-US_h_p_finance_2.png,C,Yahoo,The department allegedly opened two “baseless” investigations into the worker’s conduct that ruined her reputation and left her no choice but to leave.,https://finnhub.io/api/news?id=6435778038afd6febf5785e4492512280935735038468cec892b9682da2d7531
company,1769527680,"Former Citi Executive Sues Bank, Alleging Sexual Harassment",138283960,,C,DowJones,"Former Citi Executive Sues Bank, Alleging Sexual Harassment",https://finnhub.io/api/news?id=25e2dd6cf5b7f7f10585fd662978bf49632ac7e6acd2976e83de30873036020c
company,1769525744,"Ex-Citi Wealth Executive Sues Bank, Alleging Sexual Harassment",138272521,https://s.yimg.com/rz/stage/p/yahoo_finance_en-US_h_p_finance_2.png,C,Yahoo,Julia Carreon claims she endured sexual harassment from Andy Sieg for months and accused the bank of having a “weaponized” human resources department.,https://finnhub.io/api/news?id=91690b905460c7fce4dae9c936fda285a5f0fe10771ef1faaaf02a15ad963aa4
company,1769515800,Bank of America's Q4 Loan Growth Snapshot: The Mix Matters,138270924,https://s.yimg.com/rz/stage/p/yahoo_finance_en-US_h_p_finance_2.png,C,Yahoo,"BAC's Q4 loan growth was led by commercial lending, with a cautious consumer backdrop shaping the mix and earnings path.",https://finnhub.io/api/news?id=23d881b2a688d08325d44a44693822662e31729e7955e228dc9ee1ccc6276a8a
