category,datetime,headline,id,image,related,source,summary,url
company,1769557419,Smurfit Westrock: 3 Reasons To Consider This Underperforming Packaging Specialist,138277792,https://static.seekingalpha.com/cdn/s3/uploads/getty_images/1217618176/image_1217618176.jpg?io=getty-c-w1536,PKG,SeekingAlpha,"Smurfit Westrock (SW) stock is lagging since its NYSE debut. Learn 3 overlooked reasons to stay bullish: margin upside, 3.97% yield, and momentum. See more.",https://finnhub.io/api/news?id=3ca6c0f71516f3c87867369c5037820f6d08e6dc461b7338f473141aa8106593
company,1769557202,Packaging Corp. (PKG) Misses Q4 Earnings and Revenue Estimates,138277203,https://s.yimg.com/rz/stage/p/yahoo_finance_en-US_h_p_finance_2.png,PKG,Yahoo,"Packaging Corp. (PKG) delivered earnings and revenue surprises of -3.73% and -2.42%, respectively, for the quarter ended December 2025. Do the numbers hold clues to what lies ahead for the stock?",https://finnhub.io/api/news?id=4e69395f8b758136ac638490f4e5a428433a68b35f45b5a1e9bd78c72fff15cd
company,1769553844,Packaging Corp.: Q4 Earnings Snapshot,138276499,https://s.yimg.com/rz/stage/p/yahoo_finance_en-US_h_p_finance_2.png,PKG,Yahoo,"The Lake Forest, Illinois-based company said it had profit of $1.13 per share. Earnings, adjusted for non-recurring costs, were $2.32 per share. The results fell short of Wall Street expectations.",https://finnhub.io/api/news?id=9731add9352d71869df2b43fe216aba274ac31a06a971707497f0759f0a40b1e
company,1769553033,Packaging Corporation of America (NYSE:PKG) Misses Q4 CY2025 Sales Expectations,138276500,https://s.yimg.com/rz/stage/p/yahoo_finance_en-US_h_p_finance_2.png,PKG,Yahoo,"Packaging Corporation of America (NYSE:PKG) missed Wall Street’s revenue expectations in Q4 CY2025, but sales rose 10.1% year on year to $2.36 billion. Its non-GAAP profit of $2.32 per share was 3.9% below analysts’ consensus estimates.",https://finnhub.io/api/news?id=9ce253c7056633c5627dbf2bd5c1a6414ea44db3e20ee4706bc2d7c14a93860e
company,1769552580,Packaging Corporation of America Reports Fourth Quarter and Full Year 2025 Results,138276501,https://s.yimg.com/rz/stage/p/yahoo_finance_en-US_h_p_finance_2.png,PKG,Yahoo,"LAKE FOREST, Ill., January 27, 2026--Packaging Corporation of America (NYSE: PKG) today reported fourth quarter 2025 net income of $102 million, or $1.13 per share, and net income of $209 million, or $2.32 per share, excluding special items. Fourth quarter net sales were $2.4 billion in 2025 and $2.1 billion in 2024. Full year 2025 net income was $774 million, or $8.58 per share, and net income of $888 million, or $9.84 per share, excluding special items. Full year 2024 net income was $805 milli",https://finnhub.io/api/news?id=22997170eab9663244d66001e5341380d05d88ed662424b32d4b62303c604554
company,1769547900,Greif Reports Fiscal First Quarter 2026 Results,138275530,https://s.yimg.com/rz/stage/p/yahoo_finance_en-US_h_p_finance_2.png,PKG,Yahoo,"DELAWARE, Ohio, Jan. 27, 2026 (GLOBE NEWSWIRE) -- Greif, Inc. (NYSE: GEF, GEF.B), a global leader in industrial packaging products and services, today announced fiscal first quarter 2026 results. On June 30, 2025, we entered into a definitive agreement to divest our containerboard business, including our CorrChoice sheet feeder system (the “Containerboard Business”), in an all-cash transaction for $1.8 billion to Packaging Corporation of America. The transaction closed as of August 31, 2025. As",https://finnhub.io/api/news?id=23dfb33e157b623c6deecab62e72ac40856a05845b1d497c90326474f8b5ae0d
company,1769530950,Smurfit Westrock After Pricing News: Upside Looks Baked In,138274965,https://static.seekingalpha.com/cdn/s3/uploads/getty_images/2178503644/image_2178503644.jpg?io=getty-c-w1536,PKG,SeekingAlpha,"Smurfit Westrock Plc outlook: containerboard pricing power, merger synergies and EBITDA leverage, but valuation looks full. Click for more on SW stock prospects.",https://finnhub.io/api/news?id=18bbfc199272f9613876d413b174af0e3b90a85e7c8dda2e875a56b26c9a2080
