category,datetime,headline,id,image,related,source,summary,url
company,1769553001,PPG Industries (PPG) Q4 Earnings: Taking a Look at Key Metrics Versus Estimates,138276495,https://s.yimg.com/rz/stage/p/yahoo_finance_en-US_h_p_finance_2.png,PPG,Yahoo,"The headline numbers for PPG Industries (PPG) give insight into how the company performed in the quarter ended December 2025, but it may be worthwhile to compare some of its key metrics to Wall Street estimates and the year-ago actuals.",https://finnhub.io/api/news?id=321b51e4ae0c269a8401df42223071969f6e7045e3b04151e8685332e3d25cfe
company,1769552402,PPG Industries (PPG) Q4 Earnings Miss Estimates,138276496,https://s.yimg.com/rz/stage/p/yahoo_finance_en-US_h_p_finance_2.png,PPG,Yahoo,"PPG Industries (PPG) delivered earnings and revenue surprises of -3.82% and +4.52%, respectively, for the quarter ended December 2025. Do the numbers hold clues to what lies ahead for the stock?",https://finnhub.io/api/news?id=b3c35282cf65a3fde733b19cb053d75ff60239245a7de6f3fdc55b515280cc26
company,1769551080,"PPG Industries Logs Higher Quarterly Revenue on Higher Prices, Volume",138276497,https://s.yimg.com/rz/stage/p/yahoo_finance_en-US_h_p_finance_2.png,PPG,Yahoo,The Pittsburgh paint and coatings company’s revenue grew around 5% to $3.91 billion in the fourth quarter.,https://finnhub.io/api/news?id=eee539394158dde47487bbac8653784ed34eeed1394e2d4e398dddef6bf72f89
company,1769549178,PPG Industries: Q4 Earnings Snapshot,138275522,https://s.yimg.com/rz/stage/p/yahoo_finance_en-US_h_p_finance_2.png,PPG,Yahoo,"The average estimate of eight analysts surveyed by Zacks Investment Research was for earnings of $1.57 per share. The paint and coatings maker posted revenue of $3.91 billion in the period, which beat Street forecasts. Seven analysts surveyed by Zacks expected $3.74 billion.",https://finnhub.io/api/news?id=93d1b3481b27c3c04acf3942aa5d9e53bec90fe3df4ce4727d0a35e0735f1949
company,1769547900,PPG reports fourth quarter and full-year 2025 financial results,138275523,https://s.yimg.com/rz/stage/p/yahoo_finance_en-US_h_p_finance_2.png,PPG,Yahoo,"PITTSBURGH, January 27, 2026--PPG (NYSE:PPG) today reported financial results for the fourth quarter and full-year 2025.",https://finnhub.io/api/news?id=3903aa0243d874822ff8008360330610e6607318547dcc6332398c0e9c43a987
