category,datetime,headline,id,image,related,source,summary,url
company,1769267760,Is Abbott’s January Pullback a Good Time to Buy?,138253971,https://s.yimg.com/rz/stage/p/yahoo_finance_en-US_h_p_finance_2.png,ABT,Yahoo,Abbott Laboratories' January price pullback is a signal to load up on shares; this Dividend Aristocrat is growing its business and driving cash flow.,https://finnhub.io/api/news?id=18fed95cfe22eecdb77944ee296a7b84f0930e12d02d6d096fe891e2b57d6c63
company,1769252400,"Apple, Microsoft, Meta To Report Results; Fed's Interest Rate Decision In Focus",138245964,https://static.seekingalpha.com/assets/og_image_1200-29b2bfe1a595477db6826bd2126c63ac2091efb7ec76347a8e7f81ba17e3de6c.png,ABT,SeekingAlpha,"Wall Street Week Ahead: key earnings (AAPL, MSFT, META, TSLA), Fed rate decision, IPOs, dividends and volatility picks. Read more details here.",https://finnhub.io/api/news?id=74334fe78feae1e66ef0e5cd6f369b1ea035b40b2e233f4d21f65953514a6897
company,1769247005,Investing.com’s stocks of the week,138243798,https://s.yimg.com/rz/stage/p/yahoo_finance_en-US_h_p_finance_2.png,ABT,Yahoo,"Investing.com – There was no shortage of big-name stock moves this week, with earnings releases ramping up and significant gains in some tech names.",https://finnhub.io/api/news?id=652569746484f9c3f4ec91ad68f2fe0fe65bf4fc043d80fecc28bc62f417b8f1
company,1769239800,Abbott Laboratories: The Market's Overreaction Is The Long-Term Investor's Opportunity,138244665,https://static.seekingalpha.com/cdn/s3/uploads/getty_images/2209596910/image_2209596910.jpg?io=getty-c-w1536,ABT,SeekingAlpha,Abbott Laboratories raised its dividend 7% and targets $5.80 EPS with 19.2x forward P/E and double-digit profit growth. See why ABT stock is a buy.,https://finnhub.io/api/news?id=28f978ecbc53112d49525e2b202b97d4e7bcf1dcd6d09812c17de4146b87da2b
company,1769237036,What Moved Markets This Week,138244297,,ABT,SeekingAlpha,,https://finnhub.io/api/news?id=f2f367a61e5589d22a00176ef176c1f60b55b5c4c30c385bbfe53a46d296da32
