category,datetime,headline,id,image,related,source,summary,url
company,1769276343,Brace yourself: Nvidia and AMD GPU prices may rise as top AIBs adjust costs,138247897,https://s.yimg.com/rz/stage/p/yahoo_finance_en-US_h_p_finance_2.png,AMD,Yahoo,"A new report suggests GPU prices may soon climb as NVIDIA and AMD partners face rising DDR6 and DDR7 costs, leaving consumers to spot changes through retail listings. The post Brace yourself: Nvidia and AMD GPU prices may rise as top AIBs adjust costs appeared first on Digital Trends.",https://finnhub.io/api/news?id=11e24c523bc70456cfe0d7881ab1b66efd967ba7b068dc5d87695591fffeaf80
company,1769274684,Is Riot Platforms (RIOT) Quietly Recasting Its Bitcoin Identity With This AMD AI Data Center Deal?,138246825,https://s.yimg.com/rz/stage/p/yahoo_finance_en-US_h_p_finance_2.png,AMD,Yahoo,"Earlier in January 2026, Riot Platforms announced a 10-year, 25MW data center lease and services agreement with AMD at its Rockdale, Texas site, with options that could significantly expand AMD’s access to AI and high-performance computing capacity. This deal marks a meaningful broadening of Riot’s business model as it seeks to pair its large power footprint with long-term AI infrastructure tenants, reducing reliance on Bitcoin mining alone. Next, we’ll examine how this AMD agreement...",https://finnhub.io/api/news?id=754b917fa785481cffdf82b44931f8cc3b6654f5aa8f247d11b60e99aecb4f35
company,1769270402,Citi Analysts Love This 1 Lesser-Known Chip Stock Ahead of Earnings,138247898,https://s.yimg.com/rz/stage/p/yahoo_finance_en-US_h_p_finance_2.png,AMD,Yahoo,Citi named NXP Semiconductor one of its top picks ahead of earnings.,https://finnhub.io/api/news?id=a6fba9da188ac7832426ce3c553dc5af43f8abf6f1d8e89f4218348f25b4915b
company,1769270100,I Predicted TSMC Would Be a Must-Own Stock in 2025. I Still Think It's a Fantastic Buy in 2026,138246788,https://s.yimg.com/rz/stage/p/yahoo_finance_en-US_h_p_finance_2.png,AMD,Yahoo,Taiwan Semiconductor Manufacturing will benefit from the same tailwinds in 2026 as it did in 2025.,https://finnhub.io/api/news?id=87d9cdc0e162722c6ee4f445e1d8026fd798a1a562de00ab3d87bb4a54c8f38a
company,1769256000,MarketBeat Week in Review – 01/19 - 01/23,138253079,https://s.yimg.com/rz/stage/p/yahoo_finance_en-US_h_p_finance_2.png,AMD,Yahoo,"Stocks rallied after a sharp sell-off as economic indicators pointed to a growing economy; next week may bring more volatility as ""big tech"" begins to report.",https://finnhub.io/api/news?id=6c87a96990cf81e0a85fe11c64d6887c17c757553a28f700604693bd171adfae
company,1769237036,What Moved Markets This Week,138244297,,AMD,SeekingAlpha,,https://finnhub.io/api/news?id=f2f367a61e5589d22a00176ef176c1f60b55b5c4c30c385bbfe53a46d296da32
