category,datetime,headline,id,image,related,source,summary,url
company,1769270937,Is This Greg Abel’s Next Stock to Sell From Berkshire Hathaway’s Portfolio?,138246894,https://s.yimg.com/rz/stage/p/yahoo_finance_en-US_h_p_finance_2.png,KHC,Yahoo,"Greg Abel is only three weeks into his tenure as CEO of Berkshire Hathaway (NYSE:BRK-A)(NYSE:BRK-B) and he is already making moves, filing a notice that the company may sell its entire stake in Kraft Heinz (NASDAQ:KHC), which represents about 27.5% of the company’s shares. That seems an entirely reasonable decision as Kraft Heinz will be ... Is This Greg Abel’s Next Stock to Sell From Berkshire Hathaway’s Portfolio?",https://finnhub.io/api/news?id=74388c9c79956347d8e163016e49b9ff7cf797d6ead9680d8525252fe7fcbf87
company,1769264954,Berkshire Hathaway (BRK-B) Looks to Exit Its 27.5% Stake in Kraft Heinz,138245959,https://s.yimg.com/rz/stage/p/yahoo_finance_en-US_h_p_finance_2.png,KHC,Yahoo,"Berkshire Hathaway Inc. (NYSE:BRK-B) is included in our list of the best stocks to buy and hold for 20 years. On January 20, 2026, Reuters reported that Berkshire Hathaway Inc. (NYSE:BRK-B) is possibly exiting its 27.5% stake in Kraft Heinz. The company has made investments in the food and beverage stock for the past ten years. However, […]",https://finnhub.io/api/news?id=2deeb2a0add72626c67f3311e9c8a14f97710fec67a8893023570a0652cbf516
company,1769254659,"Jim Cramer on Kraft Heinz: “I’m a Seller, Not a Buyer”",138244438,https://s.yimg.com/rz/stage/p/yahoo_finance_en-US_h_p_finance_2.png,KHC,Yahoo,"The Kraft Heinz Company (NASDAQ:KHC) is one of the stocks Jim Cramer shared his take on. Inquiring about the stock, when a caller mentioned that Warren Buffett is getting rid of his 28% share in the stock, Cramer commented: Well, okay, so we know that it’s not Warren. It’s the new fellow that took it […]",https://finnhub.io/api/news?id=bfa5d29e281409580fad40ed88b6a7d7fd3e2e4845caf683b4b2b11c9136f5b0
company,1769245162,New Berkshire CEO Abel quickly signals troubled Kraft Heinz stake could be toast,138246478,https://image.cnbcfm.com/api/v1/image/108193115-1756822177269-2015-05-02T120000Z_73361273_GF10000080689_RTRMADP_3_BERKSHIRE-RESULTS.JPG?v=1756822252&w=1920&h=1080,KHC,CNBC,"With Greg Abel as Berkshire Hathaway's new CEO of Berkshire Hathaway, the company is apparently preparing to sell some or all of its Kraft Heinz shares.",https://finnhub.io/api/news?id=07ecf524a7bd9d5c5f6a3d8d50ff96d45216eeef004566f9986d2046419faa0c
company,1769214667,Buffett's Successor Is Ready To Pass The Ketchup — Berkshire's Kraft Heinz Losses Are Bigger Than You Think,138230676,https://s.yimg.com/rz/stage/p/yahoo_finance_en-US_h_p_finance_2.png,KHC,Yahoo,"Berkshire Hathaway Inc (NYSE:BRK)(NYSE:BRK) shares underperformed the S&P 500 in 2025, marking a rare miss in the final year under Warren Buffett‘s leadership. With Buffett gone from the CEO role, his successor could have his eye on changing some of the long-standing stock picks. Berkshire's Kraft Heinz Stake Up First Kraft Heinz Co (NASDAQ:KHC) shares fell Tuesday after hours with the company filing plans to sell up to 325,442,152 shares on behalf of shareholder Berkshire Hathaway. The shares c",https://finnhub.io/api/news?id=1853d3734c2268b26c1019bf87f3112fed2c885c6be4e3184ca2752f45fb259c
