category,datetime,headline,id,image,related,source,summary,url
company,1769292620,Does Netflix’s Warner Bros. Bid and Buyback Pause Change The Bull Case For Netflix (NFLX)?,138248949,https://s.yimg.com/rz/stage/p/yahoo_finance_en-US_h_p_finance_2.png,NFLX,Yahoo,"Earlier this week, Netflix reported fourth-quarter and full-year 2025 results, with revenue rising to US$12,050.76 million for the quarter and US$45.18 billion for the year alongside higher net income and earnings per share. At the same time, Netflix paused its long-running share repurchase program and pressed ahead with an all-cash bid for Warner Bros. Discovery’s studios and streaming assets, raising questions about future growth, margins, and execution risk. With these developments and...",https://finnhub.io/api/news?id=3a0b3799265489b1d8522832ef1c3121cf0d91321e56018ca5e625e42889d4f1
company,1769292480,"Should You Invest $1,000 in Netflix Stock Right Now?",138248950,https://s.yimg.com/rz/stage/p/yahoo_finance_en-US_h_p_finance_2.png,NFLX,Yahoo,This longtime stock market winner is trading below its peak price.,https://finnhub.io/api/news?id=65b6ea50525d827de47d65b58df5c4a851bc4ac1fb202c7d021db7a6e59305ab
company,1769291400,Netflix Shares Continue to Fall. Is It Time to Buy the Dip?,138248537,https://s.yimg.com/rz/stage/p/yahoo_finance_en-US_h_p_finance_2.png,NFLX,Yahoo,Netflix's share price has struggled to gain traction in recent months.,https://finnhub.io/api/news?id=e80306846eda436c320b48463f650d8c939bb5ab62a00135475b3980c1a71c9f
company,1769287200,Netflix Stock Tanks After Earnings: Warning Sign or Should You Ignore?,138248538,https://s.yimg.com/rz/stage/p/yahoo_finance_en-US_h_p_finance_2.png,NFLX,Yahoo,The streamer's stock price hit a 52-week low on Wednesday.,https://finnhub.io/api/news?id=8d094e3d283add95d22946a78523a6f26f5dae03216eb138d69cf8c797ebeb3f
company,1769276366,Wedbush Is Betting That Netflix Can Double Ad Revenue in 2026. Does That Make NFLX Stock a Buy Here?,138248539,https://s.yimg.com/rz/stage/p/yahoo_finance_en-US_h_p_finance_2.png,NFLX,Yahoo,"Netflix remains under pressure, even as Wedbush highlighted the growth potential in its advertising business. Could investors be underestimating this upside?",https://finnhub.io/api/news?id=36d5a20799e5c749326b4eb82d6aa04f4d3480b63c1fca97019573f58178c1fe
company,1769270478,"Netflix's Greg Peters Says Paramount's Warner Bros Bid Has No Chance Without Larry Ellison, Calls Debt Plan 'Pretty Crazy'",138246827,https://s.yimg.com/rz/stage/p/yahoo_finance_en-US_h_p_finance_2.png,NFLX,Yahoo,"Netflix Inc. (NASDAQ:NFLX) co-CEO Greg Peters said Paramount Skydance's (NASDAQ:PSKY) $108 billion hostile bid for Warner Bros. Discovery (NASDAQ:WBD) is unrealistic without Oracle Corp (NYSE:ORCL) founder Larry Ellison's financial backing. Netflix Dismisses Paramount's Debt-Fueled Offer Netflix co-chief executive Greg Peters sharply criticized Paramount's rival bid for Warner Bros. Discovery, saying the offer ""doesn't pass the sniff test"" and would collapse without Ellison's personal support. I",https://finnhub.io/api/news?id=cb474a7c1e0176ed3e4ad559bc038bd72c4aa7dc3be36e20e49286528040015f
company,1769263295,Notable open interest changes for January 23rd,138245850,https://s.yimg.com/rz/stage/p/yahoo_finance_en-US_h_p_finance_2.png,NFLX,Yahoo,"Thursday’s total option volume of 66.7 million contracts resulted in net open interest growth of 9.22 million calls and 6.95 million puts. NVIDIA (NVDA), Intel (INTC), Tesla (TSLA) and Netflix (NFLX) saw the greatest growth. Top five new positions opened include 145k Netflix (NFLX) Sep-26 100 calls, 127k NVIDIA (NVDA) 1/30 weekly 165 puts, 122k Netflix (NFLX) Sep-26 120 calls, 60k Advanced Micro Devices (AMD) 1/30 weekly 220 puts and 48k Broadcom (AVGO) 1/30 weekly 297.5 puts.Claim 50% Off TipRa",https://finnhub.io/api/news?id=11ea68844615c3544b30808c006edd32cec876d0e5d8fc5de0ce3ff690b0c00b
company,1769256000,MarketBeat Week in Review – 01/19 - 01/23,138253079,https://s.yimg.com/rz/stage/p/yahoo_finance_en-US_h_p_finance_2.png,NFLX,Yahoo,"Stocks rallied after a sharp sell-off as economic indicators pointed to a growing economy; next week may bring more volatility as ""big tech"" begins to report.",https://finnhub.io/api/news?id=6c87a96990cf81e0a85fe11c64d6887c17c757553a28f700604693bd171adfae
company,1769252400,"Apple, Microsoft, Meta To Report Results; Fed's Interest Rate Decision In Focus",138245964,https://static.seekingalpha.com/assets/og_image_1200-29b2bfe1a595477db6826bd2126c63ac2091efb7ec76347a8e7f81ba17e3de6c.png,NFLX,SeekingAlpha,"Wall Street Week Ahead: key earnings (AAPL, MSFT, META, TSLA), Fed rate decision, IPOs, dividends and volatility picks. Read more details here.",https://finnhub.io/api/news?id=74334fe78feae1e66ef0e5cd6f369b1ea035b40b2e233f4d21f65953514a6897
