category,datetime,headline,id,image,related,source,summary,url
company,1769286300,"Bill Gates Issues Warning on AI Investment Hype, Urges Caution",138248525,https://s.yimg.com/rz/stage/p/yahoo_finance_en-US_h_p_finance_2.png,ORCL,Yahoo,"Bill Gates on Wednesday warned the AI industry will be ""hypercompetitive,"" and that ""a reasonable percentage"" of today's pricey tech stocks will lose a lot of their value.",https://finnhub.io/api/news?id=382c552660fc0ffbfcfb783fa6b2f81cac4c952b0eeefccc207169808cb151a6
company,1769270478,"Netflix's Greg Peters Says Paramount's Warner Bros Bid Has No Chance Without Larry Ellison, Calls Debt Plan 'Pretty Crazy'",138246827,https://s.yimg.com/rz/stage/p/yahoo_finance_en-US_h_p_finance_2.png,ORCL,Yahoo,"Netflix Inc. (NASDAQ:NFLX) co-CEO Greg Peters said Paramount Skydance's (NASDAQ:PSKY) $108 billion hostile bid for Warner Bros. Discovery (NASDAQ:WBD) is unrealistic without Oracle Corp (NYSE:ORCL) founder Larry Ellison's financial backing. Netflix Dismisses Paramount's Debt-Fueled Offer Netflix co-chief executive Greg Peters sharply criticized Paramount's rival bid for Warner Bros. Discovery, saying the offer ""doesn't pass the sniff test"" and would collapse without Ellison's personal support. I",https://finnhub.io/api/news?id=cb474a7c1e0176ed3e4ad559bc038bd72c4aa7dc3be36e20e49286528040015f
company,1769268862,Jim Cramer Discusses President Trump & CoreWeave (CRWV),138245847,https://s.yimg.com/rz/stage/p/yahoo_finance_en-US_h_p_finance_2.png,ORCL,Yahoo,"We recently published 14 Stocks Jim Cramer Talked About. CoreWeave Inc. (NASDAQ:CRWV) is one of the stocks Jim Cramer talked about. CoreWeave Inc. (NASDAQ:CRWV), along with Oracle, is a key player in the AI infrastructure space. Cramer has discussed the stock several times over the past couple of months and commented on the firm’s close […]",https://finnhub.io/api/news?id=02adef18c672dd543ed4881cfeb2f5bfa52403e33926720c7de0790feafd2b5b
company,1769268742,"Oracle (ORCL)’s a “Linchpin” Stock, Says Jim Cramer",138245876,https://s.yimg.com/rz/stage/p/yahoo_finance_en-US_h_p_finance_2.png,ORCL,Yahoo,"We recently published 14 Stocks Jim Cramer Talked About. Oracle Corporation (NYSE:ORCL) is one of the stocks Jim Cramer talked about. AI infrastructure giant Oracle Corporation (NYSE:ORCL)’s shares are down by 3.4% over the past year. Year-to-date, the stock has lost 9%, and during this time period, several analysts have discussed the firm. For instance, […]",https://finnhub.io/api/news?id=a2afb309e22a16cd19dc05c29cc0c215d223be3dd8ec1cc7479019e358dc24e5
company,1769252481,Oracle's Cash Is Vanishing — But Larry Ellison's Dividend Check Still Clears Tomorrow,138244342,https://s.yimg.com/rz/stage/p/yahoo_finance_en-US_h_p_finance_2.png,ORCL,Yahoo,"Oracle Corp (NYSE:ORCL) is torching cash to build its AI cloud—but it's still sending billions back to shareholders. That tension is becoming one of the most underappreciated capital allocation stories in Big Tech. On Friday, Oracle will pay out roughly $1.4 billion in dividends, even as analysts expect nearly $23 billion in cash burn this fiscal year. On paper, cutting the dividend looks logical. In reality, it's complicated. Larry Ellison’s Stake Raises The Bar For A Cut Co-founder and executi",https://finnhub.io/api/news?id=76ca8306ba4d07f2f35acf749123a63dd483c5e0f5dc55de49d6e3306689a619
company,1769232442,Legal AI giant Harvey acquires Hexus as competition heats up in legal tech,138231638,https://s.yimg.com/rz/stage/p/yahoo_finance_en-US_h_p_finance_2.png,ORCL,Yahoo,"Hexus founder and CEO Sakshi Pratap, who previously held engineering roles at Walmart, Oracle, and Google, tells TechCrunch that her San Francisco-based team has already joined Harvey, while the startup's India-based engineers will come onboard once Harvey establishes a Bangalore office.",https://finnhub.io/api/news?id=c848a387bc3062d2354cdd9c95c55894ab14712a41351c391f80499d034b4daa
