category,datetime,headline,id,image,related,source,summary,url
company,1769266871,Crypto Currents: BitGo raises $212.8M in U.S. IPO,138245867,https://s.yimg.com/rz/stage/p/yahoo_finance_en-US_h_p_finance_2.png,V,Yahoo,"As bitcoin, ethereum and other cryptocurrencies see major legal, institutional, and technological developments, the financial landscape continues to adapt. Stay up on the crypto news that matters with the “Crypto Currents” weekly from The Fly. Also, join us for your essential daily recap, every day at 2 PM ET on FlyCast radio.Claim 50% Off TipRanks PremiumUnlock hedge fund-level data and powerful investing tools for smarter, sharper decisions Stay ahead of the market with the latest news and ana",https://finnhub.io/api/news?id=6f12538d91000e6de08964e8e69086a8bc1e0382acef7dc9866bc2f10ec860f3
company,1769264963,JPMorgan CEO Jamie Dimon Sees Rising Regulatory Risk for Card Networks Such as Visa (V),138245868,https://s.yimg.com/rz/stage/p/yahoo_finance_en-US_h_p_finance_2.png,V,Yahoo,"Visa Inc. (NYSE:V) is one of the best stocks to buy and hold for 20 years. On January 21, 2026, JPMorgan CEO Jamie Dimon warned that customer access to credit could be sharply curtailed following a proposed 10% cap on U.S. credit card interest rates. According to him, the move could mean the removal of […]",https://finnhub.io/api/news?id=f2c811a3cb2b5e6abb6cbbcde54dcd88d68e4a4dc25349c8d95e5160f7d3736a
company,1769259960,Are You on Track With the Net Worth and Income of America's Top 10%?,138245869,https://s.yimg.com/rz/stage/p/yahoo_finance_en-US_h_p_finance_2.png,V,Yahoo,"To be in the top 10% in the U.S., you must earn at least $210,000 per year or have at least $1.8 million of net worth.",https://finnhub.io/api/news?id=9379bc6076ace72d1224e35aebc49ce7b3800489079f3134e3798905c5448aaf
company,1769252400,"Apple, Microsoft, Meta To Report Results; Fed's Interest Rate Decision In Focus",138245964,https://static.seekingalpha.com/assets/og_image_1200-29b2bfe1a595477db6826bd2126c63ac2091efb7ec76347a8e7f81ba17e3de6c.png,V,SeekingAlpha,"Wall Street Week Ahead: key earnings (AAPL, MSFT, META, TSLA), Fed rate decision, IPOs, dividends and volatility picks. Read more details here.",https://finnhub.io/api/news?id=74334fe78feae1e66ef0e5cd6f369b1ea035b40b2e233f4d21f65953514a6897
company,1769212812,"Mag 7 earnings, Fed's rate decision: What to Watch",138229913,https://s.yimg.com/rz/stage/p/yahoo_finance_en-US_h_p_finance_2.png,V,Yahoo,"Market Domination Overtime Host Josh Lipton previews several of the biggest stories to come throughout next week, including a wide array of earnings results due out from major companies like Microsoft (MSFT), Meta Platforms (META), Apple (AAPL), Tesla (TSLA), and many more; and the Federal Reserve's latest interest rate decision followed by a press conference with chairman Jerome Powell. To watch more expert insights and analysis on the latest market action, check out more Market Domination Overtime.",https://finnhub.io/api/news?id=d4b198ce7ec769d582b53891e32e4512ec49ead9eb231a58b48f387851d8d7bf
