category,datetime,headline,id,image,related,source,summary,url
company,1768377600,How Macy’s Media Network navigates complex ‘coopetition’ with Amazon,138111109,https://s.yimg.com/rz/stage/p/yahoo_finance_en-US_h_p_finance_2.png,AMZN,Yahoo,"The platform, among the first major retail media networks to pilot Amazon’s Retail Ad Service, has drawn in 175 new brands since August.",https://finnhub.io/api/news?id=0beb69ccb39828b1e0907170612eda1fe66b4d1728d52d241cfae25a15c5e249
company,1768377142,Heard on the Street Tuesday Recap: Powered Down,138109900,https://s.yimg.com/rz/stage/p/yahoo_finance_en-US_h_p_finance_2.png,AMZN,Yahoo,JPMorgan gave a bum start to bank earnings. The Dow industrials component slid 4.2% after results showed a surprise slip in investment-banking fees and a significant charge for taking over the Apple credit-card program.,https://finnhub.io/api/news?id=604001b11a5232c056f695d6dd053739565b1c762433b9ad8df3e3b2ff33dbd1
company,1768375903,"Amazon to appeal against Italian fine, even after it was cut, paper says",138101375,https://s.yimg.com/rz/stage/p/yahoo_finance_en-US_h_p_finance_2.png,AMZN,Yahoo,"U.S. e-commerce giant Amazon will appeal ​against a decision by ‌an Italian court that reduced a fine ‌imposed by the country's antitrust regulator as it believes it should not be charged at all, ⁠Italian daily ‌MF reported on Wednesday. On Monday, Italy's antitrust authority said ‍it had reduced to 752.4 million euros ($876.3 million) a 1.13-billion-euro fine it ​imposed on Amazon in 2021 ‌for abusing its dominant position, restricting competition in e-commerce logistics services in Italy. The reduction followed a regional administrative court ruling last ⁠September.",https://finnhub.io/api/news?id=90f1ad22dbc0752d3aee0877e742b9d07cf36f372c8d34c17f8b6e9606d7c319
company,1768374070,"Saks Global, century-old high-end department store chain, files for bankruptcy",138090870,https://s.yimg.com/rz/stage/p/yahoo_finance_en-US_h_p_finance_2.png,AMZN,Yahoo,The venerable retailer is seeking protection from its creditors after $2.65 billion purchase of Nieman Marcus failed to spark growth.,https://finnhub.io/api/news?id=e0e899fe6574c997914e3ab9e45332518841c93bbbc25ca451bba6a9150f1b56
company,1768361692,"Saks Global, the longtime leader of luxury department stores, files for bankruptcy protection",138112575,https://image.cnbcfm.com/api/v1/image/108249029-17677346672026-01-06t211718z_942828322_rc2vviaxuan1_rtrmadp_0_saks-global-bankruptcy.jpeg?v=1767734773&w=1920&h=1080,AMZN,CNBC,"Saks Global, which also owns Neiman Marcus and Bergdorf Goodman, filed for bankruptcy protection after running out of cash.",https://finnhub.io/api/news?id=b6d0e7919dc5c8e75d797a5c2cddb603ff8bd4d80c44530d35b8ba1424f815c4
company,1768359000,"Generative AI Digest: New Models, U.S. Executive Order",138101381,https://static.seekingalpha.com/cdn/s3/uploads/getty_images/2228138973/image_2228138973.jpg?io=getty-c-w1536,AMZN,SeekingAlpha,"Amid a flurry of new proprietary model releases and leaderboard wrestling, AWS' Nova Forge announcement stands out with its focus on custom models. Read more here.",https://finnhub.io/api/news?id=c75d7849f7d40276689be85b5677cafe28cfc879a9dabe3355897be40cfb616d
company,1768354259,Hims & Hers: Growth Catalysts Or Margin Trap,138090646,https://static.seekingalpha.com/cdn/s3/uploads/getty_images/1865252871/image_1865252871.jpg?io=getty-c-w1536,AMZN,SeekingAlpha,"Hims & Hers was rated Hold amid margin pressure, Amazon-driven competition, & uncertain catalysts. Learn more about HIMS stock.",https://finnhub.io/api/news?id=cc373f211bb132de53f7cd097ff1a2a62baa725c07d8dd9f681853531bbff27e
