category,datetime,headline,id,image,related,source,summary,url
company,1768431664,"Cathie Wood Predicts 'Goldilocks' Boom In 2026: 5% GDP With Deflation, Calls Bitcoin 'Ultimate Diversifier' For Portfolios",138120853,https://s.yimg.com/rz/stage/p/yahoo_finance_en-US_h_p_finance_2.png,LEN,Yahoo,"ARK Invest CEO Cathie Wood is calling for an economic “Goldilocks” scenario in 2026, forecasting real GDP growth surging toward 5%, accompanied by falling inflation—and potentially outright deflation—driven by an AI-led productivity boom. ‘Goldilocks’ Return In a latest ARK Invest video, Wood argued that the U.S. economy is exiting a three-year “rolling recession” that quietly battered housing and manufacturing. Citing recent data showing real GDP growth already topping 4% in late 2025, she expe",https://finnhub.io/api/news?id=c6f20f75e3c4404002ce54ef4f76a096a51f19c4e12ec5aa7b0fb110b363a17d
company,1768407091,"Home builders had a tough day, after criticism from a former ally",138135870,,LEN,MarketWatch,"Home builders had a tough day, after criticism from a former ally",https://finnhub.io/api/news?id=88aff96700d57cdb382fb3d3bd68f6ed9167098cce0ec8652fe9a4ac99b2a225
company,1768406836,"Homebuilder stocks slide, silver miners gain, crypto stocks rise",138113329,https://s.yimg.com/rz/stage/p/yahoo_finance_en-US_h_p_finance_2.png,LEN,Yahoo,"Yahoo Finance Data and Markets Editor Jared Blikre joins Market Catalysts with Julie Hyman to take a closer look at some of the trending tickers on Yahoo Finance's platform on Wednesday. Homebuilder stocks (XHB) are in focus after Trump's Federal Housing Finance Agency Director Bill Pulte criticized share buybacks. Silver (SI=F) miners share in the precious metal's rise. Crypto stocks rise on bitcoin (BTC-USD) gains. To watch more expert insights and analysis on the latest market action, check out more Market Catalysts.",https://finnhub.io/api/news?id=71f34db268d54068ad3ca69d4ca6469e103c56de4eea765d09cf11eb016f8982
company,1768402140,"D.R. Horton, Lennar, Other Home Builder Stocks Hit as Pulte Slams Buybacks",138113349,https://s.yimg.com/rz/stage/p/yahoo_finance_en-US_h_p_finance_2.png,LEN,Yahoo,"Bill Pulte took aim at home builders’ stock buybacks, sending shares in D.R. Horton and Lennar lower.",https://finnhub.io/api/news?id=964d70cd3727e2d1729488b5ba642ba27de91113d941dced9be873ff02ea9228
company,1768392180,Trump’s Housing Czar Slams Buybacks. These Home Builder Stocks Are Falling.,138111349,https://s.yimg.com/rz/stage/p/yahoo_finance_en-US_h_p_finance_2.png,LEN,Yahoo,"Bill Pulte took aim at home builders’ stock buybacks, sending shares in D.R. Horton and Lennar lower.",https://finnhub.io/api/news?id=fc77348f1d5d6393d482572301d6bd05eb6257106a5da9f7e4b1113ca3fbf975
company,1768390029,"Wall Street Lunch: Gold, Silver Hit All-Time Highs As Safe-Haven Demand Surges",138112348,https://static.seekingalpha.com/cdn/s3/uploads/getty_images/506120376/image_506120376.jpg?io=getty-c-w1536,LEN,SeekingAlpha,"Gold (XAUUSD:CUR) and silver (XAGUSD:CUR) hit fresh all-time highs, with gold up about 1% above $4,641/oz and silver jumping 6% to top $90/oz for the first time.",https://finnhub.io/api/news?id=ea7107a13d97c4883a003e7bb9d6a53f82a6a3eb7f6a940b3c0bce669e547aa2
company,1768384689,"Stocks to Watch Wednesday: Netflix, Bank of America, Citi",138110417,https://s.yimg.com/rz/stage/p/yahoo_finance_en-US_h_p_finance_2.png,LEN,Yahoo,"? Bank of America (BAC): The lender is due to post quarterly earnings, as are Wells Fargo (WFC) and Citigroup (C). ↗️ Netflix (NFLX): The streaming company is preparing an all-cash bid for Warner Bros.",https://finnhub.io/api/news?id=dff764c28d5479aafd189b8a929b6199bd750d2cbaea1ee2f16ee59493e95847
company,1768352400,Trump Administration Takes Aim at Home-Builder Stock Buybacks,138095456,https://s.yimg.com/rz/stage/p/yahoo_finance_en-US_h_p_finance_2.png,LEN,Yahoo,"For some in the Trump administration, buybacks have become a dirty word.  In an interview with The Wall Street Journal, President Trump’s Federal Housing Finance Agency director,  Bill Pulte,  questioned repurchases made by home builders when discussing the administration’s plans to lower housing costs.  “They’re making, in some cases, more money than they’ve ever made, and they’re buying back stock like never before,” Pulte said.",https://finnhub.io/api/news?id=004fd4019ab7e50018c597aab3409b1629f073d5b0216e58eee9706820f52fb9
