category,datetime,headline,id,image,related,source,summary,url
company,1768413181,Super Micro Computer (SMCI) Announces Collaboration with Technology Partners,138113386,https://s.yimg.com/rz/stage/p/yahoo_finance_en-US_h_p_finance_2.png,SMCI,Yahoo,"Super Micro Computer, Inc. (NASDAQ:SMCI) is one of the Best Fundamental Stocks to Buy According to Analysts. On January 11, the company announced collaboration with technology partners for AI-powered intelligent in-store retail solutions, which have been designed to meet increasing customer expectations with scalability, improved productivity, and higher profitability. Through combining Super Micro Computer, Inc. […]",https://finnhub.io/api/news?id=58afd973b60a7d6f59210d3c183df925ba93cec92c21f36bc7cefc2ab0ebf2f2
company,1768412168,Insiders Favor These 3 High Growth Stocks For Potential Gains,138113416,https://s.yimg.com/rz/stage/p/yahoo_finance_en-US_h_p_finance_2.png,SMCI,Yahoo,"As the U.S. stock market navigates through a period marked by fluctuating bank earnings, inflation concerns, and record highs in precious metals, investors are keenly observing sectors that could offer potential growth amid these uncertainties. In such an environment, companies with high insider ownership often attract attention as they may indicate confidence from those who know the business best.",https://finnhub.io/api/news?id=fe9347022a88cdbda5533ac4a54d92d3e325518f0dc91b89dce878fbfe115e49
company,1768405425,"Supermicro Stock Slips 46% in 3 Months: Should You Buy, Sell, or Hold SMCI?",138114909,https://s.yimg.com/rz/stage/p/yahoo_finance_en-US_h_p_finance_2.png,SMCI,Yahoo,"Supermicro’s revenue growth story remains compelling, driven by secular demand for AI infrastructure. However, investors should be mindful of near-term margin compression.",https://finnhub.io/api/news?id=9b43bafe7246d487b77be09ea7689dec54de85a57ba4176fe8ad5a3c386667ba
company,1768397938,Super Micro Computer Shares Slide After Goldman Sachs Downgrade,138111389,https://s.yimg.com/rz/stage/p/yahoo_finance_en-US_h_p_finance_2.png,SMCI,Yahoo,Analyst flags margin pressure despite AI server demand and revenue growth.,https://finnhub.io/api/news?id=aed995029c1e25d5f3d084c110997abd9c2586bc30ef20aa36a3591d4e031209
company,1768397093,Super Micro Stock Is Sliding. Wall Street Is Worried About Margins,138111210,https://s.yimg.com/rz/stage/p/yahoo_finance_en-US_h_p_finance_2.png,SMCI,Yahoo,Super Micro Shares Fall After Goldman Starts Coverage With a Sell.,https://finnhub.io/api/news?id=8d66102ce05e5170befc5eb1d49b9627387e206d01fec9223aa14932fbc68fe0
company,1768395638,"Stocks making big moves yesterday: Mobileye, AMD, Five9, UiPath, and Super Micro",138114671,https://s.yimg.com/rz/stage/p/yahoo_finance_en-US_h_p_finance_2.png,SMCI,Yahoo,Check out the companies making headlines yesterday:,https://finnhub.io/api/news?id=44b0560228f2cce89c9572d30b14de5e1db9b1a5025c2a4ab4368f7f8120616d
company,1768390548,January 2026's Top Growth Stocks With Strong Insider Confidence,138110596,https://s.yimg.com/rz/stage/p/yahoo_finance_en-US_h_p_finance_2.png,SMCI,Yahoo,"As of January 2026, the U.S. markets are reaching new heights, with the S&P 500 and Dow Jones Industrial Average closing at record highs despite concerns about a DOJ probe into Fed Chair Powell. This resilient performance highlights the importance of identifying growth companies with strong insider ownership, as such stocks often reflect confidence from those closest to the company's operations and can be particularly appealing in a thriving market environment.",https://finnhub.io/api/news?id=c3d8ffc29d0793723bb85f902c47dfd0883204681050871c8c7e87b3588fc90c
company,1768390029,"Wall Street Lunch: Gold, Silver Hit All-Time Highs As Safe-Haven Demand Surges",138112348,https://static.seekingalpha.com/cdn/s3/uploads/getty_images/506120376/image_506120376.jpg?io=getty-c-w1536,SMCI,SeekingAlpha,"Gold (XAUUSD:CUR) and silver (XAGUSD:CUR) hit fresh all-time highs, with gold up about 1% above $4,641/oz and silver jumping 6% to top $90/oz for the first time.",https://finnhub.io/api/news?id=ea7107a13d97c4883a003e7bb9d6a53f82a6a3eb7f6a940b3c0bce669e547aa2
