category,datetime,headline,id,image,related,source,summary,url
company,1768416842,"2026’s Biggest AI Trends: The Memory Explosion | MU Stock, SNDK Stock, SK Hynix, CAMT Stock",138114649,https://s.yimg.com/rz/stage/p/yahoo_finance_en-US_h_p_finance_2.png,SNDK,Yahoo,"24/7 Wall St. Analysts Eric Bleeker and Austin Smith are kicking the New Year off in style with 12 trends for AI investors to watch in 2026. Over the course of 12 videos, the two will share their thoughts on everything from the memory explosion to software stocks to robotics. In this video we'll discuss why memory stocks like SanDisk (Nasdaq: SNDK), Micron (Nasdaq: MU), and SK Hynix took off in 2025 and why their stocks are continuing to run in 2026. We'll also discuss some strategies for investing in the trend in 2026 such as buying semiconductor equipment companies in the space like Camtek (Nasdaq: CAMT).",https://finnhub.io/api/news?id=e97c6d2eddc4a732e0ae6690f687f95fdb524c865302b2d99e6b2f432bbbb8f6
company,1768402500,Can PC Refresh Cycle Drive Edge Segment Growth for SNDK Stock?,138113147,https://s.yimg.com/rz/stage/p/yahoo_finance_en-US_h_p_finance_2.png,SNDK,Yahoo,Windows 11 migration propels Sandisk's edge segment. Higher NAND content per PC and BiCS8 efficiency create sustained competitive positioning.,https://finnhub.io/api/news?id=e2231f5d8c953619f5abd9daf9bcd538d37cd435badb5aaf03ad0f1b8a18baed
company,1768398603,This Memory Stock Is Up 745% in the Past 6 Months. Is It Unstoppable?,138113290,https://s.yimg.com/rz/stage/p/yahoo_finance_en-US_h_p_finance_2.png,SNDK,Yahoo,Sandisk (SNDK) is trading at new all-time highs. Shares are up more than 745% over the past six months. SNDK maintains a 100% “Buy” technical opinion from Barchart. The stock is benefitting from what some analysts have called a “supply crunch” in memory products driven by artificial intelligence demand. Today’s...,https://finnhub.io/api/news?id=250ac4578b3223652a741053c0a53177d0f3d5aee5d3651e2e467b6a96d7edfd
company,1768391841,"Retail traders pile into memory chipmakers as AI boom squeezes supplies, lifts prices",138110540,https://s.yimg.com/rz/stage/p/yahoo_finance_en-US_h_p_finance_2.png,SNDK,Yahoo,"Retail investors ramped up buying of U.S. memory and data storage chipmakers in January, following 2025's strong momentum on expectations ​that booming artificial intelligence infrastructure demand will tighten supply and lift prices.  An acute ‌global shortage of memory chips is forcing AI and consumer-electronics companies to fight for dwindling supplies, which is ‌expected to support a multi-year backlog for memory chip makers.  Samsung's co-CEO TM Roh described the memory chip shortage as ""unprecedented"" in an interview with Reuters earlier this month, echoing rivals who have warned that constraints could persist for months, if not years, as the AI infrastructure race continues to ⁠hog supplies.",https://finnhub.io/api/news?id=b4233bfde33856f348dfe81bae5ff338affaa229057859a9cdae37e1c2e96203
company,1768386180,"Here’s how Sandisk’s stock can follow its 1,000% surge with even more gains",138212361,,SNDK,MarketWatch,"Here’s how Sandisk’s stock can follow its 1,000% surge with even more gains",https://finnhub.io/api/news?id=6e7983566dbda6ee7f99ef644603b654dff46113a1cf6eac45ec154ab39c76d5
