category,datetime,headline,id,image,related,source,summary,url
company,1768943938,"KeyCorp, facing activist investor heat, tweaks board lineup",138190482,https://s.yimg.com/rz/stage/p/yahoo_finance_en-US_h_p_finance_2.png,DG,Yahoo,"The Cleveland-based bank announced changes Tuesday to its board of directors, including the appointment of a new lead independent director. Last month, activist investor HoldCo Asset Management urged the bank's board to not re-nominate its longtime lead independent director.",https://finnhub.io/api/news?id=3d05dc749fe5efe2ceb33a590b288c836491a59c51ac87eba8656c2ba833f9d8
company,1768934309,Wednesday's big stock stories: What’s likely to move the market in the next trading session,138196782,https://image.cnbcfm.com/api/v1/image/107211826-16793389632023-03-20t185827z_1419079596_rc2sxz9ziduq_rtrmadp_0_global-banks-charles-schwab.jpeg?v=1725654542&w=1920&h=1080,DG,CNBC,Stocks sold off on Tuesday as President Trump stepped up his rhetoric around Greenland and tariffs. The three major averages saw their worst day since October.,https://finnhub.io/api/news?id=101285411a4072ddb0bbd02d0b64d357298d23480987983014998dc0de2da603
company,1768921020,Costco's Warehouse Expansion Strategy Fuels Long-Term Growth,138188468,https://s.yimg.com/rz/stage/p/yahoo_finance_en-US_h_p_finance_2.png,DG,Yahoo,"COST's warehouse expansion, faster new-store ramp-ups and creative site reuse signal long-term growth momentum.",https://finnhub.io/api/news?id=b011d3e47a7129e5e8306095ac5ac62c10efa4552b244ba376f7dbee4a7ffd6b
company,1768916580,5 Stocks With Strong Relative Price Strength to Start 2026,138187652,https://s.yimg.com/rz/stage/p/yahoo_finance_en-US_h_p_finance_2.png,DG,Yahoo,"MU, HTH, CASY, AEM and DG are showing strong relative price strength with rising earnings estimates to kick off 2026.",https://finnhub.io/api/news?id=0f1b97f736bb3db5fc9f9b1d0c8b05709961c8734d94834f73e133659aaf68c6
company,1768883655,1 Safe-and-Steady Stock with Exciting Potential and 2 We Find Risky,138186626,https://s.yimg.com/rz/stage/p/yahoo_finance_en-US_h_p_finance_2.png,DG,Yahoo,"Low-volatility stocks may offer stability, but that often comes at the cost of slower growth and the upside potential of more dynamic companies.",https://finnhub.io/api/news?id=638cc91e8ac96e260feca78f1cc9a502b0d21ee6f07fb46d4767833370e02fec
