category,datetime,headline,id,image,related,source,summary,url
company,1768949704,Meta Platforms (META) Dips More Than Broader Market: What You Should Know,138191515,https://s.yimg.com/rz/stage/p/yahoo_finance_en-US_h_p_finance_2.png,META,Yahoo,"In the closing of the recent trading day, Meta Platforms (META) stood at $604.12, denoting a -2.6% move from the preceding trading day.",https://finnhub.io/api/news?id=d2ba1f079c5cf5d8630c5b7add6cf0e00d5fda9d2611fdf6b4b5182cf423ca0e
company,1768948020,Dave Inc. Appoints Nima Khajehnouri to Board of Directors; Announces Board Leadership Transitions,138190933,https://s.yimg.com/rz/stage/p/yahoo_finance_en-US_h_p_finance_2.png,META,Yahoo,"LOS ANGELES, Jan. 20, 2026 (GLOBE NEWSWIRE) -- Dave Inc. (“Dave” or the “Company”) (Nasdaq: DAVE), one of the nation's leading neobanks, today announced that Nima Khajehnouri, a distinguished leader in artificial intelligence and data engineering, has joined its Board of Directors, effective immediately. Mr. Khajehnouri will serve as a member of the Company’s Audit Committee. Imran Khan, who has served on the Board since August 2023, is stepping down in conjunction with this appointment. Mr. Kha",https://finnhub.io/api/news?id=7df0dafa9718b2a13710f0f79c8eeb05b41a28814496e37edd98d6e445de3c62
company,1768944456,FTC Appeals Loss in Antitrust Case Against Meta,138190247,https://s.yimg.com/rz/stage/p/yahoo_finance_en-US_h_p_finance_2.png,META,Yahoo,The Federal Trade Commission said Tuesday it would appeal a court's decision last year dismissing its claims that Facebook-owner Meta Platforms built an illegal monopoly through the acquisitions of Instagram and WhatsApp.,https://finnhub.io/api/news?id=d27decae4e3adf22b3e5b42518c700edd04a6f554be3ea8f6d5e289277899a02
company,1768944000,Billionaire Chamath Palihapitiya Says This Is the Best Artificial Intelligence (AI) Investment for 2026 (Hint: It's Not Even a Stock),138190276,https://s.yimg.com/rz/stage/p/yahoo_finance_en-US_h_p_finance_2.png,META,Yahoo,"Chamath Palihapitiya, also known as the SPAC King, just revealed his top investment idea for 2026.",https://finnhub.io/api/news?id=b29ec784a4c3f37c2cb106841c58d5965ac9d713ff1a1f417bed693a767a7d0a
company,1768943738,How Zuckerberg went from renaming Meta to mass metaverse layoffs,138190277,https://s.yimg.com/rz/stage/p/yahoo_finance_en-US_h_p_finance_2.png,META,Yahoo,"Meta Platforms (META) laid off 1,500 workers from its reality segment last week, as reported by the Wall Street Journal. Yahoo Finance Tech Editor Dan Howley joins Market Domination to examine what went wrong with Mark Zuckerberg's Metaverse ambitions. To watch more expert insights and analysis on the latest market action, check out more Market Domination.",https://finnhub.io/api/news?id=a4a590c58dbdc892a6283202fe24668357ad8b62e080ad68f08426ec14fb556e
company,1768941954,"Himax, Broadcom, KLA Corporation, Impinj, and Qualcomm Stocks Trade Down, What You Need To Know",138190220,https://s.yimg.com/rz/stage/p/yahoo_finance_en-US_h_p_finance_2.png,META,Yahoo,"A number of stocks fell in the afternoon session after rising geopolitical tensions between the US and Europe over control of Greenland sparked a broad, risk-off mood in asset markets.",https://finnhub.io/api/news?id=8980c9e68049f1e662f00a4cc6e395d22bb2897998e4d0c2610fdcfa230580ca
company,1768941942,Why Nvidia (NVDA) Stock Is Down Today,138190221,https://s.yimg.com/rz/stage/p/yahoo_finance_en-US_h_p_finance_2.png,META,Yahoo,"Shares of leading designer of graphics chips Nvidia (NASDAQ:NVDA) fell 3.8% in the afternoon session after rising geopolitical tensions between the US and Europe over control of Greenland sparked a broad, risk-off mood in asset markets.",https://finnhub.io/api/news?id=a5de2fd0874cf4bdd2f4e4383a9211fbe56e32c16273e6fcf16bf902b1eb5607
company,1768941068,Bill Gates Recalls Warren Buffett Treating Him to McDonald's — Then Paying With Coupons,138190243,https://s.yimg.com/rz/stage/p/yahoo_finance_en-US_h_p_finance_2.png,META,Yahoo,"Being rich doesn't always mean acting rich. Just ask the two men who've taken turns wearing the crown of richest person alive. Bill Gates and Warren Buffett could afford just about any lunch they wanted—but when they grabbed McDonald's in Hong Kong, one of them reached into his pocket and pulled out coupons. Spoiler: it wasn't Bill Gates. Gates told the story himself in a letter he wrote to Buffett in 2017. ""Remember the laugh we had when we traveled together to Hong Kong and decided to get lunc",https://finnhub.io/api/news?id=937519356be747b8dbd68ea79434daed5193b55159eb1422537ad2a1031a14e8
company,1768937520,"2 Undervalued, High-Quality Companies to Buy in 2026 and Hold Forever",138189442,https://s.yimg.com/rz/stage/p/yahoo_finance_en-US_h_p_finance_2.png,META,Yahoo,Meta Platforms and Walt Disney are compelling buys for value investors in the new year.,https://finnhub.io/api/news?id=21cff0ff1269a264e74cbc69fc7d8e23b438fdda113538683960c068b816c4ae
company,1768934158,The Hidden Tradeoffs Between Dividend Income and Total Return,138189416,https://s.yimg.com/rz/stage/p/yahoo_finance_en-US_h_p_finance_2.png,META,Yahoo,"Dividend investing and total return investing are often presented as competing philosophies, each with its own set of loyal advocates who dismiss the other as missing the point. Dividend investors are going to argue that cash flow matters more than any kind of paper gains. Separately, total return investors will counter that focusing on yield ... The Hidden Tradeoffs Between Dividend Income and Total Return",https://finnhub.io/api/news?id=230f2e5d04de38dca8dadfe7e7c1e4721de7a2efa940e542b292a83d32cdacd3
company,1768933263,"Nvidia, Tesla, and Amazon Lead Tech Stocks Fall on Tuesday",138189399,https://s.yimg.com/rz/stage/p/yahoo_finance_en-US_h_p_finance_2.png,META,Yahoo,AI Stocks Retreat With the Market. What Tariffs and Earnings Mean Next,https://finnhub.io/api/news?id=a78168db400c129822229da1f31addee901fab0a3e903d434b40387faa5754e3
company,1768933181,Why Advanced Micro Devices Shares Are Climbing Today,138189427,https://s.yimg.com/rz/stage/p/yahoo_finance_en-US_h_p_finance_2.png,META,Yahoo,Meta Platforms Chooses AMD Over Google for AI Deployment,https://finnhub.io/api/news?id=4b1fb039ee4717422b22a8127809bd4500c7557b043b962ffd7251687293378c
company,1768933143,Meta's Reels Push Hits Critical Scale,138189446,https://s.yimg.com/rz/stage/p/yahoo_finance_en-US_h_p_finance_2.png,META,Yahoo,Meta's video bet turns into real revenue,https://finnhub.io/api/news?id=55a292531aa3a5444982077b406b1a8bc8b3fa2506da245333036a8ae88f3df9
company,1768930921,Correction Warning: The Market Is Getting Too Risky,138190699,https://static.seekingalpha.com/cdn/s3/uploads/getty_images/2229006239/image_2229006239.jpg?io=getty-c-w1536,META,SeekingAlpha,The market is flashing a warning that most investors are ignoring. Learn more about SP500 stock here.,https://finnhub.io/api/news?id=3a99c96807857a1765de4bdd544b91f89a4adf4cf401db44140c9a680f22a4e8
company,1768930268,Gavin Newsom Built His Political Career With Billionaire Backing — Now California Is Preparing To Hit That Same Wealth Class With A Massive New Tax,138188407,https://s.yimg.com/rz/stage/p/yahoo_finance_en-US_h_p_finance_2.png,META,Yahoo,"Gavin Newsom's (D-Calif.) rise from a Getty-backed entrepreneur to California governor now collides with a proposed billionaire wealth tax he calls ""bad economics"" and has vowed to defeat. A Governor Shaped By Wealth — And By Struggle Newsom's first major business success came in the early 1990s with PlumpJack, a San Francisco wine shop launched with financial backing from Gordon Getty, an oil heir and longtime family friend. Getty and his family later invested in Newsom's expanding portfolio of",https://finnhub.io/api/news?id=867ab50b3141f791c191546862c61d125ebb492990ad253e0da8a4ab5f6cac5b
company,1768927702,Why Nebius Stock Is Tumbling Today,138188401,https://s.yimg.com/rz/stage/p/yahoo_finance_en-US_h_p_finance_2.png,META,Yahoo,NBIS Stock Reacts to Global Tariff News Ahead of Earnings,https://finnhub.io/api/news?id=f0fe4b36f081a632a89cfef7ca8806ceeeeb42b3b2d74585a656c92c555d3205
company,1768927200,Amazon Drops Amid Declines Across ‘Mag 7’. What’s Hitting Big Tech Stocks.,138232130,,META,MarketWatch,Amazon Drops Amid Declines Across ‘Mag 7’. What’s Hitting Big Tech Stocks.,https://finnhub.io/api/news?id=8666484396889a4323c696adafe204e44e8800ce83ca6b4d0a6ed4d512fca542
company,1768926960,Nvidia Stock Falls. ‘The Honeymoon Is Over for AI.’,138232249,,META,MarketWatch,Nvidia Stock Falls. ‘The Honeymoon Is Over for AI.’,https://finnhub.io/api/news?id=27caf298d20b656801539ad7bc4b029783a9c57091351fa88b2929e67297299e
company,1768926568,"Nvidia, Tesla lead tech stocks lower as Trump trade war threats rattle market",138188388,https://s.yimg.com/rz/stage/p/yahoo_finance_en-US_h_p_finance_2.png,META,Yahoo,Tech stocks led broader market declines as investors grew skittish over geopolitical tensions and fears of an AI bubble continued.,https://finnhub.io/api/news?id=59c6ec870b438f56459c2c7c5aae0d917b5f343f4f616b1fe39ddab671e481f7
company,1768923529,"Apple will ship millions of $2,000 foldable iPhones this year: Citi",138187342,https://s.yimg.com/rz/stage/p/yahoo_finance_en-US_h_p_finance_2.png,META,Yahoo,Citi thinks Apple will be all in on a foldable iPhone — and soon.,https://finnhub.io/api/news?id=a398907bcc5b5c7ed9f9164353c32889996c7d951b4b0e9e6f43dec23a3f4224
company,1768922660,America’s Biggest Tech Stocks Lead Tuesday’s Sell-Off as Trump's Greenland Rhetoric Rattles Markets,138188391,https://s.yimg.com/rz/stage/p/yahoo_finance_en-US_h_p_finance_2.png,META,Yahoo,Big tech stocks led markets lower Tuesday amid a broad market sell-off after Trump over the weekend threatened new tariffs on a number of European countries unless the U.S. is allowed to acquire Greenland.,https://finnhub.io/api/news?id=d560f79df9124ed6f69f01f886e86105a02bcc208699123747a28bc7cc6ca310
company,1768922319,AI startup Humans& raises $480 million at $4.5 billion valuation in seed round,138187345,https://s.yimg.com/rz/stage/p/yahoo_finance_en-US_h_p_finance_2.png,META,Yahoo,"AI startup Humans&, founded by former OpenAI, Alphabet and xAI researchers, has raised $480 million ​in a seed financing round, which values the company ‌at $4.48 billion, it said on Tuesday.  The outsized seed round highlights intense investor interest ‌in next-generation AI labs founded by veteran researchers as companies race to build systems that go beyond chatbots and agentic tools.  The round was led by Ron Conway's SV Angel and co-founder Georges Harik, ⁠while Nvidia, Jeff Bezos, ‌Alphabet's VC arm, GV, among other venture capital investors, also participated.",https://finnhub.io/api/news?id=84f41c6cabc450f15bae45b007f45f3d0d9e7acd24206dd3f8c0773cb12342d8
company,1768921620,"Prediction: Nvidia Will Overtake Alphabet, Apple, and Microsoft to Become the World's Most Profitable Company by the End of 2027. Here's Why the ""Magnificent Seven"" Stock Is a Buy in January.",138187347,https://s.yimg.com/rz/stage/p/yahoo_finance_en-US_h_p_finance_2.png,META,Yahoo,"Nvidia is already the most valuable company in the world, but it could soon become the most profitable, too.",https://finnhub.io/api/news?id=79254c7528efcdebbfa8af7015ab691e4b22b88ebc8287fcda235c26bafe7b9e
company,1768921538,Meta’s Nicola Mendelsohn on AI race and Australia’s social media ban,138196753,https://image.cnbcfm.com/api/v1/image/108254532-1768938374678-1768937899910-TANIABRYERNICOLAMENDELSOHNFULLIVFINAL.jpg?v=1768938377&w=1920&h=1080,META,CNBC,"The Head of Global Business Group sits down with CNBC’s Tania Bryer at the World Economic Forum in Davos to talk about how the tech giant is ‘all-in’ on AI, the latest on the metaverse and her thoughts on the social media ban for teens.",https://finnhub.io/api/news?id=c27b46b5eea917f1774c0adb5c02d2350c6ac42f8cb0899e8e78bbedafc695bb
company,1768919285,Meta Accused of Ignoring Illegal Gambling Ads in the U.K.,138187415,https://s.yimg.com/rz/stage/p/yahoo_finance_en-US_h_p_finance_2.png,META,Yahoo,Regulator says the tech giant failed to act on unlicensed casino promotions across Facebook and Instagram.,https://finnhub.io/api/news?id=268aeb7ce113e6671abdab6a4b7e6fba1c518615f611d1f64c2efc85181d22fa
company,1768918600,Meta (META) Slid Despite Reporting Strong Earnings,138187416,https://s.yimg.com/rz/stage/p/yahoo_finance_en-US_h_p_finance_2.png,META,Yahoo,"Fred Alger Management, an investment management company, released its “Alger Spectra Fund” fourth-quarter 2025 investor letter. A copy of the letter can be downloaded here. The US equity market ended the fourth quarter on a strong note, with the S&P surging 2.7%, maintaining its steady upward momentum. Investors’ optimism was supported by better-than-expected corporate earnings, […]",https://finnhub.io/api/news?id=a8544fd384574662b69769de5fef7721f8d2143db146af638ce79974465d8eb8
company,1768917898,"Vistra Stock Can Gain 78%, Says Pro. Here’s What it’ll Take.",138187417,https://s.yimg.com/rz/stage/p/yahoo_finance_en-US_h_p_finance_2.png,META,Yahoo,"Shares of Vistra (NYSE:VST) are going through a bit of a slump, now down around 24% from its peak. Undoubtedly, the bear seems firmly in control, especially as the S&P chops around following fears surrounding Trump’s new slate of tariffs over Greenland. Undoubtedly, it’s hard to tell if we’re at the start of a vicious ... Vistra Stock Can Gain 78%, Says Pro. Here’s What it’ll Take.",https://finnhub.io/api/news?id=6b5ef88cb885148439388848aaece85457a9602408ac74c69bdd5119ed72794a
company,1768917841,Meta Platforms: From Heavy AI CapEx to 2026 ROI?,138187418,https://s.yimg.com/rz/stage/p/yahoo_finance_en-US_h_p_finance_2.png,META,Yahoo,"Breaking down Meta's AI investment cycle, advertising engine, and what must go right for the stock.",https://finnhub.io/api/news?id=0f61ab875bc8ebd7f6bcdd744d13817bc2556f7efe29e296f61099a4b19bb49a
company,1768917600,Invoca Adds New Integrations with Reddit Ads and LinkedIn Ads to Power Better Revenue Outcomes,138187419,https://s.yimg.com/rz/stage/p/yahoo_finance_en-US_h_p_finance_2.png,META,Yahoo,"Invoca, the leader in revenue execution, today announced new integrations with Reddit Ads and LinkedIn Ads, expanding its industry-leading solution for social advertising. With these new integrations, marketers and their agency partners can now connect how their Reddit and LinkedIn ads drive leads, conversions, and revenue at their contact centers and business locations.",https://finnhub.io/api/news?id=8ec2c320bd06eda968cfa3533dafe2eaa82d7914ad09c800da554784802abe59
company,1768917498,"Profit Alert: Netflix Goes All-Cash, Microsoft Cracks Healthcare AI, and How You Win",138187356,https://s.yimg.com/rz/stage/p/yahoo_finance_en-US_h_p_finance_2.png,META,Yahoo,"Tuesday morning brings five major stories, and five ways to profit. Here’s what happened and how you make money from it. 1. Netflix Goes All-Cash: Warner Bros Deal Gets Real Netflix revised its Warner Bros. Discovery bid to $83 billion all-cash, ditching the cash-and-stock structure. The move simplifies shareholder approval and signals Netflix means business: ... Profit Alert: Netflix Goes All-Cash, Microsoft Cracks Healthcare AI, and How You Win",https://finnhub.io/api/news?id=b9bc3e5c7fb2153a1060d937a3a0e97c1cd61b2f7553646dd696e884fd3afd59
company,1768915020,Meta (META) Proceeded to Compound on Its 13%-15% Growth Trajectory,138186392,https://s.yimg.com/rz/stage/p/yahoo_finance_en-US_h_p_finance_2.png,META,Yahoo,"Mar Vista Investment Partners, LLC, an investment management company, released its “Mar Vista U.S. Quality Premier Strategy” fourth-quarter 2025 investor letter. A copy of the letter can be downloaded here. US equities experienced strong momentum in 2025 and marked their third consecutive year of double-digit gains. The market witnessed one of the fastest recoveries following […]",https://finnhub.io/api/news?id=2a851580efbdcd57fd10ed3c1736154f12833bb9997d11710f6d2f2460b47090
company,1768914315,Will Meta’s AI Infrastructure Pivot and Dina Powell McCormick’s Role Change Meta Platforms' (META) Narrative,138186393,https://s.yimg.com/rz/stage/p/yahoo_finance_en-US_h_p_finance_2.png,META,Yahoo,"Earlier this month, Meta Platforms appointed Dina Powell McCormick as president and vice-chairman to help steer overall strategy, particularly around AI infrastructure, while simultaneously cutting Reality Labs jobs, closing VR studios, and doubling down on AI-enabled Ray-Ban smart glasses and large-scale compute and power commitments. Together, these moves point to Meta reshaping itself from a metaverse-heavy social media company into an AI and infrastructure powerhouse built around its...",https://finnhub.io/api/news?id=d4cf062fd97b6ebc042295b64dc913acea1db852e9d24bb3f8e382c90c2cf54e
company,1768914075,"OpenAI Accuses Elon Musk Of 'Cherry-Picking' Evidence In Lawsuit, Says He Backed For-Profit Shift And Quit After Failing To Secure Control",138186359,https://s.yimg.com/rz/stage/p/yahoo_finance_en-US_h_p_finance_2.png,META,Yahoo,"On Friday, OpenAI stated that Tesla Inc. (NASDAQ:TSLA) and xAI CEO Elon Musk initially supported a for-profit structure but exited the company after negotiations broke down over control, rather than mission. OpenAI Says Musk Misrepresented Internal Records OpenAI pushed back against Musk's lawsuit, accusing the billionaire of selectively using internal documents to misrepresent the company's origins and its shift to a for-profit structure. In a detailed blog post, OpenAI said Musk agreed as earl",https://finnhub.io/api/news?id=2f4c882a0e5c6c0f46cca8789f96cb93bf84bb10db20e70143d534b7616b89d0
company,1768913949,Most of Instagram ads now run on Reels,138186395,https://s.yimg.com/rz/stage/p/yahoo_finance_en-US_h_p_finance_2.png,META,Yahoo,"Investing.com -- Meta’s Instagram saw more than half of all its advertisements run on its short-form video Reels format in 2025, up from 35% in 2024, according to data from market intelligence firm Sensor Tower.",https://finnhub.io/api/news?id=c314e97547e82f5b30166a9669c652a7ac872997c94d525238581884a3f39da2
company,1768913880,Alger Capital Appreciation Fund Q4 2025 Portfolio Update,138188740,https://static.seekingalpha.com/cdn/s3/uploads/getty_images/2236769794/image_2236769794.jpg?io=getty-c-w1536,META,SeekingAlpha,Class A shares of the Alger Capital Appreciation Fund underperformed the Russell 1000 Growth Index during the fourth quarter of 2025. Read more here.,https://finnhub.io/api/news?id=089b3f54ac5726428c6a5d42f52b7327d157d958c7879360fdf08b63727400b5
company,1768912805,"Stocks Fall as Investors Assess Trump's Tariff Announcement, Await Earnings",138186326,https://s.yimg.com/rz/stage/p/yahoo_finance_en-US_h_p_finance_2.png,META,Yahoo,The benchmark US stock measures fell before the opening bell Tuesday amid renewed trade tensions bet,https://finnhub.io/api/news?id=2dd943ff2f5cb942181b39b369b69c61c5b2ee2140031994bf09e2d8ec2bf510
company,1768912271,Steve Jobs' 1976 Paper Trail: Guess How Much the First-Ever Apple Check and His Boyhood Desk Are Fetching at 50 Years,138186342,https://s.yimg.com/rz/stage/p/yahoo_finance_en-US_h_p_finance_2.png,META,Yahoo,"Some of the rarest memorabilia from the early days of Apple Inc (NASDAQ:AAPL) and personal items belonging to co-founder and former CEO Steve Jobs are up for auction to celebrate the company's 50th anniversary. Just like other past Apple and Jobs memorabilia that has come up for sale, these rare pieces are generating strong interest and bids. Apple 50th Anniversary Auction RR Auctions is hosting an auction with top Apple memorabilia items and like past auctions in recent years, early checks in t",https://finnhub.io/api/news?id=e0569c1071efd9283ff3ce0595d22d4557ed02568fe43eccacf9ca44f7a1a49c
company,1768907403,Netflix Results to Shine Light on Fundamentals Amid Warner Fight,138185679,https://s.yimg.com/rz/stage/p/yahoo_finance_en-US_h_p_finance_2.png,META,Yahoo,"Investors have been concerned about Netflix’s slowing flow of subscribers and the sustainability of its growth.  The issue sparked the worst selloff in the stock in more than three years after the company’s previous earnings report on Oct. 21.  At the time, Netflix was seen as a possible suitor for Warner Bros. Now that the deal is on the table at $82.7 billion, some investors are on edge and all the risks are amplified.",https://finnhub.io/api/news?id=c5bde1bf11958e498d6afa67d0695eee9cb75f0c910809f912e0f0e304fad933
company,1768910467,'Nobody Will Remember Tesla Ever Made A Car:' Tech Investor Says Optimus Could Become Elon Musk's Biggest Legacy,138186363,https://s.yimg.com/rz/stage/p/yahoo_finance_en-US_h_p_finance_2.png,META,Yahoo,"Jason Calacanis, tech investor and podcaster, said Tesla Inc.‘s (NASDAQ:TSLA) humanoid robot Optimus could overshadow the company's automotive legacy after a visit to its robotics facility. Visit To Tesla Optimus Lab On Thursday's episode of the All-In Podcast, Calacanis said he visited Tesla's Optimus lab with CEO Elon Musk two Sundays earlier at 10 a.m., where he saw Optimus 3 and watched teams of engineers at work. He made the remarks while speaking with Bob Sternfels, global managing partner",https://finnhub.io/api/news?id=a82f029c7cb66ea5042691d5b6750edf5e6a70616992f049c51f50ce0d3d718d
company,1768910400,"Why Power, Not Capital Will Decide Who Wins the AI Wars",138186332,https://s.yimg.com/rz/stage/p/yahoo_finance_en-US_h_p_finance_2.png,META,Yahoo,"As electricity becomes scarce, AI and crypto are turning into power businesses. Control over energy infrastructure is emerging as the decisive advantage in the race to scale",https://finnhub.io/api/news?id=b71dc738f0315f78f285010fa064f4ae14acd4a08cd073bb99cb2c40e131ad30
company,1768910400,Best AI Stocks to Buy and Hold: Micron and Arista Networks,138186400,https://s.yimg.com/rz/stage/p/yahoo_finance_en-US_h_p_finance_2.png,META,Yahoo,"Let's dive into two of the best AI-boosted technology stocks to consider buying right now and holding for the long haul: Micron Technology, Inc. (MU) and Arista Networks, Inc. (ANET)",https://finnhub.io/api/news?id=e995b50d45fcea456ab9900b4c18df418b7a93dc65155ff77b87df01cf85dbc5
company,1768909203,These Top 'AI Stocks' Are Leading the Semiconductor Boom,138185639,https://s.yimg.com/rz/stage/p/yahoo_finance_en-US_h_p_finance_2.png,META,Yahoo,"NVIDIA, AMD, and Broadcom Lead the AI Semiconductor Boom",https://finnhub.io/api/news?id=6f51a8c5fb91fdf1b8cdbca097151a204ac35865876dbd3599f7b269a386b776
company,1768908960,Amazon Leads Declines Across the ‘Mag 7’. What’s Hitting Big Tech Stocks.,138186336,https://s.yimg.com/rz/stage/p/yahoo_finance_en-US_h_p_finance_2.png,META,Yahoo,The group of large technology companies were all falling as investors fled perceived riskier assets after President Trump ramped up tariff threats against a number of European countries in his push for U.S. ownership of Greenland.  Amazon was down 3.1% in premarket trading.  The high valuations of technology companies make them vulnerable to sharp drops as investors seek haven assets.,https://finnhub.io/api/news?id=31a59b7bed1b152d7a16063b1e4c7c55c45a81da339a5a125cbdaa981d32238f
company,1768906862,"Google Has A Huge Edge Over OpenAI, Microsoft, Says Cloudflare CEO— And It All Comes Down To Data: 'Whoever Has The Most...Wins'",138185647,https://s.yimg.com/rz/stage/p/yahoo_finance_en-US_h_p_finance_2.png,META,Yahoo,"Cloudflare Inc. (NYSE:NET) co-founder and CEO and Matthew Prince said in a recent interview that Google, a unit of Alphabet Inc. (NASDAQ:GOOG) (NASDAQ:GOOGL), allows its web crawlers to access significantly more data than competitors amid debates over AI training limits. Google’s Data Access Advantage Prince, while speaking with John Coogan and Jordi Hays on a TBPN podcast released on Friday, disclosed that Googlebot sees 3.2 times more web pages than OpenAI. “For every one page that OpenAI sees",https://finnhub.io/api/news?id=01a7986c7792f39ca041a544196a8c41bd95c153b2d1b4ac66d6599e8a6cd805
company,1768906860,Why Alphabet and Meta investors shouldn’t sweat ChatGPT’s ad launch — for now,138232212,,META,MarketWatch,Why Alphabet and Meta investors shouldn’t sweat ChatGPT’s ad launch — for now,https://finnhub.io/api/news?id=b666243d226e356987a51cf3ec0863e5cd62e283febac0c1384e924bd764ef1f
company,1768899098,Nebius: When Betting The Farm Leads To A Surge,138186816,https://static.seekingalpha.com/cdn/s3/uploads/getty_images/2230807736/image_2230807736.jpg?io=getty-c-w1536,META,SeekingAlpha,"Nebius Group N.V. stock: Buy thesis on booming AI datacenter demand and $20B+ backlog, plus valuation and execution risks. Click for this NBIS update.",https://finnhub.io/api/news?id=e6d669098c2c3a90945571fb1ab29fefbe12a35c20fd2b93cf80a0cf4cb3d6f0
company,1768898903,Meta's Joel Kaplan on AI investments: Our ambition is to build 'personal superintelligence',138188073,https://image.cnbcfm.com/api/v1/image/108254215-17689163301768916327-43591520159-1080pnbcnews.jpg?v=1768916329&w=1920&h=1080,META,CNBC,"Joel Kaplan, Meta chief global affairs officer joins 'Squawk Box' to discuss the company's $600 billion investment towards AI infrastructure and jobs in the U.S., Meta's superintelligence ambitions, the company's Llama AI model, and more.",https://finnhub.io/api/news?id=8968dcf77169ffe1e5130fc91368d30f6821d72b830f6182b7d41ebb1a1b4185
company,1768894726,Tech stocks lead Wall Street sell-off as tensions over Greenland escalate,138188026,https://image.cnbcfm.com/api/v1/image/108253581-1768577462840-Traders-Photo-20260115-KK-PRESS-006.jpg?v=1768916626&w=1920&h=1080,META,CNBC,Tech stocks led declines Tuesday as renewed trade rhetoric tied to Greenland fueled a risk-off move across U.S. markets.,https://finnhub.io/api/news?id=70bb7dae8646489ba8acdf0d9745ddf33bbd9f083fca9c896d7fad65b2a1f34b
