category,datetime,headline,id,image,related,source,summary,url
company,1768892401,"Most of Instagram's ads ran on Reels in 2025, data shows",138188064,https://image.cnbcfm.com/api/v1/image/108217760-1761656514236-gettyimages-2239280474-cpu01822_embqtuwa.jpeg?v=1768922783&w=1920&h=1080,META,CNBC,"More than half of all ads on Meta's Instagram ran in the service's short-form video Reels product in 2025, up from 35% in 2024, according to Sensor Tower.",https://finnhub.io/api/news?id=ca5221779c7d8de2ed2409d2ab191eaca3a3e0c83075383ff6e13256152aa9ae
company,1768891630,Atlassian: AI Fears Are Overblown,138185738,https://static.seekingalpha.com/cdn/s3/uploads/getty_images/2248780587/image_2248780587.jpg?io=getty-c-w1536,META,SeekingAlpha,"Atlassian (TEAM) stock is down 25% on AI fearsâsee why its moat, switching costs, and 30% growth outlook may signal upside.",https://finnhub.io/api/news?id=93ffc2978bea5ddf29ed30e5a97e87fb21db72e0d394e42c55b775917720b7ca
company,1768883873,3 Quality Compounders to Research Further,138185019,https://s.yimg.com/rz/stage/p/yahoo_finance_en-US_h_p_finance_2.png,META,Yahoo,"Quality compounders are flywheels. Said differently, they’re businesses that generate heaps of profits and consistently reinvest them to produce even more profits. Rinse and repeat.",https://finnhub.io/api/news?id=5ff77c67836ad3331b14d556227f583f36805a53c54fdaf896179443bb00f656
company,1768882554,India's Lodha Developers to invest $11 billion in 2.5 GW data centre park in Maharashtra,138183406,https://s.yimg.com/rz/stage/p/yahoo_finance_en-US_h_p_finance_2.png,META,Yahoo,"BENGALURU, Jan 20 (Reuters) - India's Lodha Developers said on Tuesday that it will invest an additional 1 trillion rupees ($11 billion) to build a 2.5-gigawatt data centre park in the state of",https://finnhub.io/api/news?id=a7a917a7abef0ec469a7c8ad24e194d5effd5ce66a67ff8093c0d59f3ef1a83d
company,1768878934,Oklo (OKLO) Is Down 7.4% After Meta-Backed Nuclear Campus And DOE Isotope Deal News,138182462,https://s.yimg.com/rz/stage/p/yahoo_finance_en-US_h_p_finance_2.png,META,Yahoo,"Earlier in January 2026, Oklo Inc. announced an agreement with Meta Platforms to advance a 1.2 GW Aurora nuclear power campus in Pike County, Ohio, including mechanisms for Meta to prepay for power and fund development that could support regional grid reliability and local jobs. In parallel, Oklo signed a U.S. Department of Energy Other Transaction Agreement to execute a radioisotope pilot plant via its Atomic Alchemy subsidiary, aiming to build domestic production of medical and research...",https://finnhub.io/api/news?id=bec43a0df80263d384bcd8e6d0f55cf496137fe956a7a8949146fc1ba86e31cc
company,1768878804,A Look At Meta Platforms (META) Valuation As It Pivots From Metaverse To AI Smart Glasses,138182463,https://s.yimg.com/rz/stage/p/yahoo_finance_en-US_h_p_finance_2.png,META,Yahoo,"Meta Platforms (META) is reworking its long term story by cutting back on metaverse projects, redirecting capital into AI infrastructure and smart glasses, and bringing Dina Powell McCormick into a senior AI focused leadership role. See our latest analysis for Meta Platforms. Those AI heavy announcements are landing against a softer share price backdrop, with a 90 day share price return of 15.41% and a year to date share price return of 4.64%. This comes despite a 1 year total shareholder...",https://finnhub.io/api/news?id=09d537c14648b1198490544ad005b60688b95a87f500352972043c30cf5711b6
company,1768876263,JPMorgan CEO Jamie Dimon Visits Palantir — Wall Street Meets The War Room,138182457,https://s.yimg.com/rz/stage/p/yahoo_finance_en-US_h_p_finance_2.png,META,Yahoo,"JPMorgan Chase & Co. (NYSE:JPM) CEO Jamie Dimon visited Palantir Technologies' (NASDAQ:PLTR) office in Washington, D.C. on Thursday. Although the exact nature of the engagement is unknown, Palantir acknowledged Dimon’s visit and the ensuing discussion in a social media post. ""Thank you @jpmorgan CEO Jamie Dimon for stopping by our DC office earlier today, and for the discussion with @ChairmanG,"" Palantir said in the post that also highlighted photos of Dimon and Palantir's head of defense Mike G",https://finnhub.io/api/news?id=e9870cd0cba5c6ede01608688e4c85ac07d39f335ad80ab5c3ae89e045d07052
company,1768872600,Argo Marketing Agreement,138181928,https://s.yimg.com/rz/stage/p/yahoo_finance_en-US_h_p_finance_2.png,META,Yahoo,"Toronto, Ontario--(Newsfile Corp. - January 19, 2026) - Argo Gold Inc. (CSE: ARQ) (OTC Pink: ARBTF) (XFRA: A2ASDS) (XSTU: A2ASDS) (XBER: A2ASDS) (""Argo"" or the ""Company"") has entered into an advertising/e-marketing contract with 1001103323 Ontario Inc. to provide marketing services, including social media engagement through X (formerly Twitter), Facebook, YouTube and Reddit. The initial term of the agreement is 60 days, starting on January 19, 2026, and may be renewed with mutual written...",https://finnhub.io/api/news?id=918ab255bc10523faa3e021616d1acdccc0f9f162741d069c91c3f4702333d9b
company,1768869900,"Meta, Maxim's Group, MEDILASE, and Omnichat Showcased Strategic Use of WhatsApp for Social CRM and Conversational AI",138181929,https://s.yimg.com/rz/stage/p/yahoo_finance_en-US_h_p_finance_2.png,META,Yahoo,"Omnichat, a leading omnichannel AI customer experience platform offering conversational commerce solutions, recently hosted a highly scalable conference titled ""Social CRM and AI"". Industry experts from the global social media giant Meta, well-known F&B group Maxim's Hong Kong and the pioneering medical aesthetic provider MEDILASE, shared insights on the evolution of WhatsApp into a sophisticated platform for social CRM and conversational commerce, designed to deliver more personalised and conne",https://finnhub.io/api/news?id=fac7cb9208c8b2a33c1d9c89ca26ca6fb8ba1e009f2b70dd402c68374e94c924
company,1768869532,"Meta Is Investing Aggressively, And The Payoff Is Still Unclear",138183367,https://static.seekingalpha.com/cdn/s3/uploads/getty_images/2188450078/image_2188450078.jpg?io=getty-c-w1536,META,SeekingAlpha,"Meta Platforms' core ad business is robust, but Reality Labs continues to drag on profitability. Read why it makes sense to wait on META stock for now.",https://finnhub.io/api/news?id=481a86ca8941e5dc3434048b6f92deb69cbc37fd3436ad3a633d8a4f4a9e54b9
