category,datetime,headline,id,image,related,source,summary,url
company,1768926780,Philip Morris International Inc. stock underperforms Tuesday when compared to competitors,138208304,,PM,MarketWatch,Philip Morris International Inc. stock underperforms Tuesday when compared to competitors,https://finnhub.io/api/news?id=8065ecbcc40ded172a58ffb737c7f710a5a9e44572a4067223a800242ee98003
company,1768920419,Jefferies Downgrades Philip Morris International (PM),138187310,,PM,Fintel,,https://finnhub.io/api/news?id=f5992c79998c3f6421798c0d357d90c011c204b045faee39d85b471f39c2b721
company,1768913707,"Here Are Tuesday’s Top Wall Street Analyst Research Calls: Chevron, Domino’s Pizza, Doximity, Exact Sciences, Intel, NetApp, StubHub, Toast, and More",138186659,https://s.yimg.com/rz/stage/p/yahoo_finance_en-US_h_p_finance_2.png,PM,Yahoo,"Pre-Market Stock Futures: Futures are trading dramatically lower as we start the holiday-shortened trading week, following yesterday’s MLK remembrance day. The futures downdraft this morning is being attributed to President Trump’s threat to raise tariffs significantly over Greenland. Last Friday, the market closed unchanged primarily after a sizable options expiration that boosted trading volume throughout ... Here Are Tuesday’s Top Wall Street Analyst Research Calls: Chevron, Domino’s Pizza, D",https://finnhub.io/api/news?id=70ce834b3ffb6e351fab7859604d3096c8a7cfe44fe0a6c6c1bef19be1414d2c
company,1768906849,"Philip Morris International Insiders Sell US$25m Of Stock, Possibly Signalling Caution",138185704,https://s.yimg.com/rz/stage/p/yahoo_finance_en-US_h_p_finance_2.png,PM,Yahoo,"Over the past year, many Philip Morris International Inc. ( NYSE:PM ) insiders sold a significant stake in the company...",https://finnhub.io/api/news?id=b12e3dd4e045996c4f02bb8654a3e76745d8c1f1d397e9c29e6ad862b72c1735
company,1768903380,Philip Morris International Opens Dialogue on the Future of Human Cognition as a Defining Frontier in the Age of AI,138185705,https://s.yimg.com/rz/stage/p/yahoo_finance_en-US_h_p_finance_2.png,PM,Yahoo,"STAMFORD, CT, January 20, 2026--Philip Morris International Inc. (NYSE: PM) today released a new white paper, ""Human Cognition: The Next Frontier?"", inviting leaders across business, policy, and academia to join a global conversation on the evolving role of human cognition as artificial intelligence transforms work, society, and the economy.",https://finnhub.io/api/news?id=351ffd2ffefd133da9d8b3c744a581f2ab1eab69a8ac6125b2fb3508bb1c6714
