category,datetime,headline,id,image,related,source,summary,url
company,1768927917,What This $2M Options Bet on Corporate Bonds is Saying About the 10-Year Yield Curve,138190291,https://s.yimg.com/rz/stage/p/yahoo_finance_en-US_h_p_finance_2.png,UNH,Yahoo,Our top technical strategist takes a closer look at a big-money straddle trade that crossed the tape on LQD during Friday’s session.,https://finnhub.io/api/news?id=b5f8b5300586100fccd25b9d2eef5007dceeecfea0fd14132a58e96723d08472
company,1768920300,UNH vs. MOH: Which Insurer Can Better Navigate Current Volatility?,138188505,https://s.yimg.com/rz/stage/p/yahoo_finance_en-US_h_p_finance_2.png,UNH,Yahoo,UnitedHealth's scale and Optum diversification give it an edge over Molina as health insurers face policy-driven volatility and rising cost pressures.,https://finnhub.io/api/news?id=bc7b1e98f134fb54a26b4bd81f344d77ca1f8dfeefc1728b280f2cad74561010
company,1768914000,Alignment Health Appoints Adnan Mansour as Chief Digital Officer to Accelerate AI-Driven Growth and Technology Leadership,138186461,https://s.yimg.com/rz/stage/p/yahoo_finance_en-US_h_p_finance_2.png,UNH,Yahoo,"Industry veteran brings decades of experience in artificial intelligence, digital transformation and large-scale technology operations to support Alignment’s next phase of growthORANGE, Calif., Jan. 20, 2026 (GLOBE NEWSWIRE) -- Alignment Health, an award-winning Medicare Advantage (MA) company, today announced the appointment of Adnan Mansour as chief digital officer, an executive leadership role that unifies the company’s technology and information functions to drive scalable growth and continu",https://finnhub.io/api/news?id=5111bda3dea1fff6dc0c2320d2d416e7fd263548145c8d488a64f951141303c3
company,1768912790,CURE: Benefits And Caveats Of The Leveraged Healthcare ETF,138188296,https://static.seekingalpha.com/cdn/s3/uploads/getty_images/1351287260/image_1351287260.jpg?io=getty-c-w1536,UNH,SeekingAlpha,"Direxion CURE ETF offers 3x daily healthcare exposureâlearn risks like volatility decay and drift, plus tactical trading tips using XLV/index signals.",https://finnhub.io/api/news?id=ca3612c5b4891b901620bb4fdb6c38f001242d9ac0824dccbf1890b2577a24b9
company,1768893489,"Undercovered Dozen: Dell, Brighthouse, UnitedHealth, And More",138185952,,UNH,SeekingAlpha,,https://finnhub.io/api/news?id=48c7206d45a323d5199982e1412cd3846fae812cfa7c1456024d77fae27b83f5
