category,datetime,headline,id,image,related,source,summary,url
company,1768678380,"BlackRock sets record amid strategic shifts, job cuts",138164108,https://s.yimg.com/rz/stage/p/yahoo_finance_en-US_h_p_finance_2.png,BLK,Yahoo,"Following a whirlwind week, one of the world’s largest asset managers, BlackRock, posted its fourth quarter and full year 2025 earnings report on Thursday, Jan 15. From strategic job cuts to a record Asset Under Management (AUM), the investment firm navigated a period of intense activity this week. ...",https://finnhub.io/api/news?id=7fa5a63a1a57986c12e4dce877a41159c10b2164caf9b886be5f7a57eb42b5f9
company,1768669200,How tokenized assets could become a $400 billion market in 2026,138164082,https://s.yimg.com/rz/stage/p/yahoo_finance_en-US_h_p_finance_2.png,BLK,Yahoo,"After stablecoins proved product-market fit, crypto founders and executives say 2026 is when banks and asset managers will push tokenized assets into mainstream markets.",https://finnhub.io/api/news?id=510aab4ebecb3ab5303996ae14a0691169fe2adc66bf25cf202a0a70987e0df7
company,1768654838,S&P 500 Financial Titan BlackRock Leads Five Stocks Near Buy Points,138161513,https://s.yimg.com/rz/stage/p/yahoo_finance_en-US_h_p_finance_2.png,BLK,Yahoo,S&P 500 components BlackRock and GE Aerospace are among five stocks to watch in next week's shortened market action.,https://finnhub.io/api/news?id=b4a6a71cc19d34355ea2598f8c12a2c441cdf1b283b6705fb04c2e3a7703aca1
company,1768649825,S&P 500 Financial Titan BlackRock Leads Five Stocks To Watch,138233117,,BLK,DowJones,S&P 500 Financial Titan BlackRock Leads Five Stocks To Watch,https://finnhub.io/api/news?id=0050c445d4d35a92a635b954242138ceaf10f628ec64ef11776a9dea608a672d
company,1768646104,"Led by Texas, New Hampshire, U.S. states race to prove they can put bitcoin on public balance sheet",138162850,https://image.cnbcfm.com/api/v1/image/108252507-1768414217350-gettyimages-1076707262-_cpr3811.jpeg?v=1768414237&w=1920&h=1080,BLK,CNBC,"Many U.S. states are planning bitcoin strategic reserves, and other forms of crypto financing, showing budgets are buying into the digital assets trend.",https://finnhub.io/api/news?id=aed596eca3a07168ee06e5eacf9586fb2842f6950b92f84f942da9a98768a5fd
company,1768608210,"Dividend Champion, Contender, And Challenger Highlights: Week Of January 18",138158223,https://static.seekingalpha.com/cdn/s3/uploads/getty_images/1072593728/image_1072593728.jpg?io=getty-c-w1536,BLK,SeekingAlpha,"Track weekly dividend updates for Champions, Contenders & Challengersâsee dividend changes, upcoming ex-dividend dates, and pay dates.",https://finnhub.io/api/news?id=59c2f1c0f7166bd9bc4ad470195eaadba6f213584475db4e23fa2d9347e2b46b
