category,datetime,headline,id,image,related,source,summary,url
company,1768676482,How Will Dow Jones Futures React To Trump's Greenland Tariffs On NATO Nations?,138164075,https://s.yimg.com/rz/stage/p/yahoo_finance_en-US_h_p_finance_2.png,GE,Yahoo,Dow Jones futures: President Donald Trump said that eight NATO members face escalating tariffs unless a deal is struck for the U.S. buying Greenland.,https://finnhub.io/api/news?id=7d5aa247378668d84a8c28a0f346b4cd00bd9cf2d9342c04172a96d2d85a3e77
company,1768669746,Dow Jones Futures: Trump To Impose Tariffs On NATO Nations Over Greenland; Google In Buy Zone,138163028,https://s.yimg.com/rz/stage/p/yahoo_finance_en-US_h_p_finance_2.png,GE,Yahoo,Dow Jones futures: President Donald Trump said that eight NATO members face escalating tariffs unless a deal is struck for the U.S. buying Greenland.,https://finnhub.io/api/news?id=a9bdbcb2eb1d121dc629b85ba01de5408443db8ff3b630995c4056bf4f63357b
company,1768659543,"Dow Jones Futures: Market Pauses, But Key Areas Strong; Google Leads 7 Stocks In Buy Zones",138162205,https://s.yimg.com/rz/stage/p/yahoo_finance_en-US_h_p_finance_2.png,GE,Yahoo,"Small caps and chips led this past week while the major indexes paused near highs. Google stock leads seven stocks in buy zones, but three have earnings due.",https://finnhub.io/api/news?id=efbb024d01b89577e8465a4e9e0033d483c75b4fcce144dcbe3e0d840e57e918
company,1768658496,"Stock Market Week Ahead: Focusing On SCOTUS, Davos, Venezuelan Oil",138162226,https://s.yimg.com/rz/stage/p/yahoo_finance_en-US_h_p_finance_2.png,GE,Yahoo,"The stock market faces another heavy news week, with key Supreme Court questions and President Trump at the World Economic Forum in focus.",https://finnhub.io/api/news?id=8d97d4891b315fb62cdc83a5d9dff79e83b340452ef9be90b89aa4894d9cf669
company,1768654838,S&P 500 Financial Titan BlackRock Leads Five Stocks Near Buy Points,138161513,https://s.yimg.com/rz/stage/p/yahoo_finance_en-US_h_p_finance_2.png,GE,Yahoo,S&P 500 components BlackRock and GE Aerospace are among five stocks to watch in next week's shortened market action.,https://finnhub.io/api/news?id=b4a6a71cc19d34355ea2598f8c12a2c441cdf1b283b6705fb04c2e3a7703aca1
company,1768649825,S&P 500 Financial Titan BlackRock Leads Five Stocks To Watch,138233117,,GE,DowJones,S&P 500 Financial Titan BlackRock Leads Five Stocks To Watch,https://finnhub.io/api/news?id=0050c445d4d35a92a635b954242138ceaf10f628ec64ef11776a9dea608a672d
company,1768647600,"Netflix, Intel Step Into Earnings Spotlight; GDP On Deck",138162302,https://static.seekingalpha.com/assets/og_image_1200-29b2bfe1a595477db6826bd2126c63ac2091efb7ec76347a8e7f81ba17e3de6c.png,GE,SeekingAlpha,"Wall Street Week Ahead: key earnings (NFLX, INTC, JNJ), GDP/PCE data, IPOs, dividends & volatility stocks. Read here for more details.",https://finnhub.io/api/news?id=4102eb160a980edabd681489edcdb2d0c72b04587fcde681d5b40a9ebf7b37df
company,1768608054,"Trump at Davos, Netflix earnings, SCOTUS hearing: What to Watch",138156894,https://s.yimg.com/rz/stage/p/yahoo_finance_en-US_h_p_finance_2.png,GE,Yahoo,"Market Domination Overtime Host Josh Lipton previews several of the biggest stories to come next week, including earnings results from companies like Netflix (NFLX), Procter & Gamble (PG), and United Airlines (UAL); President Trump's attendance at the 2026 World Economic Forum (WEF) in Davos, Switzerland; the US Supreme Court's (SCOTUS) hearing on whether the Trump administration has the power to remove Federal Reserve governor Lisa Cook; and November's reading on the Personal Consumption Expenditures index (PCE). To watch more expert insights and analysis on the latest market action, check out more Market Domination Overtime.",https://finnhub.io/api/news?id=b2256b42d675c5a522d80f6075de9c312776bcdff3d3fb6360c39f86fc4848b5
