category,datetime,headline,id,image,related,source,summary,url
company,1768693884,"Gary Black Likes Elon Musk's Tesla But Not TSLA, Draws Comparison With Amazon—Says Nvidia 'Democratizes Autonomy'",138165110,https://s.yimg.com/rz/stage/p/yahoo_finance_en-US_h_p_finance_2.png,TSLA,Yahoo,"Investor Gary Black, managing director of The Future Fund LLC, has shared that Tesla Inc.'s (NASDAQ:TSLA) stock valuation has caused him to exit his position in the automaker. Gary Black Offers Insight Into Tesla Valuation Criticism The investor, in a post on the social media platform X, offered an insight into his outlook on Tesla, drawing comparisons with Amazon.com Inc.'s (NASDAQ:AMZN) stock during the e-commerce giant's early days. Black shared that he held Amazon stock before it was profita",https://finnhub.io/api/news?id=f463b0d96d8357f21243a078bf522a8016e352a6244df75a85222cf654393a3f
company,1768686825,"YouTuber MKBHD Hails Tesla Model Y Performance, Calls EV Giant's Self-Driving Technology 'The Best'",138164729,https://s.yimg.com/rz/stage/p/yahoo_finance_en-US_h_p_finance_2.png,TSLA,Yahoo,"YouTuber Marques Brownlee, aka MKBHD, has shared his thoughts on the Tesla Inc. (NASDAQ:TSLA) Model Y Performance trim, as well as the company's self-driving technology. Tesla Self-Driving Is The Best Ever, MKBHD Says The YouTuber, in a review of the Model Y Performance on Thursday, hailed the crossover's software on the 16-inch touchscreen infotainment display, which is also a real-time representation of the car. ""This is the best software in a car that is not Android Auto or Apple CarPlay,"" bo",https://finnhub.io/api/news?id=01e592b5f0270fd8a18554b02a1b6f74089fe0bf380c4f41f5d598c6711a768e
company,1768667472,Jim Cramer Says Elon Musk's OpenAI Lawsuit Is 'The Real Deal' As Kalshi Bettors Raise Odds Of xAI CEO Winning,138163018,https://s.yimg.com/rz/stage/p/yahoo_finance_en-US_h_p_finance_2.png,TSLA,Yahoo,"On Thursday, market commentator and CNBC personality Jim Cramer said that Tesla Inc. (NASDAQ:TSLA) CEO Elon Musk's lawsuit against OpenAI poses serious risks for the artificial intelligence company, particularly if it ever pursues a public listing. Jim Cramer Flags High Stakes For OpenAI ""This Musk suit against OpenAI is the real deal — and not a good one for OpenAI if and when it wants to go public,"" Cramer wrote on X. He added that OpenAI may need to complete a large private fundraising round",https://finnhub.io/api/news?id=77759aeded869a40e50a44e534808124af92af6984f9cfc9ca06be9085204701
company,1768660299,From $5.38 to 17 Cents: Inside Senator McConnell's 97% Stock Wipeout,138162190,https://s.yimg.com/rz/stage/p/yahoo_finance_en-US_h_p_finance_2.png,TSLA,Yahoo,"When it comes to tracking the stock trading activity of members of Congress, investors often pay attention to the stocks that gain or may raise conflicts of interest. A senator disclosed selling a stock for a significant loss in 2025 that might not get as much attention. Senator McConnell Sells Luminar Stock In 2025 Sen. Mitch McConnell (R-Ky.) reported selling shares of Luminar Technologies (OTC:LAZRQ) in two transactions in 2025, according to the Benzinga Government Trades page. Here are the t",https://finnhub.io/api/news?id=492e95517077498740c5eb0df836e68785f41dac10168c7bcd00180d25efde54
company,1768656639,The solar panel contracts that can kill home sales,138161507,https://s.yimg.com/rz/stage/p/yahoo_finance_en-US_h_p_finance_2.png,TSLA,Yahoo,"Although they can make home sales more difficult, solar leases have been growing in popularity and are poised to continue their rise after tax credit changes.",https://finnhub.io/api/news?id=e7428b1c16fc3be6803d6cb38ff2917f9b9097c6104665562a1f3456d69f8459
company,1768651200,MarketBeat Week in Review – 01/12 - 01/16,138168559,https://s.yimg.com/rz/stage/p/yahoo_finance_en-US_h_p_finance_2.png,TSLA,Yahoo,Economic data helped stocks move higher as it showed that the Fed's decision on interest rates may not interrupt the bullish case for equities in 2026.,https://finnhub.io/api/news?id=4e3d0f43a7911ed88340b266ab76d2f87872974762db22df2ef4344622d42402
company,1768647613,"Tesla's FSD, like almost everything else, is becoming a subscription",138160397,https://s.yimg.com/rz/stage/p/yahoo_finance_en-US_h_p_finance_2.png,TSLA,Yahoo,The open road calls out to you. But first you'll need to get Musk's permission — and make a recurring payment.,https://finnhub.io/api/news?id=74cece5b3a49550078b933ee436575849ffc62256e257bab8bc04696375d9399
company,1768646775,Tesla Touts First-Of-Its-Kind Lithium Refinery In US — Elon Musk Calls It 'Largest' In America,138160403,https://s.yimg.com/rz/stage/p/yahoo_finance_en-US_h_p_finance_2.png,TSLA,Yahoo,"Tesla Inc. (NASDAQ:TSLA) has revealed its new Lithium Refinery in Texas, intending to scale up battery production and localize supply chains. First-Of-Its-Kind Facility, Tesla Says The company's official North America handle posted a video on the social media platform X on Wednesday, showcasing the company's Lithium refinery in Texas. ""Regionalized access to critical battery minerals brings jobs, cuts emissions & helps accelerate our mission,"" Tesla said in the post. Don't Miss: Missed Nvidia an",https://finnhub.io/api/news?id=fbe84f005fcc62198d8d73634d54d4cb5e382bdd830b8618d3bfe4e6152d5fbc
company,1768645800,Supersize CEO Pay Packages Aren’t Paying Off for Shareholders,138161508,https://s.yimg.com/rz/stage/p/yahoo_finance_en-US_h_p_finance_2.png,TSLA,Yahoo,"The prospect of a nine-figure paycheck was supposed to spur CEOs to deliver outstanding results, but few of these Elon Musk-like experiments are working out that way.",https://finnhub.io/api/news?id=79b83108d25ac59546d56061a693f3e605cc5c1385e89c2117f75ccb84c21ceb
company,1768631708,"Elon Musk once backed a $10 billion OpenAI ICO, internal notes show",138159716,https://s.yimg.com/rz/stage/p/yahoo_finance_en-US_h_p_finance_2.png,TSLA,Yahoo,"Internal OpenAI call notes show Elon Musk agreed to explore an ICO with a for-profit arm in early 2018, but later dropped the idea and exited the organization.",https://finnhub.io/api/news?id=2e0c95771075357f2b4d7090778a49285e024de58e1cc8a872a1bfc329853e3d
company,1768611439,Exclusive: Elon Musk’s Boring Co. is studying a tunnel project to Tesla Gigafactory near Reno,138157924,https://s.yimg.com/rz/stage/p/yahoo_finance_en-US_h_p_finance_2.png,TSLA,Yahoo,"The surge of traffic, and accidents, on the highway that leads to the burgeoning industrial center in northern Nevada is driving a search for alternatives.",https://finnhub.io/api/news?id=c501060557f77c4ae79ae7be0b503fa84a74f5d16791d317f94607dad9fc2375
company,1768608097,"Dividend Investor Earns $30K a Month After 37 Years, Says He Started Investing in 1988 With Student Loans",138162198,https://s.yimg.com/rz/stage/p/yahoo_finance_en-US_h_p_finance_2.png,TSLA,Yahoo,"Many investors underestimate the power of staying invested. Riding out market volatility and uncertainty while holding quality stocks can lead to dramatic long-term results. In May, a dividend investor posted in a Reddit community that he reached $1,000 per day in dividend income after 37 years of investing. The portfolio screenshots shared by the investor on the social platform showed his monthly dividend income stood at $30,417. Don't Miss: Missed Nvidia and Tesla? RAD Intel Could Be the Next",https://finnhub.io/api/news?id=9675dc04f78322f6f2cb2ac5aeda8bb858d1b9b953a6cdd15c377f655f60fcba
