category,datetime,headline,id,image,related,source,summary,url
company,1768681020,Bank of America revamps Alphabet stock after Google enters two key partnerships,138164727,https://s.yimg.com/rz/stage/p/yahoo_finance_en-US_h_p_finance_2.png,WMT,Yahoo,"Investors are taking a fresh look at Google, as new partnerships tied to its Gemini models help push the stock higher. On Jan. 11, Google and Walmart (WMT) said they plan to roll out a new shopping experience inside Google’s Gemini chatbot, highlighting a potential new revenue path for Google. ...",https://finnhub.io/api/news?id=c2f6d2129af6397d94cc9ff346571f8c5977c1337c4eee02907e3c2238e53cfd
company,1768675620,Costco rival launches expansion plans,138164088,https://s.yimg.com/rz/stage/p/yahoo_finance_en-US_h_p_finance_2.png,WMT,Yahoo,"The other day, I walked into my local supermarket to buy five yogurt cups, a loaf of bread, a carton of strawberries, and a gallon of milk. Now I may not be the most skilled person when it comes to mental math. But by my calculations, the sum of those items should not have exceeded $15. So ...",https://finnhub.io/api/news?id=a63be8ac10c4ff0a76b9271afe23241f2b0bddbcf1bf85e985eeee32c25a0a30
company,1768669380,Sam’s Club makes major product change as shoppers cut back,138163043,https://s.yimg.com/rz/stage/p/yahoo_finance_en-US_h_p_finance_2.png,WMT,Yahoo,"Sam’s Club, which is operated by Walmart, has seen changing consumer behavior in recent months amid ongoing economic uncertainty, prompting shoppers to focus more on value as they rethink their spending habits. During the third quarter of 2025, Sam’s Club’s comparable sales increased by 3.8% year ...",https://finnhub.io/api/news?id=df6987d682b802c249898b29478bc15ff31d3b94abb457e60651a297429388df
company,1768642500,Amazon vs. Walmart: Which Retail Powerhouse Belongs in a Long-Term Portfolio?​,138159711,https://s.yimg.com/rz/stage/p/yahoo_finance_en-US_h_p_finance_2.png,WMT,Yahoo,"Amazon and Walmart are the top retail stocks, but one of them is the clear winner.",https://finnhub.io/api/news?id=9e9aaedd5ac3516424d996b201017f1e9272c262dc814e140795175a2d4b2a8f
company,1768612860,Walmart and Costco Are Worth Every Penny,138157922,https://s.yimg.com/rz/stage/p/yahoo_finance_en-US_h_p_finance_2.png,WMT,Yahoo,"Readers weigh in on reliable growth stocks, economic stimulus, Constellation Brands, and Trump’s approach to foreign relations.",https://finnhub.io/api/news?id=dea642b6495d546363b8ee520f353656511bcfb99957063b760df26a91113514
