category,datetime,headline,id,image,related,source,summary,url
company,1769123403,Applied Materials (AMAT) Valuation Check After Strong Recent Share Price Gains,138219653,https://s.yimg.com/rz/stage/p/yahoo_finance_en-US_h_p_finance_2.png,AMAT,Yahoo,"Applied Materials stock snapshot after recent gains Applied Materials (AMAT) has attracted fresh attention after recent share price strength, with the stock up about 23% over the past month and roughly 39% over the past 3 months. See our latest analysis for Applied Materials. That recent 30 day share price return of 22.5%, on top of a 39.4% gain over 90 days, sits against a 1 year total shareholder return of 68.8%. This suggests momentum has been building rather than fading. If Applied...",https://finnhub.io/api/news?id=0e5820a25dd93b4427c6bf26223ef3842c914a2d6c990b05be095bd9a6798992
company,1769110202,Intel earnings drag down these other chip stocks,138232678,,AMAT,MarketWatch,Intel earnings drag down these other chip stocks,https://finnhub.io/api/news?id=70f62c7bc423a739a03e9d8b48122ed34deb573df73b6683cc9af3fd71ce3107
company,1769094360,Can AMAT Lead the Display Market With Advanced OLED and AR/VR Push?,138205843,https://s.yimg.com/rz/stage/p/yahoo_finance_en-US_h_p_finance_2.png,AMAT,Yahoo,"Applied Materials' display business rebounds in fiscal 2025, with Q4 revenues up 68.2% as advanced systems, pricing and OLED demand lift margins.",https://finnhub.io/api/news?id=be85e37ba89136dcaf3748bc4722c18648444354d52b215ca097b9a256d8878c
company,1769092803,Are Computer and Technology Stocks Lagging  Applied Materials (AMAT) This Year?,138205844,https://s.yimg.com/rz/stage/p/yahoo_finance_en-US_h_p_finance_2.png,AMAT,Yahoo,Here is how Applied Materials (AMAT) and ASML (ASML) have performed compared to their sector so far this year.,https://finnhub.io/api/news?id=3503a9a6f5d1f8d71631c9e3e29fd7f79fdfc0bcc7abfb79ac1bcdecb7c97bad
company,1769085000,"Applied Materials to Report Fiscal First Quarter 2026 Results on Feb. 12, 2026",138203850,https://s.yimg.com/rz/stage/p/yahoo_finance_en-US_h_p_finance_2.png,AMAT,Yahoo,"SANTA CLARA, Calif., Jan. 22, 2026 (GLOBE NEWSWIRE) -- Applied Materials, Inc. today announced that it will hold its fiscal first quarter 2026 earnings conference call on Thursday, Feb. 12, 2026, at 4:30 p.m. ET / 1:30 p.m. PT. The call will be webcast live at: https://ir.appliedmaterials.com. A replay will be available on the same day beginning at 8:00 p.m. ET / 5:00 p.m. PT. About Applied MaterialsApplied Materials, Inc. (Nasdaq: AMAT) is the leader in materials engineering solutions that are",https://finnhub.io/api/news?id=d8d6558e65d6339d4351c91224e3ffe6995ca70bb308ec3779b4b9c8c322bcb1
company,1769076120,Nvidia Stock Is Lagging Behind Other AI Names. Why the Chips Darling Is Out of Favor.,138232100,,AMAT,MarketWatch,Nvidia Stock Is Lagging Behind Other AI Names. Why the Chips Darling Is Out of Favor.,https://finnhub.io/api/news?id=f0dd01577e438f1be9b7650a4f0525ec15e3971dfc52ea53a02c5ee78d4ac27b
company,1769071819,Jim Cramer's top 10 things to watch in the stock market Thursday,138205257,https://image.cnbcfm.com/api/v1/image/108255380-17690331752026-01-21t220523z_286979253_rc2v5ja1vheb_rtrmadp_0_usa-stocks.jpeg?v=1769033262&w=1920&h=1080,AMAT,CNBC,The S&P 500 advanced this morning as Wall Street cheered signs of easing geopolitical tensions. Traders are also awaiting key inflation data.,https://finnhub.io/api/news?id=a020014ef53804cb955cd3b5a01cb07f030f9414918e6f77a73321210a6c3f47
company,1769070840,Nvidia Stock Is Lagging Behind Other AI Names. Why the Boom’s Darling Is Out of Favor.,138203048,https://s.yimg.com/rz/stage/p/yahoo_finance_en-US_h_p_finance_2.png,AMAT,Yahoo,"Nvidia stock is hovering near the same levels it was at last August, while other companies involved in the artificial-intelligence boom have surged.",https://finnhub.io/api/news?id=bcf5a531b40331d32c00967a8322dcd10a5e1348e47e26dc6d0ed71c823a9293
company,1769054784,1 Reason to Sell AMAT and 1 Stock to Buy Instead,138203136,https://s.yimg.com/rz/stage/p/yahoo_finance_en-US_h_p_finance_2.png,AMAT,Yahoo,"The past six months have been a windfall for Applied Materials’s shareholders. The company’s stock price has jumped 74.6%, hitting $326.79 per share. This was partly thanks to its solid quarterly results, and the run-up might have investors contemplating their next move.",https://finnhub.io/api/news?id=5ea098135f0f617f99296a8473ea9e9c7168fe6a28591a45db9b0e4ad9d7a580
