category,datetime,headline,id,image,related,source,summary,url
company,1769102220,"GE Aerospace Q4 Earnings & Revenues Top Estimates, Increase Y/Y",138206871,https://s.yimg.com/rz/stage/p/yahoo_finance_en-US_h_p_finance_2.png,GEV,Yahoo,"GE tops Q4 estimates as strong engine services demand lifted revenues 18% year over year, with orders surging and 2026 growth outlook raised.",https://finnhub.io/api/news?id=5cee73c8b4cd9c22c7336cb313f9819be66528bbb28ef636b8f736eb5b78b1bf
company,1769091707,NUKZ ETF Surges 58% as Nuclear Power Bets Face Trump Policy and Concentration Tests,138204665,https://s.yimg.com/rz/stage/p/yahoo_finance_en-US_h_p_finance_2.png,GEV,Yahoo,"The Range Nuclear Renaissance Index ETF has gained 58% over the past year, riding enthusiasm for nuclear power that’s built since Microsoft and Amazon announced plans to power data centers with small modular reactors. With $725 million in assets under management and a portfolio spanning uranium miners, reactor manufacturers, and utility operators, NUKZ has become ... NUKZ ETF Surges 58% as Nuclear Power Bets Face Trump Policy and Concentration Tests",https://finnhub.io/api/news?id=57af7f18fd12b5c721f49e1217bd22ccc8258a20d1b0e73db6813baee681520b
company,1769091540,SMR vs. GEV: Which Small Modular Reactor Stock is a Better Pick?,138205871,https://s.yimg.com/rz/stage/p/yahoo_finance_en-US_h_p_finance_2.png,GEV,Yahoo,"GE Vernova's small modular reactor progress and steadier fundamentals give it an edge over NuScale Power's long-dated, higher-risk pipeline.",https://finnhub.io/api/news?id=ec29cd0091290575f1df13e3495e84620f4983b59ec48ed0fa914c55cf8121b1
company,1769090404,Investors Heavily Search GE Vernova Inc. (GEV): Here is What You Need to Know,138204619,https://s.yimg.com/rz/stage/p/yahoo_finance_en-US_h_p_finance_2.png,GEV,Yahoo,"GE Vernova (GEV) has been one of the stocks most watched by Zacks.com users lately. So, it is worth exploring what lies ahead for the stock.",https://finnhub.io/api/news?id=db265bb9acc81a6bf7cb90279d4ab77529696ba4068177b17402015ebe5e49b4
company,1769069353,Jim Cramer on GE HealthCare: “I Just Don’t Think It’s What You Want to Own”,138202446,https://s.yimg.com/rz/stage/p/yahoo_finance_en-US_h_p_finance_2.png,GEV,Yahoo,"GE HealthCare Technologies Inc. (NASDAQ:GEHC) is one of the stocks Jim Cramer recently looked at. Noting that they own 83 shares of GEHC, a caller asked if they should sell their position. In response, Cramer said: Okay, I worked for GE, so I got, I’m not allowed to own stock. I want to make that […]",https://finnhub.io/api/news?id=6beaecf919e178c56f5019ee823d2115323841ac1bb9cba9d0f1973e6af7352c
company,1769043900,Is GE Vernova the Smartest Investment You Can Make Today?,138200217,https://s.yimg.com/rz/stage/p/yahoo_finance_en-US_h_p_finance_2.png,GEV,Yahoo,Recent news from the Trump Administration sent GE Vernova soaring last week.,https://finnhub.io/api/news?id=5b0c6e65202ac25642afa98d19a6855d2c819673158494b804a15b64e82bb4b9
company,1769042550,American Superconductor: Capitalizing On Grid Modernization,138201284,https://static.seekingalpha.com/cdn/s3/uploads/getty_images/2224775705/image_2224775705.jpg?io=getty-c-w1536,GEV,SeekingAlpha,"American Superconductor is driven by surging electricity demand and grid modernization, not just AI data center exposure. See why I rate AMSC stock a Buy now.",https://finnhub.io/api/news?id=77c765a3d91d81b0878702ded971bdab1ee9cdb74f06f746067e742f1b6b16ea
