category,datetime,headline,id,image,related,source,summary,url
company,1769094000,ForecastEx Appoints Renowned Forecaster Dr. Philip Tetlock to Board of Directors,138204803,https://s.yimg.com/rz/stage/p/yahoo_finance_en-US_h_p_finance_2.png,IBKR,Yahoo,"GREENWICH, Conn., January 22, 2026--Interactive Brokers (Nasdaq: IBKR) announced the appointment of Dr. Philip Tetlock to the Board of Directors of ForecastEx.",https://finnhub.io/api/news?id=fcec2129d1e1f9c88e2ec843eb7dd9cc63eb688423bf7bda595b6e9b1389b282
company,1769092803,Are Finance Stocks Lagging  Citizens Financial Services (CZFS) This Year?,138206015,https://s.yimg.com/rz/stage/p/yahoo_finance_en-US_h_p_finance_2.png,IBKR,Yahoo,"Here is how Citizens Financial Services (CZFS) and Interactive Brokers Group, Inc. (IBKR) have performed compared to their sector so far this year.",https://finnhub.io/api/news?id=23d5ba3f074c3264839f99e959215c700794c2843cc88a895c047c6057a95c8f
company,1769092320,"Company News for Jan 22, 2026",138205777,https://s.yimg.com/rz/stage/p/yahoo_finance_en-US_h_p_finance_2.png,IBKR,Yahoo,"Companies in The News Are: XOM, TFC, IBKR, HAL",https://finnhub.io/api/news?id=892b93d8ce51ef666880b8ae25119ef7f82fc23a8e14b952bc86f946f50e8820
company,1769087235,"Interactive Brokers (IBKR) Soars to All-Time High on Earnings Blowout, PT Upgrade",138203979,https://s.yimg.com/rz/stage/p/yahoo_finance_en-US_h_p_finance_2.png,IBKR,Yahoo,"We recently published 10 Big Names Leaving Wall Street Behind; 7 Are Hitting Record Highs. Interactive Brokers Group Inc. (NASDAQ:IBKR) was one of the worst performers on Wednesday. Interactive Brokers Group soared to a new all-time high of $76.37 on Wednesday, up 6.8 percent, as investors took heart from the company’s strong earnings performance in […]",https://finnhub.io/api/news?id=1d24938b405972e95c0bbe6ecca35041556c42200a9b2f4e4ff149d0434eaa19
company,1769069087,"Dow Jones Futures Rise After Trump Greenland Shift Fuels Stocks; Google, Eli Lilly Lead 8 New Buys",138207314,,IBKR,DowJones,"Dow Jones Futures Rise After Trump Greenland Shift Fuels Stocks; Google, Eli Lilly Lead 8 New Buys",https://finnhub.io/api/news?id=07edf4e259ec611af4d61fb560e59a28bc20b7dad94b21a586968be79b48719d
