category,datetime,headline,id,image,related,source,summary,url
company,1769110202,Intel earnings drag down these other chip stocks,138232678,,KLAC,MarketWatch,Intel earnings drag down these other chip stocks,https://finnhub.io/api/news?id=70f62c7bc423a739a03e9d8b48122ed34deb573df73b6683cc9af3fd71ce3107
company,1769099640,KLA Corp. stock outperforms competitors despite losses on the day,138234127,,KLAC,MarketWatch,KLA Corp. stock outperforms competitors despite losses on the day,https://finnhub.io/api/news?id=13390bee034dfdf7eb673eddc514635ab3d7e41eb0cca5a58de61a8a26cab8b3
company,1769094018,KLA (KLAC) Reports Next Week: Wall Street Expects Earnings Growth,138205867,https://s.yimg.com/rz/stage/p/yahoo_finance_en-US_h_p_finance_2.png,KLAC,Yahoo,KLA (KLAC) doesn't possess the right combination of the two key ingredients for a likely earnings beat in its upcoming report. Get prepared with the key expectations.,https://finnhub.io/api/news?id=d1d5ea16b6389a3860f7722f64d6258f2c30f9977a53f89cefe1c86f133ba3fc
company,1769091036,Jim Cramer Calls KLA Corporation an “Incredibly Well-Run Company”,138204662,https://s.yimg.com/rz/stage/p/yahoo_finance_en-US_h_p_finance_2.png,KLAC,Yahoo,"KLA Corporation (NASDAQ:KLAC) is one of the stocks Jim Cramer talked about, along with market froth. Answering a caller’s query about the stock during the lightning round, Cramer commented: Okay, KLA is an incredibly well-run company whose stock is up gigantically. They make the semiconductor capital equipment, you need that, memory. I think that if […]",https://finnhub.io/api/news?id=82fa8c2c020170fefd6dbc8bced4cce2eada9884e6dc89988b4b054220b267ad
company,1769071819,Jim Cramer's top 10 things to watch in the stock market Thursday,138205257,https://image.cnbcfm.com/api/v1/image/108255380-17690331752026-01-21t220523z_286979253_rc2v5ja1vheb_rtrmadp_0_usa-stocks.jpeg?v=1769033262&w=1920&h=1080,KLAC,CNBC,The S&P 500 advanced this morning as Wall Street cheered signs of easing geopolitical tensions. Traders are also awaiting key inflation data.,https://finnhub.io/api/news?id=a020014ef53804cb955cd3b5a01cb07f030f9414918e6f77a73321210a6c3f47
