category,datetime,headline,id,image,related,source,summary,url
company,1769106050,Lansing Coca-Cola distributor announces layoffs. What we know,138206881,https://s.yimg.com/rz/stage/p/yahoo_finance_en-US_h_p_finance_2.png,KO,Yahoo,"According to a notice to the state, the company will lay off 62 by April 3 and reassign 99 other workers.",https://finnhub.io/api/news?id=003be31d4e91ac49458d47712c6398bc719cd7bbdc135b5d17e76b2133f97e00
company,1769101440,Coca-Cola vs. Monster Beverage: Which Stock Stays Ahead of the Curve?,138206882,https://s.yimg.com/rz/stage/p/yahoo_finance_en-US_h_p_finance_2.png,KO,Yahoo,"KO's diversified beverage portfolio contrasts with MNST's energy drink concentration, highlighting scale versus category focus.",https://finnhub.io/api/news?id=b1439c97f223da068db12978bcc67a1f7f1fcdae957083a2ffff70949e2f2e90
company,1769100484,KHC Is Low-Hanging Fruit for Greg Abel: Which Warren Buffett Stock Will He Sell Next?,138206745,https://s.yimg.com/rz/stage/p/yahoo_finance_en-US_h_p_finance_2.png,KO,Yahoo,KHC might not be the only mistake made by Warren Buffet that Berkshire Hathaway’s new CEO might try and rectify.,https://finnhub.io/api/news?id=492aa86e30c236c86b7a3f9a984cec660ce69c65b9ad887504949fa11ad7ce44
company,1769097900,2 High-Yielding Dividend Stocks That Retirees Can Rely on for Recurring Income,138205791,https://s.yimg.com/rz/stage/p/yahoo_finance_en-US_h_p_finance_2.png,KO,Yahoo,These stocks offer yields of more than double the S&P 500 average.,https://finnhub.io/api/news?id=5e3ae51d6fec7f132803b71bb882b13a297348bcc79d4ea785ed4665864cc76e
company,1769094485,Playing It Safe at 70 With $2.5 Million Is Likely To Backfire,138205128,https://s.yimg.com/rz/stage/p/yahoo_finance_en-US_h_p_finance_2.png,KO,Yahoo,"A 70-year-old investor with $2.5 million in blue-chip dividend stocks faces a question many retirees wrestle with: is playing it safe actually risky? On Reddit’s r/Bogleheads forum, one user questioned whether their early-70s father’s portfolio with just 10% in stocks was too conservative, noting it “seems just almost too conservative, where it’s almost at a ... Playing It Safe at 70 With $2.5 Million Is Likely To Backfire",https://finnhub.io/api/news?id=320a85bf58a307713306e2abbdda76898432fab2c841f75d4da8640f6ebb293c
company,1769090404,CocaCola Company (The) (KO) is Attracting Investor Attention: Here is What You Should Know,138204637,https://s.yimg.com/rz/stage/p/yahoo_finance_en-US_h_p_finance_2.png,KO,Yahoo,"Recently, Zacks.com users have been paying close attention to Coca-Cola (KO). This makes it worthwhile to examine what the stock has in store.",https://finnhub.io/api/news?id=0e6563b13d77c19e4da673f4055a588440b9b0dcb7539c0b48597f293f02d0b3
company,1769065797,Is Coca-Cola (KO) Still Attractive After Strong Multi‑Year Share Price Gains,138201881,https://s.yimg.com/rz/stage/p/yahoo_finance_en-US_h_p_finance_2.png,KO,Yahoo,"If you are wondering whether Coca-Cola shares are offering fair value at around US$72.01, you are not alone. This article is built to walk you through that question in a clear, practical way. Over the recent past, the stock has recorded returns of 0.8% over 7 days, 2.6% over 30 days, 4.2% year to date, 20.0% over 1 year, 29.3% over 3 years and 72.5% over 5 years, which naturally raises questions about what is already priced in and what might still be on the table. Alongside these returns,...",https://finnhub.io/api/news?id=1310ca645d4ec94aae3f3a9b52d0296eecb24a389de636ba0ddc0c52abd359c2
