category,datetime,headline,id,image,related,source,summary,url
company,1769105842,Is the 2026 Market Rotation Already Underway? Here’s What Could Lead After the Magnificent 7,138206734,https://s.yimg.com/rz/stage/p/yahoo_finance_en-US_h_p_finance_2.png,LLY,Yahoo,"It feels like a great rotation out of the Magnificent Seven has already kicked off just over a quarter ago. Undoubtedly, the group that’s helped lead the S&P 500 to impressive gains in the past several years has shown signs of slowing down. Collectively, the group of seven AI-driven tech leaders has stalled, but underneath ... Is the 2026 Market Rotation Already Underway? Here’s What Could Lead After the Magnificent 7",https://finnhub.io/api/news?id=99f85ec92e1ad8edd4c24f7b5d48dc6dd2c0fe841be9469f4afbf241484f8968
company,1769102372,Eli Lilly (LLY) Q2 2025 Earnings Call Transcript,138205763,https://s.yimg.com/rz/stage/p/yahoo_finance_en-US_h_p_finance_2.png,LLY,Yahoo,"Q2 was a strong quarter.  Today we shared positive top line data from the ATTAIN-1 orforglipron trial in people with obesity.  In ATTAIN-1, patients taking the highest dose of orforglipron lost more than 27 pounds or 12.4% of their body weight.",https://finnhub.io/api/news?id=4eaafba8b6448b13449a6091e825bfbea33de7ed0a25d94c843f0008d9d5f70f
company,1769101380,ABBV vs. MRK: An Oncology-Immunology Showdown for Investors,138206816,https://s.yimg.com/rz/stage/p/yahoo_finance_en-US_h_p_finance_2.png,LLY,Yahoo,"ABBV has rebounded after Humira patent cliff, with Skyrizi and Rinvoq driving growth. Rising estimates and a pipeline set to power earnings into 2029 bode well.",https://finnhub.io/api/news?id=dc8e1aee0d5f2a73f309f6897172ff20bf593c3492013eb33d815d6e66f051c6
company,1769091019,Jim Cramer on Novo Nordisk: “I Think They’re Making a Turn Here”,138204571,https://s.yimg.com/rz/stage/p/yahoo_finance_en-US_h_p_finance_2.png,LLY,Yahoo,"Novo Nordisk A/S (NYSE:NVO) is one of the stocks Jim Cramer talked about, along with market froth. During the episode, a caller asked if the stock is a buy, hold, or sell, and Cramer replied: No, I would hold it. I met with the CEO last week. I kind of, I liked him a lot. […]",https://finnhub.io/api/news?id=0cf7ade9a64f74a1947924a0597c2163d18e06aeb7c730cde8ef8b1490e2073e
company,1769081887,January 2026's Stocks That May Be Trading Below Estimated Value,138203091,https://s.yimg.com/rz/stage/p/yahoo_finance_en-US_h_p_finance_2.png,LLY,Yahoo,"Amid recent market volatility, the U.S. stock indices have shown resilience with a sharp rebound following geopolitical tensions and tariff threats. As investors navigate these fluctuations, identifying stocks that may be trading below their estimated value can present opportunities for those looking to capitalize on potential market inefficiencies.",https://finnhub.io/api/news?id=9d761d1eb7db900ecc2cb94ffe4c44f11399382a286218168b2ac229b3f27758
company,1769071819,Jim Cramer's top 10 things to watch in the stock market Thursday,138205257,https://image.cnbcfm.com/api/v1/image/108255380-17690331752026-01-21t220523z_286979253_rc2v5ja1vheb_rtrmadp_0_usa-stocks.jpeg?v=1769033262&w=1920&h=1080,LLY,CNBC,The S&P 500 advanced this morning as Wall Street cheered signs of easing geopolitical tensions. Traders are also awaiting key inflation data.,https://finnhub.io/api/news?id=a020014ef53804cb955cd3b5a01cb07f030f9414918e6f77a73321210a6c3f47
company,1769069087,"Dow Jones Futures Rise After Trump Greenland Shift Fuels Stocks; Google, Eli Lilly Lead 8 New Buys",138207314,,LLY,DowJones,"Dow Jones Futures Rise After Trump Greenland Shift Fuels Stocks; Google, Eli Lilly Lead 8 New Buys",https://finnhub.io/api/news?id=07edf4e259ec611af4d61fb560e59a28bc20b7dad94b21a586968be79b48719d
company,1769058060,Top Picks 2026- Eli Lilly  Co. LLY,138220850,https://s.yimg.com/rz/stage/p/yahoo_finance_en-US_h_p_finance_2.png,LLY,Yahoo,"Eli Lilly & Co. (LLY) needs little introduction, as it’s probably the most popular drug stock in the world right now thanks to Mounjaro (diabetes) and Zepbound (weight loss), which are the same drug selling well under both indications. But we still think the stock can surprise on the upside going forward, says Mike Cintolo, chief investment strategist at Cabot Wealth Network.",https://finnhub.io/api/news?id=ef96a052bb41622401ad64f90de14b4763ab46d3b8e91ad9d8e6e5b6a9c019ef
