category,datetime,headline,id,image,related,source,summary,url
company,1769118147,"Earnings live: Intel stock drops, GE Aerospace tumbles, Capital One announces Brex acquisition",138213201,https://s.yimg.com/rz/stage/p/yahoo_finance_en-US_h_p_finance_2.png,MMM,Yahoo,"A broader set of sectors will be represented when 35 more S&P 500 companies report earnings this week, including Netflix, Procter & Gamble, and Intel.",https://finnhub.io/api/news?id=35b1532e2b00dd9e07273e77c3ebaa8141978153776c0623c7611d232ae1443d
company,1769109696,Why 3M (MMM) Stock Is Trading Up Today,138206983,https://s.yimg.com/rz/stage/p/yahoo_finance_en-US_h_p_finance_2.png,MMM,Yahoo,Shares of industrial conglomerate 3M (NYSE:MMM) jumped 3.7% in the afternoon session after the US president announced a framework for a future deal with Greenland.,https://finnhub.io/api/news?id=625a9093f96799da997f42ef9088548effae235a52759f4abf7078e87dace898
company,1769096674,3M Suffers Tariff Risks - Correction Triggers Dip Buying Opportunity,138208809,https://static.seekingalpha.com/cdn/s3/uploads/getty_images/2232963510/image_2232963510.jpg?io=getty-c-w1536,MMM,SeekingAlpha,3M Company is rated a Buy with the softer FY2026 guidance and the potential Greenland-related tariff risks. Learn more about MMM stock here.,https://finnhub.io/api/news?id=173682c5f23d62ddd363a6868fcb9cef6ef416c81a894dd298248af75fd9e8f9
company,1769094000,"3M, Procter & Gamble share gains lead Dow's 317-point climb",138233080,,MMM,MarketWatch,"3M, Procter & Gamble share gains lead Dow's 317-point climb",https://finnhub.io/api/news?id=80804581ad886a679de74f337c79b46815056eedf506e0ae6cb4d550d3f1d881
company,1769090400,Credo and 3M Enter Into Patent License Agreement,138204709,https://s.yimg.com/rz/stage/p/yahoo_finance_en-US_h_p_finance_2.png,MMM,Yahoo,"SAN JOSE, Calif., January 22, 2026--Credo and 3M enter into patent license agreement.",https://finnhub.io/api/news?id=de9842eb5332e0fe4b60a85bf58b11394365381bc5402834136535264046257f
company,1769087950,"Earnings live: GE Aerospace orders surge, Procter & Gamble stock rises, Abbott tumbles",138206841,https://s.yimg.com/rz/stage/p/yahoo_finance_en-US_h_p_finance_2.png,MMM,Yahoo,"A broader set of sectors will be represented when 35 more S&P 500 companies report earnings this week, including Netflix, Procter & Gamble, and Intel.",https://finnhub.io/api/news?id=2c6f158e213cf99e008a3817a55c075d6b66de568979edd20fc55183c57a1b0c
company,1769087950,"Earnings live: GE Aerospace orders surge, Procter & Gamble and Abbott stocks dip",138203808,https://s.yimg.com/rz/stage/p/yahoo_finance_en-US_h_p_finance_2.png,MMM,Yahoo,"A broader set of sectors will be represented when 35 more S&P 500 companies report earnings this week, including Netflix, Procter & Gamble, and Intel.",https://finnhub.io/api/news?id=0dbc79d78237b39df48b4d83b5c739ecbf08903a9480e2ddda046a19d5163bf3
company,1769082300,"Procter & Gamble, 3M share gains lead Dow's nearly 450-point jump",138233081,,MMM,MarketWatch,"Procter & Gamble, 3M share gains lead Dow's nearly 450-point jump",https://finnhub.io/api/news?id=faa8c21e6977f15ba474cd6a18d75e0240763a702b39e474c051bac16bd91799
