category,datetime,headline,id,image,related,source,summary,url
company,1769105472,Does Lucid (LCID) Using Rockwell Software in Saudi Arabia Reframe Its Manufacturing Execution Risk?,138207033,https://s.yimg.com/rz/stage/p/yahoo_finance_en-US_h_p_finance_2.png,ROK,Yahoo,"Rockwell Automation recently announced it will roll out its FactoryTalk manufacturing execution software and workforce training programs at Lucid Group’s Saudi Arabia plant, aiming to improve production visibility and operational efficiency at the Kingdom’s first vehicle manufacturing site. This expanded collaboration reinforces Saudi Arabia’s Vision 2030 industrial goals while giving Lucid a more sophisticated backbone to support its planned global manufacturing scale-up. We’ll now examine...",https://finnhub.io/api/news?id=395f2a4aedfc408e75267f516a3a093a7070026f1b59d83b669983d5d5c31777
company,1769100540,Rockwell Automation Inc. stock underperforms Thursday when compared to competitors despite daily gains,138241177,,ROK,MarketWatch,Rockwell Automation Inc. stock underperforms Thursday when compared to competitors despite daily gains,https://finnhub.io/api/news?id=2323a25bc5729875e9cd90c59d6530d9def35f6d8748057e611ac7f3c0ab35a7
company,1769092560,Lucid and Rockwell Strengthen Production Backbone in Saudi Arabia,138205966,https://s.yimg.com/rz/stage/p/yahoo_finance_en-US_h_p_finance_2.png,ROK,Yahoo,"Lucid deepens ties with Rockwell Automation to scale its Saudi EV plant, boosting real-time control and output.",https://finnhub.io/api/news?id=24012988c09d4a3565324ca696c11e02f37f6d871634cabf76619e3d18ee37c5
company,1769087594,Lucid Group (LCID) Soars 20% on International Expansion,138203960,https://s.yimg.com/rz/stage/p/yahoo_finance_en-US_h_p_finance_2.png,ROK,Yahoo,"We recently published 10 Big Names Leaving Wall Street Behind; 7 Are Hitting Record Highs. Lucid Group Inc. (NASDAQ:LCID) was one of the worst performers on Wednesday. Lucid Group soared by as much as 19.6 percent on Wednesday to hit $11.64 at intra-day trading, as investors took heart from its planned manufacturing expansion in Saudi […]",https://finnhub.io/api/news?id=bf50edb3d963a694a8ffd25a41eb89a304adaf57964ada48689bf48aa83811b6
company,1769083200,Rockwell Automation to Report First Quarter Fiscal 2026 Results,138203961,https://s.yimg.com/rz/stage/p/yahoo_finance_en-US_h_p_finance_2.png,ROK,Yahoo,"MILWAUKEE, January 22, 2026--Rockwell Automation, Inc. (NYSE: ROK) is scheduled to report its first quarter fiscal 2026 results on Thursday, Feb. 5, before the market opens. The release will be posted on the Rockwell Investor Relations website at www.rockwellautomation.com/en-us/investors.html.",https://finnhub.io/api/news?id=61a1689d86bd4cb3f0d57b78b47d117ea6da3625c69b4bc72d8e641d1e8f9c79
