category,datetime,headline,id,image,related,source,summary,url
company,1769126400,Why American Shale Know-How Is Becoming a Global Export,138220327,https://s.yimg.com/rz/stage/p/yahoo_finance_en-US_h_p_finance_2.png,SLB,Yahoo,Developing shale basins include the Vaca Muerta in Argentina and the Diyarbakir basin in Turkiye.,https://finnhub.io/api/news?id=4e1c5f820eed24de1e4fbdbc94e8892bbdf33348523cb4bf4b18f0ad4dbb7153
company,1769124300,"Energy Stocks Steady Amid Macro Chaos, With A Sunday Night Earnings Surprise Ahead",138221029,https://static.seekingalpha.com/cdn/s3/uploads/getty_images/2256336734/image_2256336734.jpg?io=getty-c-w1536,SLB,SeekingAlpha,"Bond market stress, global geopolitical risk, and weather shocks at home have lifted Energy to the top sector spot YTD.",https://finnhub.io/api/news?id=8b48d8806fa5df739a3bb67a21704f06655b7f449330b7c08bdfa8f85350fad6
company,1769100180,SLB Ltd. stock outperforms competitors on strong trading day,138238344,,SLB,MarketWatch,SLB Ltd. stock outperforms competitors on strong trading day,https://finnhub.io/api/news?id=556b71340eee7d23db1d85a410ab564f225259ca94b32107c80371570379b8ea
company,1769077800,Change in Venezuela Isn’t the Only Reason to Own Oil-Field-Services Stocks,138203123,https://s.yimg.com/rz/stage/p/yahoo_finance_en-US_h_p_finance_2.png,SLB,Yahoo,"Oil-field-services giants have been among the biggest gainers in the energy universe since Maduro’s capture:  SLB  and  Halliburton’s  shares have appreciated 21% and 13%, respectively, outpacing the 6.8% gain for an ETF tracking large oil-and-gas-sector companies.  This is especially true for Halliburton, whose business depends more heavily on the short-cycle shale producers in the U.S. that are more reactive to oil prices.  Halliburton on its earnings call on Wednesday said that revenue in North America fell 6% in 2025; it expects another high-single-digit percentage decline in 2026.",https://finnhub.io/api/news?id=76d8cf3b887a03abe9a79b911dac26f58ce7c13ee13050191fefc73c2023bb51
company,1769076539,Assessing SLB (NYSE:SLB) Valuation As Recent Share Price Momentum Accelerates,138203209,https://s.yimg.com/rz/stage/p/yahoo_finance_en-US_h_p_finance_2.png,SLB,Yahoo,"Why SLB (SLB) May Be On Your Radar Today SLB (SLB) has drawn attention recently, with the stock last closing at $48.52 and showing double digit total returns over the past month and past 3 months, as well as over 1 year and 5 years. For investors watching the energy sector, the company’s current valuation metrics, recent share performance, and fundamentals such as revenue of $35.247b and net income of $3.645b may prompt a closer look at whether the recent move aligns with their portfolio...",https://finnhub.io/api/news?id=4f67efa7c0f19e662c50858ba54fb18ab3ed2b5a50f6350c57d79dd8d957ab93
company,1769069400,Top Oil Companies To Invest In For An Oil Sector Revival,138203599,https://static.seekingalpha.com/cdn/s3/uploads/getty_images/2155273281/image_2155273281.jpg?io=getty-c-w1536,SLB,SeekingAlpha,"Oilfield services and refiners face short-term volatility, but structural demand supports a cautiously constructive outlook for 2026. Read more here.",https://finnhub.io/api/news?id=793301b9983a56a853a2b8a6a11419e999e4a2450257907afaf09eb5f596a980
company,1769062097,Does SLB’s Aramco Win and Tech Expansion Change The Bull Case For SLB (SLB)?,138201890,https://s.yimg.com/rz/stage/p/yahoo_finance_en-US_h_p_finance_2.png,SLB,Yahoo,"In recent weeks, Archer announced that, in collaboration with SLB, it secured an integrated plug and abandonment contract from Equinor for the Titan platform in the Gulf of America, while SLB also completed its purchase of RESMAN Energy Technology and won a five-year stimulation services contract with Aramco for Saudi Arabia’s unconventional gas fields. Together, these moves show SLB expanding both its advanced reservoir-monitoring toolkit and its presence in long-cycle, technically complex...",https://finnhub.io/api/news?id=00f9df607025fe60d06da34a476d05165fda19cb098acbaf7c78853190d2311d
