category,datetime,headline,id,image,related,source,summary,url
company,1769122800,"TradFi firms are increasingly warming to cryptocurrencies, says Bybit CEO Ben Zhou",138220855,https://s.yimg.com/rz/stage/p/yahoo_finance_en-US_h_p_finance_2.png,V,Yahoo,"“If they don't embrace it, they will be obsolete, especially with crypto wallet adoption growing 20 to 30% each year.”",https://finnhub.io/api/news?id=af75b3d4ca1fd0461d7a0139c1ebe57c367a9ad12cd505c98c798d3babd4f6ad
company,1769111400,1 Blue Chip Stock I Keep Doubling Down On No Matter What,138213199,https://s.yimg.com/rz/stage/p/yahoo_finance_en-US_h_p_finance_2.png,V,Yahoo,This finance sector stock has become one of my favorite long-term holds.,https://finnhub.io/api/news?id=37bfccdb160a8b20f01e966362c0ea91cbf3cbeafb3fb263a98c9f222bb7d1df
company,1769106540,Does Mastercard's Agoda Deal Mark a New Phase in Rewards?,138213200,https://s.yimg.com/rz/stage/p/yahoo_finance_en-US_h_p_finance_2.png,V,Yahoo,"MA's Agoda partnership brings instant travel redemptions to loyalty programs, signaling a shift toward experience-driven, digital-first rewards.",https://finnhub.io/api/news?id=f3d3b52e8665153127c23470a03e854913f6d2f98f914bfa32b0a181a70e6d31
company,1769105334,Visa Enables Apple Pay Support for Chinese Visa Cardholders,138206838,https://s.yimg.com/rz/stage/p/yahoo_finance_en-US_h_p_finance_2.png,V,Yahoo,"Visa Inc. (NYSE:V) is one of the 15 Best S&P 500 Stocks to Look For in 2026. On January 15, Visa Inc. (NYSE:V) announced that it has enabled Apple Pay support for Chinese Visa cardholders. Eligible customers from the partnering Chinese banks will be allowed to add their Visa cards to Apple Pay and make […]",https://finnhub.io/api/news?id=a49f8d1cfe764ab844c8dcc30e7d7e5e0ad626adef9b401f865a95a8466bc020
company,1769103221,Trump's call for a 10% credit card rate cap is 'inconceivable',138205772,https://s.yimg.com/rz/stage/p/yahoo_finance_en-US_h_p_finance_2.png,V,Yahoo,"Trump called on Congress to implement a 10% cap on credit card interest rates, but Wolfe Research head of US policy and politics Tobin Marcus says that the odds of the cap coming to fruition are ""essentially zero,"" highlighting unintended consequences for consumers. Marcus tells Market Catalysts Host Julie Hyman that some of the other affordability-focused efforts that Trump has called for — like banning large institutional investors from buying single-family homes — and the Credit Card Competition Act are unlikely, but not ""inconceivable"" like the credit card rate cap. To watch more expert insights and analysis on the latest market action, check out more Market Catalysts.",https://finnhub.io/api/news?id=80e741c33b3aef6a50bbbea147182698d6fa7e5e1f51eec7e0c26a3a03ac221d
company,1769094627,How Visa (V) Price Targets Are Reframing The Long Term Investment Story,138204581,https://s.yimg.com/rz/stage/p/yahoo_finance_en-US_h_p_finance_2.png,V,Yahoo,"Visa's latest price target update reflects a shift in how the market is framing its long term story, not just a single data point. Analysts are reworking their assumptions around the company’s role in global payments and the pace of change across digital spending, which feeds directly into this revised target. Stay with this article to see how you can keep on top of future updates to Visa's evolving narrative. Analyst Price Targets don't always capture the full story. Head over to our Company...",https://finnhub.io/api/news?id=a75b28c24e8ca3c631684e33e13b4319e26ae94e432921f1936243593f1f56b0
company,1769094003,Visa (V) Reports Next Week: Wall Street Expects Earnings Growth,138205779,https://s.yimg.com/rz/stage/p/yahoo_finance_en-US_h_p_finance_2.png,V,Yahoo,Visa (V) doesn't possess the right combination of the two key ingredients for a likely earnings beat in its upcoming report. Get prepared with the key expectations.,https://finnhub.io/api/news?id=4534e7233736b09e8ae84af7ffe230badc849a61672b7899e5783ec58684d70b
