category,datetime,headline,id,image,related,source,summary,url
company,1768517400,These 3 Blue Chip Dividend Stocks Are Trading Near Their 52-Week Lows,138137497,https://s.yimg.com/rz/stage/p/yahoo_finance_en-US_h_p_finance_2.png,HD,Yahoo,The stocks have been raising their payouts for years and have solid underlying businesses.,https://finnhub.io/api/news?id=d5efd81e655a733f915cab295e8a05057eeb8cb2c11d9ed0705a07bc0eabb4bd
company,1768509781,"The Home Depot, Inc. (HD): A Bear Case Theory",138132338,https://s.yimg.com/rz/stage/p/yahoo_finance_en-US_h_p_finance_2.png,HD,Yahoo,"We came across a bearish thesis on The Home Depot, Inc. on The Frugal Investor’s YouTube Channel. In this article, we will summarize the bears’ thesis on HD. The Home Depot, Inc.’s share was trading at $379.74 as of January 13th. HD’s trailing and forward P/E were 25.90 and 25.19, respectively according to Yahoo Finance. The […]",https://finnhub.io/api/news?id=5838c86b747fa8bf987b3ac8d1bd755a92170b5310178a16ba2431fd1d476e78
company,1768505423,"Rubrik, Inc. (RBRK): A Bull Case Theory",138126357,https://s.yimg.com/rz/stage/p/yahoo_finance_en-US_h_p_finance_2.png,HD,Yahoo,"We came across a bullish thesis on Rubrik, Inc. on Hidden Market Gems’s Substack. In this article, we will summarize the bulls’ thesis on RBRK. Rubrik, Inc.’s share was trading at $71.37 as of January 12th. RBRK’s trailing P/E was 24.66 according to Yahoo Finance. Rubrik Inc. (RBRK) is a Palo Alto–based cybersecurity and cloud data management company […]",https://finnhub.io/api/news?id=e3f1a2ba44136b33b64303fd87ab6d10cd308d0dc3a82fd5f1eea6984f6e64d8
company,1768482660,Reviewing All My Stocks - December Dividend Income Report,138123212,https://static.seekingalpha.com/cdn/s3/uploads/getty_images/2184156762/image_2184156762.jpg?io=getty-c-w1536,HD,SeekingAlpha,"I significantly underperformed the market in 2025 (7.34% vs. 20.50% for my benchmark). However, it means little as I donât invest for 12 months, but for 40 years.",https://finnhub.io/api/news?id=2cd0f48ab37b188fe9b0e774b55f94659f8c8f111c973273e142e9fd833338ec
company,1768482354,The One Data Point That Changed My Dividend Growth Strategy,138123039,https://static.seekingalpha.com/cdn/s3/uploads/getty_images/1320148440/image_1320148440.jpg?io=getty-c-w1536,HD,SeekingAlpha,AI-related infrastructure companies are currently the most attractive risk-adjusted dividend growth plays in the market today. Read what investors need to know.,https://finnhub.io/api/news?id=ec066d63c769c602b8f1715103beb15b746bd2ac6f66926bd084b0166ceb158a
company,1768479309,Home Depot Deepens Push Into AI,138120570,https://s.yimg.com/rz/stage/p/yahoo_finance_en-US_h_p_finance_2.png,HD,Yahoo,New tools target shoppers and store teams,https://finnhub.io/api/news?id=3cd4f31a47071a866fc7a580bc62746e915cb5b6f1af739e926c8e8a7b18914b
company,1768477813,U.S. Economy: What It Would Take To Bring Back Home Affordability,138122174,https://static.seekingalpha.com/cdn/s3/uploads/getty_images/2209734748/image_2209734748.jpg?io=getty-c-w1536,HD,SeekingAlpha,Housing affordability is heating up ahead of midterms.,https://finnhub.io/api/news?id=7bb43f68e4a592d9bfc0616f725d239acc5969a53fdd886cbdc085061f2bdaca
