category,datetime,headline,id,image,related,source,summary,url
company,1768518002,Howmet (HWM) Outpaces Stock Market Gains: What You Should Know,138143205,https://s.yimg.com/rz/stage/p/yahoo_finance_en-US_h_p_finance_2.png,HWM,Yahoo,"In the most recent trading session, Howmet (HWM) closed at $224.26, indicating a +1.82% shift from the previous trading day.",https://finnhub.io/api/news?id=8d0a84592dccb7c468b64c2d093c8c225cb1a15ac9a8c2dc9f13dcd816db0bff
company,1768495200,Howmet Aerospace Inc. stock outperforms competitors on strong trading day,138211059,,HWM,MarketWatch,Howmet Aerospace Inc. stock outperforms competitors on strong trading day,https://finnhub.io/api/news?id=dcbce753d58525b76bfe64919b84becbd2fe77218ec7fbc7cda71c4fc6771f0b
company,1768488902,RSPN: Industrials Dashboard For January,138127015,https://static.seekingalpha.com/cdn/s3/uploads/getty_images/476259318/image_476259318.jpg?io=getty-c-w1536,HWM,SeekingAlpha,"Industrials look overvalued. Learn more about RSPN vs. XLI, risk and returns, plus eight cheaper industrial stocks to watch now.",https://finnhub.io/api/news?id=bc42aa6cff4a15f3c2f6946d363ddbe4f0620ffa39738dc0ce2aa169cbacf3c1
company,1768482477,How Investors Are Reacting To Howmet Aerospace (HWM) Pivot Toward High-Margin Aftermarket And CAM Deal,138120784,https://s.yimg.com/rz/stage/p/yahoo_finance_en-US_h_p_finance_2.png,HWM,Yahoo,"In recent months, Howmet Aerospace reported strong Q3 2025 results with revenue up 14%, repeatedly raised its 2025 guidance, and agreed to acquire Consolidated Aerospace Manufacturing from Stanley Black & Decker for US$1.80 billion in cash, a deal expected to add nearly US$500 million in annual revenue and deliver a significant 2026 tax benefit. Together with Howmet’s pivot toward higher-margin aftermarket services and its concentration in critical engine components, these moves highlight a...",https://finnhub.io/api/news?id=5c359ad21b0a3c12aaa156d5bee9d159928ba19f040a213037f4575b8a6c2f42
company,1768482000,Howmet Aerospace to Host Webcast and Announce Fourth Quarter and Full Year 2025 Results,138120785,https://s.yimg.com/rz/stage/p/yahoo_finance_en-US_h_p_finance_2.png,HWM,Yahoo,"Howmet Aerospace Inc. (NYSE: HWM) will announce its fourth quarter and full year 2025 financial results on Thursday, February 12, 2026. The press release and presentation materials will be available at approximately 7:00 AM ET on February 12, 2026, via the ""Investors"" section of the Howmet Aerospace website.",https://finnhub.io/api/news?id=1b8f562869167c1f1641c59f0e66ab7ab9caf33ea1deff4c8e935c6e745a13d5
company,1768439330,Is It Too Late To Consider Howmet Aerospace (HWM) After An 81% One Year Surge?,138116737,https://s.yimg.com/rz/stage/p/yahoo_finance_en-US_h_p_finance_2.png,HWM,Yahoo,"If you are wondering whether Howmet Aerospace's current share price still makes sense after a strong run, this article will walk through what that price might be implying about the company. The stock last closed at US$220.25, with returns of 4.4% over 7 days, 11.7% over 30 days, 4.0% year to date and 81.2% over 1 year, along with a very large return over 3 and 5 years that is around 7x over 5 years. Recent coverage has focused on Howmet Aerospace as a long term structural supplier to...",https://finnhub.io/api/news?id=2bfbca79d538e048c1d98b6cce8f2cf7b935ddbd29d6fc87d39357feee6ce7bb
