category,datetime,headline,id,image,related,source,summary,url
company,1768511700,Invesco Mortgage Capital Inc. Announces Monthly Common Dividend and Provides Update on Book Value and Leverage,138132797,https://s.yimg.com/rz/stage/p/yahoo_finance_en-US_h_p_finance_2.png,IVZ,Yahoo,"Invesco Mortgage Capital Inc. (NYSE: IVR) (the ""Company"") today announced the declaration of a cash dividend of $0.12 per share of common stock for the month of January 2026. The dividend will be paid on February 13, 2026 to stockholders of record at the close of business on January 26, 2026, with an ex-dividend date of January 26, 2026.",https://finnhub.io/api/news?id=6165f7f40dbb0e991eb4ae09f6b3c140aa9037ffc8cb006826c1b77fe5f40d8c
company,1768509942,Why Invesco (IVZ) Stock Is Trading Up Today,138132798,https://s.yimg.com/rz/stage/p/yahoo_finance_en-US_h_p_finance_2.png,IVZ,Yahoo,Shares of asset management firm Invesco (NYSE:IVZ) jumped 3.5% in the afternoon session after Barclays raised its price target on the stock and the company announced a major transaction for its Canadian fund business.,https://finnhub.io/api/news?id=c50e50a0d584c73dbe4aebfb5b03e2db406bb049178c42170809f985f7d184d7
company,1768494360,BlackRock Beats on Q4 Earnings as Revenues & AUM Increase Y/Y,138126534,https://s.yimg.com/rz/stage/p/yahoo_finance_en-US_h_p_finance_2.png,IVZ,Yahoo,"BLK beats Q4 earnings as revenues surge and AUM hits a record high, lifted by strong net inflows despite higher expenses.",https://finnhub.io/api/news?id=313f7e28cee740634da5f80b67db4e23b9e312567b650fa0aa8119efb83ab76c
company,1768482784,Invesco’s Sleepy ETF Ended Up Ripping 33% While No One Was Watching,138121851,https://s.yimg.com/rz/stage/p/yahoo_finance_en-US_h_p_finance_2.png,IVZ,Yahoo,"While investors obsessed over artificial intelligence stocks and the Magnificent Seven throughout 2025, Invesco KBW Bank ETF (NYSEARCA:KBWB) quietly delivered a 33% return with barely a mention on Reddit or mainstream financial media. The ETF tracks 24 of the largest U.S. banks using an equal-weight methodology, which proved to be its secret weapon during a ... Invesco’s Sleepy ETF Ended Up Ripping 33% While No One Was Watching",https://finnhub.io/api/news?id=77d1f63285e6cafeae90bc4e03f2babe3b6f2bcd3c279b2f4434b6842958100a
company,1768482558,Is It Too Late To Consider Invesco (IVZ) After Its 73% One-Year Rally?,138120879,https://s.yimg.com/rz/stage/p/yahoo_finance_en-US_h_p_finance_2.png,IVZ,Yahoo,"If you are wondering whether Invesco's share price fairly reflects its prospects today, you are not alone. This article is built to help you frame that question clearly. Over the most recent periods, Invesco's shares closed at US$28.25, with returns of 2.0% over 7 days, 8.5% over 30 days, 4.9% year to date, 73.0% over 1 year, 71.2% over 3 years and 61.3% over 5 years. These figures may influence how you think about upside and risk right now. Recent coverage around Invesco has focused on its...",https://finnhub.io/api/news?id=dd8b22677aaa16b610b2bdee04033e6a615bc7a888c0ddb01d5d53a8d066ae70
company,1768476002,Should Invesco S&P MidCap 400 Pure Growth ETF (RFG) Be on Your Investing Radar?,138120880,https://s.yimg.com/rz/stage/p/yahoo_finance_en-US_h_p_finance_2.png,IVZ,Yahoo,Style Box ETF report for RFG,https://finnhub.io/api/news?id=a2b12d55aada33e4d86176eb083c69a8f0d6d62affb2cc67f772185e04fea1f0
