category,datetime,headline,id,image,related,source,summary,url
company,1768505093,Friday's big stock stories: What’s likely to move the market in the next trading session,138153290,https://image.cnbcfm.com/api/v1/image/108212980-1760624130662-gettyimages-2241301832-bb2_4903_97rgamzj.jpeg?v=1760624190&w=1920&h=1080,MTB,CNBC,"Post-earnings gains for Morgan Stanley and Goldman Sachs, as well as a rally in chips, helped lift the major averages to a positive session Thursday.",https://finnhub.io/api/news?id=52f68032e33e5c17a61ea13102808f1a9e18da729ff550e1da3e046b8a768ddc
company,1768497006,Will M&T Bank (MTB) Beat Estimates Again in Its Next Earnings Report?,138126803,https://s.yimg.com/rz/stage/p/yahoo_finance_en-US_h_p_finance_2.png,MTB,Yahoo,M&T Bank (MTB) has an impressive earnings surprise history and currently possesses the right combination of the two key ingredients for a likely beat in its next quarterly report.,https://finnhub.io/api/news?id=a9d4c68d9b6a165db74950805bf1eef080bd06ca8aaeff7e8cac23b166ae79f8
company,1768496220,M&T Bank Corp. stock outperforms competitors on strong trading day,138216906,,MTB,MarketWatch,M&T Bank Corp. stock outperforms competitors on strong trading day,https://finnhub.io/api/news?id=91a34e3745ae7d63f56795c78661339ff9235c4bb271acb6eb897fb1bf68a8ec
company,1768474808,Investors in M&T Bank (NYSE:MTB) have seen decent returns of 71% over the past five years,138119918,https://s.yimg.com/rz/stage/p/yahoo_finance_en-US_h_p_finance_2.png,MTB,Yahoo,"When you buy and hold a stock for the long term, you definitely want it to provide a positive return. Better yet, you'd...",https://finnhub.io/api/news?id=ce8a3c079506053937fed4faa672f65186cf01f4b16835a5f561bd4d132e528e
company,1768465536,"Bank Earnings, Fed Speakers, Jobless Claims: Still to Come This Week",138119147,https://s.yimg.com/rz/stage/p/yahoo_finance_en-US_h_p_finance_2.png,MTB,Yahoo,"More big banks are scheduled to report earnings on Thursday. Investors will also check for any fallout from the criminal probe into Federal Reserve Chair Jerome Powell, plus any news on who may be the central bank's next chair.",https://finnhub.io/api/news?id=a3a54daba105742419f99a37b8217e73d6d53efd8d72495ddc59f1e89a86e7ee
company,1768446108,M&T Bank (MTB) Reports Q4: Everything You Need To Know Ahead Of Earnings,138117243,https://s.yimg.com/rz/stage/p/yahoo_finance_en-US_h_p_finance_2.png,MTB,Yahoo,Regional banking company M&T Bank (NYSE:MTB) will be reporting results this Friday before market open. Here’s what investors should know.,https://finnhub.io/api/news?id=cfd658c2653464432f1ebf3c672beb7c9a102bea3cf391369bb2cf4e07a8bae8
