category,datetime,headline,id,image,related,source,summary,url
company,1768495380,TE Connectivity PLC stock outperforms competitors on strong trading day,138212663,,TEL,MarketWatch,TE Connectivity PLC stock outperforms competitors on strong trading day,https://finnhub.io/api/news?id=3d674b7525c216e7fe4b148d2b4a23d44787b26368f2768a41ad150e3abcd493
company,1768494960,LightPath Technologies (LPTH) Surges 13.5%: Is This an Indication of Further Gains?,138126671,https://s.yimg.com/rz/stage/p/yahoo_finance_en-US_h_p_finance_2.png,TEL,Yahoo,LightPath Technologies (LPTH) saw its shares surge in the last session with trading volume being higher than average. The latest trend in earnings estimate revisions may not translate into further price increase in the near term.,https://finnhub.io/api/news?id=d97b57e8538b4791019ddcab194e0e57d2d11764718c675a54dc7e0bb41fc704
company,1768486506,Stay Ahead of the Game With TE Connectivity (TEL) Q1 Earnings: Wall Street's Insights on Key Metrics,138122864,https://s.yimg.com/rz/stage/p/yahoo_finance_en-US_h_p_finance_2.png,TEL,Yahoo,"Evaluate the expected performance of TE Connectivity (TEL) for the quarter ended December 2025, looking beyond the conventional Wall Street top-and-bottom-line estimates and examining some of its key metrics for better insight.",https://finnhub.io/api/news?id=2ae111727223c950d09bfd84dc23722123ac6914a3900f1afd700e429c9b0648
company,1768482045,This Indicator Identified Strength In Rocket Lab Ahead Of Its Powerful Breakout,138120731,https://s.yimg.com/rz/stage/p/yahoo_finance_en-US_h_p_finance_2.png,TEL,Yahoo,Rocket Lab Stock: The Ants Indicator identified strength in the space name ahead of its powerful breakout move in December.,https://finnhub.io/api/news?id=6f93aa742ae2607170921768b5bff4420ea5ffbbab6c6f87032d964d5aa7040e
company,1768482002,"Funds Make Deep Connection With This AI Play — So Do Nvidia, Tesla",138120530,https://s.yimg.com/rz/stage/p/yahoo_finance_en-US_h_p_finance_2.png,TEL,Yahoo,"For a third straight month, TE Connectivity popped onto the list of new buys by top funds as it looks to spark a breakout.",https://finnhub.io/api/news?id=963b4a02172b2dd8dbc4c518dfb978e3418a967e7f094becb2d5e43ab05f6f8e
