category,datetime,headline,id,image,related,source,summary,url
company,1769385170,"Samsung to start production of HBM4 chips next month for Nvidia supply, source says",138256763,https://s.yimg.com/rz/stage/p/yahoo_finance_en-US_h_p_finance_2.png,AMD,Yahoo,"Samsung Electronics plans to ​start production of ‌its next-generation high-bandwidth memory (HBM) chips, or ‌HBM4, starting next month and supply them to Nvidia, a person ⁠familiar with ‌the matter told Reuters on Monday. The person ‍declined to give details such as how many chips ​it plans to supply ‌to Nvidia. A Samsung spokesperson declined to comment.",https://finnhub.io/api/news?id=849a53822c7a59d639c551825f3b5fc4ad69f3f17eb974c21688e830a0fb9717
company,1769375100,Nvidia's 85% GPU Market Share Faces Growing Competition: Is This AI Stock Still a Buy for 2026?,138256347,https://s.yimg.com/rz/stage/p/yahoo_finance_en-US_h_p_finance_2.png,AMD,Yahoo,The AI hardware market is heating up with mounting competition. Is Nvidia still the leader of the industry?,https://finnhub.io/api/news?id=9ec7746290b8c406d0d840679596e66979f2a4ff7eb4ca25b688d17565b41c79
company,1769371318,CNBC Daily Open: Canada is drawing Trump's ire — and faces a 100% tariff,138262842,https://image.cnbcfm.com/api/v1/image/108256210-17691710632026-01-23t023824z_359957567_rc2m6ja3en04_rtrmadp_0_usa-trump.jpeg?v=1769171091&w=1920&h=1080,AMD,CNBC,"Trump threatened Canada with tariffs of 100% if it strikes a deal with China. Trump also withdrew an invitation to the Canada to join his ""Board of Peace.""",https://finnhub.io/api/news?id=0371760d21171afa9decfaf17986918eadd17cd35133a9c2f220d2739c1ccdb2
company,1769351974,China Opens Door to Nvidia H200 Chips But Questions Outnumber Answers,138253941,https://s.yimg.com/rz/stage/p/yahoo_finance_en-US_h_p_finance_2.png,AMD,Yahoo,"China has reportedly indicated willingness to approve NVIDIA (NASDAQ:NVDA) H200 chips for import. The timing, conditions, and competitive dynamics present a complex situation for the company’s China market strategy. The Approval That Isn’t Really an Approval Jensen Huang is currently in Shanghai. China is “poised to approve” H200 imports. Questions remain about whether this represents ... China Opens Door to Nvidia H200 Chips But Questions Outnumber Answers",https://finnhub.io/api/news?id=dced40a780c97b9bf0c681ba10d394cfe05d32fba7a5824a79f07034e8dced05
company,1769336400,"Prediction: This Will Be the Next Artificial Intelligence (AI) Chip Stock to Join Nvidia, Taiwan Semiconductor, and Broadcom in the Trillion-Dollar Club (Hint: It's Not AMD)",138252418,https://s.yimg.com/rz/stage/p/yahoo_finance_en-US_h_p_finance_2.png,AMD,Yahoo,"The trillion-dollar club features three artificial intelligence (AI) chip stocks, and another could soon join the ranks.",https://finnhub.io/api/news?id=8f9c2c24a5a14376c885b92c730ace534fe5f1a3a24ca51867acb2b18eccd0d1
