category,datetime,headline,id,image,related,source,summary,url
company,1769375419,How Investors May Respond To Walt Disney (DIS) Unifying Marketing Under New Chief Brand Officer,138256392,https://s.yimg.com/rz/stage/p/yahoo_finance_en-US_h_p_finance_2.png,DIS,Yahoo,"Earlier this month, The Walt Disney Company created a new enterprise-wide marketing and brand organization led by Asad Ayaz as Chief Marketing and Brand Officer to better coordinate its marketing efforts and strengthen how it connects with consumers globally. This restructuring, alongside recent creative successes such as Zootopia 2 and stronger results from streaming and parks, underscores Disney’s focus on unifying its brand message across all businesses. Next, we’ll explore how this...",https://finnhub.io/api/news?id=9d7272fe00538ed5be2f2a20abf46ec82b7a61e8ce82f40147f49f2c994625bd
company,1769373960,"Disney’s Surprise Box Office Champion is ‘Zootopia 2,’ Thanks to China",138256393,https://s.yimg.com/rz/stage/p/yahoo_finance_en-US_h_p_finance_2.png,DIS,Yahoo,"Walt  Disney  Animation Studios has been partying a lot since “Zootopia 2” opened in November.  Artists and executives celebrated with Champagne toasts when their sequel crossed $1 billion at the global box office, when it became their biggest movie ever, and when it surpassed Pixar’s “Inside Out 2” to become the highest grossing American animated film of all time, with $1.74 billion so far.  Many in Hollywood predicted  Disney  would have the top-grossing movie of 2025, but they didn’t think it would be a cartoon about a city of talking animals.",https://finnhub.io/api/news?id=46d0c53513c8c3fb13f34949a5ac2dad728e8a94743dceebe8f9fab7369ce9aa
company,1769360400,Seven People Who Changed the Course of American Entertainment,138255830,https://s.yimg.com/rz/stage/p/yahoo_finance_en-US_h_p_finance_2.png,DIS,Yahoo,"From P.T. Barnum to Walt Disney, these pioneers reimagined how the public wanted to be entertained—before the public realized it themselves.",https://finnhub.io/api/news?id=c99c04f34eb784839c0f053dab78fd38b260508567e16386fed77f404858af2e
company,1769359260,Amazon’s ‘Mercy’ unseats ‘Avatar: Fire & Ash’ as winter storm hampers box office,138267062,,DIS,MarketWatch,Amazon’s ‘Mercy’ unseats ‘Avatar: Fire & Ash’ as winter storm hampers box office,https://finnhub.io/api/news?id=8636f7c44f15a4cffab25869c100ca5b23d09e5b7568a3057f17e18a8597d2ec
company,1769355960,"Disney’s Surprise Box-Office Champion is ‘Zootopia 2,’ Thanks to China",138284086,,DIS,DowJones,"Disney’s Surprise Box-Office Champion is ‘Zootopia 2,’ Thanks to China",https://finnhub.io/api/news?id=8d7d1c9248d9825f259ac40d69cdca065e33d00165c481580bb0946743fd9a9d
