category,datetime,headline,id,image,related,source,summary,url
company,1769376960,"Billionaire David Tepper Sells Oracle, Micron, and Intel, and Buys an AI Stock Up 31,000% Since Its IPO",138256371,https://s.yimg.com/rz/stage/p/yahoo_finance_en-US_h_p_finance_2.png,INTC,Yahoo,This chip stock is another contrarian play from Tepper.,https://finnhub.io/api/news?id=cfb54f86074079d03280b20c1bb2cb9576a42d823d67140cd55fad6b2e903d54
company,1769371318,CNBC Daily Open: Canada is drawing Trump's ire — and faces a 100% tariff,138262842,https://image.cnbcfm.com/api/v1/image/108256210-17691710632026-01-23t023824z_359957567_rc2m6ja3en04_rtrmadp_0_usa-trump.jpeg?v=1769171091&w=1920&h=1080,INTC,CNBC,"Trump threatened Canada with tariffs of 100% if it strikes a deal with China. Trump also withdrew an invitation to the Canada to join his ""Board of Peace.""",https://finnhub.io/api/news?id=0371760d21171afa9decfaf17986918eadd17cd35133a9c2f220d2739c1ccdb2
company,1769367780,Asia-Pacific stocks trade mixed as geopolitical worries keep investors on edge,138262905,https://image.cnbcfm.com/api/v1/image/108189994-1756078681534-gettyimages-626017422-_elx1096.jpeg?v=1756171372&w=1920&h=1080,INTC,CNBC,"Asia-Pacific markets traded mixed Monday as investors continued to pile into gold, sending it to fresh highs.",https://finnhub.io/api/news?id=65ce3f3d9aae3d698c0b7855b2348a0812397529c926eebfd43655e239d843bb
company,1769364109,"S&P 500 rises as Apple, Meta gain ahead of earnings: Live updates",138262852,https://image.cnbcfm.com/api/v1/image/108255823-1769115929731-108255823-17691004432026-01-22t163423z_210834275_rc2d6jaudhs3_rtrmadp_0_usa-stocks.jpeg?v=1769115947&w=1920&h=1080,INTC,CNBC,"The S&P 500 ticked higher as traders braced for a big week, with key earnings reports and a U.S. monetary policy meeting.",https://finnhub.io/api/news?id=158f0bfae4ec7428a2f2270765845aa22d5887172d3a61fae288dc1d4120f93e
company,1769363220,Bank of America resets Intel stock forecast,138254730,https://s.yimg.com/rz/stage/p/yahoo_finance_en-US_h_p_finance_2.png,INTC,Yahoo,"Intel reported its Q4 earnings on January 22. The guidance provided by the company for Q1 disappointed investors, and the stock took a tumble on the following day, closing at $45.07, or 17.03% lower, according to Yahoo Finance. During the earnings call, Lip-Bu Tan, CEO of Intel, addressed the ...",https://finnhub.io/api/news?id=90a97304a09245ced216dfb44f5946a6848b4a588e313be9d4a60ba2cf64817f
company,1769360402,Intel’s Nvidia-Like Rally Faces a Reality Check: Should You Buy the Dip In INTC Stock?,138256348,https://s.yimg.com/rz/stage/p/yahoo_finance_en-US_h_p_finance_2.png,INTC,Yahoo,Intel stock is trading sharply lower today after the company gave soft guidance for Q1. Should you buy the dip in INTC stock?,https://finnhub.io/api/news?id=502aea0d22e81398dee614788aacb0f2c950449df3b177b331cf12609c90dcc3
company,1769351974,China Opens Door to Nvidia H200 Chips But Questions Outnumber Answers,138253941,https://s.yimg.com/rz/stage/p/yahoo_finance_en-US_h_p_finance_2.png,INTC,Yahoo,"China has reportedly indicated willingness to approve NVIDIA (NASDAQ:NVDA) H200 chips for import. The timing, conditions, and competitive dynamics present a complex situation for the company’s China market strategy. The Approval That Isn’t Really an Approval Jensen Huang is currently in Shanghai. China is “poised to approve” H200 imports. Questions remain about whether this represents ... China Opens Door to Nvidia H200 Chips But Questions Outnumber Answers",https://finnhub.io/api/news?id=dced40a780c97b9bf0c681ba10d394cfe05d32fba7a5824a79f07034e8dced05
company,1769331647,"Seaport Global Turns Bullish on Intel (INTC), Citing Strong PC Signals and Foundry Progress",138251861,https://s.yimg.com/rz/stage/p/yahoo_finance_en-US_h_p_finance_2.png,INTC,Yahoo,"Intel Corporation (NASDAQ:INTC) is one of the Buzzing AI Stocks Analysts are Watching. On January 20, Seaport Global Securities analyst Jay Goldberg upgraded the stock to “Buy” from Neutral with a price target of $65. The firm is cautiously optimistic on the stock, noting that INTC is back on track, but a full turnaround at […]",https://finnhub.io/api/news?id=1de0a717bf2268862198ea6d941dd1ab1b53f25a136650e40c532dca85cd6560
