category,datetime,headline,id,image,related,source,summary,url
company,1769384429,"Dow Jones Futures Fall; Trump Tariffs, Government Shutdown, Big Earnings In Focus",138256768,https://s.yimg.com/rz/stage/p/yahoo_finance_en-US_h_p_finance_2.png,TSLA,Yahoo,"President Donald Trump threatened a 100% tariff on Canada. Government shutdown risks soared. Tesla, Microsoft, Meta, Apple learnings loom.",https://finnhub.io/api/news?id=d7eac97034f9f0f9fa212be8bd56d54592fd890060b8e3c866961d48b30413e7
company,1769383860,Stock Futures Are Falling Ahead of Fed Meeting as Shutdown Fears Rise,138257942,https://s.yimg.com/rz/stage/p/yahoo_finance_en-US_h_p_finance_2.png,TSLA,Yahoo,"Investors are looking forward to a busy week of earnings, including one-fifth of the S&P 500 companies, and four of the Magnificent Seven stocks reporting results this week.",https://finnhub.io/api/news?id=797f5b82c67bdc12201e74a6c116d056c3bafc58b9ef025f8da6c32505ece4a6
company,1769381797,Tracking Baillie Gifford's 13F Portfolio - Q4 2025 Update,138257955,,TSLA,SeekingAlpha,,https://finnhub.io/api/news?id=b3383b9e7185db3ec63aa0b8161e4799d83f1e4e26f1c6a36c00caa6bccdf604
company,1769372520,Why Lucid Is Zigging While Rival Tesla Zags,138256362,https://s.yimg.com/rz/stage/p/yahoo_finance_en-US_h_p_finance_2.png,TSLA,Yahoo,"While Lucid and Tesla entered similar markets in different ways, the jury remains out regarding whether Lucid's long-term strategy will pay off.",https://finnhub.io/api/news?id=bb634920d208e2af86647eca4e3375f0d22715dcce6d3db76afadb5bd5e355b0
company,1769372170,Prediction Market Bettors Cash In on Elon Musk's Ambitious Plans,138256363,https://s.yimg.com/rz/stage/p/yahoo_finance_en-US_h_p_finance_2.png,TSLA,Yahoo,"Online prediction markets are experiencing a significant increase in bettors who are making considerable gains by betting against the ambitious, yet often unfulfilled, plans of Elon Musk. Bettors on prediction market platforms like Kalshi and Polymarket are earning tens of thousands of dollars by betting against Musk’s initiatives. These include robotaxi service in California and the creation of a third political party in the United States. Prediction markets offer a more cautious and granular o",https://finnhub.io/api/news?id=68feb132f67862b536ef80e33b8bab2189a8194fcf119ebd14cdd3b1907d96de
company,1769367865,"Dow Jones Futures Due With Trump Tariffs, Government Shutdown, Big Earnings In Focus",138255790,https://s.yimg.com/rz/stage/p/yahoo_finance_en-US_h_p_finance_2.png,TSLA,Yahoo,"President Donald Trump threatened a 100% tariff on Canada. Government shutdown risks soared. Tesla, Microsoft, Meta, Apple learnings loom.",https://finnhub.io/api/news?id=3dfee4f0f03ade3709bca628ad052b75e740be90e1f536f5b5e7d25a25d958a4
company,1769367600,"Fed Meeting, Apple, Meta, GM, Boeing, Chevron, and More to Watch This Week",138255791,https://s.yimg.com/rz/stage/p/yahoo_finance_en-US_h_p_finance_2.png,TSLA,Yahoo,"A big week for earnings will see reports from Microsoft, Exxon, Visa, GE Vernova, and many more. The Fed is expected to keep rates steady, as Jerome Powell closes out his final months as Chair.",https://finnhub.io/api/news?id=eb73b7c3c56a50bf1f20ac95c6fc617182ec0c32dd92c8a4cbfd88a96baa70f2
company,1769364109,"S&P 500 rises as Apple, Meta gain ahead of earnings: Live updates",138262852,https://image.cnbcfm.com/api/v1/image/108255823-1769115929731-108255823-17691004432026-01-22t163423z_210834275_rc2d6jaudhs3_rtrmadp_0_usa-stocks.jpeg?v=1769115947&w=1920&h=1080,TSLA,CNBC,"The S&P 500 ticked higher as traders braced for a big week, with key earnings reports and a U.S. monetary policy meeting.",https://finnhub.io/api/news?id=158f0bfae4ec7428a2f2270765845aa22d5887172d3a61fae288dc1d4120f93e
company,1769364002,"Earnings, Tariffs and Other Key Things to Watch this Week",138256349,https://s.yimg.com/rz/stage/p/yahoo_finance_en-US_h_p_finance_2.png,TSLA,Yahoo,"Markets face one of the most consequential weeks of 2026 with an extraordinary convergence of events including Wednesday's Federal Reserve meeting at 2:00pm, multiple speeches by President Trump on Tuesday and Wednesday, and a blockbuster earnings lineup featuring mega-cap technology giants.",https://finnhub.io/api/news?id=3924bc06311c74cc88e6186542bd6b13ca7e8ecdba3e4bef4118218375e79de4
company,1769360760,"TechCrunch Mobility: RIP, Tesla Autopilot, and the NTSB investigates Waymo",138254716,https://s.yimg.com/rz/stage/p/yahoo_finance_en-US_h_p_finance_2.png,TSLA,Yahoo,Welcome back to TechCrunch Mobility — your central hub for news and insights on the future of transportation.,https://finnhub.io/api/news?id=6285b472804a33a29d4aa3fac2e4b5800378e443c345016d298f025a6754807e
company,1769353200,"Investors Hedge China, Tech Risks Amid Trump TACO Trade Drama",138254711,https://s.yimg.com/rz/stage/p/yahoo_finance_en-US_h_p_finance_2.png,TSLA,Yahoo,"For volatility markets, it’s an all-too familiar quick spike and reversal: The Cboe Volatility Index jumped Tuesday, then quickly retreated to below the level from the previous Friday, with the futures curve ending the week in an almost identical shape.  Meanwhile, away from the Trump-driven headlines that moved the broader indexes and the VIX, some investors were putting on hedges against geopolitical risks that could pressure shares of Chinese companies and against the potential for disappointing tech earnings.  Last week, investors bought about 400,000 lots of March-expiring puts in the iShares China Large-Cap ETF (FXI), along with 20,000 contracts in the KraneShares CSI China Internet ETF (KWEB) and 150,000 of Xtrackers Harvest CSI China A-Shares ETF (ASHR) puts.",https://finnhub.io/api/news?id=346877eccd958cdd6c20e3635a8caf62afe5aae98882d7a2ee3262c2ffca15c0
company,1769349607,Big Tech Earnings Land With 2026’s AI Winners Still In Question,138259671,https://s.yimg.com/rz/stage/p/yahoo_finance_en-US_h_p_finance_2.png,TSLA,Yahoo,"Earnings from some of the world’s biggest technology companies this week will offer an indication of whether they should stick to that strategy in 2026.  The Magnificent Seven tech giants — Alphabet Inc., Amazon.com Inc., Apple Inc., Meta Platforms Inc., Microsoft Corp., Nvidia Corp. and Tesla Inc. — have led the stock market higher for much of the past three years.",https://finnhub.io/api/news?id=9233c3644792cdfe5c947371949509aea32bcba6105ff98156df32115830b8da
company,1769346960,"Dow Jones Futures Loom: New Trump Tariff Threat, Government Shutdown, Earnings Wave In Focus",138253077,https://s.yimg.com/rz/stage/p/yahoo_finance_en-US_h_p_finance_2.png,TSLA,Yahoo,"President Donald Trump threatened a 100% tariff on Canada. Government shutdown risks soared. Tesla, Microsoft, Meta, Apple learnings loom.",https://finnhub.io/api/news?id=c84bb42e70c5e791e294dfa079afc52cc721f0a06d7e1905b39ab47589a977dc
company,1769345674,"Big Tech earnings, Fed meeting feature as markets end January with busiest week of Q1: What to watch",138253078,https://s.yimg.com/rz/stage/p/yahoo_finance_en-US_h_p_finance_2.png,TSLA,Yahoo,"As geopolitical tensions simmer in the background, Big Tech earnings and the January Fed meeting take center stage this week.",https://finnhub.io/api/news?id=d321b47cddf11d68be78b9f043fc46d9aef6f6739024e647b79d754b4c1b829d
company,1769335200,Uber Isn't Dead; Robotaxis Won't Be Winner Takes All (Rating Upgrade),138253641,https://static.seekingalpha.com/cdn/s3/uploads/getty_images/1311247904/image_1311247904.jpg?io=getty-c-w1536,TSLA,SeekingAlpha,"Uber Technologies has a strong moat, 18% FCF margins, and limited 2030 robotaxi impact at 20.7x earnings. Check out why UBER stock is upgraded to buy.",https://finnhub.io/api/news?id=dff4756b76cf9f6121e7b571975b7a2e1b1c2903c2eca295ccc76b3edcc14666
company,1769335200,"What to Expect in Markets This Week: Fed Interest Rate Decision, Earnings From Microsoft, Meta, Tesla, Apple",138252421,https://s.yimg.com/rz/stage/p/yahoo_finance_en-US_h_p_finance_2.png,TSLA,Yahoo,"Coming up: A Federal Reserve interest rate decision, earnings from Microsoft, Meta, Tesla, Apple, and other key firms, U.S. trade deficit data, and more.",https://finnhub.io/api/news?id=53e97af7c74f475a1286d54f4caf2fc763e5b409e642ddc43f5c2a26d93a0fa3
company,1769330568,Wall Street Week Ahead,138253045,https://static.seekingalpha.com/cdn/s3/uploads/getty_images/1477463465/image_1477463465.jpg?io=getty-c-w1536,TSLA,SeekingAlpha,Big Tech earnings and the Fed rate decision lead a volatile week.,https://finnhub.io/api/news?id=556a3cdd7d15a2be275e3eed4041abc55ab412053eb3124249c0e26a07ee9b3b
company,1769328002,Auto executives are hoping for the best and planning for the worst in 2026,138254567,https://image.cnbcfm.com/api/v1/image/108251932-17683326942026-01-13t192918z_542253059_rc2h0ja7qr1x_rtrmadp_0_usa-trump.jpeg?v=1768332714&w=1920&h=1080,TSLA,CNBC,Automakers are entering a new phase of uncertainty as they deal with affordability issues and slowing consumer demand.,https://finnhub.io/api/news?id=1a5b2c02057246c615eba87f9af2600227957a8678753392bc4bd6e94430374c
company,1769328000,This Is How You Value Tesla,138252858,https://static.seekingalpha.com/cdn/s3/uploads/getty_images/2032357824/image_2032357824.jpg?io=getty-c-w1536,TSLA,SeekingAlpha,"Tesla is making promising progress on scaling robotaxis, with unsupervised rides beginning in Austin. Check out TSLA stock's latest earnings preview here.",https://finnhub.io/api/news?id=cb89a36afe42825a30c05732cb4eafdd25b975ac18b9b0bb8244b996020c5684
company,1769325900,"Tesla Stock: Buy, Sell, or Hold in 2026?​",138251062,https://s.yimg.com/rz/stage/p/yahoo_finance_en-US_h_p_finance_2.png,TSLA,Yahoo,"The company's future hinges on its robotaxi rollout, and this is a critical year for the future of autonomous taxis.",https://finnhub.io/api/news?id=0efbc0f23cd6c848ef51f582c244f235be2dad10eda6846d67dfc5b63f2a54c4
company,1769316985,TSLW: Big Payouts While Holding NAV,138251912,https://static.seekingalpha.com/cdn/s3/uploads/getty_images/2197142109/image_2197142109.jpg?io=getty-c-w1536,TSLA,SeekingAlpha,Roundhill TSLA WeeklyPay ETF delivers weekly distributions above $0.31 per share using 1.2x leverage and swap exposure. Find out why TSLW ETF is a hold.,https://finnhub.io/api/news?id=2d0461ac20184d011cd504e2a520031ac465b8406f33a62b07640c10eb3e7127
