category,datetime,headline,id,image,related,source,summary,url
company,1768167300,Should You Forget Nvidia and Buy These 2 Artificial Intelligence (AI) Stocks Right Now?,138068426,https://s.yimg.com/rz/stage/p/yahoo_finance_en-US_h_p_finance_2.png,AMD,Yahoo,The stocks of Broadcom and AMD could have higher upside than Nvidia in the coming years.,https://finnhub.io/api/news?id=91243a31bcf82db2deb0b99b8be74daba87149dafc16dee6240e1db56307fc08
company,1768157640,3 AI Stocks Poised for Explosive Growth as Enterprise Spending Accelerates in 2026,138068429,https://s.yimg.com/rz/stage/p/yahoo_finance_en-US_h_p_finance_2.png,AMD,Yahoo,Sometimes the best stocks are the most obvious ones.,https://finnhub.io/api/news?id=91501230a92b1c53c29c39d14724f6bdf7c45f38e7613cf36e68f9cb20f3cac6
company,1768154592,"S&P 500 is little changed, rallying back from session lows despite Powell probe, bank sell-off: Live updates",138075812,https://image.cnbcfm.com/api/v1/image/108241873-17658163342025-12-15t163117z_1712109297_rc21hia0ogro_rtrmadp_0_usa-stocks.jpeg?v=1765816457&w=1920&h=1080,AMD,CNBC,Stocks were rattle initially after the Department of Justice opened a criminal investigation into Federal Reserve Chair Jerome Powell.,https://finnhub.io/api/news?id=44034eacdde6585fc286f44720e4524fc4905289caab1545126679e38d227a84
company,1768141925,5 AI Stocks That Could Replicate NVIDIA’s Decade of Dominance,138068438,https://s.yimg.com/rz/stage/p/yahoo_finance_en-US_h_p_finance_2.png,AMD,Yahoo,"NVIDIA (NASDAQ:NVDA) has delivered a 23,000% return over the past decade has become the benchmark every tech investor measures against. The company created the infrastructure that made modern AI possible. Now the question: which company pulls off the next NVIDIA-like run? We analyzed 15 AI-adjacent stocks across semiconductors, software, and quantum computing to find the ... 5 AI Stocks That Could Replicate NVIDIA’s Decade of Dominance",https://finnhub.io/api/news?id=495fc13383548ebcc103b4b0051f02f0a3b994f6036af7091325a6a7267a936a
company,1768136435,Top AI stock picks: Is it Nvidia or bust?,138068711,https://s.yimg.com/rz/stage/p/yahoo_finance_en-US_h_p_finance_2.png,AMD,Yahoo,"Which stock is the best artificial intelligence (AI) play for investors: Nvidia (NVDA), Intel (INTC), or AMD (AMD)? D.A. Davidson head of technology research Gil Luria, Wedbush Securities managing director and global head of technology research Dan Ives, and Yahoo Finance Senior Reporter Ines Ferré join Opening Bid host Brian Sozzi to share their takes on the names. To watch more expert insights and analysis on the latest market action, check out more Opening Bid.",https://finnhub.io/api/news?id=cc08664bf75aa11a73de65ac27736496ee9903147cd760774fc3e9eae05717ba
company,1768128900,2 AI Stocks That Could Help Make You a Fortune,138068961,https://s.yimg.com/rz/stage/p/yahoo_finance_en-US_h_p_finance_2.png,AMD,Yahoo,These stocks are poised to deliver wealth-building returns.,https://finnhub.io/api/news?id=2c183664cfa6e898870c72c60717353a88b4e0f9e6243959b1463bd507634ab1
company,1768127400,AI Is Causing a Memory Shortage. Why Producers Aren’t Rushing to Make a Lot More.,138068945,https://s.yimg.com/rz/stage/p/yahoo_finance_en-US_h_p_finance_2.png,AMD,Yahoo,"The world needs a lot more memory chips and hard drives.  The boom-and-bust memory business has been enjoying its biggest boom in years—perhaps ever.  The rapid build-out of infrastructure for artificial intelligence is consuming a large portion of available supply of NAND flash memory, DRAM memory and hard drives.",https://finnhub.io/api/news?id=f7d7d459e0650f2ce9142f5e9e4cc7802098125dbd8b5e05daad35006504ee75
company,1768120517,AMD: Serious AI-Driven Upside In 2026,138063270,https://static.seekingalpha.com/cdn/s3/uploads/getty_images/2196897625/image_2196897625.jpg?io=getty-c-w1536,AMD,SeekingAlpha,"AMD gains AI share as DC revenue hit $4.3B, MI300 adoption rises, MI400 targets cloud inference at premium valuation. Read why AMD stock is a buy.",https://finnhub.io/api/news?id=8f7821317a7eca025c72fcc6e811fa58855ea803542249372a96badf9a2f6c27
company,1768092765,SA Quant Top 10 In 2026: A Focus On The AI Trade,138061159,https://static.seekingalpha.com/cdn/s3/uploads/getty_images/2223805475/image_2223805475.jpg?io=getty-c-w1536,AMD,SeekingAlpha,"The SA Quant Top 10 for 2026 targets high-growth AI infrastructure suppliers, with a median earnings growth forecast of 29%. Learn more about the portfolio here.",https://finnhub.io/api/news?id=b436012b7faa1611fc4710ec95b731e67c1ac5ca8b83bfcef4d3b151914b7aaa
