category,datetime,headline,id,image,related,source,summary,url
company,1769025060,ICE vs Coinbase: The Race for Dominance in a 24/7 Market,138206974,https://s.yimg.com/rz/stage/p/yahoo_finance_en-US_h_p_finance_2.png,COIN,Yahoo,Intercontinental Exchange and Coinbase are aggressively building the infrastructure required to dominate the emerging era of continuous global asset trading.,https://finnhub.io/api/news?id=d37d4ea170a3134559a48053cda9b620d3f7143e832d42e0b2d9e14bfee2ffe5
company,1769000438,"Stocks making big moves yesterday: Generac, Coinbase, Forestar Group, Nova, and Intel",138196076,https://s.yimg.com/rz/stage/p/yahoo_finance_en-US_h_p_finance_2.png,COIN,Yahoo,Check out the companies making headlines yesterday:,https://finnhub.io/api/news?id=0c47a6110bffd65ed9b00d3ca89b0c425fb3a6bcc5b79d62df1d595a2982d617
company,1768995050,Senate leaves CLARITY Act in limbo: What to know ahead of midterms,138194488,https://s.yimg.com/rz/stage/p/yahoo_finance_en-US_h_p_finance_2.png,COIN,Yahoo,"Benchmark Company managing director and senior research analyst Mark Palmer comments on where the Senate Banking Committee currently stands on the crypto regulation bill, the CLARITY Act, ahead of the 2026 midterm elections. To watch more expert insights and analysis on the latest market action, check out more Market Catalysts.",https://finnhub.io/api/news?id=5256161c02a8382b72facf4523be833528add7e557af857bb442a65d2cb568ca
company,1768990257,Coinbase (COIN) Valuation Check As Analyst Upgrades Highlight Expansion Beyond Crypto Trading,138194489,https://s.yimg.com/rz/stage/p/yahoo_finance_en-US_h_p_finance_2.png,COIN,Yahoo,"Recent analyst commentary on Coinbase Global (COIN) has zeroed in on its push beyond pure crypto trading into stocks, ETFs, and prediction markets, with these product shifts now seen as a key influence on the share price. See our latest analysis for Coinbase Global. At a share price of US$227.73, Coinbase has recently seen a 28.91% 90 day share price decline and a 22.59% 1 year total shareholder return decline. The 3 year total shareholder return of about 3.3x still points to a strong longer...",https://finnhub.io/api/news?id=f14ce9cec2e581821b1f627a81201f37dd020853c9023d099b6c88dbf97ce55b
company,1768989600,"Most big cryptocurrencies climb on Cardano, XRP increases",138214151,,COIN,MarketWatch,"Most big cryptocurrencies climb on Cardano, XRP increases",https://finnhub.io/api/news?id=188fdfc91e3ec44ef3b9152cdfa1ad20adb3937fe32f94da9c7fe4c441c3b332
