category,datetime,headline,id,image,related,source,summary,url
company,1769035324,"Stock Market Today, Jan. 21: Netflix Falls After Fourth-Quarter Earnings and New All-Cash WBD Deal",138199596,https://s.yimg.com/rz/stage/p/yahoo_finance_en-US_h_p_finance_2.png,DIS,Yahoo,"On Jan. 21, 2026, investors assess how Q4 earnings and a massive studio bid reshape this streaming giant’s growth, cash flow, and risk profile.",https://finnhub.io/api/news?id=6b2794c4e087661de1a307672da183f5b42fab875600cff50cd3b840c6efbdb0
company,1769020003,"Netflix: The Buy Window Is Open Again, And I Don't Want To Miss It (Upgrade)",138199451,,DIS,SeekingAlpha,,https://finnhub.io/api/news?id=eb3b88b16c16f536234c391bdeb062766862497e8c09a8352dffa7b64b7b8866
company,1769015280,Is Disney's Stronger Cash Flow Generation Supporting Higher Payouts?,138198184,https://s.yimg.com/rz/stage/p/yahoo_finance_en-US_h_p_finance_2.png,DIS,Yahoo,DIS' surging cash flow is driving a 50% dividend hike and bigger buybacks as streaming turns profitable and investments ease.,https://finnhub.io/api/news?id=c31505ca8c4c479f81745ceb40fe4559c5dad64cfc6f9ed7171d99902da17347
company,1769010720,"Amgen, NVIDIA Corp. share gains lead Dow's 566-point rally",138207837,,DIS,MarketWatch,"Amgen, NVIDIA Corp. share gains lead Dow's 566-point rally",https://finnhub.io/api/news?id=7c2008043a841f5e2224dd09c251e9e49c239ae52293460677a3886a86cad441
company,1769010547,Nearly 400 millionaires and billionaires across 24 countries are demanding Davos leaders to tax them more: ‘Tax us. Tax the super rich.’,138198988,https://s.yimg.com/rz/stage/p/yahoo_finance_en-US_h_p_finance_2.png,DIS,Yahoo,"As the world’s wealthiest touch down in Davos for the World Economic Forum, hundreds of the ultra-rich—including the Disney heirs and millionaire real estate developer Jeffrey Gural—call on leaders to end the “control” of global oligarchs with taxes.",https://finnhub.io/api/news?id=ef140f1104a2f1366084fe94c904966dedc3d66e703f528c29b48f7808f06302
company,1769007120,"Netflix Beats Q4 Earnings Estimates, Crosses 325M Subscribers",138197178,https://s.yimg.com/rz/stage/p/yahoo_finance_en-US_h_p_finance_2.png,DIS,Yahoo,"NFLX beats Q4 earnings and revenue estimates, crosses 325 million paid members, and sees strong gains from ads, pricing, and a blockbuster content slate.",https://finnhub.io/api/news?id=177d3121012f102d225cc622a02c6c99ea365723b067adca8aa5209456be26ac
company,1769004003,The Walt Disney Company (DIS) is Attracting Investor Attention: Here is What You Should Know,138197223,https://s.yimg.com/rz/stage/p/yahoo_finance_en-US_h_p_finance_2.png,DIS,Yahoo,"Recently, Zacks.com users have been paying close attention to Disney (DIS). This makes it worthwhile to examine what the stock has in store.",https://finnhub.io/api/news?id=61042896faab370f115060dd7d846aad4bfcf90a5e6e75fe1b496f5e859fdabe
company,1768988700,"Dow rallies 236 points on gains for Merck, UnitedHealth stocks",138207918,,DIS,MarketWatch,"Dow rallies 236 points on gains for Merck, UnitedHealth stocks",https://finnhub.io/api/news?id=0bae8313584b40bd7cd4f32acb158043ae93b4c6b8d6a9bdf9aad6113d032b6d
company,1768965438,Assessing Walt Disney (DIS) Valuation As P/E Suggests Value But DCF Flags Possible Overpricing,138192106,https://s.yimg.com/rz/stage/p/yahoo_finance_en-US_h_p_finance_2.png,DIS,Yahoo,"How Walt Disney Stock Has Been Trading Recently Walt Disney (DIS) has seen mixed share performance recently, with a 0.8% decline over the past week and a similar move over the past month. Over the past 3 months, the stock has shown a 2.4% decline. Over longer periods, the stock reflects a 1.4% negative return year to date, a 2.6% total return over the past year, and a 6.5% total return over the past 3 years, alongside a 33.4% total return decline over the past 5 years. See our latest analysis...",https://finnhub.io/api/news?id=1fc1d75312c0b78e1f365da18d8800c0cc0966e5938bf29fe4cb2fb42efb0cbf
