category,datetime,headline,id,image,related,source,summary,url
company,1769013840,FedEx Corp. stock outperforms competitors on strong trading day,138239034,,FDX,MarketWatch,FedEx Corp. stock outperforms competitors on strong trading day,https://finnhub.io/api/news?id=5b7b902e79685e99c5f9fb927a4f2d3b74cf1f865628274d7ff3ee81c7a0b171
company,1769012340,FedEx Stock Bounces Despite Downgrade,138217126,,FDX,MarketWatch,FedEx Stock Bounces Despite Downgrade,https://finnhub.io/api/news?id=23053ff18686d6c08a3a88c6027503a3410b569fdc1aeadac13e571cfd05b317
company,1769008920,"CS Group (OTCQB: CSDX) Announces Multi-Channel Sales Model, Global Logistics Partners, and Sustainable Innovation Roadmap for MEDUSA SDP",138195991,https://s.yimg.com/rz/stage/p/yahoo_finance_en-US_h_p_finance_2.png,FDX,Yahoo,"CHEYENNE, Wyo., Jan. 21, 2026 (GLOBE NEWSWIRE) -- CS Diagnostics Corp. (OTCQB: CSDX) today detailed its multi-channel sales strategy, global logistics partnerships, and sustainability roadmap supporting the commercial rollout of MEDUSA SDP. The Company plans to distribute MEDUSA SDP through a diversified sales model designed to serve both institutional and consumer demand. B2B distribution channels include: Hospitals and healthcare facilitiesGyms and wellness centersSchools and educational insti",https://finnhub.io/api/news?id=eb98ca746973d6a54752a9fcf2fc31763d6b1029ac416f22d707d2b92e593913
company,1769006155,"Arm upgraded, Flutter downgraded: Wall Street's top analyst calls",138196005,https://s.yimg.com/rz/stage/p/yahoo_finance_en-US_h_p_finance_2.png,FDX,Yahoo,"Arm upgraded, Flutter downgraded: Wall Street's top analyst calls",https://finnhub.io/api/news?id=f28cafa0e52b381f67b318dff34ec65116c43a4dd5eaae19238754ea5c9b6643
company,1769006100,FedEx Stock Drops. Why Good Things Can Drive Wall Street to Downgrade.,138196164,https://s.yimg.com/rz/stage/p/yahoo_finance_en-US_h_p_finance_2.png,FDX,Yahoo,"FedEx shares have rallied into a planned 2026 spinoff of its freight business, prompting at least one analyst to turn cautious.",https://finnhub.io/api/news?id=5a439c377a84cb311076b4bedb84284326d0593cdd04c44c77c652d7df6c116f
company,1769004000,"Aurora to Host Fourth Quarter 2025 Business Review Conference Call on February 11, 2026",138196165,https://s.yimg.com/rz/stage/p/yahoo_finance_en-US_h_p_finance_2.png,FDX,Yahoo,"PITTSBURGH, January 21, 2026--Aurora Innovation, Inc. (NASDAQ: AUR) today announced it will release fourth quarter 2025 results after market close on February 11, 2026 and will host a business review conference call that day at 5:00 p.m. Eastern time. The conference call will be webcast on Aurora’s investor relations website at ir.aurora.tech. A replay of the webcast will be available for 30 days following the call.",https://finnhub.io/api/news?id=b44de808c5b49d226298bc94ece326cf038973ccd8f8d112837ce3ee35f2b0f4
company,1769001374,"Here Are Wednesday’s Top Wall Street Analyst Research Calls: Alibaba, Applied Digital, ARM Holdings, FedEx, Flutter Entertainment, Ulta Beauty, and More",138196166,https://s.yimg.com/rz/stage/p/yahoo_finance_en-US_h_p_finance_2.png,FDX,Yahoo,"Pre-Market Stock Futures: The futures are trading lower again after a dreadful risk-off day across Wall Street, where all major indices finished the day solidly lower. The combination of President Trump’s pursuit of Greenland, multiple geopolitical hotspots, both foreign and domestic, and a market that remains very overbought led to the biggest selling day we ... Here Are Wednesday’s Top Wall Street Analyst Research Calls: Alibaba, Applied Digital, ARM Holdings, FedEx, Flutter Entertainment, Ult",https://finnhub.io/api/news?id=41384e1cae3ececa638e2378124ab0ea427d5aeb1fcce3aeab4d4db8310b78a8
company,1769001120,UPS Stock Before Q4 Earnings: Is It a Smart Buy or Risky Move?,138196141,https://s.yimg.com/rz/stage/p/yahoo_finance_en-US_h_p_finance_2.png,FDX,Yahoo,"United Parcel Service eyes a Q4 earnings beat despite weak volumes, but near-term headwinds may cloud its recovery story.",https://finnhub.io/api/news?id=eee9bf6931aeb8d3f1309a71c62643b3a7926435c13e93afe85e7ece6deefae4
