category,datetime,headline,id,image,related,source,summary,url
company,1769033293,"Honeywell, Flexjet settle litigation, extend engine maintenance deal",138199644,https://s.yimg.com/rz/stage/p/yahoo_finance_en-US_h_p_finance_2.png,HON,Yahoo,"Honeywell said on Wednesday it had reached ​an agreement with private aviation ‌company Flexjet to resolve their litigation and ‌aims to rebuild their commercial partnership.  The industrial conglomerate said it agreed to extend its aircraft engine ⁠maintenance deal ‌with Flexjet through 2035 as part of the settlement.  Flexjet ‍had sued Honeywell in March 2023, accusing the company of breaching an aircraft ​engine maintenance services deal and ‌seeking liquidated damages over delayed engine repairs.",https://finnhub.io/api/news?id=33651434b54178ce10ba4c9ef0e360b3392c03c037f865e26cbc585a85c8c4f0
company,1769031420,Honeywell Settles Litigation With Flexjet. What It Means for the Stock.,138199009,https://s.yimg.com/rz/stage/p/yahoo_finance_en-US_h_p_finance_2.png,HON,Yahoo,"Honeywell  has finally put one pandemic-related issue in the rearview mirror.  Flexjet had alleged that Honeywell failed live up to repair contracts, while Honeywell contended that supply-chain problems made that difficult during the Covid-19 pandemic.  In December, Honeywell announced it would take a fourth-quarter charge of $470 million related to the Flexjet litigation.",https://finnhub.io/api/news?id=60c876983f6d253070bf207442e9c650765d72b2c04586a17c31580b79903ba8
company,1769031240,Honeywell CEO: Why “Physical AI” Won’t Replace All Industrial Jobs—and What It Will Change,138199010,https://s.yimg.com/rz/stage/p/yahoo_finance_en-US_h_p_finance_2.png,HON,Yahoo,"Vimal Kapur, Honeywell CEO, speaks with WSJ Leadership Institute President Alan Murray on how AI is moving from digital tools to physical infrastructure. Kapur explains how Honeywell is using “physical AI” to help factories, refineries, and other businesses operate amid shortages in skilled employees—augmenting workers rather than fully replacing them.",https://finnhub.io/api/news?id=5aba75b63625e22f05de2c265f608763c6a42433ae744334ee5b7febd94efb81
company,1769030100,"HONEYWELL AND FLEXJET FINALIZE SETTLEMENT, RENEW LONG-TERM CONTRACT THROUGH 2035",138199011,https://s.yimg.com/rz/stage/p/yahoo_finance_en-US_h_p_finance_2.png,HON,Yahoo,Honeywell (Nasdaq: HON) and Flexjet are pleased to have reached a comprehensive agreement to resolve their pending litigation and look forward to rebuilding the parties' commercial partnership.,https://finnhub.io/api/news?id=884bfe93e3a515fed547733eda81782dab9790756c6178d7f120c3d4e82a0531
company,1769005802,"Up 12% So Far in 2026, Should You Buy Honeywell Stock?",138197260,https://s.yimg.com/rz/stage/p/yahoo_finance_en-US_h_p_finance_2.png,HON,Yahoo,"With Honeywell off to a strong start in 2026, is this momentum a buy signal for investors?",https://finnhub.io/api/news?id=f827f03646f8077a5fc5c67c5ebaf9c414806fd7499ec3694616ca411c041ae7
company,1768992360,"UnitedHealth, Honeywell share gains lead Dow's 519-point rally",138233213,,HON,MarketWatch,"UnitedHealth, Honeywell share gains lead Dow's 519-point rally",https://finnhub.io/api/news?id=fd6561ed39c98f87b11699c74c1cb551516d0d6aad79d7b0614c918f74400006
company,1768983576,Honeywell CEO: Splitting into 3 separate companies positions us well for the next couple of decades,138196902,https://image.cnbcfm.com/api/v1/image/108254840-17690005651769000562-43608530667-1080pnbcnews.jpg?v=1769000564&w=1920&h=1080,HON,CNBC,"Honeywell CEO Vimal Kapur joins 'Squawk Box' to discuss the split into three separate, publicly traded companies, state of the industrial sector, and more.",https://finnhub.io/api/news?id=caa888529a3eb7df2b25df773395b9e1b5c654594f5c4887c9070a96cc2b2673
