category,datetime,headline,id,image,related,source,summary,url
company,1769026260,"President Trump addresses world leaders—Davos CEO Brief for Wednesday, January 21, 2026",138199097,https://s.yimg.com/rz/stage/p/yahoo_finance_en-US_h_p_finance_2.png,HPE,Yahoo,"WSJ Leadership Institute President Alan Murray recaps a pivotal day at the World Economic Forum in Davos, including President Trump’s highly anticipated address to political and business leaders and the key issues shaping the global agenda.",https://finnhub.io/api/news?id=b43deb4f64837230d5029703c18c1c3fad9e82a35badb7d4684f6b72dc541038
company,1769009880,Can Vertiv's International Expansion Drive More Upside in the Stock?,138197388,https://s.yimg.com/rz/stage/p/yahoo_finance_en-US_h_p_finance_2.png,HPE,Yahoo,"VRT's overseas momentum accelerates as AI demand lifts sales, expands backlog to $9.5B, and supports continued double-digit organic growth.",https://finnhub.io/api/news?id=ca8d29cbf5bf0e3371b1bbc45bad1426119a2eeff0592381a9a99b698d8dacef
company,1769009040,HPE CEO: Governments Are Racing to Build Their Own AI Clouds—and They Want Them Now,138196212,https://s.yimg.com/rz/stage/p/yahoo_finance_en-US_h_p_finance_2.png,HPE,Yahoo,Hewlett Packard Enterprise CEO Antonio Neri speaks with WSJ Leadership Institute President Alan Murray about why geopolitics and AI are now inseparable—and why governments are moving fast to build their own sovereign AI infrastructure.,https://finnhub.io/api/news?id=9416e4695290918a62f55c4d544687b75de9d3b0dcf2c7a3946c8cd5b19d5a6e
company,1768994880,"Managed Services Market to Grow from $430 Billion in 2026 to $704 Billion by 2031: Strategic Analysis of IBM, Cisco Systems, Fujitsu, AT&T, HPE and Other Key Players",138194381,https://s.yimg.com/rz/stage/p/yahoo_finance_en-US_h_p_finance_2.png,HPE,Yahoo,"Dublin, Jan. 21, 2026 (GLOBE NEWSWIRE) -- The ""Managed Services - Market Share Analysis, Industry Trends & Statistics, Growth Forecasts (2026-2031)"" has been added to ResearchAndMarkets.com's offering. The global managed services market is on track to reach a significant milestone, with projections estimating its value at USD 430.56 billion by 2026, up from USD 390.21 billion in 2025. By 2031, the market is expected to expand further to USD 704.2 billion, achieving a compound annual growth rate",https://finnhub.io/api/news?id=4b3ed6d897bfa240c94e81e05ab99edbb84452ef4e0c7651251cf2e34d075391
company,1768986531,How The Evolving Story For Hewlett Packard Enterprise (HPE) Is Reflected In New Price Targets,138193761,https://s.yimg.com/rz/stage/p/yahoo_finance_en-US_h_p_finance_2.png,HPE,Yahoo,"Why the Hewlett Packard Enterprise Price Target Just Shifted Hewlett Packard Enterprise is back in focus after analysts revised their price target, signaling a fresh view on how the market is framing the company today. While the specific drivers behind this updated target are still being unpacked, the change itself highlights that the story around the stock is evolving. Stay tuned to see how you can track these narrative shifts and keep updated on future price target moves. Analyst Price...",https://finnhub.io/api/news?id=5621eb4f1f447137328a5f0ed80a24fb9b3e9992bd4acc91e7bcd20f7807166d
