category,datetime,headline,id,image,related,source,summary,url
company,1768970769,"OpenAI to start offering chatbot ads to advertisers, The Information reports",138192605,https://s.yimg.com/rz/stage/p/yahoo_finance_en-US_h_p_finance_2.png,MSFT,Yahoo,"OpenAI has started offering its new chatbot ads to dozens of advertisers, The ​Information reported on Tuesday, citing people familiar with ‌the matter.  OpenAI is asking that to a small pool of advertisers ‌for less than $1 million in spending commitments each over a several week trial period, with ads launching in early February, the report said.  The company does not yet offer ​technology that lets advertisers easily buy ads themselves, ‌but is working to get self-service ads up and running, The Information report said.",https://finnhub.io/api/news?id=262e6bd32d8e0d91d3cd4bbdca08e26d9851c31e643d783ab6e182756dd88789
company,1768968815,Alibaba Teams With China’s Nuclear Leader to Power AI Expansion,138192606,https://s.yimg.com/rz/stage/p/yahoo_finance_en-US_h_p_finance_2.png,MSFT,Yahoo,"Alibaba this week established a 250 million yuan ($35.9 million) joint venture with China National Nuclear Power Co. and several other partners, according to data on corporate database Tianyancha.  The registration documents outlined areas of cooperation including energy generation, but didn’t specify the exact scope of their partnership or operations.  Alibaba representatives didn’t immediately respond to requests for comment.",https://finnhub.io/api/news?id=949a85ad9465c4efaca2632065e81a8bdec9777b4f02e1edd6ad7f948c31d55c
company,1768967580,"Polen Focus Growth Portfolio  Q4 2025 Performance, Attribution & Portfolio Activity",138193473,https://static.seekingalpha.com/cdn/s3/uploads/getty_images/2248337363/image_2248337363.jpg?io=getty-c-w1536,MSFT,SeekingAlpha,"Polen Focus Growth Portfolio reports a -1.4% return in Q4 2025, lagging the index due to Oracle's performance. Review new positions and exits here.",https://finnhub.io/api/news?id=7e946756de23997589fb7919b2dda2f3c368458e3b4ec75f380668e358064d11
company,1768961495,AI Partnerships Across Healthcare and Retail Could Be A Game Changer For Microsoft (MSFT),138192063,https://s.yimg.com/rz/stage/p/yahoo_finance_en-US_h_p_finance_2.png,MSFT,Yahoo,"In January 2026, Bristol Myers Squibb, Algolia, Hanshow, PayPal, Fiserv and others announced new collaborations with Microsoft to deploy AI across healthcare imaging, retail commerce, store operations, payments and financial services, deepening adoption of Azure, Copilot and the Precision Imaging Network. These agreements highlight how Microsoft’s AI and cloud platforms are becoming embedded in mission‑critical workflows, from early lung cancer detection to “agentic” shopping and store...",https://finnhub.io/api/news?id=abbf70d3833134fdaba66b089eaac4005cb4d34835c3c6dec8c9b0cc1bbf05fc
company,1768961340,Is Oklo Stock a Buy in 2026 After Its Nuclear Deal With Meta?,138192059,https://s.yimg.com/rz/stage/p/yahoo_finance_en-US_h_p_finance_2.png,MSFT,Yahoo,Oklo and Meta announced a partnership to support 1.2 gigawatts of power in Ohio.,https://finnhub.io/api/news?id=b215aff38d5379569bfcdca422ac3f56e89683b2fe8946ad960e30ceaad4c90a
company,1768957680,"STM Goods Deploys Millions of Dux Cases Worldwide, Reinforcing Its Leadership in Device Protection",138191497,https://s.yimg.com/rz/stage/p/yahoo_finance_en-US_h_p_finance_2.png,MSFT,Yahoo,"Photo Courtesy of: STM Goods SYDNEY, Jan. 20, 2026 (GLOBE NEWSWIRE) -- STM Goods announced that it has deployed millions of Dux cases across global education, corporate, and consumer markets, marking a significant milestone in the company’s long-standing focus on protective solutions for iPad, MacBook, and Microsoft Surface devices. The deployment reflects more than a decade of product development centred on durability, functionality, and real-world performance. Originally introduced to address",https://finnhub.io/api/news?id=aed3a05d30b32e0deb5d03b4cc52966eb4c41cfa5e24025e8cb92ef1af16e7ac
company,1768957668,Assessing Microsoft (MSFT) Valuation After Recent Share Price Weakness And Conflicting Fair Value Signals,138191498,https://s.yimg.com/rz/stage/p/yahoo_finance_en-US_h_p_finance_2.png,MSFT,Yahoo,"Microsoft stock under pressure: what recent returns say about sentiment Microsoft (MSFT) has recently seen softer share performance, with the stock showing a 1-day return of a 1.10% decline, a past-week return of a 3.37% decline, and a 1-month return of a 6.41% decline. See our latest analysis for Microsoft. Those recent short term share price declines come after a softer 90 day share price return of a 12.63% decline. However, the 1 year total shareholder return of 6.92% and 3 year total...",https://finnhub.io/api/news?id=2f67a85b43e0bbd86b3ac4c5550d6d6f295d9c452f51541bc54407a08bbe1c6f
company,1768955820,"What Nvidia didn’t show at CES, and whether AMD should care",138191494,https://s.yimg.com/rz/stage/p/yahoo_finance_en-US_h_p_finance_2.png,MSFT,Yahoo,"Nvidia (NVDA) stock is trading about 3.39% lower near $180, at the time of writing, Tuesday afternoon, Jan. 20, according to Yahoo Finance. And as if the worries about the AI bubble weren’t enough, other big tech stocks, including Apple, Meta, Microsoft, Tesla, and Google, are also down, as ...",https://finnhub.io/api/news?id=a8b90db9b65a9e2274f0e9f72f6dac8ab19f076539e4626a306c2afd20b9f2ab
