category,datetime,headline,id,image,related,source,summary,url
company,1769039510,"Stifel Raises Micron Technology (MU) Price Target to $360, Keeps Buy Rating",138200185,https://s.yimg.com/rz/stage/p/yahoo_finance_en-US_h_p_finance_2.png,MU,Yahoo,"Micron Technology, Inc. (NASDAQ:MU) is one of the AI Stocks on Market Radar. On January 20, Stifel raised the stock’s price target to $360.00 (from $300.00) while maintaining a “Buy” rating. The firm believes AI cloud demand and strategic fab acquisition are key margin/ supply levers for Micron. According to Stifel, Micron has gained flexibility […]",https://finnhub.io/api/news?id=380e152b1eada7de07b62ccfeeeeed1cabf47df7daf2beacf94510f88bd1b1c3
company,1769032818,"Stocks to Watch Wednesday Recap: Netflix, Schwab, J&J, United Airlines",138199575,https://s.yimg.com/rz/stage/p/yahoo_finance_en-US_h_p_finance_2.png,MU,Yahoo,"↘️ Netflix (NFLX): The streaming company posted better-than-expected quarterly results, but its cash flow and outlook disappointed, as did the news that it would pause buybacks. The stock dropped 2.2%.",https://finnhub.io/api/news?id=57f7fb58e6f5b7e2b7f2c0962e5f621b9538e01237367a4e890ca7c4ff583bbd
company,1769023512,"Nvidia, Broadcom, Micron Stocks Jump -- JPMorgan Flags as Top Chip Picks",138198041,https://s.yimg.com/rz/stage/p/yahoo_finance_en-US_h_p_finance_2.png,MU,Yahoo,"Chip Stocks Rise After JPMorgan Names Nvidia, Broadcom, Micron Top Picks",https://finnhub.io/api/news?id=8ce7a737887197f12e62400fa3f02c3db4b1afe2a9d1e9007e722138b8934753
company,1768988816,"Stocks to Watch Wednesday: Netflix, United Airlines, Kraft Heinz",138194358,https://s.yimg.com/rz/stage/p/yahoo_finance_en-US_h_p_finance_2.png,MU,Yahoo,"↘️ Netflix (NFLX): The streaming company posted better-than-expected quarterly results, with series such as “Stranger Things” boosting viewership. However, shares dropped 6.5% in premarket trading. Netflix posted its results shortly after sweetening its $72 billion bid for Warner Bros.",https://finnhub.io/api/news?id=67c905fe80c497504181c5ea40a9f6a81a318d3137a6231b0f3fdb2f613e5b90
company,1769020620,"Top Stock Picks for Week of January 19, 2026",138198934,https://s.yimg.com/rz/stage/p/yahoo_finance_en-US_h_p_finance_2.png,MU,Yahoo,A Top Financial Stock That's a Good Dividend Play and a Key Player in AI Semiconductor Ecosystem,https://finnhub.io/api/news?id=3145abded31598382f08726c05fa996752576b6ce8597e93503f70dd32834a71
company,1769019336,CEO Sanjay Mehrotra Says Demand for Memory Will Keep Lifting Micron Stock for Years to Come,138198935,https://s.yimg.com/rz/stage/p/yahoo_finance_en-US_h_p_finance_2.png,MU,Yahoo,"Micron stock is benefiting from sustained AI-driven memory demand, with visibility through 2027 supporting pricing strength, capacity expansion, and long-term returns.",https://finnhub.io/api/news?id=2c5a4ff6f832bc846479529bd1e515896a69d80dc9b6145ac0aa931056f1ce3f
company,1769018820,3 Red-Hot Growth Stocks to Buy in 2026,138198075,https://s.yimg.com/rz/stage/p/yahoo_finance_en-US_h_p_finance_2.png,MU,Yahoo,These companies boast different strengths that help them succeed with AI.,https://finnhub.io/api/news?id=e635f2d9dc7d1efd42dba4ef91da1394c256bd58a8784659c4cca8830dbd17c0
company,1769018820,Micron knows something the market is only starting to see,138198051,https://s.yimg.com/rz/stage/p/yahoo_finance_en-US_h_p_finance_2.png,MU,Yahoo,"Nvidia supplier Micron Technology is airing its opinion regarding an ""unprecedented"" issue regarding AI, and Wall Street is standing up and taking notice. For now, the chipmaker believes the biggest issue facing the AI sector is a memory shortage that won't go away. Micron believes the issue is ...",https://finnhub.io/api/news?id=b7de9bc7cb3101d4d6822223f2ce74ee293da9dce94bbe9f25bf80a27870944f
company,1769018755,"Dow jumps nearly 400 points, claws back Greenland turmoil losses in two-day rally: Live updates",138205204,https://image.cnbcfm.com/api/v1/image/108255370-17690326632026-01-21t215601z_1748655105_rc2v5japswy2_rtrmadp_0_usa-stocks.jpeg?v=1769032713&w=1920&h=1080,MU,CNBC,"Stocks rose on Thursday, extending their gains from the previous session after easing geopolitical fears sparked a broad-based market rally.",https://finnhub.io/api/news?id=7bf7c03a215967de986fb9f9ba023752d5e34e9adafd925420b4437fc3c8f07b
company,1769016104,Why AppLovin (APP) Stock Is Nosediving,138197252,https://s.yimg.com/rz/stage/p/yahoo_finance_en-US_h_p_finance_2.png,MU,Yahoo,"Shares of mobile app technology company AppLovin (NASDAQ:APP) fell 5.6% in the afternoon session after a scathing report from short-seller CapitalWatch alleged the software firm had become a ""safe haven"" for illicit funds and had ties to a global money laundering syndicate.",https://finnhub.io/api/news?id=c20aa81109a167e62008b5e287ecbed741853ad1074e306c94f8c0e3bb2251f9
company,1769016095,Why Is Micron (MU) Stock Soaring Today,138197157,https://s.yimg.com/rz/stage/p/yahoo_finance_en-US_h_p_finance_2.png,MU,Yahoo,"Shares of memory chips maker Micron (NYSE:MU) jumped 5.9% in the afternoon session after analysts at multiple firms, including Barclays, Stifel, and TD Cowen, raised their price targets on the stock, citing strong demand for its AI-related memory chips.",https://finnhub.io/api/news?id=e928d281ad29eb5d67dddad0dc7c4451fb34ac194eff5d34830e65972a87511f
company,1769013000,Micron Technology Inc. stock underperforms Wednesday when compared to competitors despite daily gains,138232687,,MU,MarketWatch,Micron Technology Inc. stock underperforms Wednesday when compared to competitors despite daily gains,https://finnhub.io/api/news?id=b1c05c0ed9cc52a6031cf2c9ddc204ce7ae8a499a28f42786fdddacdd5060a11
company,1769011647,"As Micron Spends $1.8 Billion on a New Chip Fab Site, Should You Buy MU Stock?",138198125,https://s.yimg.com/rz/stage/p/yahoo_finance_en-US_h_p_finance_2.png,MU,Yahoo,Micron announced it is buying a chip fabrication site in Taiwan.,https://finnhub.io/api/news?id=c1cf42201e1b0327c6812d56cab3ed1111f2fdf0625fd75469bb28052fa3de20
company,1769009472,Micron: Are We At The Peak Of The Supercycle? Not Even Close,138198611,https://static.seekingalpha.com/cdn/s3/uploads/getty_images/1689227296/image_1689227296.jpg?io=getty-c-w1536,MU,SeekingAlpha,"Micron is a compelling AI-driven growth story, with a Buy rating despite recent outperformance and a preference to add on pullbacks. Read this MU stock update.",https://finnhub.io/api/news?id=e799e31856ea6bf29bfe6dc075638bcbe462a39d966633b08fc21c5660148ab4
company,1769008632,"Micron: This Time Is Not Different, It's Time To 'Sell' (Downgrade)",138198582,https://static.seekingalpha.com/cdn/s3/uploads/getty_images/1370158199/image_1370158199.jpg?io=getty-c-w1536,MU,SeekingAlpha,Micron is downgraded to Sell as AI-driven demand may be fully priced in. Click here to learn more about MU's valuation and stock prospects.,https://finnhub.io/api/news?id=e0c4f74713263c324cc5ffffd7ae248755522166a37f870addcfc44120612665
company,1769004222,Intel's stock jumps 11% to highest since early 2022 ahead of earnings,138205206,https://image.cnbcfm.com/api/v1/image/108209988-1760019895734-lib-bu-tan-wafer-ultra-core-3-1024x726.jpg?v=1769029098&w=1920&h=1080,MU,CNBC,Intel has gotten a boost due to optimism around its latest server CPUs and following investments from the U.S. government and Nvidia. ,https://finnhub.io/api/news?id=11160ee24d33deb9ef45bdc84fd3847ca927e0afcbe139ca0caf649dacae7262
company,1769002554,3 Stocks That Could Double In 2026,138196036,https://s.yimg.com/rz/stage/p/yahoo_finance_en-US_h_p_finance_2.png,MU,Yahoo,"We’re halfway into January, and the market is in action mode. Growth stocks have had an excellent 2025 and generated impressive returns for investors. But this year, many investors fear growth stocks might lose momentum. The artificial intelligence (AI) race has disrupted several industries and also claimed a few victims. Some stocks have climbed faster ... 3 Stocks That Could Double In 2026",https://finnhub.io/api/news?id=163144baeffaf2314a427af2f69b6b71ead16c90da331660bcdbf36518493358
company,1768999983,"Daily Profit Alert: Netflix Business Model Under Fire, NVIDIA Lock-in Accelerates",138195044,https://s.yimg.com/rz/stage/p/yahoo_finance_en-US_h_p_finance_2.png,MU,Yahoo,"1. Netflix’s Business Model Under Fire Despite Q4 Beat Netflix beat Q4 earnings estimates but the stock dropped 7% anyway, revealing what Wall Street really cares about: future growth, not past performance. The company reported $11.51 billion in revenue with 17% year-over-year growth, but EPS missed by 15.8% at $5.87 versus the $6.97 estimate. A ... Daily Profit Alert: Netflix Business Model Under Fire, NVIDIA Lock-in Accelerates",https://finnhub.io/api/news?id=72617b0c8d2a469b1eb41d9b9121240b258dc94deac690e0d3232ab27643c2c3
company,1768999478,"Stocks making the biggest moves midday: Netflix, Teledyne, Lucid, Kraft Heinz, Intel & more",138205207,https://image.cnbcfm.com/api/v1/image/108193668-1756904885178-gettyimages-2233394867-_75a3509_yy2wi8ye.jpeg?v=1769015914&w=1920&h=1080,MU,CNBC,Check out some of the biggest movers in midday trading.,https://finnhub.io/api/news?id=599e71c148679dbbc5aa6cdda0b24a9bcbb911e7d1eff37a35151a4c3387e03a
company,1768998840,Micron to purchase PSMC fabrication site in Taiwan for $1.8B,138197158,https://s.yimg.com/rz/stage/p/yahoo_finance_en-US_h_p_finance_2.png,MU,Yahoo,The deal will further position Micron to address growing global demand for memory solutions.,https://finnhub.io/api/news?id=769a0324663588472e061f4f8ade1599bb1e53e9062bf2ab8770bb09e9033d76
company,1768997443,Barclays Remains Bullish on Micron Technology (MU) Amid Continued AI Momentum,138195106,https://s.yimg.com/rz/stage/p/yahoo_finance_en-US_h_p_finance_2.png,MU,Yahoo,"Micron Technology, Inc. (NASDAQ:MU) is included in our list of the 10 Goldman Sachs undervalued stocks to invest in. On January 15, 2026, Barclays analyst Tom O’Malley increased the firm’s price target on Micron Technology, Inc. (NASDAQ:MU) from $275.00 to $450.00, while reiterating an ‘Overweight’ rating. The update came as part of the firm’s 2026 […]",https://finnhub.io/api/news?id=99bf651e991f80232cba6a49ac98c31d9bb5e53efb0a02c9dd8242984aceb7e2
company,1768995465,This Week In AI Chips - Innovative Cooling Solutions Fuel Next-Gen AI Data Centers,138194297,https://s.yimg.com/rz/stage/p/yahoo_finance_en-US_h_p_finance_2.png,MU,Yahoo,"Motivair by Schneider Electric has unveiled the MCDU-70, a cutting-edge 2.5MW Coolant Distribution Unit (CDU), designed to address the cooling needs of next-generation AI data centers. This new CDU model supports scalability up to 10MW and is engineered to handle the intense heat generated by advanced GPUs, which power AI Factories. By integrating with Schneider Electric’s EcoStruxure software, the unit promises reliable and efficient cooling solutions for high-density data centers at a...",https://finnhub.io/api/news?id=ca930c5442a9e84a8865fa8728aabc15f67929975d11039f6c262376bf36924c
company,1768995462,Tech stocks rebound after Trump says U.S. won't use military force in Greenland,138196659,https://image.cnbcfm.com/api/v1/image/108254962-1769009080180-gettyimages-2257418605-mms18684_fv2opla8.jpeg?v=1769009115&w=1920&h=1080,MU,CNBC,Comment from President Donald Trump in Switzerland eased worries of a widespread conflict in Greenland. ,https://finnhub.io/api/news?id=7bb5d3b89b4d26acc7aafda445533a7907096fe8b93dfc6c2ca5539e1eaa7ad3
company,1768988745,Intel Has A New Problem,138195537,,MU,SeekingAlpha,,https://finnhub.io/api/news?id=9bdd99e3a25d628b9d074085b713f727e55cb7c7e99994ec16533ba213cb75cf
company,1768987140,Jim Cramer Says AI Stocks Micron and Sandisk (Up Over 600% Since January 2023) Can Go Even Higher,138193717,https://s.yimg.com/rz/stage/p/yahoo_finance_en-US_h_p_finance_2.png,MU,Yahoo,CNBC's Jim Cramer thinks Micron and Sandisk can maintain their momentum because of an unprecedented memory chip supply shortage.,https://finnhub.io/api/news?id=903214ee0bf9e0e974baead2e00fb85a1c8d2a183c16d933661740daa1d679a7
company,1768985700,"Zacks.com featured highlights include Micron, Hilltop Holdings, Casey's, Agnico Eagle Mines and Dollar General",138194364,https://s.yimg.com/rz/stage/p/yahoo_finance_en-US_h_p_finance_2.png,MU,Yahoo,"Micron, Hilltop Holdings, Casey's, Agnico Eagle Mines and Dollar General lead early 2026 as stocks showing standout relative price strength.",https://finnhub.io/api/news?id=88b5267ad4dd3ba131e713c9ff3cc6808af3080be912a4b1e4d80ff1b0c337e0
company,1768984800,"Zacks Investment Ideas feature highlights: Micron, MicroStrategy and APi Group",138194365,https://s.yimg.com/rz/stage/p/yahoo_finance_en-US_h_p_finance_2.png,MU,Yahoo,"Micron, MicroStrategy and APi Group draw attention as insiders step in with notable share purchases, signaling confidence beyond near-term market swings.",https://finnhub.io/api/news?id=0eabeb5574aae5b909b02d317a75fcf29c72a36770e3f757cb9337a424a6eabb
company,1768980300,BUZZ Investing: Macro Recalibration And Valuation Discipline Shape Performance,138194689,,MU,SeekingAlpha,,https://finnhub.io/api/news?id=d0f788da8d9b2c857f18279c7735f2eb61ce8c1e4bd5f711f69f73cdb8658407
company,1768973996,"Netflix slides after earnings, and other early market movers",138213017,,MU,MarketWatch,"Netflix slides after earnings, and other early market movers",https://finnhub.io/api/news?id=b22c0fb59a4b0b696d9540154b4a6a6b01f8ea365ac750f85db51876f283d7b0
