category,datetime,headline,id,image,related,source,summary,url
company,1769026873,"Seagate Rises After Upgrade, Higher Target",138199045,https://s.yimg.com/rz/stage/p/yahoo_finance_en-US_h_p_finance_2.png,STX,Yahoo,Analyst sees longer AI driven storage cycle,https://finnhub.io/api/news?id=64dc5b4794f12c526e98c7a19994c103484d0451a2d15d72dfa314182978d665
company,1769021663,"Sandisk Rips Higher, Tops S&P 500",138198277,https://s.yimg.com/rz/stage/p/yahoo_finance_en-US_h_p_finance_2.png,STX,Yahoo,AI driven memory demand keeps rally alive,https://finnhub.io/api/news?id=9193edf7bd2d7a25addd5abe8820c9e7bd82e7c75579b4c3a71ac77c93566d8d
company,1769019245,A Look At Seagate Technology (STX) Valuation After Analyst Upgrades And AI Storage Progress,138198278,https://s.yimg.com/rz/stage/p/yahoo_finance_en-US_h_p_finance_2.png,STX,Yahoo,"Recent rating upgrades and higher expectations from Wall Street have put fresh attention on Seagate Technology Holdings (STX), as investors consider how its AI-focused storage portfolio might influence the stock’s risk and return profile. See our latest analysis for Seagate Technology Holdings. The share price has climbed to $325.99 alongside a 51.59% 3 month share price return and a very large 5 year total shareholder return, suggesting momentum has been building as AI storage news and...",https://finnhub.io/api/news?id=245d1e4f1f18c51eb55d871167c4206f499070dd0629d8fd8694ad760421971e
company,1769013000,Seagate Technology Holdings PLC stock outperforms competitors on strong trading day,138212355,,STX,MarketWatch,Seagate Technology Holdings PLC stock outperforms competitors on strong trading day,https://finnhub.io/api/news?id=13e75449d6007e3210a0c11e7811ba3d9791b83bcd4a4c264f26528f07f798ee
company,1769006155,"Arm upgraded, Flutter downgraded: Wall Street's top analyst calls",138196005,https://s.yimg.com/rz/stage/p/yahoo_finance_en-US_h_p_finance_2.png,STX,Yahoo,"Arm upgraded, Flutter downgraded: Wall Street's top analyst calls",https://finnhub.io/api/news?id=f28cafa0e52b381f67b318dff34ec65116c43a4dd5eaae19238754ea5c9b6643
company,1768994823,"Western Digital Is Not An AI Stock, But AI May Change Its Cycle",138196435,https://static.seekingalpha.com/cdn/s3/uploads/getty_images/157772273/image_157772273.jpg?io=getty-c-w1536,STX,SeekingAlpha,"Western Digital (WDC) benefits from rebounding NAND prices and AI-driven demand for nearline storage, supporting its earnings recovery.",https://finnhub.io/api/news?id=75f901175401a2cc08dce4969c6e9d7bc86291a58e4fd93abe6084e5ff00fd4d
company,1768991274,Western Digital: The Storage Sugar High,138195774,https://static.seekingalpha.com/cdn/s3/uploads/getty_images/157772273/image_157772273.jpg?io=getty-c-w1536,STX,SeekingAlpha,"Western Digital (WDC) rated Sell: AI-driven HDD super-cycle and margins may fade as supply normalizes, SSDs rise, and CapEx slows.",https://finnhub.io/api/news?id=ff8aaa27b1f197d2b9ed59cc3abfcaa080fc52dab9cc882a4a7338fb5dcf0b7d
